ASIN,Copertina,Titolo,Autore,Data,Recensioni,Categoria
B09TZ2LNHK,https://m.media-amazon.com/images/I/71vywg3HUeL._AC_UY218_.jpg,Metodo Montessori: La Miglior Guida per Crescere il tuo Bambino da 0 a 3 Anni in modo Sano. Stimola la sua Mente con 375+ Attività Pratiche di Sviluppo e Sensoriali in Casa e all'Aperto,Serena De Micheli,6 mar. 2022,715,Società e scienze sociali
8804655224,https://m.media-amazon.com/images/I/717T-QrfroL._AC_UY218_.jpg,I cuccioli non dormono da soli. Il sonno dei bambini oltre i metodi e i pregiudizi,Alessandra Bortolotti,19 gen. 2016,698,Società e scienze sociali
8807902583,https://m.media-amazon.com/images/I/71Nyq2RZIvL._AC_UY218_.jpg,La brevità della vita,Seneca,31 mar. 2022,685,Società e scienze sociali
B0CZSJG1TG,https://m.media-amazon.com/images/I/61tWEMhepsL._AC_UY218_.jpg,Dentro di me c'è un posto bellissimo. Imparare a volersi bene affinché l'amore accada,Ameya Gabriella Canovi,24 set. 2024,680,Società e scienze sociali
B09GY4PCNM,https://m.media-amazon.com/images/I/71QZF6ilJ4L._AC_UY218_.jpg,La Legge dell'Attrazione: Il segreto per far cospirare l’universo a tuo favore e manifestare i tuoi desideri,Gaia Zendali,23 set. 2021,678,Società e scienze sociali
8860306485,https://m.media-amazon.com/images/I/711ADrXwNSL._AC_UY218_.jpg,Non è più come prima. Elogio del perdono nella vita amorosa,Massimo Recalcati,12 mar. 2014,678,Società e scienze sociali
B009J5ZO1M,https://m.media-amazon.com/images/I/71i7JVoxAVL._AC_UY218_.jpg,Cambia l'abitudine di essere te stesso. Nuova Edizione: La Fisica Quantistica nella vita quotidiana,Joe Dispenza,8 feb. 2024,666,Società e scienze sociali
8804766417,https://m.media-amazon.com/images/I/61Fy9n05VUL._AC_UY218_.jpg,Vincere l'ansia. Un percorso in 8 lezioni,Raffaele Morelli,26 apr. 2023,650,Società e scienze sociali
8827200290,https://m.media-amazon.com/images/I/71DGQ3haTDL._AC_UY218_.jpg,Il potere del subconscio,Joseph Murphy,1 lug. 1990,644,Società e scienze sociali
8807171430,https://m.media-amazon.com/images/I/71Mhy7i4QrL._AC_UY218_.jpg,L'ospite inquietante. Il nichilismo e i giovani,Umberto Galimberti,1 dic. 2008,632,Società e scienze sociali
8807882000,https://m.media-amazon.com/images/I/61dPARllfUL._AC_UY218_.jpg,Umberto Galimberti Le cose dell'amore: Opere 15,Umberto Galimberti,25 set. 2013,630,Società e scienze sociali
B0DPJJVD32,https://m.media-amazon.com/images/I/71kYZzIE7nL._AC_UY218_.jpg,Casa Bianca-Italia. La corruzione dell'informazione di uno Stato satellite,Alessandro Orsini,8 apr. 2025,614,Società e scienze sociali
880472434X,https://m.media-amazon.com/images/I/81A6a+gcZ0L._AC_UY218_.jpg,Le disobbedienti. Storie di sei donne che hanno cambiato l’arte,Elisabetta Rasy,19 mag. 2020,612,Società e scienze sociali
B0CGM8W5C1,https://m.media-amazon.com/images/I/51UEGy2daqL._AC_UY218_.jpg,"Corpo Intelligente: Come usare il Movimento per trasformare te stesso, calmare la mente e liberare il corpo",Ale Demaria,5 set. 2023,568,Società e scienze sociali
8857306623,https://m.media-amazon.com/images/I/611123oaPhL._AC_UY218_.jpg,Calmo e attento come una ranocchia. Esercizi di mindfulness per bambini (e genitori),Eline Snel,29 ott. 2015,567,Società e scienze sociali
8894611779,https://m.media-amazon.com/images/I/619fG2DPjPL._AC_UY218_.jpg,Gli Dèi della Bibbia: Sulle tracce degli antichi Creatori,Mauro Biglino,6 lug. 2023,565,Società e scienze sociali
8893445484,https://m.media-amazon.com/images/I/71Et31GXR1L._AC_UY218_.jpg,Il razzismo spiegato a mia figlia. Con «1998-2018. Il razzismo è in buona salute». Nuova ediz.,Tahar Ben Jelloun,5 lug. 2018,561,Società e scienze sociali
8804801816,https://m.media-amazon.com/images/I/71Cix2uH+DL._AC_UY218_.jpg,Alzarsi all'alba,Mario Calabresi,16 set. 2025,549,Società e scienze sociali
8806227157,https://m.media-amazon.com/images/I/71JnIBqemLL._AC_UY218_.jpg,"La gioia di educare: Non siamo capaci di ascoltarli-Voi, noi-I figli non crescono più",Paolo Crepet,8 apr. 2015,539,Società e scienze sociali
8868363976,https://m.media-amazon.com/images/I/71zgN09h6GL._AC_UY218_.jpg,Libro degli angeli e dell'io celeste. Che angelo sei?,Igor Sibaldi,5 set. 2017,535,Società e scienze sociali
8807091844,https://m.media-amazon.com/images/I/61i-nHhkHSL._AC_UY218_.jpg,Lezioni d'amore per un figlio. Accompagnare i ragazzi nei labirinti dell'adolescenza,Stefano Rossi,29 ago. 2023,525,Società e scienze sociali
B09TZ5W4L2,https://m.media-amazon.com/images/I/617o0JQTrbL._AC_UY218_.jpg,Perché tu vali! Un libro pieno d’amore. Per te.,Giovanna Terrizzi,7 mar. 2022,513,Società e scienze sociali
B09QNV72WP,https://m.media-amazon.com/images/I/61v+qQyWIlL._AC_UY218_.jpg,Apprendimento Rivoluzionario: L'unico Metodo Scientifico per Apprendere Velocemente,Gianni Golfera,21 gen. 2022,507,Società e scienze sociali
8859004373,https://m.media-amazon.com/images/I/81SBEVr3EhL._AC_UY218_.jpg,Primi voli. Fare,Camillo Bortolato,6 ago. 2013,502,Società e scienze sociali
8817191183,https://m.media-amazon.com/images/I/81N8Rres4yL._AC_UY218_.jpg,Cuori spettinati. Amori catartici e attrazioni fatali. Il significato degli incontri che ti cambiano la vita,Matteo Sinatti,1 apr. 2025,501,Società e scienze sociali
8842097357,https://m.media-amazon.com/images/I/71+JkKPYLmL._AC_UY218_.jpg,Modernita' Liquida,Bauman,22 set. 2011,490,Società e scienze sociali
8817190896,https://m.media-amazon.com/images/I/616BbWVH9NL._AC_UY218_.jpg,Quella volta. Un viaggio nel passato di tutti noi,Gerry Scotti,29 ott. 2024,485,Società e scienze sociali
8865801727,https://m.media-amazon.com/images/I/61cGHYIVnJL._AC_UY218_.jpg,"Benvenuto fratellino, benvenuta sorellina: Favorire l’accoglienza del nuovo nato e la relazione tra fratelli – Strategie ed emozioni per una famiglia che cresce",Giorgia Cozza,1 gen. 2018,481,Società e scienze sociali
8815384464,https://m.media-amazon.com/images/I/71TJ+TmWQ+L._AC_UY218_.jpg,Machina sapiens. L'algoritmo che ci ha rubato il segreto della conoscenza,Nello Cristianini,15 mar. 2024,480,Società e scienze sociali
8817105414,https://m.media-amazon.com/images/I/61bJwaC5dnL._AC_UY218_.jpg,Avremo sempre Parigi. Passeggiate sentimentali in disordine alfabetico,Serena Dandini,23 ott. 2018,478,Società e scienze sociali
B00LZZJV3Q,https://m.media-amazon.com/images/I/81ZMGLT5vGL._AC_UY218_.jpg,Breve storia della vita privata,Bill Bryson,24 lug. 2014,476,Società e scienze sociali
8883375793,https://m.media-amazon.com/images/I/71oRDZDBMLL._AC_UY218_.jpg,I miserabili. Ediz. integrale. Con Segnalibro,Victor Hugo,12 dic. 2017,466,Società e scienze sociali
8809052277,https://m.media-amazon.com/images/I/61M9qE5scIL._AC_UY218_.jpg,Giù la maschera. Come riconoscere le emozioni dall'espressione del viso,Wallace V. Friesen Paul Ekman,16 mag. 2007,464,Società e scienze sociali
8809872924,https://m.media-amazon.com/images/I/71hgAP0ExBL._AC_UY218_.jpg,"Il diario delle regole di italiano: Mappe, schemi e tabelle di morfologia e sintassi",Paola Anna Sacchetti,31 ott. 2018,459,Società e scienze sociali
8845402223,https://m.media-amazon.com/images/I/71fkQH7rEZL._AC_UY218_.jpg,La principessa che voleva amare Narciso. Come uscire insieme dai labirinti del cuore,Maria Chiara Gritti,4 nov. 2021,455,Società e scienze sociali
8804703083,https://m.media-amazon.com/images/I/615-Ht4P5bL._AC_UY218_.jpg,"Il coraggio. Vivere, amare, educare",Paolo Crepet,25 set. 2018,450,Società e scienze sociali
881100652X,https://m.media-amazon.com/images/I/61pAq4-gaFL._AC_UY218_.jpg,Il segreto dell'infanzia,Maria Montessori,12 lug. 2022,441,Società e scienze sociali
8806233122,https://m.media-amazon.com/images/I/719VfGPZLUL._AC_UY218_.jpg,Il tennis come esperienza religiosa,David Foster Wallace,1 feb. 2021,435,Società e scienze sociali
8806247220,https://m.media-amazon.com/images/I/61kWL76NjDL._AC_UY218_.jpg,Arcipelago N. Variazioni sul narcisismo,Vittorio Lingiardi,4 mag. 2021,434,Società e scienze sociali
B08KY96PKV,https://m.media-amazon.com/images/I/81a4Ug6iYbL._AC_UY218_.jpg,The Greatest Secret: Il segreto più grande,Rhonda Byrne,7 gen. 2021,434,Società e scienze sociali
8843088181,https://m.media-amazon.com/images/I/71uM2hRGNdL._AC_UY218_.jpg,Didattica speciale e inclusione scolastica,Lucio Cottini,5 dic. 2017,429,Società e scienze sociali
B0BFVCNJHD,https://m.media-amazon.com/images/I/71RgJtPI5aL._AC_UY218_.jpg,Sei una Ragazza Unica e Speciale: Storie vissute da una bambina per insegnarti ad essere coraggiosa e credere sempre in te stessa. Ideale per bambine e ragazzine,Julia Lee Wilson,22 set. 2022,423,Società e scienze sociali
8804786310,https://m.media-amazon.com/images/I/61E3b0O1K6L._AC_UY218_.jpg,Bada a come parli. Corso rapido ed efficace di intelligenza linguistica con esercizi,Paolo Borzacchiello,18 giu. 2024,421,Società e scienze sociali
8807892383,https://m.media-amazon.com/images/I/61lai4+azpL._AC_UY218_.jpg,Manuale pratico di psicomagia,ALEJANDRO JODOROWSKY,9 mag. 2019,420,Società e scienze sociali
8865882581,https://m.media-amazon.com/images/I/71O27S6mHjL._AC_UY218_.jpg,L'altra storia d'Italia 1948-2022: Vol. 2,Lamberto Rimondini,23 mag. 2023,417,Società e scienze sociali
8848132529,https://m.media-amazon.com/images/I/71U3DGMCUGL._AC_UY218_.jpg,La fisica dell'anima,Fabio P. Marchesi,6 lug. 2017,415,Società e scienze sociali
8815295674,https://m.media-amazon.com/images/I/61ImWfhU-1L._AC_UY218_.jpg,Attaccamento e amore. Che cosa si nasconde dietro la scelta del partner?,Grazia Attili,5 mag. 2022,415,Società e scienze sociali
8838775397,https://m.media-amazon.com/images/I/61CSJBgD3JL._AC_UY218_.jpg,Ginnastica mentale. Esercizi di ginnastica per la mente per disturbi della memoria e altri deficit cognitivi lievi-moderati,Cristina Gueli,15 dic. 2013,414,Società e scienze sociali
8883371100,https://m.media-amazon.com/images/I/71wERGVjLmL._AC_UY218_.jpg,Le confessioni. Ediz. integrale. Con Segnalibro,Agostino,3 nov. 2011,411,Società e scienze sociali
8815299831,https://m.media-amazon.com/images/I/81ZtIt1KUwL._AC_UY218_.jpg,LA SCORCIATOIA. Come le macchine sono diventate intelligenti senza pensare in modo umano,Nello Cristianini,24 feb. 2023,407,Società e scienze sociali
B09WHKPMWT,https://m.media-amazon.com/images/I/61wYyoCQ0kL._AC_UY218_.jpg,Il cane di Falcone,Dario Levantino,14 apr. 2022,392,Società e scienze sociali
8829791253,https://m.media-amazon.com/images/I/71YBn-VfOKL._AC_UY218_.jpg,Domani interrogo,Gaja Cenciarelli,4 ott. 2024,390,Società e scienze sociali
8832737094,https://m.media-amazon.com/images/I/71likEqzNtL._AC_UY218_.jpg,Ogni maledetto lunedì su due. Nuova ediz.,Zerocalcare,21 giu. 2022,390,Società e scienze sociali
8806238035,https://m.media-amazon.com/images/I/617vSyxxrgL._AC_UY218_.jpg,L'autorità perduta. Il coraggio che i figli ci chiedono,Paolo Crepet,20 mag. 2022,389,Società e scienze sociali
B0FY12LF1L,https://m.media-amazon.com/images/I/61hHdKp+UQL._AC_UY218_.jpg,"TFA Sostegno 2026 XI Ciclo: Capisci, Memorizza, Allenati – Il metodo pratico per superare la preselettiva anche se hai poco tempo",NextEu Editore,27 ott. 2025,379,Società e scienze sociali
B01B8TCPZY,https://m.media-amazon.com/images/I/81eVdvOxNaL._AC_UY218_.jpg,Il linguaggio della vita,Ignazio Burgio,29 gen. 2016,378,Società e scienze sociali
8809795113,https://m.media-amazon.com/images/I/61b6gdqIvML._AC_UY218_.jpg,I volti della menzogna - gli indizi dell'inganno nei rapporti interpersonali,Paul Ekman,16 lug. 2014,375,Società e scienze sociali
1709745266,https://m.media-amazon.com/images/I/51KwPPVwFHL._AC_UY218_.jpg,La prova orale dell'esame di Stato di psicologia: Legislazione e deontologia professionale,Titti Damato,20 apr. 2020,368,Società e scienze sociali
8833922006,https://m.media-amazon.com/images/I/61vJJJlh6YL._AC_UY218_.jpg,L'analisi dei sogni-Gli archetipi dell'inconscio-La sincronicità. Ediz. integrale,Carl Gustav Jung,13 gen. 2011,364,Società e scienze sociali
8865882743,https://m.media-amazon.com/images/I/71jnpsapjfL._AC_UY218_.jpg,L'altra storia d'Italia 1802-1947: Vol. 1,Lamberto Rimondini,24 gen. 2024,358,Società e scienze sociali
880475463X,https://m.media-amazon.com/images/I/61yBbLeCzEL._AC_UY218_.jpg,"Ogni cosa è collegata. Pauli, Jung, la fisica quantistica, la sincronicità, l'amore e tutto il resto",Gabriella Greison,21 feb. 2023,358,Società e scienze sociali
8804680059,https://m.media-amazon.com/images/I/71poXNcnrLL._AC_UY218_.jpg,"Storia della filosofia greca, medioevale, moderna",Luciano De Crescenzo,13 apr. 2017,335,Società e scienze sociali
8858152603,https://m.media-amazon.com/images/I/71paJbMNZVL._AC_UY218_.jpg,"Fitopolis, la città vivente",Stefano Mancuso,14 nov. 2023,331,Società e scienze sociali
8832855526,https://m.media-amazon.com/images/I/61ijc1SgA8L._AC_UY218_.jpg,Sii te stesso a modo mio. Essere adolescenti nell'epoca della fragilità adulta,Matteo Lancini,16 mag. 2023,328,Società e scienze sociali
8859025915,https://m.media-amazon.com/images/I/61+imZGfs9L._AC_UY218_.jpg,DOP disturbo oppositivo provocatorio. Cosa fare (e non). Guida rapida per insegnanti. Scuola secondaria di primo e di secondo grado,Gianluca Daffi,26 ago. 2021,324,Società e scienze sociali
8804786302,https://m.media-amazon.com/images/I/51NPmZsHGiL._AC_UY218_.jpg,Usa il cervello prima che lui usi te. Manuale di autodifesa cognitiva,Paolo Borzacchiello,21 ott. 2025,320,Società e scienze sociali
B0D45ZW55M,https://m.media-amazon.com/images/I/71bWHzQ4KBL._AC_UY218_.jpg,Se il mondo ti crolla addosso: Imparare a veleggiare tra le ondate della vita,Russ Harris,24 mag. 2024,314,Società e scienze sociali
8834610989,https://m.media-amazon.com/images/I/61M-A5W57OL._AC_UY218_.jpg,Diario minimo,Umberto Eco,12 mag. 2022,309,Società e scienze sociali
8817193127,https://m.media-amazon.com/images/I/61mFu+edPTL._AC_UY218_.jpg,La caduta di un impero. 1993. Montedison Ferruzzi Enimont,Carlo Sama,29 ott. 2024,308,Società e scienze sociali
8870780384,https://m.media-amazon.com/images/I/71SxuTr-eML._AC_UY218_.jpg,Tecnica del colloquio,Antonio A. Semi,1 feb. 1996,304,Società e scienze sociali
B0CJLLK6PV,https://m.media-amazon.com/images/I/61HNAg+4MJL._AC_UY218_.jpg,"La scimmia zen e il fiore di loto: 52 storie per pensieri più positivi, pace interiore e felicità (mindfulness)",Jinpa Sherab,21 set. 2023,302,Società e scienze sociali
885901901X,https://m.media-amazon.com/images/I/61tBdfvhn2L._AC_UY218_.jpg,"Italiano in quarta con il metodo analogico. Lettura, comprensione, composizione, analisi grammaticale e logica",Camillo Bortolato,6 gen. 2019,301,Società e scienze sociali
B0DFZYTXL5,https://m.media-amazon.com/images/I/614dfMIXwRL._AC_UY218_.jpg,Il quaderno delle tabelline. Per non sbagliarle più,Maestra Federica,10 gen. 2025,299,Società e scienze sociali
B0CWNM31MG,https://m.media-amazon.com/images/I/71OLpBUeOqL._AC_UY218_.jpg,"IKIGAI E FILOSOFIA GIAPPONESE: 3 libri in 1: Ikigai, Kaizen, Shinrin-yoku - scopri i segreti della felicità e della filosofia giapponese per un senso della vita lungo, felice e soddisfacente",TETSUGAKU GROUP,27 feb. 2024,293,Società e scienze sociali
B0F9YJ3ZLR,https://m.media-amazon.com/images/I/71ZSHmbn0sL._AC_UY218_.jpg,Dove vai così di fretta?: Buddhismo nella vita quotidiana,Michel Lama Rinpoche,4 giu. 2025,292,Società e scienze sociali
889262024X,https://m.media-amazon.com/images/I/61CAoHbFaaL._AC_UY218_.jpg,Analisi logica. La grammatica senza segreti,Raffaella Riboni,23 lug. 2016,287,Società e scienze sociali
8817191159,https://m.media-amazon.com/images/I/61iC5gw7ZwL._AC_UY218_.jpg,Mollami! Educare i figli adolescenti e trovare la giusta distanza per farli crescere,Daniele Novara,28 gen. 2025,287,Società e scienze sociali
8806225650,https://m.media-amazon.com/images/I/718OFMEnp5L._AC_UY218_.jpg,Le confessioni,Agostino,16 gen. 2015,283,Società e scienze sociali
B0DY18KQLR,https://m.media-amazon.com/images/I/61PMNRpXVKL._AC_UY218_.jpg,La vera interpretazione dei sogni,Gabriella Tupini,20 feb. 2025,281,Società e scienze sociali
8807174863,https://m.media-amazon.com/images/I/81GS3Kcx7YL._AC_UY218_.jpg,L'eleganza del vuoto. Di cosa è fatto l'universo,Guido Tonelli,29 apr. 2025,279,Società e scienze sociali
1388201127,https://m.media-amazon.com/images/I/71Shi-qT2hL._AC_UY218_.jpg,Dottrina del Fascismo: Testo originale,Benito Mussolini,29 gen. 2026,276,Società e scienze sociali
8830154237,https://m.media-amazon.com/images/I/61V9AIle-6L._AC_UY218_.jpg,Nobody’s girl. La mia storia di sopravvivenza in nome della giustizia. Il caso Epstein,Virginia Roberts Giuffre,21 ott. 2025,263,Società e scienze sociali
B0F5HDZHPY,https://m.media-amazon.com/images/I/71HVF7l-reL._AC_UY218_.jpg,Instant Persuasion: I segreti delle neuroscienze applicati alla persuasione,Paolo Borzacchiello,6 mag. 2025,257,Società e scienze sociali
8806265059,https://m.media-amazon.com/images/I/61ZQcA5-cLL._AC_UY218_.jpg,"Corpo, umano",Vittorio Lingiardi,29 ott. 2024,254,Società e scienze sociali
8845927369,https://m.media-amazon.com/images/I/51CsCcGQAAL._AC_UY218_.jpg,La persona e il sacro,Weil Simone,26 set. 2012,251,Società e scienze sociali
8859028965,https://m.media-amazon.com/images/I/61sFdSJyvfL._AC_UY218_.jpg,Tabelline al volo. Nuovi strumenti per impararle strada facendo. Con app. Con mazzetta delle divisioni. Con pennarello. Con striscia delle tabelline,Camillo Bortolato,16 set. 2022,250,Società e scienze sociali
B0D2647QMZ,https://m.media-amazon.com/images/I/6139G3R3FCL._AC_UY218_.jpg,Trasformare limiti in traguardi: Lo sport come filosofia di vita,Il saggio dello sport,18 apr. 2024,247,Società e scienze sociali
B0DMK9NHML,https://m.media-amazon.com/images/I/51Z2-aebSFL._AC_UY218_.jpg,100 Azioni x Amarti: Scopri la versione migliore di te stessa,MARCO DISO,29 nov. 2024,243,Società e scienze sociali
B0BYTQHXZK,https://m.media-amazon.com/images/I/61trqgSiw1L._AC_UY218_.jpg,Se sbagli non fa niente. Il segreto delle carezze emotive che aiutano i nostri figli ad apprendere,Daniela Lucangeli,14 nov. 2023,242,Società e scienze sociali
B012EI8MVY,https://m.media-amazon.com/images/I/71sMLYKPx6L._AC_UY218_.jpg,L'autoterapia razionale emotiva: Come pensare in modo psicologicamente efficace,Ellis Albert,23 lug. 2015,237,Società e scienze sociali
8883588428,https://m.media-amazon.com/images/I/71TyCVUc5kL._AC_UY218_.jpg,L'esistenzialismo è un umanismo,Aavv,17 apr. 2008,236,Società e scienze sociali
8809788753,https://m.media-amazon.com/images/I/51qopV3UHOL._AC_UY218_.jpg,"Insegnanti efficaci: Pratiche educative per insegnanti, genitori e studenti",Thomas Gordon,20 nov. 2013,230,Società e scienze sociali
8869204308,https://m.media-amazon.com/images/I/61livGJ3LWL._AC_UY218_.jpg,A silent voice (Vol. 3),Yoshitoki Oima,12 ago. 2015,230,Società e scienze sociali
8809905911,https://m.media-amazon.com/images/I/71CoX7jX6uL._AC_UY218_.jpg,"Strumenti compensativi. Il quaderno di matematica. Numeri, misura, spazio e figure, dati e previsioni, relazioni e funzioni",Marianna Nicoletti,7 apr. 2021,227,Società e scienze sociali
880480145X,https://m.media-amazon.com/images/I/61bD05t3U-L._AC_UY218_.jpg,Predatori. I serial killer che hanno segnato l'America,Stefano Nazzi,9 set. 2025,222,Società e scienze sociali
8848327389,https://m.media-amazon.com/images/I/61AoMVGj4SL._AC_UY218_.jpg,Alpha Test Architettura Test Arched - Kit di preparazione,AA.VV,9 feb. 2024,220,Società e scienze sociali
8807897172,https://m.media-amazon.com/images/I/61kx5ktmXqL._AC_UY218_.jpg,Madri che feriscono,Buffet,7 ott. 2022,219,Società e scienze sociali
8817188999,https://m.media-amazon.com/images/I/71E2rl3vkqL._AC_UY218_.jpg,Un mondo possibile. Dieci idee per cambiare il futuro e la tua vita ogni giorno,Nicolò Govoni,5 nov. 2024,216,Società e scienze sociali
8806251228,https://m.media-amazon.com/images/I/610QsGaUK-L._AC_UY218_.jpg,La restanza,Vito Teti,26 apr. 2022,212,Società e scienze sociali
B0BDW4Z2L5,https://m.media-amazon.com/images/I/71G4yqmd7xL._AC_UY218_.jpg,"Manipolazione Mentale: La guida aggiornata sulle migliori Tecniche di Persuasione, capaci di difenderti dalla Manipolazione in poco tempo, INCLUDE le 7 Tecniche avanzate di PNL svelate dagli Esperti",Savior Murphy,10 set. 2022,212,Società e scienze sociali
888388518X,https://m.media-amazon.com/images/I/71fe5tKw5pS._AC_UY218_.jpg,Guidattiva matematica. Strumenti e materiali per l'inclusione,Lorena Figini,1 gen. 2021,210,Società e scienze sociali
B0F1WY6LXS,https://m.media-amazon.com/images/I/81K4eNv+8OL._AC_UY218_.jpg,I demoni (La Grande Biblioteca Europea),Fëdor Dostoevskij,18 mar. 2025,208,Società e scienze sociali
B0DNLC5G8D,https://m.media-amazon.com/images/I/71mjTfW1BqL._AC_UY218_.jpg,Vivere mindfulness. Un viaggio dentro noi stessi per ritrovare la serenità e respirare la vita,Iosno,24 giu. 2025,208,Società e scienze sociali
885804942X,https://m.media-amazon.com/images/I/618XT391GcL._AC_UY218_.jpg,Apprendimento fenomenico. Il metodo di studio rivoluzionario per capire e ricordare qualunque materia,Giovanni Fenu,23 apr. 2024,205,Società e scienze sociali
8874667027,https://m.media-amazon.com/images/I/61NhhR8GqdL._AC_UY218_.jpg,Le strategie didattiche,Giovanni Bonaiuti,9 ott. 2014,204,Società e scienze sociali
8869204995,https://m.media-amazon.com/images/I/81eWUj0omdL._AC_UY218_.jpg,A silent voice (Vol. 5),Yoshitoki Oima,7 ott. 2015,204,Società e scienze sociali
8830463450,https://m.media-amazon.com/images/I/615H+YPUw1L._AC_UY218_.jpg,L'amore è il perché,Massimo Gramellini,14 ott. 2025,201,Società e scienze sociali
B00JFHMPDY,https://m.media-amazon.com/images/I/71Y7O4gOvNL._AC_UY218_.jpg,L'istinto di narrare: Come le storie ci hanno reso umani,Jonathan Gottschall,3 apr. 2014,201,Società e scienze sociali
8893628139,https://m.media-amazon.com/images/I/612C8lQ-jWL._AC_UY218_.jpg,EdiTEST. Professioni sanitarie. Teoria & test. Teoria ed esercizi commentati per la preparazione ai test di ammissione. Con software di simulazione,AA.VV.,3 feb. 2026,199,Società e scienze sociali
8859039339,https://m.media-amazon.com/images/I/51XbHbWqJZL._AC_UY218_.jpg,Strumento La linea del 20 - Metodo analogico per l’apprendimento del calcolo,Camillo Bortolato,11 apr. 2024,195,Società e scienze sociali
8883885236,https://m.media-amazon.com/images/I/61M2aHBygtL._AC_UY218_.jpg,Guidattiva italiano. Strumenti e materiali per l'inclusione,Lorena Figini,1 gen. 2021,192,Società e scienze sociali
8807174987,https://m.media-amazon.com/images/I/61dyBoe-NXL._AC_UY218_.jpg,Uno diviso due. Fratelli e sorelle,Massimo Recalcati,6 mag. 2025,190,Società e scienze sociali
8811016444,https://m.media-amazon.com/images/I/5160GpbyVIL._AC_UY218_.jpg,Gesù e Cristo,Vito Mancuso,11 nov. 2025,186,Società e scienze sociali
8859021073,https://m.media-amazon.com/images/I/61tkecMalNL._AC_UY218_.jpg,Babù acchiappaparole. Sillaba iniziale. Training logopedico per lo sviluppo fonologico e lessicale,Elisa Damian,11 giu. 2020,186,Società e scienze sociali
8830901628,https://m.media-amazon.com/images/I/71SVcY0XisS._AC_UY218_.jpg,Anche Dafne ha paccato Apollo. I miti greci come rimedi di ogni giorno,Chiara Lipari,13 mag. 2021,186,Società e scienze sociali
8832857448,https://m.media-amazon.com/images/I/51FbfZiC0jL._AC_UY218_.jpg,Chiamami adulto. Come stare in relazione con gli adolescenti,Matteo Lancini,25 mar. 2025,184,Società e scienze sociali
8815287914,https://m.media-amazon.com/images/I/71lxLBmHSML._AC_UY218_.jpg,Sociologia della comunicazione nell'era digitale,Luciano Paccagnella,27 ago. 2020,183,Società e scienze sociali
B096TL8Z8X,https://m.media-amazon.com/images/I/41yx5m53foL._AC_UY218_.jpg,Femminili singolari. Il femminismo è nelle parole. Ediz. ampliata,Vera Gheno,20 ott. 2021,180,Società e scienze sociali
8817098493,https://m.media-amazon.com/images/I/61mhQ9aPnOL._AC_UY218_.jpg,L'educazione emotiva. Come educare al meglio i nostri bambini grazie alle neuroscienze,Alberto Pellai,20 feb. 2018,179,Società e scienze sociali
8898991606,https://m.media-amazon.com/images/I/814x7MDUzUL._AC_UY218_.jpg,La guida alla teoria polivagale. Il potere trasformativo della sensazione di sicurezza,Stephen W. Porges,11 apr. 2018,178,Società e scienze sociali
B0DBRL1QRN,https://m.media-amazon.com/images/I/71jJwhEp4jL._AC_UY218_.jpg,Elogio dell'inconscio: Come fare amicizia con il proprio peggio,Massimo Recalcati,31 lug. 2024,178,Società e scienze sociali
B0FFW9GTKZ,https://m.media-amazon.com/images/I/61T7mLyzpdL._AC_UY218_.jpg,Nel sangue di Garlasco,Gianluca Zanella,4 nov. 2025,173,Società e scienze sociali
8843088270,https://m.media-amazon.com/images/I/81dt77F3CxL._AC_UY218_.jpg,Costruire unità di apprendimento. Guida alla progettazione a ritroso,Mario Castoldi,11 mag. 2017,172,Società e scienze sociali
8843048945,https://m.media-amazon.com/images/I/81W1o0kRobL._AC_UY218_.jpg,Il mondo in questione. Introduzione alla storia del pensiero sociologico,Paolo Jedlowski,19 mar. 2009,171,Società e scienze sociali
8868361280,https://m.media-amazon.com/images/I/71RhGtUc2uL._AC_UY218_.jpg,Il codice segreto del Vangelo. Il libro del giovane Giovanni,Igor Sibaldi,4 nov. 2013,168,Società e scienze sociali
8815252134,https://m.media-amazon.com/images/I/71BgQUrgjHL._AC_UY218_.jpg,Metodologia e tecniche della ricerca sociale,Piergiorgio Corbetta,9 ott. 2014,168,Società e scienze sociali
8808720322,https://m.media-amazon.com/images/I/61hDA1ka9rL._AC_UY218_.jpg,Psicologia dello sviluppo. Vol. unico. Con e-book,Janet Belsky,3 giu. 2020,165,Società e scienze sociali
B0DYFZV452,https://m.media-amazon.com/images/I/61YLhYWbkvL._AC_UY218_.jpg,La mia amica matematica. Imparo i numeri e la geometria… per non sbagliarli più!,Maestra Federica,20 mag. 2025,164,Società e scienze sociali
8863113467,https://m.media-amazon.com/images/I/510EQ0c89+L._AC_UY218_.jpg,Elogio della follia. Ediz. integrale,Erasmo da Rotterdam,1 mar. 2018,164,Società e scienze sociali
