ASIN,Copertina,Titolo,Autore,Data,Recensioni,Categoria
1408728516,https://m.media-amazon.com/images/I/61UgrSU0tQL._AC_UY218_.jpg,The Housemaid : An absolutely addictive psychological thriller with a jaw-dropping twist,sponibile immediatamente,26 nov. 2024,681373,"Arte, cinema e fotografia"
0349437017,https://m.media-amazon.com/images/I/81cquiyLW8L._AC_UY218_.jpg,Fourth Wing: Rebecca Yarros: 1,sponibile immediatamente,4 lug. 2024,477631,"Arte, cinema e fotografia"
1542025605,https://m.media-amazon.com/images/I/71rdsaOMvVL._AC_UY218_.jpg,Reminders of Him: A Novel,sponibile immediatamente,18 gen. 2022,357339,"Arte, cinema e fotografia"
0349437068,https://m.media-amazon.com/images/I/81dY-4XtCXL._AC_UY218_.jpg,"Untitled: DISCOVER THE FOLLOW-UP TO THE GLOBAL PHENOMENONS, FOURTH WING AND IRON FLAME!: 3",sponibile immediatamente,31 dic. 2023,293141,"Arte, cinema e fotografia"
1464223319,https://m.media-amazon.com/images/I/91ZcHe+FCaL._AC_UY218_.jpg,The Housemaid Is Watching : An Instant Sunday Times Bestseller,sponibile immediatamente,1 mar. 2025,289013,"Arte, cinema e fotografia"
0141036141,https://m.media-amazon.com/images/I/61HkdyBpKOL._AC_UY218_.jpg,1984 (Inglese),sponibile immediatamente,1 gen. 2012,137570,"Arte, cinema e fotografia"
0007155662,https://m.media-amazon.com/images/I/81fiotccNCL._AC_UY218_.jpg,The alchemist [Lingua Inglese],sponibile immediatamente,1 dic. 2002,134143,"Arte, cinema e fotografia"
1529105102,https://m.media-amazon.com/images/I/81PdkxXJObL._AC_UY218_.jpg,"The Boy, The Mole, The Fox and The Horse: Charlie Mackesy",sponibile immediatamente,29 ago. 2025,125954,"Arte, cinema e fotografia"
0349139636,https://m.media-amazon.com/images/I/71ud9Tcj5YL._AC_UY218_.jpg,The Goldfinch: Donna Tartt,sponibile immediatamente,26 nov. 2024,124994,"Arte, cinema e fotografia"
0571334652,https://m.media-amazon.com/images/I/61nFGO425OL._AC_UY218_.jpg,Normal People: The multimillion copy bestseller,sponibile immediatamente,2 mag. 2019,122072,"Arte, cinema e fotografia"
1408891387,https://m.media-amazon.com/images/I/81kONtZsITL._AC_UY218_.jpg,The Song of Achilles: Bloomsbury Modern Classics,sponibile immediatamente,21 set. 2017,120547,"Arte, cinema e fotografia"
1914425022,https://m.media-amazon.com/images/I/71VQK43EoAL._AC_UY218_.jpg,Zodiac Academy: The Awakening,sponibile immediatamente,8 set. 2021,111721,"Arte, cinema e fotografia"
1472223829,https://m.media-amazon.com/images/I/91Pcy-XIBDL._AC_UY218_.jpg,Hamnet : WINNER OF THE WOMEN'S PRIZE FOR FICTION 2020 - THE NO. 1 BESTSELLER: Maggie O'Farrell,sponibile immediatamente,15 mag. 2025,73524,"Arte, cinema e fotografia"
1398529486,https://m.media-amazon.com/images/I/81TDiLmks2L._AC_UY218_.jpg,Powerless: TikTok made me buy it! The most epic and sizzling fantasy romance book of the year: 1,sponibile immediatamente,26 nov. 2024,64980,"Arte, cinema e fotografia"
0006546064,https://m.media-amazon.com/images/I/71b674P2aKL._AC_UY218_.jpg,Fahrenheit 451 [Inglese],sponibile immediatamente,16 ago. 1999,56943,"Arte, cinema e fotografia"
1335534636,https://m.media-amazon.com/images/I/71ZQTREIELL._AC_UY218_.jpg,Heated Rivalry: Now Streaming on Crave and HBO Max: 2,sponibilità: solo 3,20 gen. 2026,53230,"Arte, cinema e fotografia"
0571056865,https://m.media-amazon.com/images/I/710kMF3SzEL._AC_UY218_.jpg,Lord of The Flies Education: a novel,sponibile immediatamente,24 mag. 1995,51775,"Arte, cinema e fotografia"
0349448256,https://m.media-amazon.com/images/I/91TXgDTr5eL._AC_UY218_.jpg,"Bridgerton: An Offer From A Gentleman. Netflix Tie-In: Benedict's Story, the inspiration for Bridgerton series four: 3",sponibile immediatamente,20 gen. 2026,49984,"Arte, cinema e fotografia"
0140167773,https://m.media-amazon.com/images/I/81YhQfeiynL._AC_UY218_.jpg,The Secret History: From the Pulitzer Prize-winning author of The Goldfinch,sponibile immediatamente,24 gen. 2025,49596,"Arte, cinema e fotografia"
1804955914,https://m.media-amazon.com/images/I/912brAq45fL._AC_UY218_.jpg,God of Wrath: An addictive dark mafia romance from the New York Times bestselling author,sponibile immediatamente,15 mag. 2025,45805,"Arte, cinema e fotografia"
1804955957,https://m.media-amazon.com/images/I/81jrz5OgJkL._AC_UY218_.jpg,God of Fury: An addictive dark college romance from the New York Times bestselling author,sponibile immediatamente,22 lug. 2025,45479,"Arte, cinema e fotografia"
0007578490,https://m.media-amazon.com/images/I/7157ctJGaqL._AC_UY218_.jpg,The Giver. Film Tie-In [Lingua inglese],sponibile immediatamente,31 lug. 2014,41878,"Arte, cinema e fotografia"
1335534644,https://m.media-amazon.com/images/I/71LLGT0DIxL._AC_UY218_.jpg,The Long Game: Now Streaming on Crave and HBO Max: 6,sponibile immediatamente,20 gen. 2026,41572,"Arte, cinema e fotografia"
0571258093,https://m.media-amazon.com/images/I/716qHj8vH7L._AC_UY218_.jpg,Never Let Me Go,sponibile immediatamente,25 feb. 2010,39281,"Arte, cinema e fotografia"
1788176189,https://m.media-amazon.com/images/I/911UmVYIcBL._AC_UY218_.jpg,The Let Them Theory : A Life-Changing Tool That Millions of People Can’t Stop Talking About,sponibile immediatamente,31 dic. 2023,37213,"Arte, cinema e fotografia"
1335534628,https://m.media-amazon.com/images/I/71ejSFcGc1L._AC_UY218_.jpg,GAME CHANGER: Now Streaming on Crave and HBO Max: 1,sponibile immediatamente,26 nov. 2024,33153,"Arte, cinema e fotografia"
1398536512,https://m.media-amazon.com/images/I/71vflgiZIUL._AC_UY218_.jpg,Better Than the Movies: by Lynne Painter,sponibile immediatamente,26 nov. 2024,26626,"Arte, cinema e fotografia"
B0BL797SSS,https://m.media-amazon.com/images/I/81IENwdbF-L._AC_UY218_.jpg,Magnolia Parks: TikTok made me buy it! The addictive romance sensation – Book 1 (Magnolia Parks Universe) (English Edition),sponibile immediatamente,1 dic. 2022,23922,"Arte, cinema e fotografia"
0761169253,https://m.media-amazon.com/images/I/6160ydZQJxL._AC_UY218_.jpg,Steal Like an Artist: 10 Things Nobody Told You About Being Creative,sponibile immediatamente,28 feb. 2012,19203,"Arte, cinema e fotografia"
0099561549,https://m.media-amazon.com/images/I/71njb0VDPuL._AC_UY218_.jpg,Stoner: A Novel [Lingua inglese],sponibile immediatamente,10 apr. 2012,19174,"Arte, cinema e fotografia"
1509804757,https://m.media-amazon.com/images/I/91+xmGo-wvL._AC_UY218_.jpg,The Gruffalo,sponibile immediatamente,11 ott. 2016,17332,"Arte, cinema e fotografia"
1335534598,https://m.media-amazon.com/images/I/71hLRrhhhPL._AC_UY218_.jpg,TOUGH GUY: Now Streaming on Crave and HBO Max: 3,sponibile immediatamente,26 nov. 2024,16024,"Arte, cinema e fotografia"
0060959479,https://m.media-amazon.com/images/I/71xEY+ZI8kL._AC_UY218_.jpg,All About Love: New Visions,sponibile immediatamente,30 gen. 2018,13991,"Arte, cinema e fotografia"
1335534601,https://m.media-amazon.com/images/I/718Ilzh2NyL._AC_UY218_.jpg,COMMON GOAL: Now Streaming on Crave and HBO Max: 4,sponibile immediatamente,26 nov. 2024,13537,"Arte, cinema e fotografia"
1250208149,https://m.media-amazon.com/images/I/A1XKsrTPlML._AC_UY218_.jpg,The Antiquarian Sticker Book : An Illustrated Compendium of Adhesive Ephemera,sponibilità: solo 4,15 mag. 2025,13058,"Arte, cinema e fotografia"
152911179X,https://m.media-amazon.com/images/I/71jIvFJGf9L._AC_UY218_.jpg,I Who Have Never Known Men: The heart-breaking post-apocalyptic TikTok sensation,sponibile immediatamente,25 gen. 2025,12899,"Arte, cinema e fotografia"
0261103253,https://m.media-amazon.com/images/I/913sMwNHsBL._AC_UY218_.jpg,The Lord of the Rings: The Classic Bestselling Fantasy Novel,sponibile immediatamente,17 apr. 2007,12091,"Arte, cinema e fotografia"
1472518381,https://m.media-amazon.com/images/I/71mmrzTTueL._AC_UY218_.jpg,Hamlet: Revised Edition,sponibile immediatamente,21 apr. 2016,11235,"Arte, cinema e fotografia"
1401308775,https://m.media-amazon.com/images/I/617-2I06oGL._AC_UY218_.jpg,Dead Poets Society: N.H. Kleinbaum,sponibilità: solo 10,1 set. 2006,6471,"Arte, cinema e fotografia"
1603580557,https://m.media-amazon.com/images/I/71+QmpkC0aL._AC_UY218_.jpg,Thinking in Systems: International Bestseller,sponibile immediatamente,5 dic. 2008,5962,"Arte, cinema e fotografia"
1526364107,https://m.media-amazon.com/images/I/81b5degOodL._AC_UY218_.jpg,Billie Eilish: In Her Own Words: The Official Book,sponibile immediatamente,11 mag. 2021,5677,"Arte, cinema e fotografia"
0199536228,https://m.media-amazon.com/images/I/8132CtOef4L._AC_UY218_.jpg,Strange Case of Dr Jekyll and Mr Hyde and Other Tales,sponibile immediatamente,22 gen. 2013,4862,"Arte, cinema e fotografia"
024143811X,https://m.media-amazon.com/images/I/91ooulyPV2L._AC_UY218_.jpg,The Interior Design Handbook,sponibile immediatamente,7 feb. 2025,4261,"Arte, cinema e fotografia"
1638583528,https://m.media-amazon.com/images/I/91IYJiC6LmL._AC_UY218_.jpg,Heaven Official's Blessing Vol. 4: Tian Guan Ci Fu (Novel),sponibile immediatamente,27 set. 2022,4245,"Arte, cinema e fotografia"
4861522471,https://m.media-amazon.com/images/I/61CCq+e0vWL._AC_UY218_.jpg,A Dictionary of Color Combinations,sponibilità: solo 2,17 mar. 2011,4229,"Arte, cinema e fotografia"
B0D3J18V6F,https://m.media-amazon.com/images/I/71uowtGHgSL._AC_UY218_.jpg,Il Dio dei nostri padri: Il grande romanzo della Bibbia,Aldo Cazzullo,24 set. 2024,3112,"Arte, cinema e fotografia"
8867582283,https://m.media-amazon.com/images/I/61+9KTM0hHL._AC_UY218_.jpg,"Uno, nessuno e centomila",Luigi Pirandello,1 gen. 2021,2989,"Arte, cinema e fotografia"
1787335739,https://m.media-amazon.com/images/I/71twhiFXTNL._AC_UY218_.jpg,What We Can Know: Shortlisted for the Nero Book Awards Fiction Award 2025,sponibile immediatamente,4 nov. 2025,2561,"Arte, cinema e fotografia"
1646081528,https://m.media-amazon.com/images/I/71xhy9oD9vL._AC_UY218_.jpg,"La migliore guida alla calligrafia moderna & hand lettering per principianti: Impara l'handlettering: un manuale con consigli, tecniche, pagine per l'allenamento e progetti",June & Lucy,5 feb. 2020,2238,"Arte, cinema e fotografia"
0241422264,https://m.media-amazon.com/images/I/81s8qDunoiS._AC_UY218_.jpg,Madonna in a Fur Coat: Sabahattin Ali,sponibile immediatamente,29 ago. 2025,1936,"Arte, cinema e fotografia"
8893672154,https://m.media-amazon.com/images/I/81v0kLckvPL._AC_UY218_.jpg,Ti saluta stocazzo! Ignora e colora. 40 nuove parolacce da colorare. Ediz. illustrata,Aa.Vv.,2 nov. 2017,1852,"Arte, cinema e fotografia"
383658509X,https://m.media-amazon.com/images/I/71WlaSfm6iL._AC_UY218_.jpg,Virgil Abloh. Nike. ICONS,sponibilità: solo 6,15 nov. 2020,1745,"Arte, cinema e fotografia"
B0D47SKF19,https://m.media-amazon.com/images/I/71fWnZgtrbL._AC_UY218_.jpg,The Art and Making of Arcane,sponibile immediatamente,26 nov. 2024,1730,"Arte, cinema e fotografia"
1594749582,https://m.media-amazon.com/images/I/91Ibf9adRnL._AC_UY218_.jpg,Let's Find Momo!: A Hide-and-Seek Board Book: 3,sponibile immediatamente,18 apr. 2017,1710,"Arte, cinema e fotografia"
1506713750,https://m.media-amazon.com/images/I/91F1R5Ba4VL._AC_UY218_.jpg,The Art of Super Mario Odyssey,sponibile immediatamente,5 nov. 2019,1695,"Arte, cinema e fotografia"
8891589748,https://m.media-amazon.com/images/I/61LQOmSwuHL._AC_UY218_.jpg,"Ciao, io sono Chico",Francesco Taverna,24 ott. 2023,1667,"Arte, cinema e fotografia"
8857606627,https://m.media-amazon.com/images/I/81UJSdHlbSL._AC_UY218_.jpg,L'occhio del fotografo. Guida grafica ai principi della composizione,Michael Freeman,1 gen. 2014,1626,"Arte, cinema e fotografia"
8863885141,https://m.media-amazon.com/images/I/81xpTFkWV7L._AC_UY218_.jpg,Il musigatto. Metodo per lo studio del pianoforte. Livello preparatorio. Nuova ediz.,Maria Vacca,3 feb. 2016,1507,"Arte, cinema e fotografia"
1791934048,https://m.media-amazon.com/images/I/71n+vNEYz0L._AC_UY218_.jpg,Suoni e Silenzi: Il solfeggio più facile del mondo!: 1,Maestro Libero,18 dic. 2018,1451,"Arte, cinema e fotografia"
1718502346,https://m.media-amazon.com/images/I/71DFuHo7CRL._AC_UY218_.jpg,Open Circuits: The Inner Beauty of Electronic Components,sponibile immediatamente,1 nov. 2022,1350,"Arte, cinema e fotografia"
150672163X,https://m.media-amazon.com/images/I/81tC6rDaWdL._AC_UY218_.jpg,The Art of the Mass Effect Trilogy: Expanded Edition,sponibile immediatamente,23 feb. 2021,1313,"Arte, cinema e fotografia"
1700809792,https://m.media-amazon.com/images/I/71jak87mQdL._AC_UY218_.jpg,Crea i tuoi fumetti personalizzati,Papeterie Bleu,27 nov. 2019,1251,"Arte, cinema e fotografia"
8863885044,https://m.media-amazon.com/images/I/81UF6xTIwdL._AC_UY218_.jpg,Il solfeggio a... fumetti. Corso di solfeggio per bambini. Nuova ediz. (Vol. 1),Maria Vacca,3 feb. 2016,1202,"Arte, cinema e fotografia"
8806243888,https://m.media-amazon.com/images/I/81iVlfg-8IL._AC_UY218_.jpg,Figure. Come funzionano le immagini dal Rinascimento a Instagram. Ediz. illustrata,Riccardo Falcinelli,6 ott. 2020,1143,"Arte, cinema e fotografia"
3836560011,https://m.media-amazon.com/images/I/717TCHhuCZL._AC_UY218_.jpg,Dalí,Gilles Néret,15 lug. 2015,1090,"Arte, cinema e fotografia"
B08VYLNZJ7,https://m.media-amazon.com/images/I/71CI6e6VaJL._AC_UY218_.jpg,Le Più Belle 777 Barzellette E Indovinelli Per Bambini: RIDI A CREPAPELLE! Stimola La Creatività Dei Tuoi Bimbi Con Una Valanga Di Risate Per Tutta La Famiglia. Extra Bonus Di 150 Colmi Ed Enigmi.,Chioccia,5 feb. 2021,986,"Arte, cinema e fotografia"
0804850801,https://m.media-amazon.com/images/I/818THxUnnkL._AC_UY218_.jpg,"Origami Paper Kimono Patterns: Tuttle Origami Paper; High-quality Double-sided Origami Sheets Printed With 12 Patterns; Instructions for 6 Projects Included; 200 Sheets, 6 Inch, 15 Cm",sponibilità: solo 6,12 mar. 2019,981,"Arte, cinema e fotografia"
8896450039,https://m.media-amazon.com/images/I/71F1nsdKg0L._AC_UY218_.jpg,"Story. Contenuti, struttura, stile, principi per la sceneggiatura e per l'arte di scrivere storie",Robert McKee,1 dic. 2010,966,"Arte, cinema e fotografia"
B08N3NBQC7,https://m.media-amazon.com/images/I/71WmVNrrpCL._AC_UY218_.jpg,Coupon erotici: 52 coupon erotici per lui,Marble Bay Media,10 nov. 2020,959,"Arte, cinema e fotografia"
B0F63SVP5Y,https://m.media-amazon.com/images/I/6196YVJNUbL._AC_UY218_.jpg,Suoniamo La Chitarra. Include Audio-online,Roberto Fabbri,1 gen. 1900,944,"Arte, cinema e fotografia"
1856697053,https://m.media-amazon.com/images/I/61D9NqoF11L._AC_UY218_.jpg,Pattern Magic: (E),sponibile immediatamente,6 set. 2010,931,"Arte, cinema e fotografia"
8850730683,https://m.media-amazon.com/images/I/71N4Q4-hDvL._AC_UY218_.jpg,VOLONTE Manuale completo di chitarra. Corso per principianti. Con espansione online,Massimo Varini,1 giu. 2017,909,"Arte, cinema e fotografia"
1856697061,https://m.media-amazon.com/images/I/61OeSdsidxL._AC_UY218_.jpg,Pattern Magic 2: (E),sponibile immediatamente,21 feb. 2011,908,"Arte, cinema e fotografia"
383656369X,https://m.media-amazon.com/images/I/613Xov8qOnL._AC_UY218_.jpg,1000 Chairs. Revised and updated edition,sponibilità: solo 1,25 set. 2017,906,"Arte, cinema e fotografia"
B08GRKGY5Q,https://m.media-amazon.com/images/I/71LbVbnaXeL._AC_UY218_.jpg,"Libro da colorare per bambini: Numeri, Lettere, Forme. Libro di attività per bambini in età prescolare.",Libro da Colorare Kim,26 ago. 2020,799,"Arte, cinema e fotografia"
8832008041,https://m.media-amazon.com/images/I/71pOu2BAcYL._AC_UY218_.jpg,Suonare la batteria. Guida completa per imparare a suonare la batteria da zero. Con videotutorial. Con File audio per il download,Corrado Bertonazzi,11 ott. 2018,783,"Arte, cinema e fotografia"
1780676948,https://m.media-amazon.com/images/I/71SLIjOLhML._AC_UY218_.jpg,"Pattern Magic 3: The latest addition to the cult Japanese Pattern Magic series (dress-making, pattern design, sewing, fashion)",sponibile immediatamente,22 feb. 2016,750,"Arte, cinema e fotografia"
B08H6QGPDB,https://m.media-amazon.com/images/I/715g5MaUTPL._AC_UY218_.jpg,L'arte del mandala: Libro da colorare antistress per adulti con mandala decorativi.,Libro da Colorare Kim,28 ago. 2020,746,"Arte, cinema e fotografia"
B08H4RZ4SR,https://m.media-amazon.com/images/I/81vQOxxwS4L._AC_UY218_.jpg,Animali Fantastici: Un libro da colorare antistress per adulti con animali nello stile di un mandala.,Libro da Colorare Kim,27 ago. 2020,720,"Arte, cinema e fotografia"
B00473NNKA,https://m.media-amazon.com/images/I/81CKVUOrEOL._AC_UY218_.jpg,Le scale,Vincenzo Mannino,1 gen. 2010,667,"Arte, cinema e fotografia"
8854028223,https://m.media-amazon.com/images/I/71zMau4Y6FL._AC_UY218_.jpg,Corso completo di fotografia digitale,Ian Farrell,23 lug. 2015,650,"Arte, cinema e fotografia"
8858128796,https://m.media-amazon.com/images/I/61Y-HiK5XDL._AC_UY218_.jpg,"Fantasia. Invenzione, creatività e immaginazione nelle comunicazioni visive",Bruno Munari,16 mar. 2017,637,"Arte, cinema e fotografia"
B08NS9J31W,https://m.media-amazon.com/images/I/71EZ5L-1sYL._AC_UY218_.jpg,"Fiori Rilassanti: Libro da colorare per adulti con motivi floreali, mazzi di fiori, ghirlande e decorazioni varie.",Libro da Colorare Kim,18 nov. 2020,620,"Arte, cinema e fotografia"
8859278813,https://m.media-amazon.com/images/I/71WI8z2bLrS._AC_UY218_.jpg,"Italia in 52 weekend. Itinerari inconsueti tra natura, arte e tradizioni",Aavv,27 mag. 2021,608,"Arte, cinema e fotografia"
B0DK8D2642,https://m.media-amazon.com/images/I/71iwyy-U0WL._AC_UY218_.jpg,"Omniscient Reader's Viewpoint (novel), Vol. 1",sponibile immediatamente,27 ago. 2025,590,"Arte, cinema e fotografia"
8897353088,https://m.media-amazon.com/images/I/81eFunWKoFL._AC_UY218_.jpg,Esercizi progressivi di solfeggi parlati e cantati. Per la scuola secondaria di primo grado,Nerina Poltronieri,16 apr. 2018,578,"Arte, cinema e fotografia"
B08GLSY821,https://m.media-amazon.com/images/I/71ei4aiDVLL._AC_UY218_.jpg,"Unicorno Libro da Colorare: Magiche avventure di unicorno piene di fate, principesse, castelli, arcobaleno e animali.",Libro da Colorare Kim,25 ago. 2020,531,"Arte, cinema e fotografia"
B09GCSLFYS,https://m.media-amazon.com/images/I/71kMIer7KmL._AC_UY218_.jpg,"La Guida Completa alla Calligrafia Moderna & Hand Lettering per Principianti: Una guida passo dopo passo e un libro di esercizi con teoria, tecniche, ... e progetti per imparare l’arte del lettering",Special Art Entertainment,13 set. 2021,524,"Arte, cinema e fotografia"
B0053CE29U,https://m.media-amazon.com/images/I/71lA9SLLqNL._AC_UY218_.jpg,Il primo libro per lo studio del pianoforte,Antonoi Trombone,1 gen. 2011,515,"Arte, cinema e fotografia"
0215734610,https://m.media-amazon.com/images/I/61xJ2ks5LSL._AC_UY218_.jpg,Teoria Musicale,Rossi L,1 gen. 1977,498,"Arte, cinema e fotografia"
8863885133,https://m.media-amazon.com/images/I/81ftCSWsgWL._AC_UY218_.jpg,Il Piano Magico V.1,Maria Vacca,3 feb. 2016,494,"Arte, cinema e fotografia"
8857610179,https://m.media-amazon.com/images/I/615wrPdKgvL._AC_UY218_.jpg,La bibbia del fotografo,Michael Freeman,30 apr. 2019,494,"Arte, cinema e fotografia"
164608179X,https://m.media-amazon.com/images/I/61BbqaAk5SL._AC_UY218_.jpg,Guida per iniziare con la calligrafia moderna e l'hand lettering per giovani artisti,June & Lucy Kids,16 apr. 2020,489,"Arte, cinema e fotografia"
B0CYKZYHZ6,https://m.media-amazon.com/images/I/71IUOYpzDzL._AC_UY218_.jpg,"TATTICHE DI CONVERSAZIONE: Le Regole d’Oro per avere una Comunicazione Efficace e Persuasiva, Saper Gestire ogni tipo di Conversazione ed Aumentare la propria Autostima",James Path,19 mar. 2024,486,"Arte, cinema e fotografia"
8865209763,https://m.media-amazon.com/images/I/81M2MM9tukL._AC_UY218_.jpg,Enciclopedia delle tecniche a uncinetto. Una guida completa e illustrata alle tecniche tradizionali e moderne,Jan Eaton,19 set. 2018,482,"Arte, cinema e fotografia"
8867222996,https://m.media-amazon.com/images/I/61p6TXE3AnL._AC_UY218_.jpg,Anatomia artistica. Carnet di morfologia,Michel Lauricella,28 set. 2017,478,"Arte, cinema e fotografia"
B08K3YHWRM,https://m.media-amazon.com/images/I/81uoS-zrKbL._AC_UY218_.jpg,Disegni Mandala: Libro da colorare per adulti antistress con bellissimi e grandi mandala complessi.,Libro da Colorare Kim,25 set. 2020,471,"Arte, cinema e fotografia"
B0041LV0DK,https://m.media-amazon.com/images/I/81hF9Y4dqWL._AC_UY218_.jpg,Antologia pianistica. per la scuola secondaria di primo grado. Volume 1,G. Piccioli,1 gen. 2009,468,"Arte, cinema e fotografia"
1506754902,https://m.media-amazon.com/images/I/81XfP0JrwrL._AC_UY218_.jpg,Rosalina's Storybook,sponibilità: solo 10,21 gen. 2026,459,"Arte, cinema e fotografia"
8850727097,https://m.media-amazon.com/images/I/61d25AJSgjL._AC_UY218_.jpg,Manuale degli accordi: Carisch Music Lab Italia,Massimo Varini,1 gen. 2015,445,"Arte, cinema e fotografia"
B00OQZMOZE,https://m.media-amazon.com/images/I/91Sdhzo7MtL._AC_UY218_.jpg,Amleto (Liber Liber),William Shakespeare,1 ott. 2014,435,"Arte, cinema e fotografia"
1922785369,https://m.media-amazon.com/images/I/71viInZ6s3L._AC_UY218_.jpg,Seasons of the Witch – Ostara Oracle,sponibilità: solo 1,25 ago. 2902,434,"Arte, cinema e fotografia"
B08PJK78WZ,https://m.media-amazon.com/images/I/71e82Pm0AQS._AC_UY218_.jpg,"Gatti con Mandala - Libro da Colorare per Adulti: Più di 50 simpatici, amorevoli e bellissimi Gatti. Libri da colorare antistress con disegni rilassanti. (Idea Regalo, Formato Grande)",Special Art,4 dic. 2020,430,"Arte, cinema e fotografia"
8806249142,https://m.media-amazon.com/images/I/81lm0H69ORL._AC_UY218_.jpg,La lunga attesa dell'angelo. Nuova ediz.,Melania G. Mazzucco,16 mar. 2021,425,"Arte, cinema e fotografia"
0215900383,https://m.media-amazon.com/images/I/71viCcw1RyL._AC_UY218_.jpg,Metodo completo per la divisione,Bona Pasquale,1 gen. 2008,423,"Arte, cinema e fotografia"
B0B1BTQ4KB,https://m.media-amazon.com/images/I/71hSh57FWDL._AC_UY218_.jpg,Imparare a disegnare: Guida pratica per imparare l’arte del disegno artistico dalle basi alle tecniche più avanzate,Alfredo Papa,19 mag. 2022,413,"Arte, cinema e fotografia"
8804792981,https://m.media-amazon.com/images/I/61UPp4J+NKL._AC_UY218_.jpg,Lo potevo fare anch'io. Perché l'arte contemporanea è davvero arte,Francesco Bonami,24 apr. 2024,412,"Arte, cinema e fotografia"
B0B1C5NJQ2,https://m.media-amazon.com/images/I/71KXBLJvxKL._AC_UY218_.jpg,Il Mio Primo Libro da colorare per bambini da 1 anno: Album da disegno da colorare e scarabocchiare con più di 50 immagini create con amore per sviluppare la motricità fine e la creatività.,bambiniz,18 mag. 2022,404,"Arte, cinema e fotografia"
B08L94NGP2,https://m.media-amazon.com/images/I/71pE2346YWL._AC_UY218_.jpg,Mandala per bambini: Libro da colorare con motivi semplici Mandala.,Libro da Colorare Kim,18 ott. 2020,395,"Arte, cinema e fotografia"
1646093488,https://m.media-amazon.com/images/I/910g-+HTn9L._AC_UY218_.jpg,The Apothecary Diaries Art Book,sponibile immediatamente,6 mag. 2025,390,"Arte, cinema e fotografia"
B0F35VYDTM,https://m.media-amazon.com/images/I/716GQaqXR4L._AC_UY218_.jpg,Fabrizio De André: Il libro del mondo,Walter Pistarini,16 lug. 2025,390,"Arte, cinema e fotografia"
8822730194,https://m.media-amazon.com/images/I/81Gd5TMRCUL._AC_UY218_.jpg,Il metodo sticazzi! Per colorare,AA.VV.,28 feb. 2019,388,"Arte, cinema e fotografia"
8864910077,https://m.media-amazon.com/images/I/61g7ooFEBFL._AC_UY218_.jpg,Il manuale dei nodi,Geoffrey Budworth,1 mag. 2014,388,"Arte, cinema e fotografia"
B09JV97ZFS,https://m.media-amazon.com/images/I/71833FN2aqL._AC_UY218_.jpg,150 Mandala: Un libro da colorare per adulti con 150 bellissimi mandala in vari stili per alleviare lo stress e rilassarsi,Creative Mandala,19 ott. 2021,373,"Arte, cinema e fotografia"
B0B4BRQTVT,https://m.media-amazon.com/images/I/61W2-5QT6WL._AC_UY218_.jpg,MANUALE DEL LINGUAGGIO DEL CORPO: Le Regole d’Oro Per Analizzare Ogni Gesto ed Espressione Altrui : Sfrutta Appieno l’Intelligenza Emotiva Per Capire Sempre Con Chi Hai a Che Fare Realmente,James Path,21 giu. 2022,371,"Arte, cinema e fotografia"
B0041LV21U,https://m.media-amazon.com/images/I/817ogvDWiPL._AC_UY218_.jpg,Il pianista virtuoso,Charles-Louis Hanon,1 gen. 2010,359,"Arte, cinema e fotografia"
8891596728,https://m.media-amazon.com/images/I/81Qr7to+a+L._AC_UY218_.jpg,A tutto Chico,Francesco Taverna,7 mag. 2024,356,"Arte, cinema e fotografia"
0215901479,https://m.media-amazon.com/images/I/51HZ9EdSSDL._AC_UY218_.jpg,Scale E Arpeggi V.1,Luigi Schininà,1 gen. 2010,355,"Arte, cinema e fotografia"
B08TFDNJLY,https://m.media-amazon.com/images/I/71W7wv-4m6L._AC_UY218_.jpg,Friggitrice ad Aria: L’Unico Ricettario Tutto Italiano con 300 Ricette Salutari e Gustose da Preparare in 5 min. 21 Trucchi per Cucinare Pietanze Sane con lo Stesso Gusto di una Frittura Tradizionale,Dafne Bianco,19 gen. 2021,351,"Arte, cinema e fotografia"
B0FW4J4ZTJ,https://m.media-amazon.com/images/I/71epc42MGWL._AC_UY218_.jpg,"CONCORSO ISTRUTTORE AMMINISTRATIVO ENTI LOCALI - CATEGORIA C: Guida Completa Spiegata Facile, con Teoria Chiara, Box Pratici, Tabelle di Sintesi e ... e Approfondire - Manuale Aggiornato",il TUO Concorso,13 ott. 2025,349,"Arte, cinema e fotografia"
3836589052,https://m.media-amazon.com/images/I/81LQH42KtCL._AC_UY218_.jpg,Caravaggio. L'opera completa. 45th Ed.,Sebastian Schütze,29 lug. 2021,347,"Arte, cinema e fotografia"
8806154443,https://m.media-amazon.com/images/I/71RjnyNuaWL._AC_UY218_.jpg,La grammatica della musica,Ottó Károlyi,8 feb. 2000,345,"Arte, cinema e fotografia"
8855057243,https://m.media-amazon.com/images/I/61zKPdjgUcL._AC_UY218_.jpg,Colori. La guida completa,Rossella Migliaccio,29 nov. 2022,343,"Arte, cinema e fotografia"
889735324X,https://m.media-amazon.com/images/I/61QhdvlPwDL._AC_UY218_.jpg,Lezioni di teoria musicale. Per gli Ist. magistrali,Nerina Poltronieri,1 gen. 2016,340,"Arte, cinema e fotografia"
8875703264,https://m.media-amazon.com/images/I/71kFr66y5IL._AC_UY218_.jpg,Come diventare un esploratore del mondo. Ediz. illustrata,Keri Smith,1 dic. 2011,339,"Arte, cinema e fotografia"
