ASIN,Copertina,Titolo,Autore,Data,Recensioni,Categoria
8892218441,https://m.media-amazon.com/images/I/61Zo1XI-7TL._AC_UY218_.jpg,Le dieci parole. Catechesi sui comandamenti,Francesco,22 feb. 2019,262,Religione e spiritualità
8848603831,https://m.media-amazon.com/images/I/618qa1D8GOL._AC_UY218_.jpg,Gesù di Nazaret,Benedetto XVI,19 mar. 2008,261,Religione e spiritualità
8886616961,https://m.media-amazon.com/images/I/71NmcBoBlEL._AC_UY218_.jpg,Coroncina e novena alla Divina Misericordia,M. Faustina Kowalska,1 gen. 2014,261,Religione e spiritualità
8831528947,https://m.media-amazon.com/images/I/61fggo2fIML._AC_UY218_.jpg,Il castello interiore,Teresa d'Avila,1 lug. 2005,260,Religione e spiritualità
B01FUFNRI6,https://m.media-amazon.com/images/I/81fQSYWp3FL._AC_UY218_.jpg,Le Visioni della Beata Anna Caterina Emmerick (I doni della Chiesa),Anna Caterina Emmerick,18 mag. 2016,254,Religione e spiritualità
8886616422,https://m.media-amazon.com/images/I/71tCk2f1eIL._AC_UY218_.jpg,Novena a san Michele Arcangelo,AA.VV.,1 gen. 1999,251,Religione e spiritualità
8892225936,https://m.media-amazon.com/images/I/71nEtlmjkXS._AC_UY218_.jpg,"San Giuseppe. Accogliere, custodire e nutrire",Fabio Rosini,10 giu. 2021,250,Religione e spiritualità
B0CFT1L6RN,https://m.media-amazon.com/images/I/91SYyUy5-qL._AC_UY218_.jpg,"Dieta chetogenica in 30 giorni: Menu settimanale Day by Day - 100 ricette a tua disposizione (Come dimagrire per sempre, in maniera sana, naturale ed efficace, con la vera dieta chetogenica. Vol. 1)",Ivan Lopresti,14 ago. 2023,249,Religione e spiritualità
B08HGR5G1G,https://m.media-amazon.com/images/I/71cr532K6IL._AC_UY218_.jpg,I Promessi Sposi: Riassunto breve e dettagliato capitolo per capitolo,Patrick Cherif,3 set. 2020,237,Religione e spiritualità
8804793775,https://m.media-amazon.com/images/I/71ssdlUpp-L._AC_UY218_.jpg,L'avventura d'un povero cristiano,Ignazio Silone,7 mag. 2024,236,Religione e spiritualità
8886468121,https://m.media-amazon.com/images/I/71Scnq+-AEL._AC_UY218_.jpg,Yoga Nidra,Swami Saraswati Satyananda,26 set. 2016,236,Religione e spiritualità
B004GXAX90,https://m.media-amazon.com/images/I/61XCXqx5XkL._AC_UY218_.jpg,Il Vangelo e gli Atti degli Apostoli,"""editio princeps""",20 dic. 2010,236,Religione e spiritualità
9655986683,https://m.media-amazon.com/images/I/71D3AoTsS-L._AC_UY218_.jpg,Jerusalén: desde el Paraíso hasta la Eternidad,sponibile immediatamente,8 feb. 2024,236,Religione e spiritualità
8834016009,https://m.media-amazon.com/images/I/71c95gg3w6L._AC_UY218_.jpg,LO YOGA DI GESU',PARAMHANSA YOGANANDA SWA,22 giu. 2011,231,Religione e spiritualità
8822896580,https://m.media-amazon.com/images/I/71LHFBV-l9L._AC_UY218_.jpg,Il Sutra del Loto,Massimo Claus,20 apr. 2017,229,Religione e spiritualità
B0C5VVSVB8,https://m.media-amazon.com/images/I/61a4DZqSvoL._AC_UY218_.jpg,"IL CODICE VERNE: Il segreto degli Anunnaki, di Atlantide e della vera forma della Terra, svelato",Jesús Cediel,20 mag. 2023,228,Religione e spiritualità
8806267132,https://m.media-amazon.com/images/I/71GoiCimzgL._AC_UY218_.jpg,La legge del desiderio. Radici bibliche della psicoanalisi,Massimo Recalcati,16 set. 2025,223,Religione e spiritualità
B0CRPZRL6Z,https://m.media-amazon.com/images/I/61ticRCpjLL._AC_UY218_.jpg,"DIARIO ZEN: 12 mesi per scoprire consapevolezza, ottimismo e serenità in soli 3 minuti al giorno. Inizia da qui.",Luca Daisei Hiroki,6 gen. 2024,222,Religione e spiritualità
8826601984,https://m.media-amazon.com/images/I/71DWlE+qihL._AC_UY218_.jpg,Catechismo della Chiesa cattolica,AA.VV,7 dic. 2018,219,Religione e spiritualità
8861381170,https://m.media-amazon.com/images/I/71rNskUOv+L._AC_UY218_.jpg,Alle porte del cielo e dell'inferno. Testimonianza di Gloria Polo,Gloria Polo,16 gen. 2019,219,Religione e spiritualità
8866714283,https://m.media-amazon.com/images/I/71WRvLbir2L._AC_UY218_.jpg,Il libro dei Salmi,Aa.Vv.,15 feb. 2018,218,Religione e spiritualità
8892221949,https://m.media-amazon.com/images/I/616UNXcXQ+L._AC_UY218_.jpg,"LA BIBBIA, SCRUTATE LE SCRITTURE. EDIZIONE RILEGATA.",Aa.Vv.,16 ott. 2020,218,Religione e spiritualità
8821591395,https://m.media-amazon.com/images/I/71QQ36ZJFYL._AC_UY218_.jpg,Evangelii gaudium. Esortazione apostolica,Francesco,20 nov. 2013,218,Religione e spiritualità
8856697270,https://m.media-amazon.com/images/I/615lEeevQpL._AC_UY218_.jpg,Abbi cura di te. Riscopri la bellezza di vivere,fra Stefano,18 mar. 2025,216,Religione e spiritualità
8845910091,https://m.media-amazon.com/images/I/61S9FNYrWdL._AC_UY218_.jpg,"I vangeli gnostici. Vangeli di Tomaso, Maria, Verità, Filippo",Luigi Moraldi,29 set. 1993,215,Religione e spiritualità
8817048321,https://m.media-amazon.com/images/I/615YGGA54+L._AC_UY218_.jpg,Gesù di Nazaret. Dal battesimo alla trasfigurazione,Benedetto XVI,10 mar. 2011,211,Religione e spiritualità
8884040736,https://m.media-amazon.com/images/I/71bxhk551rL._AC_UY218_.jpg,La dolorosa passione di nostro Signore Gesù Cristo. Secondo le visioni della beata Anna Katharina Emmerick,Anna K. Emmerick,1 gen. 2015,210,Religione e spiritualità
882157895X,https://m.media-amazon.com/images/I/61Wo6NIJTQL._AC_UY218_.jpg,L'imitazione di Cristo,Ambrogio Recalcati,1 lug. 2013,209,Religione e spiritualità
8831544217,https://m.media-amazon.com/images/I/51r3CsYepwL._AC_UY218_.jpg,Lumen fidei. Lettera enciclica sulla fede,Francesco,7 lug. 2013,206,Religione e spiritualità
B0B5KQMZSH,https://m.media-amazon.com/images/I/71VjoFsvSFL._AC_UY218_.jpg,CODICI NUMERICI SACRI CANALIZZATO DA AGESTA,OM TSÉ,8 lug. 2022,206,Religione e spiritualità
8834740157,https://m.media-amazon.com/images/I/71sIao-ai8L._AC_UY218_.jpg,"La chiave di Salomone. Magia nera, incantesimi, talismani, evocazioni diaboliche",Anonimo,15 gen. 2020,204,Religione e spiritualità
B0D3QCR3ZN,https://m.media-amazon.com/images/I/81UFTHivL7L._AC_UY218_.jpg,Benedetto il giorno che abbiamo sbagliato,Costanza Miriano,14 mag. 2024,203,Religione e spiritualità
880625992X,https://m.media-amazon.com/images/I/719te4vEXoL._AC_UY218_.jpg,La Legge della parola. Radici bibliche della psicoanalisi,Massimo Recalcati,12 set. 2023,200,Religione e spiritualità
B0CMPXPJ8Q,https://m.media-amazon.com/images/I/612vMSJZaEL._AC_UY218_.jpg,"Il Sentiero della Pace Interiore: Una guida pratica per una maggiore consapevolezza, auto-riflessione, pensiero positivo e armonia interiore attraverso storie buddiste zen di grande ispirazione",Sumitra Shakya,5 nov. 2023,199,Religione e spiritualità
B0DP39DGFF,https://m.media-amazon.com/images/I/71yqbiBXrnL._AC_UY218_.jpg,SUMERYA: Origini Aliene dell'Umanità e suo Destino,Adam Kadmon,24 nov. 2024,194,Religione e spiritualità
8817196258,https://m.media-amazon.com/images/I/61+Ik2HronL._AC_UY218_.jpg,La forza della mitezza. Un viaggio attraverso le pagine del Vangelo di Matteo,Luigi Maria Epicoco,23 set. 2025,189,Religione e spiritualità
8834016815,https://m.media-amazon.com/images/I/61BD-Xy0BML._AC_UY218_.jpg,Il libro tibetano del vivere e del morire,Sogyal,15 gen. 2015,188,Religione e spiritualità
8851138591,https://m.media-amazon.com/images/I/812wbT3QfjL._AC_UY218_.jpg,Il Corano. Testo originale a fronte,G. Mandel,1 mag. 2019,187,Religione e spiritualità
8807897962,https://m.media-amazon.com/images/I/51ZNaMt1B0L._AC_UY218_.jpg,La mente che mente,Osho,23 giu. 2023,185,Religione e spiritualità
8834002881,https://m.media-amazon.com/images/I/71NmgtBwXcL._AC_UY218_.jpg,Pranayama. La dinamica del respiro,André Van Lysebeth,1 nov. 1978,183,Religione e spiritualità
8885519148,https://m.media-amazon.com/images/I/51AInBKXcfL._AC_UY218_.jpg,IL VANGELO DI TOMMASO,Didimo Giuda Tommaso,1 giu. 2017,181,Religione e spiritualità
B0CLKTKP7M,https://m.media-amazon.com/images/I/810I-1N-I0L._AC_UY218_.jpg,"Le stagioni di Teresa: Un libro da leggere assolutamente, uno dei romanzi più venduti (ANUNNAKI - Narrativa Vol. 223)",Elisabetta Baraldi,20 nov. 2023,180,Religione e spiritualità
8892218263,https://m.media-amazon.com/images/I/51o6epzfh2L._AC_UY218_.jpg,Youcat for kids,Aa.Vv.,24 mag. 2019,180,Religione e spiritualità
8820984865,https://m.media-amazon.com/images/I/71hI1We50KL._AC_UY218_.jpg,Gesù di Nazaret. Dall'ingresso a Gerusalemme fino alla risurrezione,Benedetto XVI,10 mar. 2011,178,Religione e spiritualità
8884040795,https://m.media-amazon.com/images/I/71V4PDWfeZL._AC_UY218_.jpg,Tre minuti per Dio,Editrice Shalom,22 mag. 2005,177,Religione e spiritualità
8869963497,https://m.media-amazon.com/images/I/51c5fex9gFL._AC_UY218_.jpg,La nuova coscienza di Maria Maddalena. Il tuo risveglio attraverso la sua frequenza,Adele Venneri,11 lug. 2025,177,Religione e spiritualità
8804790954,https://m.media-amazon.com/images/I/81iS2rr3enL._AC_UY218_.jpg,"Come se tutto fosse un miracolo. Un cammino per riconquistare leggerezza, felicità e meraviglia",Daniel Lumera,2 apr. 2024,175,Religione e spiritualità
8892212516,https://m.media-amazon.com/images/I/61eYfCVerWL._AC_UY218_.jpg,Catechismo della Chiesa cattolica. Testo integrale. Nuovo commento teologico-pastorale,Rino Fisichella,10 ott. 2017,174,Religione e spiritualità
8896865050,https://m.media-amazon.com/images/I/91SrRVfPOoL._AC_UY218_.jpg,Le porte interiori. Meditazioni quotidiane,Eileen Caddy,9 feb. 2012,173,Religione e spiritualità
8884042178,https://m.media-amazon.com/images/I/712MkfnsBKL._AC_UY218_.jpg,Vangelo e Atti degli Apostoli. Nuova versione ufficiale della Conferenza Episcopale Italiana,Mariano Grosso,1 gen. 2015,172,Religione e spiritualità
8839928510,https://m.media-amazon.com/images/I/61B8naSpAlL._AC_UY218_.jpg,Introduzione al cristianesimo. Lezioni sul simbolo apostolico,Benedetto XVI,1 giu. 2005,170,Religione e spiritualità
8862447078,https://m.media-amazon.com/images/I/51unFyF8FJL._AC_UY218_.jpg,L'amore che decide. Due meditazioni in un tempo di indecisioni,Luigi Maria Epicoco,12 dic. 2018,169,Religione e spiritualità
8834002784,https://m.media-amazon.com/images/I/61TOt1pB6bL._AC_UY218_.jpg,"Mente zen, mente di principiante. Conversazioni sulla meditazione e la pratica zen",Shunryu Suzuki-Roshi,1 nov. 1978,165,Religione e spiritualità
B08L4GMKH7,https://m.media-amazon.com/images/I/71JzCNAZt3L._AC_UY218_.jpg,"RICALCARE LETTERE E NUMERI MAXI: 110 pagine di pratica per imparare l’alfabeto, tracciare lettere e numeri, scrivere e colorare",Matite Volanti,12 ott. 2020,162,Religione e spiritualità
8831545965,https://m.media-amazon.com/images/I/61BP9YqlPPL._AC_UY218_.jpg,Laudato si'. Lettera enciclica sulla cura della casa comune,Francesco,1 lug. 2015,159,Religione e spiritualità
8828537671,https://m.media-amazon.com/images/I/81LMC2IUqrL._AC_UY218_.jpg,Paura. Supera la tempesta con la saggezza,Hanh Thich Nhat,8 mar. 2022,159,Religione e spiritualità
B0FKGK9ZTW,https://m.media-amazon.com/images/I/61u0cRdMoAL._AC_UY218_.jpg,The Book of Wisdom: Volume 1 and 2,sponibile immediatamente,29 lug. 2025,159,Religione e spiritualità
B01FROZ0TO,https://m.media-amazon.com/images/I/71c-NSclsGL._AC_UY218_.jpg,La Passione di Nostro Signore secondo la Beata Anna Caterina Emmerick (I doni della Chiesa),Anna Caterina Emmerick,16 mag. 2016,158,Religione e spiritualità
B0DV9343FG,https://m.media-amazon.com/images/I/81mI4iwQQmL._AC_UY218_.jpg,I miracoli eucaristici nel mondo,Carlo Acutis,14 gen. 2025,156,Religione e spiritualità
B0D9WT9H3G,https://m.media-amazon.com/images/I/51+N0093s0L._AC_UY218_.jpg,Sei unica. Inno al genio femminile,Francesco,2 ott. 2024,156,Religione e spiritualità
8886616368,https://m.media-amazon.com/images/I/81kmOlBuXRL._AC_UY218_.jpg,Quindici orazioni di santa Brigida,Brigida di Svezia,1 set. 2013,156,Religione e spiritualità
B0B28D189M,https://m.media-amazon.com/images/I/517LnZwotpL._AC_UY218_.jpg,In sinu Jesu. Quando il cuore parla al cuore. Il diario di un sacerdote in preghiera,Monaco benedettino,9 apr. 2025,153,Religione e spiritualità
B01FUFNRHW,https://m.media-amazon.com/images/I/71TEA3oEbSL._AC_UY218_.jpg,Notte Oscura (I doni della Chiesa),San Giovanni della Croce,18 mag. 2016,152,Religione e spiritualità
B0FYF7HBTB,https://m.media-amazon.com/images/I/81YqQjMk62L._AC_UY218_.jpg,The Road Map: Escaping the Maze of Madness (English Edition),sponibile immediatamente,7 gen. 2026,152,Religione e spiritualità
B071WL4GLK,https://m.media-amazon.com/images/I/81xSzRg1c+L._AC_UY218_.jpg,Camminare in consapevolezza: Meraviglia e gratitudine ad ogni passo,Thich Nhat Hanh,5 giu. 2017,150,Religione e spiritualità
889222901X,https://m.media-amazon.com/images/I/61m5o5WI0sL._AC_UY218_.jpg,La Bibbia: 155,Aa.Vv.,3 giu. 2022,149,Religione e spiritualità
8831552619,https://m.media-amazon.com/images/I/61XXAjnNRJL._AC_UY218_.jpg,Stabili e credibili. Esercizi di fedeltà quotidiana,Luigi Maria Epicoco,13 lug. 2020,148,Religione e spiritualità
8809930975,https://m.media-amazon.com/images/I/71xvU+2QD3L._AC_UY218_.jpg,"Lo zen per samurai metropolitani. Manuale di sopravvivenza contro stress, ansia e paure",Antonio Antefermo,4 ott. 2023,147,Religione e spiritualità
B08PJD1695,https://m.media-amazon.com/images/I/71hz+daldKL._AC_UY218_.jpg,Divina Commedia Inferno: Parafrasi Riassunto Commento Canto per Canto,Patrick Cherif,2 dic. 2020,146,Religione e spiritualità
1521170355,https://m.media-amazon.com/images/I/61rQWtzoraL._AC_UY218_.jpg,Catechismo Maggiore,San Pio X,7 lug. 2017,146,Religione e spiritualità
8817009695,https://m.media-amazon.com/images/I/71hxMyjHX-L._AC_UY218_.jpg,Le confessioni,Agostino,8 feb. 2006,145,Religione e spiritualità
8897420249,https://m.media-amazon.com/images/I/71gBceWBW0L._AC_UY218_.jpg,In adorazione. Testimonianza di Catalina Rivas,Catalina Rivas,31 lug. 2023,145,Religione e spiritualità
8884040361,https://m.media-amazon.com/images/I/51B10g2r7fL._AC_UY218_.jpg,Filotea. Introduzione alla vita devota,Francesco di Sales,1 gen. 2015,145,Religione e spiritualità
B0C1J5BR6T,https://m.media-amazon.com/images/I/7197L+1X48L._AC_UY218_.jpg,"I Libri Di Enoch-3Libri in1: I Manoscritti Apocrifi Più Antichi del Mondo Proibiti e Censurati dalla Bibbia I Guardiani, I Giganti Nephilim, gli Angeli Caduti Bonus: I Segreti e il calendario di Enoch",Sacred Scriptures Publishing,16 apr. 2023,145,Religione e spiritualità
B0D7TS9XNZ,https://m.media-amazon.com/images/I/91iN5CrKnqL._AC_UY218_.jpg,"Incantesimi: Scopri i segreti di antichi rituali e moderne tecniche di magia per trasformare la tua vita, espandere i tuoi poteri e realizzare benessere e prosperità!",Sybil Shawn,22 giu. 2024,143,Religione e spiritualità
B0G3CG62DH,https://m.media-amazon.com/images/I/81K9EOKbyVL._AC_UY218_.jpg,Un Fidanzamento forzato: La Scelta del Don,Thamy  Bastida,21 nov. 2025,142,Religione e spiritualità
8886616597,https://m.media-amazon.com/images/I/71DskPJOpGL._AC_UY218_.jpg,Padre Pio. Un pensiero per ogni giorno dell'anno,Pio da Pietrelcina,1 apr. 2011,141,Religione e spiritualità
8804767111,https://m.media-amazon.com/images/I/71a+f-3HtBL._AC_UY218_.jpg,L'arte della felicità,Gyatso Tenzin,13 set. 2022,139,Religione e spiritualità
8892223828,https://m.media-amazon.com/images/I/61trURepX7L._AC_UY218_.jpg,Camminando sui passi del Risorto. Trenta piccole meditazioni e un «quaderno» per la riflessione personale: un percorso di preparazione alla Pasqua,Luigi Maria Epicoco,25 gen. 2021,139,Religione e spiritualità
8892597841,https://m.media-amazon.com/images/I/61SMSlAvLeL._AC_UY218_.jpg,Il Potere della Consapevolezza,Neville Goddard,28 mar. 2017,137,Religione e spiritualità
8821568644,https://m.media-amazon.com/images/I/61Hx9S7OHRL._AC_UY218_.jpg,Vangelo e Atti degli Apostoli. Ediz. a caratteri grandi,AA.VV.,1 set. 2010,134,Religione e spiritualità
B0CTKM29KP,https://m.media-amazon.com/images/I/7122eKKgnfL._AC_UY218_.jpg,"IL GATTO ZEN: Migliora la tua vita, impara a rilassarti e a diminuire i pensieri con la filosofia del Gatto Zen. Simbologia giapponese, Meditazioni e Storie Zen.",Luca Daisei Hiroki,29 gen. 2024,134,Religione e spiritualità
8831547585,https://m.media-amazon.com/images/I/61ub+opB6aL._AC_UY218_.jpg,Amoris Laetitia Esortazione postsinodale sulla famiglia oggi,Francesco,8 apr. 2016,133,Religione e spiritualità
8822787307,https://m.media-amazon.com/images/I/71FTxP99EzL._AC_UY218_.jpg,"Un incantesimo per ogni giorno. 365 incantesimi, rituali e piccole magie quotidiane",Strega Delle Mele,22 ott. 2024,133,Religione e spiritualità
B09TF9C11B,https://m.media-amazon.com/images/I/81wlT2vUlNL._AC_UY218_.jpg,Il Corano in Italiano Completo :Il Nobile Corano traduzione dei suoi significati lingua italiana: Il Sacro Corano / RAMADAN 2022 ;corano italiano ... in italiano / Noble Quran in Italian Language,YT P,26 feb. 2022,132,Religione e spiritualità
8895120035,https://m.media-amazon.com/images/I/719n22rBb7L._AC_UY218_.jpg,L'essenza della vita. Il risveglio della consapevolezza nel cammino spirituale,Willigis Jäger,1 gen. 2007,131,Religione e spiritualità
8895403363,https://m.media-amazon.com/images/I/61NSUGwY6fL._AC_UY218_.jpg,I misteri di nascita e morte. La visione buddista della vita,Daisaku Ikeda,1 nov. 1998,131,Religione e spiritualità
8884043565,https://m.media-amazon.com/images/I/71VBPYZlx3L._AC_UY218_.jpg,I doni dello Spirito Santo. Catechesi di papa Francesco,Francesco,1 gen. 2015,131,Religione e spiritualità
8834620860,https://m.media-amazon.com/images/I/419B-lVm+0L._AC_UY218_.jpg,Riflessioni sul dolore,Umberto Eco,18 apr. 2025,131,Religione e spiritualità
8886517394,https://m.media-amazon.com/images/I/71kwPKgkmuL._AC_UY218_.jpg,L'arte di purificare il cuore,Tomás Spidlík Cardinale,1 feb. 2001,130,Religione e spiritualità
8895403614,https://m.media-amazon.com/images/I/71fU6V2XS6L._AC_UY218_.jpg,Giorno per giorno,Daisaku Ikeda,1 ott. 2011,130,Religione e spiritualità
8830153044,https://m.media-amazon.com/images/I/61veyEk8ATL._AC_UY218_.jpg,La profezia della luce,Emmanuel Exitu,29 ott. 2025,129,Religione e spiritualità
8892222759,https://m.media-amazon.com/images/I/61ehw8hQ-RL._AC_UY218_.jpg,La Bibbia. Scrutate le Scritture,Aa.Vv.,16 ott. 2020,128,Religione e spiritualità
8830119695,https://m.media-amazon.com/images/I/61dENd2kMbL._AC_UY218_.jpg,Le chiavi del regno,Archibald J Cronin,5 lug. 2023,128,Religione e spiritualità
8834009088,https://m.media-amazon.com/images/I/61uzI7BzJFL._AC_UY218_.jpg,Scrivere zen. Manuale di scrittura creativa,Natalie Goldberg,15 dic. 1987,125,Religione e spiritualità
8869375072,https://m.media-amazon.com/images/I/71W-htB4GpL._AC_UY218_.jpg,Fisiologia occulta. Il funzionamento dell'essere umano da un punto di vista spirituale,Rudolf Steiner,6 feb. 2020,125,Religione e spiritualità
8842055042,https://m.media-amazon.com/images/I/61zHdtxAmUL._AC_UY218_.jpg,Manuale di storia delle religioni,Aa. Vv,15 mag. 1998,124,Religione e spiritualità
1939261201,https://m.media-amazon.com/images/I/61q-AUDX8bL._AC_UY218_.jpg,"Sii Te Stesso, Cambia Il Mondo - Being You, Changing the World Italian",Dain Heer,1 mar. 2013,124,Religione e spiritualità
B0DHZNZ71V,https://m.media-amazon.com/images/I/71uJ3Hry6kL._AC_UY218_.jpg,Destinazione speranza,Vito Mancuso,15 ott. 2024,122,Religione e spiritualità
B0FG7L382P,https://m.media-amazon.com/images/I/81lOqhnXSbL._AC_UY218_.jpg,Il Mio Possessivo Finto Marito: Romanzo Da Nemici Ad Amanti Con Finto Matrimonio (Romanzo miliardario Vol. 1),Elara  Long,1 lug. 2025,121,Religione e spiritualità
B0C9SDN2PS,https://m.media-amazon.com/images/I/514of3ufjCL._AC_UY218_.jpg,L'eterno ritrovarsi,Marta Turnu,12 lug. 2023,121,Religione e spiritualità
B01FPJSO7Q,https://m.media-amazon.com/images/I/81wsSXeY6xL._AC_UY218_.jpg,La Vita di San Francesco d'Assisi (I doni della Chiesa),Tommaso da Celano,15 mag. 2016,118,Religione e spiritualità
8892228528,https://m.media-amazon.com/images/I/611qfkpr1PL._AC_UY218_.jpg,Preghiamo con i salmi,Aa.Vv.,3 giu. 2022,112,Religione e spiritualità
8896665450,https://m.media-amazon.com/images/I/41PC8tcMrxL._AC_UY218_.jpg,Francesco d'Assisi,Hermann Hesse,5 mar. 2012,112,Religione e spiritualità
8831114492,https://m.media-amazon.com/images/I/41Y1giq5XuL._AC_UY218_.jpg,Esercizi spirituali,Ignazio di Loyola,5 apr. 2013,109,Religione e spiritualità
8810204727,https://m.media-amazon.com/images/I/617lWokQJbL._AC_UY218_.jpg,Messale quotidiano. Festivo e feriale. Letture bibliche dal Nuovo Lezionario CEI. Nuova ediz.,MichaelDavide Semeraro,25 feb. 2021,108,Religione e spiritualità
8807885085,https://m.media-amazon.com/images/I/71OCpreQa7L._AC_UY218_.jpg,Dhammapada. La via del Buddha,G. Pecunia,24 set. 2014,107,Religione e spiritualità
B0FF1DFWVW,https://m.media-amazon.com/images/I/71RtHSQ0-pL._AC_UY218_.jpg,Il Sigillo di Santa Marta,Matteo Corsi,16 giu. 2025,104,Religione e spiritualità
8861386660,https://m.media-amazon.com/images/I/712CW8e2ewL._AC_UY218_.jpg,L'orologio della passione,Luisa Piccarreta,29 mar. 2013,99,Religione e spiritualità
886588990X,https://m.media-amazon.com/images/I/81y5mRALZ+L._AC_UY218_.jpg,L'antico segreto del fiore della vita (Vol. 1),Melchizedek Drunvalo,29 giu. 2022,99,Religione e spiritualità
8880578529,https://m.media-amazon.com/images/I/61yQ8M7zojL._AC_UY218_.jpg,Bibbia ebraica. Pentateuco e Haftaroth. Testo ebraico a fronte,Dario Disegni,6 ago. 2020,99,Religione e spiritualità
883400860X,https://m.media-amazon.com/images/I/71mXRb2ukkL._AC_UY218_.jpg,Il tao del Tai-chi chuan. La via del ringiovanimento,Hwa Jou Tsung,19 giu. 1986,98,Religione e spiritualità
B0G657ZSNB,https://m.media-amazon.com/images/I/81uvaHwp5lL._AC_UY218_.jpg,UN DONO D'AMORE PER UN CUORE ORFANOA : UN ROMANZO VITTORIANO DI NATALE,Marley Hawkins,10 dic. 2025,97,Religione e spiritualità
8817065137,https://m.media-amazon.com/images/I/919NicB1duL._AC_UY218_.jpg,All'origine della pretesa cristiana. Volume secondo del PerCorso,Luigi Giussani,28 gen. 2004,95,Religione e spiritualità
8884047501,https://m.media-amazon.com/images/I/51qVXLT32iL._AC_UY218_.jpg,La Sacra Bibbia. Ediz. grande a caratteri grandi. Tela rossa,Tarcisio Stramare,24 giu. 2022,95,Religione e spiritualità
8816306947,https://m.media-amazon.com/images/I/61pYRCA2zpL._AC_UY218_.jpg,Contro Maestro Ciliegia. Commento teologico a «Le avventure di Pinocchio»,Giacomo Biffi Cardinale della Chiesa cattolica,10 mar. 2023,94,Religione e spiritualità
8820913399,https://m.media-amazon.com/images/I/71OYf69cSfL._AC_UY218_.jpg,La bottega dell'orefice. Meditazioni sul sacramento del matrimonio che di tanto in tanto si trasformano in dramma,Giovanni Paolo II,1 gen. 1992,93,Religione e spiritualità
B0DJDVXQJM,https://m.media-amazon.com/images/I/61v79KSehrL._AC_UY218_.jpg,"Il mio infinito. Dio, la vita e l'universo nelle riflessioni di una scienziata atea. Nuova ediz.",Margherita Hack,21 feb. 2025,92,Religione e spiritualità
8830809322,https://m.media-amazon.com/images/I/8125R0EpV+L._AC_UY218_.jpg,Come leggere il Vangelo (e non perdere la fede),Alberto Maggi,1 gen. 2011,90,Religione e spiritualità
8831114352,https://m.media-amazon.com/images/I/61ny+Akr1oL._AC_UY218_.jpg,Notte oscura,Giovanni della Croce,11 set. 2006,89,Religione e spiritualità
8841897635,https://m.media-amazon.com/images/I/61BXIKpH6qL._AC_UY218_.jpg,Avesta,A. Alberti,26 set. 2013,89,Religione e spiritualità
8817182540,https://m.media-amazon.com/images/I/61ZSONhh4lL._AC_UY218_.jpg,Con Dio non sei mai solo,Benedetto XVI,5 gen. 2023,89,Religione e spiritualità
8881350262,https://m.media-amazon.com/images/I/61TBhTLe8WL._AC_UY218_.jpg,Fonti francescane,Ernesto Caroli,1 gen. 2009,88,Religione e spiritualità
8821594815,https://m.media-amazon.com/images/I/716FbO3EbuL._AC_UY218_.jpg,Imitazione di Cristo,Tommaso da Kempis,6 mag. 2015,88,Religione e spiritualità
B0CPQGSBNP,https://m.media-amazon.com/images/I/61OH5-XQOuL._AC_UY218_.jpg,Diario della Gratitudine: 5 Minuti al Giorno per Migliorare la Tua Vita. Sviluppa la Capacità di Vedere il Lato Positivo delle Cose e Scopri il Potere Magico di Dire Grazie,ParoleLibere Edizioni,4 dic. 2023,87,Religione e spiritualità
8817186589,https://m.media-amazon.com/images/I/71ihjRa2UhL._AC_UY218_.jpg,Il più bel trucco del diavolo,Gianluca Herold,29 ott. 2024,87,Religione e spiritualità
8831530321,https://m.media-amazon.com/images/I/615tEdr1A2L._AC_UY218_.jpg,Libro della mia vita,Teresa d'Avila,1 set. 2016,87,Religione e spiritualità
B072L7SNZL,https://m.media-amazon.com/images/I/81q0wYP0M5L._AC_UY218_.jpg,Dhammapada - La Via del Buddha,Gautama Buddha,2 mag. 2017,87,Religione e spiritualità
B0FVX92CKR,https://m.media-amazon.com/images/I/61j9ELCbNhL._AC_UY218_.jpg,TI RACCONTO CARLO ACUTIS: Con attività diaristiche di riflessione per grandi e piccini. Font ad alta leggibilità per DSA,SONIA D'ALESSIO,12 ott. 2025,86,Religione e spiritualità
8884048729,https://m.media-amazon.com/images/I/61SEIt-cXUL._AC_UY218_.jpg,Pensieri e preghiere di don Dolindo,Grazia Ruotolo,21 mag. 2023,85,Religione e spiritualità
8867950533,https://m.media-amazon.com/images/I/61oATd77OBL._AC_UY218_.jpg,I capitoli Hoben e Juryo. Il cuore del Sutra del Loto,Daisaku Ikeda,1 mar. 2015,85,Religione e spiritualità
8831558048,https://m.media-amazon.com/images/I/61jv3j262ZL._AC_UY218_.jpg,Dilexit nos. Lettera enciclica sull’amore umano e divino del cuore di Gesù Cristo,Francesco,7 nov. 2024,85,Religione e spiritualità
8831552651,https://m.media-amazon.com/images/I/61+jiU7ANKL._AC_UY218_.jpg,Filotea. Introduzione alla vita devota,Francesco di Sales,13 mag. 2020,84,Religione e spiritualità
8894635902,https://m.media-amazon.com/images/I/61GuzC0YuCS._AC_UY218_.jpg,Ecate. Fiore di fuoco. Sacerdotesse della Nuova Era,Valentina Minoglio,18 giu. 2021,82,Religione e spiritualità
8834004361,https://m.media-amazon.com/images/I/61CsDb-pxsL._AC_UY218_.jpg,Iniziazione all'ermetica. Una pratica della magia,Franz Bardon,1 nov. 1978,82,Religione e spiritualità
8821593827,https://m.media-amazon.com/images/I/71ERnMzLSjL._AC_UY218_.jpg,Il libro dei Salmi. Versione ufficiale della Conferenza Episcopale Italiana,Conferenza episcopale italiana,16 gen. 2015,81,Religione e spiritualità
