Categoria,Data_Aggiunta,Editore,Copertina,Titolo,Autore,Descrizione,Link
Bestseller,2026-06-03,Marco Pietteur,https://products-images.di-static.com/image/wolf-naomi-pfizer-papers/9782874342509-475x500-1.webp,Pfizer papers. Les crimes de Pfizer contre l'humanité,Naomi Wolf,"Pfizer Papers présente de nouveaux rapports rédigés par des chercheurs bénévoles de WarRoom/DailyClout, qui s'appuient sur les documents de source primaire relatifs aux essais cliniques de Pfizer qui ont été divulgués à la suite d'une décision de justice, ainsi que sur la littérature médicale connexe. Le livre montre avec force que l'essai clinique du vaccin ARNm COVID-19 de Pfizer était profondément défectueux et que la société pharmaceutique savait dès novembre 2020 que son vaccin n'était ni sûr ni efficace. Les rapports détaillent les effets néfastes des vaccins sur l'ensemble du corps humain, y compris sur le système reproducteur ; ils montrent que les femmes souffrent d'effets indésirables liés aux vaccins dans une proportion de 3 pour 1 ; ils révèlent que la myocardite induite par les vaccins n'est ni rare, ni légère, ni transitoire ; et, ce qui est choquant, ils démontrent que les vaccins à ARNm ont créé une nouvelle catégorie de maladies multisystémiques et multi-organiques, que l'on appelle la "" maladie du CoVax"" . Bien que Pfizer se soit engagée dans son propre protocole d'essai clinique à suivre le bras placebo de son essai pendant 24 mois, la firme a vacciné environ 95 % des bénéficiaires du placebo en mars 2021, éliminant ainsi le groupe de contrôle de l'essai et rendant impossible toute détermination comparative de la sécurité. Tout aussi important, Pfizer Papers montre clairement que la Food and Drug Administration américaine était au courant des lacunes de l'essai clinique de Pfizer ainsi que des dommages causés par le vaccin COVID à ARNm de l'entreprise, mettant ainsi en évidence l'échec lamentable de la FDA à remplir sa mission de ""[protéger] la santé publique en assurant l'innocuité, l'efficacité et la sécurité des médicaments humains et vétérinaires, des produits biologiques et des dispositifs médicaux"" . "" Pfizer Papers "" montre en détail comment Big Pharma, le gouvernement étasunien et les organismes de santé se retranchent derrière la large immunité juridique offerte par la loi dite "" PREP Act "" lorsqu'ils créent, prescrivent et administrent des vaccins ; et, sous ce bouclier de protection, font ce qui est le mieux pour leurs résultats financiers plutôt que pour la santé et le bien-être des Etasuniens. "" Pfizer savait dès février 2021 que son vaccin COVID à ARNm était associé à une myriade d'effets indésirables graves, dont plus de 1 200 décès signalés dans les 3 premiers mois suivant son déploiement. """,https://www.decitre.fr/livres/pfizer-papers-9782874342509.html
Bestseller,2026-06-03,Hachette Pluriel,https://products-images.di-static.com/image/zemmour-eric-le-suicide-francais/9782818507926-475x500-1.webp,Le suicide français. 2008-2026édition actualisée,Eric Zemmour,""" Il y a un peu plus de dix ans, je publiais Le Suicide français. L'émoi fut considérable. Les journalistes, commentateurs, politiques rivalisèrent d'invectives à mon égard. On me traita de ""passéiste"", ""réactionnaire"", ""misogyne"", ""homophobe"", ""raciste"", ""fasciste' : Qu'avais-je fait ? Qu'avais-je dit ? Qu'avais-je écrit ? J'avais tenté de comprendre cette impression de dépossession qui étreignait nombre de Français, qui ne se sentaient plus chez eux dans leur pays. Il y a longtemps, l'écrivain français du XIXe siècle Edgar Quinet avait eu cette formule : ""Le véritable exil n'est pas d'être arraché de son pays ; c'est d'y vivre et de n'y plus rien trouver de ce qui le faisait aimer."" Pourquoi ce sentiment, autrefois limité à quelques élites, était-il devenu dans la France du XXIe siècle un phénomène de masse ? """,https://www.decitre.fr/livres/le-suicide-francais-9782818507926.html
Bestseller,2026-06-03,Flammarion,https://products-images.di-static.com/image/cohen-patrick-les-mystificateurs/9782080456427-475x500-1.webp,Les Mystificateurs,Patrick Cohen,"Comment un mystificateur, interdit d'exercer la médecine depuis, a-t-il pu tenir le haut du pavé dans la France du Covid ? Les gourous scientifiques ne datent pas d'hier. Entre désinformation, mauvaise science et pseudo-science, ce livre est une plongée dans la face noire de l'histoire, qui a vu des scientifiques réputés se persuader d'avoir raison contre le reste de la communauté scientifique et bénéficier du soutien de médias et de politiques. Patrick Cohen nous raconte, à sa manière précise et informée, les grandes affaires qui ont contribué à populariser l'anti-science. Parmi celles-ci, le climatoscepticisme porté par l'ancien ministre Claude Allègre dans les années 2000, la controverse de la ciclosporine présentée en 1985 comme un médicament miracle face au sida. Celle de la mémoire de l'eau en 1988, censée révolutionner la biologie moléculaire et justifier l'homéopathie. Ou encore le mensonge autour du vaccin ROR (rougeole, oreillons, rubéole) suspecté de déclencher l'autisme chez des jeunes enfants, aux conséquences criminelles en Europe et aux Etats-Unis. Un livre qui invite à réconcilier science et confiance.",https://www.decitre.fr/livres/les-mystificateurs-9782080456427.html
Bestseller,2026-06-03,Fayard,https://products-images.di-static.com/image/bock-cote-mathieu-le-pessimiste-joyeux/9782213733753-475x500-1.webp,Le pessimiste joyeux,Mathieu Bock-Côté,"""Le monde ne se présente pas à nous comme une pâte à modeler, mais comme un héritage à transmettre, comme une tâche à poursuivre. L'homme a besoin de s'inscrire dans les grandes chaînes de la continuité : s'il a l'impression que cette mémoire qui nous alimente, le souvenir des ancêtres, toutes ces choses qui sont les besoins naturels de l'âme humaine, sont sacrifiés au profit d'une forme de présent perpétuel, il est non seulement déraciné, asséché, mais plus encore, il est facilement manipulable"". Dans son premier livre d'entretiens accordés à Laurent Dandrieu, Mathieu Bock-Côté décrit sans fard les fondements d'une pensée philosophique et politique fondée sur la gratitude et l'attachement aux réalités charnelles plutôt qu'aux abstractions idéologiques.",https://www.decitre.fr/livres/le-pessimiste-joyeux-9782213733753.html
Bestseller,2026-06-03,Stock,https://products-images.di-static.com/image/foly-liane-la-droguerie-du-sourire/9782234099128-475x500-1.webp,La droguerie du sourire,Liane Foly,"Une voix unique. Une carrière lumineuse. Un récit de femme pour toutes les femmes. ""Mon histoire s'adresse à celles et ceux qui ont osé transformer leur rêve d'enfant en réalité et à celles et ceux pour qui il est encore temps"". L. F. Liane Foly est bien plus qu'une voix iconique du répertoire de la chanson française : c'est avant tout une artiste plurielle qui, tel un phénix, se réinvente continuellement depuis quarante ans. Aujourd'hui, elle prend la plume pour nous raconter son histoire, son enfance dans ""la droguerie du sourire"" de ses parents au coeur de Lyon, ses débuts, ses inspirations, ses passions, son désir de transmission, les rencontres qui ont bouleversé sa vie - et encore et toujours sa détermination à rester une femme libre. La Droguerie du sourire est une autobiographie sincère et authentique où l'émotion affleure à chaque page.",https://www.decitre.fr/livres/la-droguerie-du-sourire-9782234099128.html
Bestseller,2026-06-03,Le Cherche Midi,https://products-images.di-static.com/image/ceylac-catherine-intime/9782749185743-475x500-1.webp,Intime,Catherine Ceylac,"Catherine Ceylac, animatrice emblématique de Thé ou Café , revient pour la première fois dans cette autobiographie sur son parcours singulier et nous dévoile avec pudeur et sincérité une part de son intimité. C'est l'histoire d'une femme qui, dans les années 1970, est entrée par effraction dans le monde de l'audiovisuel public avec l'ambition de colorer sa vie. Elle raconte les embûches rencontrées, le combat pour exister dans un milieu très masculin et obtenir ses galons, la reconnaissance du public. Ce récit est aussi celui d'un engagement viscéral envers les femmes. Pendant vingt-trois ans, Catherine Ceylac a cuisiné, piqué, caressé et souvent aimé les 1 752 invités qu'elle a reçus dans son émission emblématique, Thé ou Café . Les yeux dans les yeux ou "" dos à dos "", acteurs, chanteurs, écrivains, intellectuels, personnalités politiques - dont une reine et trois présidents ! -, tous sont venus se confier sans fard et avec le coeur. Dans cette autobiographie, pour la première fois, Catherine Ceylac revient sur les rencontres qui l'ont marquée et nous livre avec sincérité des fragments de son intimité.",https://www.decitre.fr/livres/intime-9782749185743.html
Bestseller,2026-06-03,Robert Laffont,https://products-images.di-static.com/image/menage-francois-xavier-les-oublies/9782221282557-475x500-1.webp,Les oubliés. Enquête aux racines de la colère française,François-Xavier Ménage,"Ils tiennent littéralement le pays debout. Dans l'ombre, sans bruit. Il y a les ""premiers de cordée"" : ils ramassent nos poubelles, conduisent nos bus, mais certains dorment la nuit sur un carton. Il y a ces infirmières des déserts médicaux qui vont jusqu'à soigner gracieusement. L'Education nationale ? En banlieue, on fait classe dans des écoles où les radiateurs pendent aux murs. La lutte contre l'insécurité ? Des hommes en bleu travaillent bien au-delà de leurs horaires pour sécuriser des quartiers délaissés. Les élus ? Sur le terrain 70 heures par semaine et pourtant oubliés de la classe dirigeante, là-haut, dans la capitale. Le ras-le-bol, à force de grandir, se transforme. Allant au-delà des cris de colère, ce livre-enquête, fruit de quatre ans de reportage dans tout le pays, cherche à comprendre pourquoi de plus en plus de Français se sentent oubliés. II donne aussi à voir des solidarités intérieures tenues à bout de bras, les "" épuisés"" refusant de lâcher. La question est d'intérêt général : car pourquoi continuer à penser collectif quand on se sent abandonné ?",https://www.decitre.fr/livres/les-oublies-9782221282557.html
Bestseller,2026-06-03,Les Petits Matins,https://products-images.di-static.com/image/hannezo-guillaume-sans-eux/9782363834782-475x500-1.webp,Sans eux. La France sans les immigrés,Guillaume Hannezo,"En 2030, la France est dirigée par une extrême droite vieillissante, ayant exclu jeunesse et immigrés. Le pays sombre dans l'autoritarisme, la crise sanitaire et économique. Des résistances émergent. Sans eux dépeint une dystopie glaçante mêlant satire et politique-fiction, proche d'un futur possible. France 2030 : extrême droite, chaos, résistance.",https://www.decitre.fr/livres/sans-eux-9782363834782.html
Bestseller,2026-06-03,La Nouvelle Librairie,https://products-images.di-static.com/image/camus-renaud-le-grand-remplacement/9782491446468-475x500-1.webp,Le grand remplacement. Introduction au remplacisme global,Renaud Camus,"Le Grand Remplacement n'est ni une théorie ni un complot. C'est un état de fait observable dans la plupart des pays occidentaux. Tout le monde le voit, sauf les démographes. Tout le monde en parle, sauf les journalistes. Tout le monde s'en effraie, sauf les politiques. Les plus audacieux l'évoquent à demi-mots. Partout le déni, l'autocensure ou simplement la peur. Comme si le réel n'avait pas lieu. ""Ils ont des yeux et ne voient pas. "" Terrible cécité. Il y avait un peuple, il yen a un autre. C'est le même administrativement ; ce n'est plus le même historiquement, culturellement, ethniquement, religieusement. A travers une série d'interventions publiques, Le Grand Remplacement décrit ce phénomène inédit à l'échelle des temps historiques. L'expression a fait le tour du monde, elle est immédiatement intelligible dans tous les idiomes de la Terre. Or, l'ouvrage dont elle est tirée n'a été traduit dans aucune langue. C'est un livre fantôme, jusqu'ici édité à compte d'auteur. C'est dire l'ampleur du non-dit et le poids des censures invisibles. Voici donc porté à la connaissance du public l'un des plus grands textes de notre temps rédigé par l'une des plus grandes voix de notre temps. Après l'avoir lu, vous ne pourrez plus dire que vous ne saviez pas !",https://www.decitre.fr/livres/le-grand-remplacement-9782491446468.html
Bestseller,2026-06-03,L'Imprévu (Editions de),https://products-images.di-static.com/image/zaleski-annie-beyonce/9791029511158-475x500-1.webp,Beyoncé. L'histoire cachée derrière chaque chanson,Annie Zaleski,"De ses débuts au sein des Destiny's Child jusqu'à sa consécration aux Grammy Awards pour Cowboy Carter, en passant par le démarrage fracassant de sa carrière solo avec Crazy in Love, Beyoncé enchaîne les succès internationaux. Femme puissante, show-woman de génie, elle s'est essayée à tous les genres musicaux et continue de délivrer dans ses textes des messages politiques forts, faisant entendre la voix des enfants, du féminisme ou de la cause noire. Ce sont près de 30 ans de carrière, 15 albums et 190 chansons que la journaliste musicale Annie Zaleski retrace ici. Album après album, titre après titre, ce livre raconte l'histoire qui se cache derrière chacune des chansons de Beyoncé - incluant featurings, collaborations et raretés. Quelles ont été ses sources d'inspiration ? A quels éléments de sa vie renvoient les paroles ? Comment les morceaux ont-ils été composés, et quelles sont les raisons de leur succès ? Un livre indispensable pour célébrer la puissance de la voix de Beyoncé, son influence révolutionnaire, son engagement wilyart et son génie qui ont fait d'elle l'une des artistes les plus importantes de ce siècle.",https://www.decitre.fr/livres/beyonce-9791029511158.html
Bestseller,2026-06-03,Observatoire (Editions de l'),https://products-images.di-static.com/image/quentin-abel-sanctuaires/9791070210024-475x500-1.webp,Sanctuaires1e édition,Abel Quentin,"Petit manuel de résistance à l'invasion de l'intelligence artificielle générative. Depuis quatre ans, l'intelligence artificielle générative rebat toutes les cartes : sur le travail, l'art, la création, le savoir, l'éducation, l'économie. Face à cette déferlante, nous sommes tentés de nous laisser aller, telle Ophélia dans les eaux profondes, et renoncer à exercer sur elle un jugement critique : ""A quoi bon ? De toute façon, elle est là"" , soupire Michel Super, le technofataliste. Dans un essai au vitriol, d'une ironie cinglante, habité par les figures de Jacques Ellul et de Georges Bernanos, Abel Quentin dénonce notre ivresse technologique, qui aggrave la crise écologique. Il fait un constat abrupt : l'homme augmenté est un homme diminué en devenir. Dans notre monde volatil et dangereux, les sociétés qui protégeront l'intelligence humaine pourraient bien détenir, à long terme, un avantage décisif. Il appelle au sursaut : pas un baroud d'honneur, mais une fronde joyeuse et transgressive.",https://www.decitre.fr/livres/sanctuaires-9791070210024.html
Bestseller,2026-06-03,RenMusic,https://products-images.di-static.com/image/editions-renmusic-jouons-du-piano/9782956552611-475x500-1.webp,"Jouons du piano. Volume 2, Méthode de piano",Elvira Caflers,N/D,https://www.decitre.fr/partition/jouons-du-piano-9782956552611.html
Bestseller,2026-06-03,Le 1,https://products-images.di-static.com/image/flammarion-sa-ud-le-1-xl-printemps-2026-le-petit-prince-fete-ses-80-ans/9782386242779-475x500-1.webp,Le 1 XL Printemps 2026Le petit Prince fête ses 80 ans,Lou Héliot,N/D,https://www.decitre.fr/revues/le-1-xl-printemps-2026-le-petit-prince-fete-ses-80-ans-9782386242779.html
Bestseller,2026-06-03,Seuil,https://products-images.di-static.com/image/vallaud-boris-nos-vies-ne-sont-pas-des-marchandises/9782021623741-475x500-1.webp,Nos vies ne sont pas des marchandises. Manifeste pour la démarchandisation,Boris Vallaud,"Démarchandiser. Et si le mot qui peut changer nos vies était sous nos yeux depuis toujours ? Il peut surprendre. Il dit pourtant l'essentiel. Depuis quarante ans, la logique du marché s'est imposée comme l'horizon indépassable de nos sociétés : se loger, se soigner, apprendre, travailler, boire, vieillir, mourir, tout semble devenu affaire de prix. Pourtant, jamais l'aspiration à la dignité, à la justice et à la fraternité n'a été aussi forte. Face à l'épuisement du modèle néolibéral, une question s'impose : que devons-nous arracher au marché pour rendre à chacun le pouvoir de vivre pleinement ? Notre histoire politique porte une réponse. Elle tient en un principe simple et radical : protéger le vivant, les liens humains, les biens communs. Démarchandiser, c'est refuser que nos existences soient réduites à des transactions. C'est reconstruire des droits, des services publics, des solidarités. C'est reprendre la main sur nos démocraties et notre destin collectif. Dans ce livre, Boris Vallaud trace un chemin de résistance et de refondation pour la gauche, mais surtout un horizon pour le pays : refaire de nos vies autre chose que des marchandises. Boris Vallaud est député des Landes et président du groupe socialiste à l'Assemblée nationale.",https://www.decitre.fr/livres/nos-vies-ne-sont-pas-des-marchandises-9782021623741.html
Bestseller,2026-06-03,Points,https://products-images.di-static.com/image/aron-matthieu-le-grand-detournement/9791041429943-475x500-1.webp,Le grand détournement. Comment milliardaires et multinationales captent l'argent de l'Etat,Matthieu Aron,"Une enquête qui doit vraiment faire prendre conscience de l'injustice sociale actuelle : 270 milliards d'euros d'aide de l'Etat français, soit à peu près le PIB nominal du Brésil en 2024, versés aux plus riches ! C'est un hold up sans arme ni violence, réalisé au coeur du nébuleux système des aides aux entreprises. Pas moins de 270 milliards d'euros de subventions sont versées chaque année par l'Etat. Plus de trois fois le budget de l'éducation et vingt-sept fois celui de la justice. Ce déluge d'argent public enrichit les multinationales aux profits déjà mirobolants. Après des dizaines de rapports budgétaires décryptés, des centaines d'heures d'entretiens avec de hauts fonctionnaires et responsables politiques de premier plan, les deux grands reporters nous plongent au coeur d'un système qui, de l'aveu même d'éminents libéraux, est devenu incontrôlable. Alors que l'Etat est surendetté et que les Français sont appelés à faire des sacrifices, il est temps de lever le voile sur ce grand détournement. ""Avec ce livre, les deux journalistes espèrent faire prendre conscience à une partie de la bourgeoisie de l'injustice fiscale qui pèse sur elle"". Le Monde Matthieu Aron (https : //allary-editions. fr/collections/matthieu-aron-et-caroline-michel-aguirre) et Caroline Michel-Aguirre (https : //allary-editions. fr/collections/matthieu-aron-et-caroline-michel-aguirre) sont grands reporters au Nouvel Obs. Ils ont publié Les Infiltrés (https : //allary-editions. fr/products/matthieu-aron-et-caroline-michel-aguirre-les-infiltres) (Points, 2023), l'enquête à l'origine de l'affaire sur les cabinets de conseil.",https://www.decitre.fr/livres/le-grand-detournement-9791041429943.html
Bestseller,2026-06-03,Le Cherche Midi,https://products-images.di-static.com/image/blanchard-elise-dans-la-maison-d-un-taliban/9782749178912-475x500-1.webp,Dans la maison d'un taliban. Le récit inédit d'une journaliste au sein d'une famille afghane pendant trois ans,Elise Blanchard,"Le quotidien d'une famille talibane, loin des stéréotypes. Mieux qu'une analyse géopolitique, un témoignage exceptionnel de vérité. En 2019, alors qu'elle n'a que 27 ans, Elise Blanchard s'installe en Afghanistan. Elle arpente les régions les plus reculées du pays, travaille pour plusieurs titres de presse français et internationaux et consacre l'essentiel de ses reportages aux conséquences des conflits armés et à la situation des Afghanes. C'est en 2022, lors d'un reportage, qu'elle rencontre Arman, un soldat taliban. Celui-ci lui ouvre les portes de sa maison, située dans un petit village à quelques heures de Kaboul. Au fur et à mesure de ses visites, Elise découvre le quotidien de cette famille. Elle apprend à connaître Arman, sa femme, ses soeurs, ses enfants ; elle devient pour eux une amie et participe aux grands événements de leur vie. Au fil des conversations, elle se permet d'aborder tous les sujets : religion, fermeture des écoles, vision des étrangers, évolutions du gouvernement. Dans ce témoignage unique, loin des stéréotypes, le dialogue entre Elise et cette famille talibane se révèle étonnamment libre.",https://www.decitre.fr/livres/dans-la-maison-d-un-taliban-9782749178912.html
Bestseller,2026-06-03,Bartillat,https://products-images.di-static.com/image/bourre-jean-paul-michael-jackson/9782841007851-475x500-1.webp,Michael Jackson. Le mythe,Jean-Paul Bourre,"Par sa musique entraînante et son pas de danse légendaire, Michael Jackson a embrasé la terre entière. Sa disparition brutale et inattendue en 2009 a soulevé une émotion sans pareille à travers les continents. Le créateur de Thriller reste aujourd'hui un mythe qui continue de nourrir l'imaginaire de millions de fans. Derrière le masque de l'idole adulée par les foules, les opérations de chirurgie esthétique, les blessures de l'enfance, les rêves de mégalomanie, qui était-il vraiment ? Dans son domaine de Neverland, Michael Jackson était-il atteint du syndrome de Peter Pan en donnant libre cours à ses fantasmes ? Au-delà du personnage public se cache une autre personnalité avec sa différence, l'emprise de la solitude et d'immenses secrets...",https://www.decitre.fr/livres/michael-jackson-9782841007851.html
Bestseller,2026-06-03,Plon,https://products-images.di-static.com/image/loana-si-dure-est-la-nuit-si-tendre-est-la-vie/9782259263375-475x500-1.webp,"Si dure est la nuit, si tendre est la vie",Loana,"Pour ne plus qu'on parle à sa place, Loana, la première star de la téléréalité française tragiquement disparue, nous a livré son témoignage, sans fard ni tabou. Ce livre est son livre, sa vérité. On croyait tout savoir sur Loana. Souvenez-vous, il y a 25 ans, la jolie blonde est sortie victorieuse du Loft et la France était à ses pieds. On a rarement vu autant de passion se cristalliser autour d'une personnalité qui, comme elle le dit elle-même, "" n'avait encore rien fait "". Très vite, tout s'enchaîne : un livre, un disque, deux immenses succès. Jean-Paul Gaultier la fait défiler, elle devient même styliste. L'argent, la gloire... la vie lui sourit enfin, une Cendrillon moderne. Lui manque ce prince charmant qu'elle rêve de rencontrer. Elle croit parfois le trouver, se trompe souvent, bien trop souvent, et paiera cher un romantisme qui lui voile la face. Mais Loana n'était pas aussi fragile, pas aussi naïve qu'on le croyait. Bien décidée à se sortir d'une spirale infernale, elle a mené, seule, un long combat. Dans ce livre tout en vérité elle se raconte sans fard, sans tabou. Loana est décédée tragiquement en mars 2026.",https://www.decitre.fr/livres/si-dure-est-la-nuit-si-tendre-est-la-vie-9782259263375.html
Bestseller,2026-06-03,Les Editions de l'Homme,https://products-images.di-static.com/image/evans-roger-le-piano-sans-professeur/9782761943185-475x500-1.webp,Le piano sans professeur. Une méthode claire et des mélodies choisies à l'intention du débutant,Roger Evans,"Prenez le contrôle de votre apprentissage du piano ! Cette méthode extrêmement simple est destinée à ceux qui désirent apprendre le piano sans avoir recours à l'aide d'un professeur. Elle convient autant aux débutants, qui n'ont aucune expérience musicale, qu'à ceux qui souhaitent renouer avec cet instrument. Les explications claires et détaillées, et des exercices faciles et amusants vous permettront d'acquérir rapidement les éléments de solfège indispensables et le doigté nécessaire pour jouer vos mélodies préférées.",https://www.decitre.fr/livres/le-piano-sans-professeur-9782761943185.html
Bestseller,2026-06-03,Actes Sud,https://products-images.di-static.com/image/la-blanche-eric-osons-la-colere/9782330207083-475x500-1.webp,Osons la colère. Eloge d'une émotion interdite par temps de crise planétaire,Eric La Blanche,"Face à la destruction imbécile et délibérée de notre monde par une clique d'industriels décérébrés, pourquoi avons-nous tant de scrupules à nous mettre en colère, à nommer les coupables et à les mettre hors d'état de nuire ? Pourquoi sommes-nous aussi nuls ? Parce que la colère, c'est mal ? Non, ça, c'est ce qu'on nous a enseigné pour nous rendre dociles et anxieux. Et ça a marché ! Nous avons été amputés d'une émotion vitale, la seule qui pourrait encore nous sauver aujourd'hui, la seule qui ait jamais fait trembler les puissants : la colère. Est-elle réellement aussi mauvaise qu'on le dit ? Est-elle forcément synonyme de violence ? Qui a intérêt à nous faire croire cela ? Le moment n'est-il pas venu de la réhabiliter ? de l'organiser ? d'investir nos colères individuelles dans de grandes ""banques de colère"" ? Il ne tient qu'aux femmes et aux hommes de bonne volonté de s'emparer de la seule émotion qui puisse changer le monde. Les brutes qui nous assassinent, elles, n'hésitent pas. Un texte d'espoir et de combat, dans la fureur et dans la liesse.",https://www.decitre.fr/livres/osons-la-colere-9782330207083.html
