Categoria_App,Copertina,Titolo,Autore,Editore,Anno,Descrizione,Link,Nuovo,Data_Aggiunta
Altri Editori,https://www.ibs.it/images/9791257010324_0_0_150_0_75.jpg,Francesco d'Assisi e la sfida della storia,Raimondo Michetti,Viella,2026,,https://www.ibs.it/francesco-d-assisi-sfida-della-libro-raimondo-michetti/e/9791257010324,False,2026-04-17
Editori Selezionati,https://www.ibs.it/images/9788858160480_0_0_150_0_75.jpg,L'Europa cambia volto. Cronache dall'anno 1087,Étienne Doublier,Laterza,2026,"Tra XI e XII secolo, l’Europa latina cambia volto: la crescita economica e l’ascesa di nuovi gruppi sociali spingono verso la delimitazione puntuale di ruoli, poteri, competenze e verso l’espansione commerciale, militare e religiosa. Questo grande tema storico si riconosce in nove eventi e documenti – non tutti eclatanti e strettamente interconnessi – dell’anno 1087, un anno come tanti, poco ricorrente nei libri di storia. L’autorità papale – come definita dal cardinale Deusdedit – si pone alla guida dell’intera Cristianità saldandosi a un territorio e non più ai singoli titolari. Le incoronazioni di Corrado il Salico in Germania e di Guglielmo il Rosso in Inghilterra fissano i princìpi della monarchia elettiva e di quella ereditaria. Il Cristianesimo si radica in Scandinavia con la vittoria del cattolico Ingold sul pagano Sven. I Normanni invadono la Sicilia araba, mentre le navi pisane e genovesi espugnano il porto di Mahdia in Tunisia. La traslazione da Myra a Bari delle ossa di san Nicola ci parla della appropriazione latina di un culto greco ma anche di vivaci marinerie e scambi commerciali. E così l’atto che comprova la truffa del mercante veneziano Vitale Zopulo ai danni del ‘collega’ Domenico Juliano, presentati per nome e cognome secondo la tendenza a definire le identità individuali riconoscibile anche nella scherzosa Postilla amiatina.",https://www.ibs.it/europa-cambia-volto-cronache-dall-libro-etienne-doublier/e/9788858160480,False,2026-04-17
Editori Selezionati,https://www.ibs.it/images/9788804816218_0_0_150_0_75.jpg,"La resa dei conti. Dalla guerra civile alla violenza postbellica, il caso di Sant'Eufemia",Mimmo Franzinelli,Mondadori,2026,"Nel maggio del 1945, quando la guerra è ormai terminata e la libertà sembra finalmente conquistata, a Sant'Eufemia - una piccola borgata alla periferia di Brescia - un gruppo di ex partigiani uccide una quarantina di persone tra ufficiali della X Mas, funzionari della Repubblica sociale italiana e civili. Un episodio rimasto sinora sepolto negli archivi e nella memoria pubblica, che rappresenta tuttavia un caso emblematico dell'atmosfera di quel periodo storico e che oggi è qui ricostruito grazie a uno straordinario fondo documentario mai visto prima. Nel suo nuovo saggio, Mimmo Franzinelli parte da questa vicenda per ricostruire il clima umano e politico in cui maturarono le violenze che seguirono la Liberazione, spesso affrontate dalla storiografia in chiave scandalistica o moralistica, e isolate dalle circostanze che le hanno generate. Collocato nel suo contesto, l'eccidio di Sant'Eufemia permette invece di osservare da vicino le tensioni accumulate durante vent'anni di dittatura e due anni di guerra civile. La ricchezza della documentazione ritrovata consente di seguire decisioni, conflitti interni e il progressivo scivolamento verso una giustizia sommaria, sfuggito al controllo dei Comitati di liberazione nazionale. Attraverso materiali inediti, testimonianze e atti giudiziari, l'indagine di Franzinelli racconta i mesi della lotta e i giorni del furore, ripercorrendo l'occupazione tedesca, la nascita della Resistenza, la formazione delle bande ribelli, la violenza interpartigiana, la repressione nazifascista e le ambiguità del dopoguerra, nel tentativo di rispondere a un interrogativo: come può accadere che giovani protagonisti della lotta per la libertà si trasformino, a loro volta, in spietati giustizieri? Sant'Eufemia diventa dunque uno specchio della violenza che accompagna la fine di ogni guerra, quando l'odio accumulato negli anni riemerge proprio nel momento in cui le armi dovrebbero tacere. Senza semplificazioni né assoluzioni, Franzinelli restituisce così a quella stagione tutta la sua complessità storica.",https://www.ibs.it/resa-dei-conti-dalla-guerra-libro-mimmo-franzinelli/e/9788804816218,False,2026-04-21
Altri Editori,https://www.ibs.it/images/9788867835669_0_0_150_0_75.jpg,"Materie prime, guerre e dazi. Dalla Mesopotamia a Marte",Alessandro Giraudo,ADD Editore,2026,,https://www.ibs.it/materie-prime-guerre-dazi-dalla-libro-alessandro-giraudo/e/9788867835669,False,2026-04-17
Editori Selezionati,https://www.ibs.it/images/9788858160497_0_0_150_0_75.jpg,"Archeologia. Storia e metodi, paesaggi e persone",Giuliano Volpe,Laterza,2026,"Nell’ultimo mezzo secolo l’archeologia ha molto modificato e arricchito il proprio bagaglio metodologico e ampliato i propri campi d’azione a livello temporale, spaziale e tematico. Questo libro offre un punto di vista aggiornato sull’evoluzione della disciplina, valorizzandone le molteplici opportunità.",https://www.ibs.it/archeologia-storia-metodi-paesaggi-persone-libro-giuliano-volpe/e/9788858160497,False,2026-04-17
Editori Selezionati,https://www.ibs.it/images/9788828218913_0_0_150_0_75.jpg,Il ricordo è l'unica difesa. Il manoscritto ritrovato di una donna antifascista,Ester Parri,Solferino,2026,"«Accovacciata sotto cinque coperte fredde, cercavo un conforto nel ricordo di quel mondo che c’era oltre le mura. Non tentavo di dormire, mi sarebbe sembrata una vigliaccheria.» Non ha mai smesso di lottare Ester Parri. Nemmeno quando il regime fascista ha recluso e poi confinato il marito Ferruccio, leader della Resistenza e primo presidente del Consiglio dopo la Liberazione. Nemmeno quando a essere catturata e incarcerata dalla Gestapo a San Vittore è stata anche lei. E nemmeno quando si è trovata a fare i conti con le angosce di madre temendo per il figlio Giorgio, giovane partigiano. In queste memorie inedite, scritte sul retro di fascicoli del Consiglio d’Europa e ritrovate dalla nipote, l’autrice racconta i due mesi più drammatici della sua vita, tra gennaio e marzo 1945, e fa rivivere, attraverso potenti flashback, quasi vent’anni della storia d’Italia, dall’organizzazione dell’espatrio clandestino del leader socialista Turati nel dicembre 1926 fino all’aprile 1945, quando Ester ritrova il marito a Locarno. Uno spaccato della dittatura e della Resistenza ma anche della vita quotidiana e dei suoi personaggi grandi e piccoli, con una particolare attenzione per le donne che incontra: le signore «dalle unghie laccate e dalle bocche dipinte», fiancheggiatrici del regime, le prigioniere politiche, ma anche parrucchiere, portinaie, impiegate, che con le loro vicende contribuiscono all’affresco più ampio di un’epoca. La passione civile è inalterata in ogni pagina, così come la sua fedeltà agli ideali di libertà e giustizia. La sua voce parla direttamente al cuore, emoziona e rende vivo quel nostro passato che rischia di diventare remoto per sempre.",https://www.ibs.it/ricordo-unica-difesa-manoscritto-ritrovato-libro-ester-parri/e/9788828218913,False,2026-04-17
Altri Editori,https://www.ibs.it/images/9788862502757_0_0_150_0_75.jpg,"Memorie di una lady armena. Da Costantinopoli a Padova, il diario di Maria Nazle Corinaldi",Maria Nazle Corinaldi,Guerini e Associati,2026,,https://www.ibs.it/memorie-di-lady-armena-da-libro-maria-nazle-corinaldi/e/9788862502757,False,2026-04-17
Editori Selezionati,https://www.ibs.it/images/9791256147151_0_0_150_0_75.jpg,"Strongmen. Ascesa, trionfo e caduta dei leader autoritari",Ruth Ben-Ghiat,Castelvecchi,2026,"L’epoca dei leader autoritari è tornata. Dalla Russia di Putin all’India di Modi, dalla Turchia di Erdogan agli Stati Uniti di Trump, figure carismatiche conquistano consenso promettendo ordine e sicurezza. Parlano a nome del “vero popolo”, denunciano élite corrotte ed evocano emergenze permanenti. Poi passano all’azione: addomesticano i media, delegittimano giudici e opposizioni, trasformano lo Stato in una rete di fedeltà e impunità. Dai fascismi del Novecento alle autocrazie contemporanee, Ruth Ben-Ghiat ricostruisce la genealogia di un potere che si organizza intorno al culto della personalità e si consolida grazie a una propaganda capace di manipolare paure e desideri collettivi. L’esaltazione della forza ne diventa il marchio, mentre gli argini istituzionali si assottigliano fino a perdere efficacia. È un modello fondato su un immaginario virile del comando, ma abbastanza flessibile da adattarsi a chiunque lo incarni, al di là del genere. Comprendere come nasce e si consolida un regime autoritario è il primo passo per difendere democrazia e diritti, prima che la promessa di protezione si trasformi in una silenziosa erosione della libertà.",https://www.ibs.it/strongmen-ascesa-trionfo-caduta-dei-libro-ruth-ben-ghiat/e/9791256147151,False,2026-04-17
Altri Editori,https://www.ibs.it/images/9791255212478_0_0_150_0_75.jpg,L'Europa verso la catastrofe. La politica estera dell'Italia fascista. 1936-1942,Galeazzo Ciano,LEG Edizioni,2026,,https://www.ibs.it/europa-verso-catastrofe-politica-estera-libro-galeazzo-ciano/e/9791255212478,False,2026-04-17
Altri Editori,https://www.ibs.it/images/9788866976080_0_0_150_0_75.jpg,"El alamein, la battaglia. La svolta del deserto","Eric Dorman O'Gowan,Giuseppe Mancinelli,Francis Wilfred de Guingand",Res Gestae,2026,,https://www.ibs.it/el-alamein-battaglia-svolta-del-libro-vari/e/9788866976080,False,2026-04-17
Editori Selezionati,https://www.ibs.it/images/9791222327280_0_0_150_0_75.jpg,Una donna nelle carceri fasciste,Cesira Fiori,Mimesis,2026,"Leggere oggi ""Una donna nelle carceri fasciste"" è un atto di resistenza. È un atto di memoria viva che ci invita a riflettere sull’importanza di riconoscere il contributo delle donne alla libertà. Cesira Fiori racconta qui la sua esperienza di prigioniera politica sotto il fascismo. Arrestata il 27 aprile del 1933, insieme al figlio adottivo Mario Mammucari, con l’accusa di aver tentato di ricostruire il Partito comunista, passa la detenzione prima nel carcere delle Mantellate a Roma e in seguito nel penitenziario di Perugia. Dopo la prigionia, deve scontare lunghi anni di confino a Ponza, Ustica, Maratea e San Demetrio ne’ Vestini: anni di violenza fisica e psicologica, soprusi, persecuzioni e vendette, durante i quali però ha modo di completare la sua formazione politica. Questo libro è un pezzo di storia di una combattente, il racconto di altre prigioniere, di altri politici, di altri coatti, è uno sguardo “fermo ma non inerte” che tutto osserva e tutto vuol cambiare. Questo è il racconto autobiografico di una “donna che sta nella storia dei resti delle galere, del confino, dell’esilio e della Resistenza fra coloro che non si piegarono”.",https://www.ibs.it/donna-nelle-carceri-fasciste-libro-cesira-fiori/e/9791222327280,False,2026-04-17
Editori Selezionati,https://www.ibs.it/images/2000000164830_0_0_150_0_75.jpg,Geopolitica umana. Capire il mondo dalle civiltà antiche alle potenze odierne,Dario Fabbri,Gribaudo,2026,"Un libro frutto degli studi e del personalissimo approccio di Dario Fabbri, che racconta di una geopolitica “umana”, intessuta con discipline quali l’antropologia e la psicologia collettiva, ma anche strettamente connessa con la profondità storica, l’etnografia e la linguistica, luogo in cui le parole si fanno campo di battaglia e che quindi segnala “traumi e invasioni, conquiste e seduzioni”. Una geopolitica da utilizzare come «lente graduata per vincere la miopia, prisma prezioso per scrutare le questioni del nostro tempo. Con l’obiettivo di comprendere cosa può scalfire il sistema che abitiamo, quale potenza possiederà il futuro, in quali contesti si deciderà la lotta per l’egemonia, quali effetti avrà sul nostro Paese.»",https://www.ibs.it/geopolitica-umana-capire-mondo-dalle-libro-dario-fabbri/e/2000000164830,False,2026-04-21
Editori Selezionati,https://www.ibs.it/images/9791259972798_0_0_150_0_75.jpg,Il contributo ebraico all'editoria italiana dall'Unità alle leggi razziali,N/D,Ronzani Editore,2026,"La storia dell’editoria italiana è anche, in larga parte, storia di editori, stampatori, librai e intellettuali ebrei che hanno dato un contributo decisivo alla formazione della cultura moderna. Questo volume ripercorre per la prima volta in modo organico e corale la vicenda degli editori di cultura ebraica in Italia, dall’Unità nazionale fino alla caduta del Fascismo, intrecciando biografie familiari, imprese culturali, sfide politiche e persecuzioni. Dai pionieri della stampa ebraica agli editori laici protagonisti della modernizzazione, i saggi qui raccolti illuminano figure e dinastie come Olschki, Treves, Voghera, Orvieto, Enriques, Lattes, Bemporad e Belforte, restituendo loro il ruolo che hanno avuto nella diffusione del sapere, nella costruzione di reti commerciali e culturali e nella difesa dell’identità ebraica. Storici, bibliografi e studiosi compongono un affresco inedito e ricco di sfumature: un viaggio attraverso secoli di idee, libri e persone che hanno intrecciato, spesso in modo decisivo, la propria vicenda con quella dell’Italia.",https://www.ibs.it/contributo-ebraico-all-editoria-italiana-libro-vari/e/9791259972798,False,2026-04-16
Altri Editori,https://www.ibs.it/images/9788855432825_0_0_150_0_75.jpg,"Questione di tocco. Storia, tecniche e sonorità degli strumenti a tastiera e a pizzico","Massimiliano Guido,Donatella Melini",LIM,2026,,https://www.ibs.it/questione-di-tocco-storia-tecniche-libro-massimiliano-guido-donatella-melini/e/9788855432825,False,2026-04-17
Altri Editori,https://www.ibs.it/images/9791280559685_0_0_150_0_75.jpg,Amori queer contro il fascismo. Manifesto per una democrazia deviante,Costanza Spina,le plurali,2026,,https://www.ibs.it/amori-queer-contro-fascismo-manifesto-libro-costanza-spina/e/9791280559685,False,2026-04-16
Altri Editori,https://www.ibs.it/images/9791256154630_0_0_150_0_75.jpg,Sguardo bianco. Politiche e pratiche visuali della bianchezza,Nicholas Mirzoeff,Meltemi,2026,,https://www.ibs.it/sguardo-bianco-politiche-pratiche-visuali-libro-nicholas-mirzoeff/e/9791256154630,False,2026-04-17
Editori Selezionati,https://www.ibs.it/images/9791256148882_0_0_150_0_75.jpg,Le origini del fascismo italiano,Enzo Sereni,Castelvecchi,2026,"Nel suo studio del 1939 sulle origini del fascismo italiano, Enzo Sereni osserva come il regime di Mussolini non abbia mai realmente unito il Paese, ma piuttosto indebolito il senso di comunità nazionale e aggravato le divisioni interne. Scrivendo dal kibbutz palestinese, Sereni non si limita alla critica del regime, ma propone una visione alternativa: una società fondata sulla partecipazione, sulla solidarietà e sul rispetto dei diritti fondamentali. Contro le logiche autoritarie e divisive del fascismo, immagina un ordine civile capace di rinascere attraverso dialogo e inclusione, mettendo al centro la giustizia sociale e indicando la strada verso una democrazia che coinvolga davvero tutti i cittadini e rafforzi il legame tra istituzioni e società civile. Oggi, in un contesto in cui il potere sembra concentrarsi nelle mani di pochi, le intuizioni di Sereni restano straordinariamente attuali e invitano a ripensare il rapporto tra cittadini, politica e responsabilità collettiva: come possiamo trasformare le sue idee di giustizia e inclusione in politiche e azioni concrete, capaci di incidere davvero sulla nostra vita quotidiana? Con un saggio introduttivo di David Bidussa.",https://www.ibs.it/origini-del-fascismo-italiano-libro-enzo-sereni/e/9791256148882,False,2026-04-17
Editori Selezionati,https://www.ibs.it/images/9791256145737_0_0_150_0_75.jpg,I vinti hanno sempre torto,Alessandro Trabucchi,Castelvecchi,2026,"A due anni dalla fine della guerra civile e dell’occupazione tedesca, il generale Alessandro Trabucchi ripercorre la storia del fronte piemontese della lotta partigiana. Il libro segue le fasi del conflitto, le scelte compiute dopo l’8 settembre e i rapporti tra le diverse formazioni. Tra i protagonisti della Resistenza, Trabucchi in quei giorni fu tra i primi ufficiali di carriera a scegliere di unirsi al Comitato di Liberazione Nazionale e, divenuto stratega dei partigiani piemontesi, lavorò per mantenerlo unito in una fase segnata da contrasti e tensioni interne. Una testimonianza diretta, rigorosa, che non manca di registrare violenze e abusi commessi da coloro che salirono alla fine sul carro dei vincitori. Allora inascoltata, oggi conserva intatta la sua forza narrativa e restituisce alla Liberazione il suo volto fragile e profondamente umano.",https://www.ibs.it/vinti-hanno-sempre-torto-libro-alessandro-trabucchi/e/9791256145737,False,2026-04-17
Editori Selezionati,https://www.ibs.it/images/9791255821946_0_0_150_0_75.jpg,Il dono di Cadmo. L'incredibile storia delle lettere dell'alfabeto,Alessandro Magrini,Ponte alle Grazie,2026,"La storia di una delle più straordinarie invenzioni umane, di quei «venti caratteruzzi» che ci permettono di «parlare con quelli che son nell'Indie, parlare a quelli che non sono ancora nati né saranno se non di qua a mille e dieci mila anni», per usare le parole di Galileo. (E perché per Galileo le lettere sono venti, e non ventuno?) Alessandro Magrini ci accompagna in un viaggio affascinante, un capitolo per lettera, dall'antico Egitto alla Fenicia alla Grecia a Roma (con lo zampino degli etruschi). E lo fa con la rara capacità di tenere sempre viva l'attenzione, complici la sua contagiosa curiosità e un'esposizione limpida e avvincente. Grazie anche al ricco apparato d'immagini,Il dono di Cadmo è uno di quei rari libri in cui il rigore scientifico convive con una genuina abilità divulgativa. Venite a scoprire la storia delle lettere: ogni scarabocchio sul muro, ogni insegna pubblicitaria non vi parrà più la stessa. Quando vedrete una N, penserete d'ora in poi a un antico serpente di mare.",https://www.ibs.it/dono-di-cadmo-incredibile-storia-libro-alessandro-magrini/e/9791255821946,False,2026-04-17
Altri Editori,https://www.ibs.it/images/9791255212867_0_0_150_0_75.jpg,I misteri della storia,Domenico Vecchioni,LEG Edizioni,2026,,https://www.ibs.it/misteri-della-storia-libro-domenico-vecchioni/e/9791255212867,False,2026-04-17
Altri Editori,https://www.ibs.it/images/9788884747990_0_0_150_0_75.jpg,Lo spettro della bomba. Israele e Iran: una cronologia ragionata (1947-2026),"Gaetano Colonna,Luca Serafini",Il Cerchio,2026,,https://www.ibs.it/spettro-della-bomba-israele-iran-libro-gaetano-colonna-luca-serafini/e/9788884747990,False,2026-04-18
Altri Editori,https://www.ibs.it/images/9788884214256_0_0_150_0_75.jpg,Il Sud che votò per la Repubblica. I risultati del referendum sulla forma Stato del 2 giugno 1946,Francesco Florenzano,EdUP,2026,,https://www.ibs.it/sud-che-voto-per-repubblica-libro-francesco-florenzano/e/9788884214256,False,2026-04-17
Editori Selezionati,https://www.ibs.it/images/9788858160848_0_0_150_0_75.jpg,Controstoria dell'alpinismo,Andrea Zannini,Laterza,2026,"Chi ha inventato l’alpinismo? Davvero è cominciato tutto con la salita di Francesco Petrarca al Mont Ventoux? Oppure sono stati gli illuministi del Settecento? O, ancora, i viaggiatori ed esploratori inglesi dell’Ottocento? E se invece fossero stati gli uomini e le donne che da sempre abitano le Alpi a diffondere la passione per le vette? Un libro originale e sorprendente, che rovescia la tradizionale narrazione sulla nascita dell’alpinismo e pone al centro del racconto i veri protagonisti finora dimenticati: i montanari.",https://www.ibs.it/controstoria-dell-alpinismo-libro-andrea-zannini/e/9788858160848,False,2026-04-17
Altri Editori,https://www.ibs.it/images/9788842571247_0_0_150_0_75.jpg,Lo sterminio mancato. La dominazione nazista nel Veneto orientale 1943-1945,P. Arrigo Carnier,Mursia,2026,,https://www.ibs.it/sterminio-mancato-dominazione-nazista-nel-libro-p-arrigo-carnier/e/9788842571247,False,2026-04-21
Altri Editori,https://www.ibs.it/images/9788842570974_0_0_150_0_75.jpg,Gli eroi della guerra perduta. Samurai contro Marines nell'ultimo inferno del Pacifico 1945,Walther Nardini,Mursia,2026,,https://www.ibs.it/eroi-della-guerra-perduta-samurai-libro-walther-nardini/e/9788842570974,False,2026-04-21
Altri Editori,https://www.ibs.it/images/9788842569794_0_0_150_0_75.jpg,Ordine del Duce: salvate il Re d'Inghilterra! La crociera di Edoardo VIII nel Mediterraneo agosto 1936,Enrico Cernuschi,Mursia,2026,,https://www.ibs.it/ordine-del-duce-salvate-re-libro-enrico-cernuschi/e/9788842569794,False,2026-04-21
Editori Selezionati,https://www.ibs.it/images/9788822795007_0_0_150_0_75.jpg,Un anno nell'antica Roma,Marco Cappadonia Mastrolorenzi,Newton Compton Editori,2026,"Questo libro ti porterà dentro tre momenti straordinari della storia romana: la fine della monarchia con i complotti di Tarquinio il Superbo, l'ascesa di Ottaviano Augusto al potere imperiale e i misteri oscuri della corte di Costantino. Non incontrerai solo imperatori e consoli, ma anche matrone, liberti, schiavi e combattenti, personaggi storici o verosimili che ti accompagneranno in un viaggio tra passioni, intrighi e colpi di scena. Marco Cappadonia Mastrolorenzi rievoca la vita quotidiana a Roma, raccontando meglio di qualunque altro manuale la storia della città che conquistò il mondo. Sarà come camminare nelle strade polverose dell'Urbe, per ascoltare i clamori del foro, respirare odori e atmosfere, accompagnare i legionari al fronte, osservare i gladiatori che si preparano a combattere e assistere a concitate discussioni in Senato. Un'esperienza immersiva, come un romanzo di impeccabile rigore storico, che restituisce lo spirito di un'epoca intera. Tra gli argomenti trattati: Il sacro fuoco di Vesta, La danza dei Salii, Le riforme di Servio Tullio, Dai condomini popolari al porto di Ostia, Un pomeriggio di spettacoli, La matrona, il console, il popolano, Cosa vediamo nei vici?, L'arco di Costantino: il libro di marmo, Templi pagani e “luoghi di riunione” cristiani, Il principe oscuro.",https://www.ibs.it/anno-nell-antica-roma-libro-marco-cappadonia-mastrolorenzi/e/9788822795007,False,2026-04-17
Editori Selezionati,https://www.ibs.it/images/9788815396099_0_0_150_0_75.jpg,I movimenti per l'unità europea (1987-2007),N/D,Il Mulino,2026,"Il volume si inserisce in un filone di ricerca che ha già portato alla pubblicazione di altre opere collettanee dedicate ai movimenti europeisti nella fase successiva alla Seconda guerra mondiale (1945-1954), poi nei primi decenni del processo di integrazione europea, dal 1954 al 1969, e, infine, dal 1970 alla metà degli anni Ottanta. Proseguendo su questa linea, «I movimenti per l'unità europea» approfondisce lo studio di tali organizzazioni nel periodo che va dall'Atto unico europeo alla firma del Trattato di Lisbona. I movimenti per l'unità europea hanno operato non solo sul terreno dell'informazione e sensibilizzazione dell'opinione pubblica sui temi europei, ma anche cercando di orientare il corso degli avvenimenti attraverso un'azione di pressione sui governi, le istituzioni comunitarie e dell'UE, le classi politiche nazionali ed europee. Si ripercorrono, pertanto, le vicende della costruzione europea attraverso uno sguardo «dal basso», quello della società civile organizzata, e da un'ottica complementare rispetto a quella esclusiva delle istituzioni.",https://www.ibs.it/movimenti-per-unita-europea-1987-libro-vari/e/9788815396099,False,2026-04-17
Editori Selezionati,https://www.ibs.it/images/9788815392022_0_0_150_0_75.jpg,"Chierici e religiosi in movimento in una città comunale. Territorio, confini e relazioni di Vercelli (XII-XIII secolo)",Francesco Cissello,Il Mulino,2026,"La mobilità territoriale delle persone è stata da tempo riconosciuta come uno degli aspetti centrali e più caratteristici nella crescita (demografica, di peso politico ed economico) dei comuni italiani del XII-XIII secolo. Il presente volume intende puntare l'attenzione su un particolare segmento della mobilità, quello ecclesiastico, che si pone all'incrocio tra le dinamiche politiche e clericali, evidenziando la progressiva costruzione dello spazio di relazioni di un comune e della sua Chiesa. L'ambito prescelto è quello di Vercelli, comune egemone nel Piemonte bassomedievale: attraverso lo spoglio di un materiale documentario ricco e vario, si prendono in esame i legami della città piemontese con territori posti a breve, media e grande distanza. I percorsi di chierici e religiosi disegnano, in effetti, un raggio di relazioni che spazia dal Monferrato alla Terrasanta; dai centri dell'Italia settentrionale fino al Regno d'Inghilterra. Ne risulta un'immagine per molti versi nuova e meglio definita di una città comunale all'apice della sua potenza.",https://www.ibs.it/chierici-religiosi-in-movimento-in-libro-francesco-cissello/e/9788815392022,False,2026-04-17
