Categoria,Data_Aggiunta,Editore,Copertina,Titolo,Autore,Descrizione,Link
Bestseller,2026-06-03,Gallimard,https://products-images.di-static.com/image/maupassant-guy-de-bel-ami/9782070409358-475x500-1.webp,Bel-Ami,Guy de Maupassant,"Georges Duroy, dit Bel-Ami, est un jeune homme au physique avantageux. Le hasard d'une rencontre le met sur la voie de l'ascension sociale. Malgré sa vulgarité et son ignorance, cet arriviste parvient au sommet par l'intermédiaire de ses maîtresses et du journalisme. Cinq héroïnes vont tour à tour l'initier aux mystères du métier, aux secrets de la mondanité et lui assurer la réussite qu'il espère. Dans cette société parisienne en pleine expansion capitaliste et coloniale, que Maupassant dénonce avec force parce qu'il la connaît bien, les femmes éduquent, conseillent, oeuvrent dans l'ombre. La presse, la politique, la finance s'entremêlent. Mais derrière les combines politiques et financières, l'érotisme intéressé, la mort est là qui veille, et avec elle, l'angoisse que chacun porte au fond de lui-même.",https://www.decitre.fr/livres/bel-ami-9782080276735.html?sku=9782070409358
Bestseller,2026-06-03,Seuil,https://products-images.di-static.com/image/huguerre-cousin-brianne-les-charognards/9782021597714-475x500-1.webp,"Les charognards. Pompes funèbres, enquête sur le business de la mort",Brianne Huguerre-Cousin,"En France, une industrie du chagrin prospère à bas bruit. Deux groupes privés, qui organisent à eux seuls un tiers des obsèques, se partagent une large part de ce marché à 3 milliards d'euros par an. Véritables empereurs de la mort, ils ont quadrillé le pays d'agences, de crématoriums et de chambres funéraires afin de ""gagner des obsèques"" . Derrière les promesses d'adieux apaisés mises en avant dans les agences se révèle une réalité où la mission d'accompagnement des familles passe au second plan, quitte à ignorer, parfois, le respect dû aux défunts. Tarifs hors de contrôle, techniques commerciales immorales, rentabilité outrancière de certains crématoriums, personnels à bout et même erreurs irréparables... Les endeuillés sont les proies de ceux que les auteurs surnomment les Charognards. Les histoires de ce livre racontent des transgressions. Des cérémonies catastrophiques, des corps inversés ou même crématisés par erreur. Pendant plus d'un an, Brianne Huguerre-Cousin et Matthieu Slisse ont enquêté et recueilli une centaine de témoignages. Ils décrivent un terrible système de marchandisation de la mort. Après les EHPAD et les crèches, l'alerte est donnée sur un nouveau service public détourné en une course effrénée à la rentabilité. Jusqu'à quand ? Brianne Huguerre-Cousin et Matthieu Slisse sont journalistes. Ils collaborent au média d'investigation Mediacités avec lequel ils ont initié cette enquête.",https://www.decitre.fr/livres/les-charognards-9782021597714.html
Bestseller,2026-06-03,Points,https://products-images.di-static.com/image/bida-mohamed-13-jours-13-nuits/9791041412266-475x500-1.webp,"13 jours, 13 nuits. Dans l'enfer de Kaboul",Mohamed Bida,"Le livre qui a inspiré le film évènement Le récit héroïque de l'évacuation, par onze policiers français, de milliers d'Afghans face à l'arrivée des talibans. Une leçon d'humanité et de résilience. Le dimanche 15 août 2021, les talibans entrent dans Kaboul et s'emparent du pouvoir. C'est la fin de l'espoir pour des millions d'Afghans épuisés par quarante années de guerre. Ils sont des milliers à fuir vers l'aéroport, tandis que d'autres tentent leur chance auprès de la dernière mission occidentale ouverte, l'ambassade de France. Seuls en charge du site et de milliers de personnes, alors que les scènes d'apocalypse et de chaos se multiplient dans la capitale et que les plans d'évacuation échouent les uns après les autres, le commandant Mohamed Bida et les dix policiers d'élite restés en charge doivent se résoudre à négocier avec les talibans et leur branche terroriste. Commencent alors 13 jours et 13 nuits de cauchemar où, au péril de leur vie, les policiers ont sauvé 2 834 personnes. Une leçon d'humanité et de résilience. Mohamed Bida est commandant divisionnaire honoraire de police. Il a été attaché de sécurité intérieure adjoint à l'ambassade de France en Afghanistan entre 2016 et 2021.",https://www.decitre.fr/livres/13-jours-13-nuits-9791041412266.html
Bestseller,2026-06-03,Seuil,https://products-images.di-static.com/image/pastoureau-michel-l-ane/9782021586695-475x500-1.webp,L'Âne. Une histoire culturelle,Michel Pastoureau,"Domestiqué quatre millénaires avant notre ère, l'âne joue un rôle important dans la vie quotidienne des peuples de l'Antiquité méditerranéenne. De nombreux documents le montrent au travail : il porte, il tire, il pousse, il foule. D'abord positive, son image tend à se dévaloriser à partir du moment où le cheval lui fait concurrence. Les fables et les proverbes dénoncent sa paresse et son entêtement, et les récits mythologiques, sa luxure. A Rome, son nom devient même une injure à l'époque impériale (asinus). Au Moyen Age, cette image de l'âne continue de se dégrader. A la campagne, l'animal travaille certes durement, mais il est désormais au service des plus pauvres et s'en trouve déprécié. Bestiaires et encyclopédies soulignent sa stupidité et sa méchanceté, tandis que dans les images, ses oreilles prennent place sur la tête des bouffons et des fous. Seule l'histoire sainte le valorise : il a eu l'honneur d'assister à la Nativité puis de porter le Christ lors de son entrée à Jérusalem. Toutefois, c'est seulement à l'Epoque moderne que la symbolique de l'âne commence à s'inverser. Chez certains philosophes, l'animal obtus devient clairvoyant, et plusieurs naturalistes - au premier rang desquels Buffon - cessent d'en faire un cheval au rabais. Ils vantent au contraire ses qualités naturelles et invitent à mieux le considérer. La sensibilité romantique prend le relais, qui s'apitoie sur le sort de cet animal par trop humilié et maltraité. Poètes, conteurs, artistes en proposent un portrait renouvelé, chaleureux et bienveillant. La prétendue bêtise de l'âne s'efface peu à peu en même temps que son bonnet d'infamie. Cette image revalorisée de l'âne se prolonge jusqu'à aujourd'hui. On la retrouve dans le livre pour enfants, au cinéma, dans le bestiaire des emblèmes et des symboles. De nos jours, peu d'animaux disposent d'un capital de sympathie comparable.",https://www.decitre.fr/livres/l-ane-9782021586695.html
Bestseller,2026-06-03,Le Cherche Midi,https://products-images.di-static.com/image/arditi-pierre-le-souvenir-de-presque-tout/9782749182919-475x500-1.webp,Le souvenir de presque tout,Pierre Arditi,"Mémoires inédites d'un des comédiens français les plus populaires. "" Pendant des années, j'ai couru derrière un type qui me ressemblait et que je tentais vainement de rejoindre. Parfois, arrivant à sa hauteur, il me regardait, m'adressait un petit sourire ironique comme on décoche une flèche, puis accélérant, me laissait sur place, spectateur de ma propre défaite. Ce petit bonhomme et son sourire énigmatique semblaient me faire savoir que je courais derrière ""ce devenir de moi' dont j'ignorais tout mais qui, un jour ou l'autre, finirait bien par se trouver... "" Pierre Arditi se raconte ici par petites touches, faisant resurgir les souvenirs comme autant de motifs composant une mémoire d'ensemble. Nous connaissions son grand talent de comédien, nous découvrons un homme de plume.",https://www.decitre.fr/livres/le-souvenir-de-presque-tout-9782749182919.html
Bestseller,2026-06-03,Fayard,https://products-images.di-static.com/image/benaim-valerie-disparus/9782213727264-475x500-1.webp,Disparus,Valérie Bénaïm,"""Toutes les 13 minutes, un enfant disparaît en France. Un phénomène qui doit nous alerter, car ce chiffre n'est pas seulement une statistique : il illustre une réalité qui nous concerne tous. Journaliste et mère, j'ai souhaité briser ce silence assourdissant qui enveloppe plus de 38 477 disparitions. Comprendre ce qui se joue derrière ce fléau, ce qu'il dit de notre société, de nous, de nos institutions. J'ai donc enquêté et rencontré les familles, les associations, les policiers, les magistrats, les psychologues, tous ceux qui tentent chaque jour d'arracher ces enfants à l'oubli et de réparer l'irréparable. Ces récits glaçants mais pleins de courage nous aident à répondre à la question essentielle : comment protéger ceux qui sont les plus vulnérables ? Chaque enfant mérite d'être sauvé dans une société dont le devoir est de les protéger"". Valérie Benaïm est journaliste, productrice et animatrice de télévision. Figure très connue du grand public, elle est chroniqueuse régulière dans l'émission Tout beau tout n9uf sur W9. Son dernier livre, paru en 2024, Il n'est pas celui que vous croyez, s'est imposé comme un best-seller.",https://www.decitre.fr/livres/disparus-9782213727264.html
Bestseller,2026-06-03,Fayard,https://products-images.di-static.com/image/raoult-didier-la-societe-du-factice/9782213734842-475x500-1.webp,La société du factice. Journal d'un complotiste,Didier Raoult,"""La science est devenue aujourd'hui un domaine sur lequel tout le monde peut avoir une opinion et se définir lui-même comme expert pour servir d'""idiot utile"" sur les plateaux télé et dans les journaux, en affirmant des choses que personne ne peut vérifier, et dont on découvrira un jour qu'elles sont complètement factices. """,https://www.decitre.fr/livres/la-societe-du-factice-9782213734842.html
Bestseller,2026-06-03,Outre mesure,https://products-images.di-static.com/image/dericq-lilian-en-harmonie/9782907891868-475x500-1.webp,En harmonie. Fondements de l'harmonie tonale et modale dans le jazz Tome 1,Lilian Dericq,"Une méthode claire, progressive, dynamique qui vous propose de découvrir les fondements de l'harmonie tonale dans le jazz. L'ouvrage s'adresse à tous les instrumentistes qui désirent comprendre la façon dont sont construits les standards et pour qui les termes intervalle, cadence, tonalité, dominante secondaire ou substitution sont encore imprécis. Il se présente comme une véritable méthode progressive où chaque notion abordée est accompagnée d'exemples et d'une série d'exercices (avec leurs corrigés). Cette approche d'un genre nouveau doit permettre au lecteur de : s'épanouir sans informations inutiles ; comprendre et s'approprier un thème par le biais de son analyse (cadences, emprunts, modulations, substitutions, etc.) afin d'en changer pertinemment la structure et, éventuellement, d'en proposer une version personnelle ; se préparer à l'étude de notions plus complexes (que l'on trouvera dans le Tome 2). Les accords et leurs enchaînements ont une histoire, ils obéissent à certaines "" règles "" que tout musicien de jazz (autodidacte ou instrumentiste chevronné) se doit de connaître afin de libérer sa créativité. Ce sont ces principes que nous vous proposons de découvrir avec En Harmonie.",https://www.decitre.fr/livres/en-harmonie-9782907891868.html
Bestseller,2026-06-03,Mame,https://products-images.di-static.com/image/amiot-karine-marie-la-bible-pour-les-enfants/9782728913787-475x500-1.webp,La Bible pour les enfants,Karine-Marie Amiot,"Découvrez en famille tous les épisodes et les grands personnages connus de la Bible, de la traversée de la mer Rouge à la fête de Pâques, en passant par l'arche de Noé, les dix commandements, les miracles et la Passion de Jésus... Ces récits richement illustrés mettent en valeur le plus grand texte de l'histoire de l'humanité et permettent de plonger dans notre patrimoine culturel commun pour en partager la richesse.",https://www.decitre.fr/livres/la-bible-pour-les-enfants-9782728913787.html
Bestseller,2026-06-03,HarperCollins France,https://products-images.di-static.com/image/darian-caroline-et-j-ai-cesse-de-t-appeler-papa/9791033913429-475x500-1.webp,Et j'ai cessé de t'appeler papa. Quand la soumission chimique devient l'arme du viol,Caroline Darian,"Le 2 novembre 2020, Caroline Darian reçoit un appel de la police de Carpentras. Son père est en garde à vue. La saisie de son matériel informatique révèle l'impensable : depuis 2013, il drogue sa femme avant de la livrer, inconsciente, à des hommes, de tous les horizons et sans contrepartie. Caroline Darian, femme debout, raconte cette déflagration, le périlleux vertige de découvrir qu'une personne aimée, son père, est capable du pire. Elle alerte aussi sur la soumission chimique, quand l'armoire à pharmacie du foyer se transforme en arme préférée des violeurs... Une voix forte, exceptionnellement courageuse, qui révèle une autre facette des violences faites aux femmes. A propos de l'autrice Caroline Darian est cadre supérieure dans une grande entreprise. Un procès est en cours concernant l'affaire décrite dans cet ouvrage. "" Un récit qui entend dépasser le fait divers, hors norme par sa durée et le nombre d'auteurs (environ 70, dont 49 identifiés à ce jour), pour alerter sur le fléau de la soumission chimique. "" Le Parisien "" Un témoignage sans concession sur sa colère, à l'écriture tranchante, qui remue et pousse à réfléchir sur les rapports hommes/femmes. "" L'Alsace "" Caroline Darian raconte l'impensable et l'indicible, l'horreur et le chaos, la trahison et la souffrance. Avec courage, force et justesse. "" Nice Matin "" Un témoignage bouleversant. "" La Provence",https://www.decitre.fr/livres/et-j-ai-cesse-de-t-appeler-papa-9791033913429.html
Bestseller,2026-06-03,Albin Michel,https://products-images.di-static.com/image/tardif-florian-un-couple-presque-parfait/9782226511805-475x500-1.webp,Un couple (presque) parfait,Florian Tardif,"Depuis dix ans, Brigitte et Emmanuel Macron sont au centre de la politique française. Mais que sait-on de la réalité de leur relation ? A partir de scènes inédites et de nombreux témoignages, cette enquête nous mène de l'autre côté du miroir. Quels ressorts cachés leur ont permis de tenir, en dépit parfois d'un entourage sceptique - voire hostile ? Comment ont-ils résisté aux attaques, aux rumeurs et aux tempêtes ? Forment-ils vraiment un couple parfait ? Ce livre démêle le vrai du faux, en revenant sur les moments clés de leur histoire, de leur rencontre à leur altercation au sortir de l'avion au Vietnam en 2025. Il décrit les rivalités politiques et les stratégies amoureuses qui font de l'Elysée le palais des intrigues. Dans ce climat de fin de règne, Emmanuel Macron s'est enfermé dans ses certitudes. Brigitte est-elle encore capable de l'en sortir ? Un livre qui nous fait entrer dans les zones interdites du vrai pouvoir.",https://www.decitre.fr/livres/un-couple-presque-parfait-9782226511805.html
Bestseller,2026-06-03,Michel Lafon,https://products-images.di-static.com/image/brault-nicolas-donner-l-ordre-ne-suffit-pas/9782749963839-475x500-1.webp,Donner l'ordre ne suffit pas,Nicolas Brault,"""Ce que les hommes sans nom m'ont appris peut servir à tous"". ""Si tu ralentis, ils s'arrêtent. Si tu faiblis, ils flanchent. Si tu t'assieds, ils se couchent. Si tu critiques, ils démolissent. Mais si tu marches devant, ils te dépasseront"". A la Légion étrangère, comme dans le monde du travail, tout repose sur la communication. Dans ce livre, le capitaine Nicolas Brault transmet son expérience du commandement, forgée sur le terrain. Il montre comment l'autorité se construit au quotidien, par la clarté, l'écoute et l'exemplarité, bien plus que par le charisme ou la contrainte. Une vision du leadership applicable à toute situation où il faut entraîner, décider et agir ensemble.",https://www.decitre.fr/livres/donner-l-ordre-ne-suffit-pas-9782749963839.html
Bestseller,2026-06-03,Fayard,https://products-images.di-static.com/image/dupont-aignan-nicolas-2027-la-liberte-ou-la-mort/9782213731704-475x500-1.webp,2027 La liberté ou la mort,Nicolas Dupont-Aignan,"Libre, la France brille. Entravée, elle dépérit. La France n'est pas, n'a jamais été, un pays comme un autre. Tout au long de son histoire tumultueuse, elle a marqué les esprits, elle a élevé l'âme, elle s'est imposée comme la conscience du monde. Mais notre nation est désormais prisonnière. De l'Union Européenne, de l'OTAN, de la mondialisation sauvage. 2027 représente la dernière chance de briser nos chaînes. Il n'en va pas seulement du destin du pays. La liberté collective garantit surtout la liberté individuelle. Ce sont nos vies qui sont en jeu. Depuis quand, nous, Français, aurions-nous peur d'être libres ?",https://www.decitre.fr/livres/2027-la-liberte-ou-la-mort-9782213731704.html
Bestseller,2026-06-03,Télémaque (Editions),https://products-images.di-static.com/image/menard-robert-lettre-a-clara/9782753305687-475x500-1.webp,Lettre à Clara,Robert Ménard,"Ecologie, sécurité, guerre en Ukraine, immigration, spiritualité, fin de vie... Robert Ménard, avec la liberté de parole qu'on lui connaît, a voulu ouvrir un dialogue avec Clara, sa fille de 24 ans, aux sensibilités souvent à l'opposé des siennes. Pour tenter de résoudre une énigme : comment peut-on être à la fois si proches et en apparence si loin Un texte idéal pour placer la campagne électorale qui s'ouvre sous le signe du dialogue et de l'apaisement. Loin des pièges du sectarisme, de la démagogie et de l'outrance. "" Que penses-tu au fond de toi ? Je n'en sais trop rien. D'abord parce que, comme pour d'autres sujets polémiques, nous évitons de les aborder. Je crois, si j'en juge par nos conversations avec nos amis, que nous ne sommes pas la seule famille à pratiquer cet art du contournement. Ce livre n'a pas pour but de te convaincre, mais de mieux te parler. Et... t'écouter. Ecrire, c'est se parler sans éclats de voix. """,https://www.decitre.fr/livres/lettre-a-clara-9782753305687.html
Bestseller,2026-06-03,Le Cherche Midi,https://products-images.di-static.com/image/voulzy-laurent-cache-derriere/9782749184364-475x500-1.webp,Caché derrière,Laurent Voulzy,Les mémoires inédits de Laurent Voulzy. Les mémoires inédits de Laurent Voulzy.,https://www.decitre.fr/livres/cache-derriere-9782749184364.html
Bestseller,2026-06-03,Coédition Plon/Radio Classique,https://products-images.di-static.com/image/giesbert-franz-olivier-la-france-est-elle-un-pays-communiste/9782259325103-475x500-1.webp,La France est-elle un pays communiste ?,Franz-Olivier Giesbert,"Ne dites pas à la France qu'elle est un pays communiste, elle croit qu'elle vit dans l'enfer du néolibéralisme. ""Nos économistes marxistes - les marxistes sont apparemment les plus écoutés - nous expliquent que la France, gangrenée par l'ultralibéralisme, est devenue l'Eden des ultra-riches qui se gaveraient d'ultra-dividendes sans payer jamais d'impôts, les pouacres ! Cette plaisanterie de garçon de bain, trompetée par la plupart des médias, abuse néanmoins beaucoup de Français, les incitant à exiger toujours plus de socialisation. Mikhaïl Gorbatchev n'était pas dupe, lui. Au couchant de son règne, alors que l'Empire soviétique s'écroulait, le dernier numéro un de l'URSS avait tout dit quand il déclarait : ""La France est le seul pays où le communisme a réussi.""""",https://www.decitre.fr/livres/la-france-est-elle-un-pays-communiste-9782259325103.html
Bestseller,2026-06-03,Outre mesure,https://products-images.di-static.com/image/dericq-lilian-en-harmonie/9782907891875-475x500-1.webp,En harmonie. Fondements de l'harmonie tonale et modale dans le jazz Tome 2,Lilian Dericq,N/D,https://www.decitre.fr/livres/en-harmonie-9782907891875.html
Bestseller,2026-06-03,Flammarion,https://products-images.di-static.com/image/erner-guillaume-schmattes/9782080148902-475x500-1.webp,"Schmattès. (Fringues, en yiddish)",Guillaume Erner,"Vous ne savez probablement pas ce que signifie le mot schmattès. C'est en pensant à vous que j'ai écrit ce livre. S'il ne s'agissait que d'une question de traduction, je dirais que schmattès veut dire ""fringues"" en yiddish, et l'affaire serait pliée. Mais voilà, il n'y a pas qu'un mot derrière le schmattès : il y a un monde englouti. Et c'est pour cela que j'ai voulu écrire ce livre. Figurez-vous que je suis un véritable schmattologue. Depuis ma naissance, je vis entouré de gens qui ont fait du schmattès. J'y ai travaillé moi aussi, parmi les Juifs du Sentier, dans cet univers si singulier où l'on vend, où l'on coud, où l'on négocie, où l'on rêve parfois. J'y ai laissé quelques plumes, et même quelques dettes, avant de réussir, autrement dit de réussir à m'en sortir. J'ai voulu laisser une trace de ce métier, cette aiguille qui a nourri mes arrière-grands-parents, mes grands-parents, mes parents et moi-même pendant des décennies. On écrit beaucoup sur la haute couture - je comprends pourquoi - mais ce n'est pas une raison pour oublier la basse couture. D'autant que le chiffon pourrait bien nous aider à percer quelques mystères du capitalisme.",https://www.decitre.fr/livres/schmattes-9782080148902.html
Bestseller,2026-06-03,Seuil,https://products-images.di-static.com/image/plenel-edwy-la-democratie-n-est-pas-l-election/9782021616057-475x500-1.webp,La démocratie n'est pas l'élection,Edwy Plenel,"Un régime démocratique ne se résume pas à l'élection de nos représentants, des députés de la Nation au président de la République. La meilleure preuve en est qu'aujourd'hui, nombre de régimes autoritaires s'attaquent aux libertés et droits fondamentaux en arguant de leur légitimité électorale qui l'emporterait sur tout autre pouvoir ou contre-pouvoir - Etat de droit, indépendance de la justice, liberté de la presse, etc. Cette primauté de l'élection appauvrit et corrompt l'idéal démocratique.",https://www.decitre.fr/livres/la-democratie-n-est-pas-l-election-9782021616057.html
Bestseller,2026-06-03,Allary,https://products-images.di-static.com/image/glucksmann-raphael-nous-avons-encore-envie/9782370736178-475x500-1.webp,Nous avons encore envie,Raphaël Glucksmann,"Pour un sursaut patriotique ""Partout en France, je ressens une envie puissante, une envie frustrée, une envie brulante. L'envie de retrouver un destin à la hauteur de notre histoire. Je la ressens chez les citoyens de gauche et progressistes comme chez les électeurs du Rassemblement national. Je la ressens dans nos tristesses et nos colères, nos angoisses et nos dépits. Nous refusons le déclassement et le déclin. Nous ne voulons pas devenir un terrain de jeu pour tycoons américains, oligarques russes, dignitaires du Parti communiste chinois ou émirs qataris. Nous sommes fiers, oui. Fiers d'être francais. Fiers d'être européens. Fiers d'être démocrates. Fiers d'être républicains. Alors que beaucoup se résignent à une victoire de l'extrême droite en 2027, je suis convaincu que nous allons déjouer les pronostics, défier l'air du temps trumpiste ou poutiniste et renouer avec une certaine idée de la France. Le temps est venu d'un grand sursaut patriotique"". R. G.",https://www.decitre.fr/livres/nous-avons-encore-envie-9782370736178.html
