Categoria_App,Copertina,Titolo,Autore,Editore,Anno,Descrizione,Link,Nuovo,Data_Aggiunta
Altri Editori,https://www.ibs.it/images/9788839934819_0_0_150_0_75.jpg,Il papato domani. Contributi per un confronto ecumenico,N/D,Queriniana,2026,,https://www.ibs.it/papato-domani-contributi-per-confronto-libro-vari/e/9788839934819,True,2026-07-09
Altri Editori,https://www.ibs.it/images/9788832991000_0_0_150_0_75.jpg,La grazia comune e il Vangelo,Cornelius Van Til,Alfa & Omega,2026,,https://www.ibs.it/grazia-comune-vangelo-libro-cornelius-van-til/e/9788832991000,False,2026-07-02
Altri Editori,https://www.ibs.it/images/9788832715972_0_0_150_0_75.jpg,"Chiamati a custodire. Persone, relazioni, tempi e spazi",Azione Cattolica Italiana. Settore Giovani,AVE,2026,,https://www.ibs.it/chiamati-a-custodire-persone-relazioni-libro-azione-cattolica-italiana-settore-giovani/e/9788832715972,False,2026-07-08
Altri Editori,https://www.ibs.it/images/9788831559393_0_0_150_0_75.jpg,Come voce di sottile silenzio. Interiorità e rapporto con Dio,Cesare Falletti,Paoline Editoriale Libri,2026,,https://www.ibs.it/come-voce-di-sottile-silenzio-libro-cesare-falletti/e/9788831559393,True,2026-07-09
Altri Editori,https://www.ibs.it/images/9788831559386_0_0_150_0_75.jpg,Humanae vitae. Lettera enciclica. Nuova ediz.,Paolo VI,Paoline Editoriale Libri,2026,,https://www.ibs.it/humanae-vitae-lettera-enciclica-nuova-libro-paolo-vi/e/9788831559386,True,2026-07-09
Altri Editori,https://www.ibs.it/images/9788831558136_0_0_150_0_75.jpg,Il Vangelo sussurrato dagli ultimi,Alessandro Mayer,Paoline Editoriale Libri,2026,,https://www.ibs.it/vangelo-sussurrato-dagli-ultimi-libro-alessandro-mayer/e/9788831558136,True,2026-07-09
Altri Editori,https://www.ibs.it/images/9788825061475_0_0_150_0_75.jpg,Credereoggi. Vol. 274: Musica ed esperienza religiosa,N/D,EMP - Edizioni Messaggero Padova,2026,,https://www.ibs.it/credereoggi-vol-274-musica-ed-libro-vari/e/9788825061475,True,2026-07-09
Altri Editori,https://www.ibs.it/images/9788801202717_0_0_150_0_75.jpg,L'ora di religione (2026). Vol. 1: Settembre–ottobre. Una pace che viene dal cuore,N/D,Editrice Elledici,2026,,https://www.ibs.it/ora-di-religione-2026-vol-libro-vari/e/9788801202717,False,2026-07-08
Editori Selezionati,https://www.ibs.it/images/9788837241926_0_0_150_0_75.jpg,Religioni himalayane,N/D,Morcelliana,2026,,https://www.ibs.it/religioni-himalayane-libro-vari/e/9788837241926?inventoryId=1042997044,False,2026-07-04
Altri Editori,https://www.ibs.it/images/9788846775672_0_0_150_0_75.jpg,Il miracolo nel pensiero ebraico tra fede e sospetto,Massimo Giuliani,Edizioni ETS,2026,,https://www.ibs.it/miracolo-nel-pensiero-ebraico-tra-libro-massimo-giuliani/e/9788846775672,False,2026-07-08
Altri Editori,https://www.ibs.it/images/9791298653504_0_0_150_0_75.jpg,L'ascolto che libera. Psicologia e fede nel discernimento della vocazione al sacerdozio,Elio Lorecchio,Edizioni TTE,2026,,https://www.ibs.it/ascolto-che-libera-psicologia-fede-libro-elio-lorecchio/e/9791298653504,False,2026-07-08
Altri Editori,https://www.ibs.it/images/9791282620130_0_0_150_0_75.jpg,La miseria della condizione umana. Testo latino a fronte. Ediz. bilingue,Lotario Di Segni,Liber Mundi,2026,,https://www.ibs.it/miseria-della-condizione-umana-testo-libro-lotario-di-segni/e/9791282620130,False,2026-07-01
Editori Selezionati,https://www.ibs.it/images/9791255741565_0_0_150_0_75.jpg,"Storia, trauma e vergogna. Il dialogo intergenerazionale come strumento per affrontare il passato",N/D,Giunti Psicologia.IO,2026,"Storia, trauma e vergogna propone un'analisi approfondita del costante dialogo sul passato portato avanti dai figli dei sopravvissuti all'Olocausto e dai discendenti di famiglie i cui genitori furono coinvolti, direttamente o indirettamente, nei crimini nazisti. Adottando una prospettiva narrativa autobiografica, i capitoli del libro esplorano l'intersezione tra storia, trauma e vergogna, nonché le modalità con cui il cambiamento e la trasformazione si dispiegano nel tempo. Le analisi degli incontri descritti nel libro offrono un esame rigoroso del processo di dialogo tra i membri del Gruppo di studio sulle conseguenze intergenerazionali dell'Olocausto (Study Group on Intergenerational Consequences of the Holocaust, PAKH), indagando come il trauma della Shoah permanga nella vita quotidiana dei discendenti dei sopravvissuti. L'opera tocca il cuore delle questioni al centro dei dibattiti transnazionali contemporanei sulla costruzione di relazioni di fiducia e riconciliazione nelle società contrassegnate da una storia di genocidio e violenza politica di massa. Questo libro sarà di grande interesse per studiosi universitari, ricercatori e dottorandi impegnati nello studio della psicologia sociale, dell'Olocausto o del genocidio, dei cultural studies, degli studi sulla riconciliazione, del trauma storico e della costruzione della pace. Si rivolge inoltre a psicologi clinici, psichiatri e psicoanalisti, come pure agli studenti universitari interessati alle aree sopra menzionate.",https://www.ibs.it/storia-trauma-vergogna-dialogo-intergenerazionale-libro-vari/e/9791255741565,True,2026-07-09
Editori Selezionati,https://www.ibs.it/images/9791255741541_0_0_150_0_75.jpg,Cosa accade nella terapia di coppia. Casi clinici per una prassi efficace,N/D,Giunti Psicologia.IO,2026,"Cosa accade davvero nella stanza della terapia di coppia? Non solo ciò che il terapeuta dice o fa, ma quello che pensa, sente, valuta e talvolta teme mentre accompagna due partner in uno dei percorsi più delicati della pratica clinica. Questo volume apre una prospettiva rara e preziosa sulle dinamiche reali della terapia di coppia: il processo decisionale, le esitazioni, le svolte, gli errori, le riparazioni, la costruzione della fiducia e della speranza. Attraverso casi clinici narrati da professionisti esperti, espressione di diversi modelli e orientamenti terapeutici, il lettore entra nel vivo del percorso di cura. Ne emerge un viaggio insieme professionale e umano, in cui teoria e tecnica prendono forma nel dialogo, nella sintonizzazione, nell'incertezza e nella capacità di orientarsi tra ambivalenze, conflitti e possibilità di cambiamento. Un volume pensato per chi desidera non soltanto conoscere la terapia di coppia, ma comprenderla dall'interno.",https://www.ibs.it/cosa-accade-nella-terapia-di-libro-vari/e/9791255741541,True,2026-07-09
Altri Editori,https://www.ibs.it/images/9788868687601_0_0_150_0_75.jpg,Il pensiero miserabile,Michele Lo Foco,Curcio,2026,,https://www.ibs.it/pensiero-miserabile-libro-michele-lo-foco/e/9788868687601?inventoryId=992847756,False,2026-07-07
Altri Editori,https://www.ibs.it/images/9788836166077_0_0_150_0_75.jpg,L'inutile voglia di migliorare se stessi,Peter Cameron Ellis,DIARKOS,2026,,https://www.ibs.it/inutile-voglia-di-migliorare-se-libro-peter-cameron-ellis/e/9788836166077?inventoryId=991314410,False,2026-07-07
Altri Editori,https://www.ibs.it/images/9791256650972_0_0_150_0_75.jpg,Eros. Quale identità nel kaos?,Sandro Rodighiero,Alpes Italia,2026,,https://www.ibs.it/eros-quale-identita-nel-kaos-libro-sandro-rodighiero/e/9791256650972?inventoryId=962529328,False,2026-07-07
Altri Editori,https://www.ibs.it/images/9788846775986_0_0_150_0_75.jpg,Scapestrato,Luigi Burzotta,Edizioni ETS,2026,,https://www.ibs.it/scapestrato-libro-luigi-burzotta/e/9788846775986,False,2026-07-07
Altri Editori,https://www.ibs.it/images/9788869157370_0_0_150_0_75.jpg,Dimenticare Freud,Salvatore Giordano,Nulla Die,2026,,https://www.ibs.it/dimenticare-freud-libro-salvatore-giordano/e/9788869157370,False,2026-07-03
Altri Editori,https://www.ibs.it/images/9791256221349_0_0_150_0_75.jpg,"Vita di Majakovskij. Poesia, scandalo e rivoluzione",Vasilij Katanjan A.,Editoriale Jouvence,2026,,https://www.ibs.it/vita-di-majakovskij-poesia-scandalo-libro-vasilij-katanjan-a/e/9791256221349?inventoryId=1029551501,False,2026-07-04
Editori Selezionati,https://www.ibs.it/images/9791223801741_0_0_150_0_75.jpg,Quando eravamo felici,Antonio Padellaro,Piemme,2026,"«Devi pubblicarlo assolutamente», gli dice sua moglie, stringendogli la mano. E lui, Antonio, quel libro lo scrive davvero. Un flusso ininterrotto di ricordi. Qualche volta incoerenti, spesso vaganti, che procedono a tentoni, come chi è bendato in una stanza oscura ma dagli spazi che gli sono familiari. Quando eravamo felici è il resoconto di questo dialogo intimo e struggente. Lei, una malattia che non dà scampo, lo ascolta, lo corregge, lo sprona. È la sua lettrice necessaria, l'unica capace di scorgere dietro la rievocazione umana ed esistenziale e il piglio del giornalista lo smarrimento di un uomo davanti a qualcosa di troppo grande. In questa immersione narrativa lucida e accorata c'è la Versilia degli anni Sessanta, la casa di villeggiatura, rifugio estivo di parenti, di zii e cuginette e del giovane autore. Di suo padre e di una madre scomparsa troppo presto, all'origine di un turbamento quasi congenito. C'è l'Italia del miracolo, dei democristiani e dei socialisti, delle riforme formidabili; della crisi dei missili a Cuba e della morte violenta di Enrico Mattei, di un'epoca in cui la felicità sembrava un diritto acquisito e la politica conservava ancora il sapore di un destino collettivo.",https://www.ibs.it/quando-eravamo-felici-libro-antonio-padellaro/e/9791223801741?inventoryId=903453094,False,2026-07-06
Altri Editori,https://www.ibs.it/images/9791259856043_0_0_150_0_75.jpg,Il silenzio è musica,Ennio Morricone,HarperCollins Italia,2026,,https://www.ibs.it/silenzio-musica-libro-ennio-morricone/e/9791259856043?inventoryId=986662492,False,2026-07-07
Altri Editori,https://www.ibs.it/images/9791223620861_0_0_150_0_75.jpg,Felilucy. Autobiografia di un collezionista di francobolli. Dove si scopre come un Dio nato Donna diventa poi Uomo,Luciano Allegri,Gruppo Albatros Il Filo,2026,,https://www.ibs.it/felilucy-autobiografia-di-collezionista-di-libro-luciano-allegri/e/9791223620861?inventoryId=1029551502,False,2026-07-07
Altri Editori,https://www.ibs.it/images/9788896130872_0_0_150_0_75.jpg,Simon Bolivar. Una vita rivoluzionaria,Dario Tagliamacco,Bepress,2026,,https://www.ibs.it/simon-bolivar-vita-rivoluzionaria-libro-dario-tagliamacco/e/9788896130872?inventoryId=928658910,False,2026-07-07
Altri Editori,https://www.ibs.it/images/9788876428142_0_0_150_0_75.jpg,Le lettere. Ediz. critica. Vol. 14: 1° novembre-15 dicembre 1526,Francesco Guicciardini,Scuola Normale Superiore,2026,,https://www.ibs.it/lettere-ediz-critica-vol-14-libro-francesco-guicciardini/e/9788876428142?inventoryId=952786919,False,2026-07-07
Editori Selezionati,https://www.ibs.it/images/9788863448849_0_0_150_0_75.jpg,Il sarto della luce. Mariano Fortuny. Un genio nella Belle Époque,Tobia Iodice,Carabba,2026,"Mariano Fortuny non è stato solo un artista, un visionario, uno stilista, ma un genio. Figlio d’arte, destinato alla gloria della pittura, scelse invece di inseguire un’ossessione più grande: la luce. Dalle sue mani nacque così un’invenzione rivoluzionaria, che accese di colori il teatro e diede anima al cinema. Ma quando il mondo era pronto a incoronarlo re dell’illuminazione, Fortuny cambiò di nuovo pelle e dal nulla si trasformò in disegnatore di moda. Contesse, marchese, dive del palcoscenico e della celluloide fecero follie per i suoi abiti e le sue stoffe, mentre lui, nel suo laboratorio segreto, continuava a brevettare oggetti che, senza saperlo, utilizziamo ancora oggi. Tra le stanze del suo ‘palazzo incantato’ affacciato sulla laguna di Venezia è passata la Storia: Marcel Proust, Gabriele d’Annunzio, Eleonora Duse, Rita Hayworth e molti altri personaggi i cui nomi sono ormai leggenda. In questa biografia, la prima pubblicata in Italia, Tobia Iodice ci accompagna in un viaggio ipnotico nel cuore della Belle Époque, alla scoperta dell’uomo che rese la bellezza non un lusso, ma una forma di libertà.",https://www.ibs.it/sarto-della-luce-mariano-fortuny-libro-tobia-iodice/e/9788863448849?inventoryId=1026724846,False,2026-07-06
Editori Selezionati,https://www.ibs.it/images/9788863448795_0_0_150_0_75.jpg,Scritti sulla musica di Mattia Cipollone. Fra Cristoforo da Lanciano,N/D,Carabba,2026,"Nato a Lanciano nel 1837, formatosi al Conservatorio di Napoli, diventato maestro di cappella a Sulmona e poi a Santa Maria degli Angeli (Assisi), Mattia Cipollone fu compositore, organista, direttore, didatta, critico musicale. Morì nel 1905 nel Convento di Monteripido di Perugia.",https://www.ibs.it/scritti-sulla-musica-di-mattia-libro-vari/e/9788863448795?inventoryId=1026724167,False,2026-07-06
Altri Editori,https://www.ibs.it/images/9788836165940_0_0_150_0_75.jpg,Coco Chanel. La donna che ha rivoluzionato il mondo della moda,Roberta Damiata,DIARKOS,2026,,https://www.ibs.it/coco-chanel-donna-che-ha-libro-roberta-damiata/e/9788836165940,True,2026-07-09
Altri Editori,https://www.ibs.it/images/9788833249049_0_0_150_0_75.jpg,"Era dolce, era giovane, era Bologna",Marco Guidi,Minerva Edizioni (Bologna),2026,,https://www.ibs.it/era-dolce-era-giovane-era-libro-marco-guidi/e/9788833249049?inventoryId=967341440,False,2026-07-07
Altri Editori,https://www.ibs.it/images/9788846772381_0_0_150_0_75.jpg,Il nostro caro sodalizio. Carteggio (1965-2000),"Luigi Blasucci,Sebastiano Timpanaro",Edizioni ETS,2026,,https://www.ibs.it/nostro-caro-sodalizio-carteggio-1965-libro-luigi-blasucci-sebastiano-timpanaro/e/9788846772381,True,2026-07-09
Editori Selezionati,https://www.ibs.it/images/9788804820994_0_0_150_0_75.jpg,Sotto le ciglia chissà. I diari,Fabrizio De André,Mondadori,2026,"«Da anni lavoriamo sulle carte dell'archivio di Fabrizio De André, eppure siamo costantemente sorpresi da nuove scoperte e costretti a confessarci ogni volta che ""era molto più curioso"" di noi. Fabrizio annotava in maniera istintiva e quasi maniacale impressioni, ricordi, detti popolari imparati nei carruggi di Genova o appresi dai contadini della Gallura, ricette, citazioni. In questo mare di appunti si trovano le idee che avrebbero dato vita alle sue canzoni, trasformate poi nelle parole che potevano essere collocate negli ""spazi stretti"" lasciati dalla musica grazie ad un lavoro di artigiano meticoloso e alla ricerca di un solo termine, il migliore e più agile, in grado di restituire tutta l'idea originale. Le pagine di questo libro, quindi, sono una selezione che speriamo possa suscitare lo stesso nostro senso di sorpresa. Così come ci auguriamo che l'eterogeneità dei contenuti riesca a sottolineare il sapore delle carte di Fabrizio, raccolte negli anni da Dori Ghezzi e oggi conservate al Centro Studi a lui dedicato presso l'Università di Siena. In ogni caso crediamo che il filo del pensiero di Fabrizio affiori in modo limpido, frase dopo frase, in un flusso che a volte pare interrotto e a volte senza fine, ma che si muove sempre in ""direzione ostinata e contraria"".» Fondazione Fabrizio De André Onlus",https://www.ibs.it/sotto-ciglia-chissa-diari-libro-fabrizio-de-andre/e/9788804820994,False,2026-07-08
Altri Editori,https://www.ibs.it/images/9791281562738_0_0_150_0_75.jpg,Memorie intrecciate,Angioletta Russotti,Linea Edizioni,2026,,https://www.ibs.it/memorie-intrecciate-libro-angioletta-russotti/e/9791281562738,True,2026-07-09
Altri Editori,https://www.ibs.it/images/9791257391744_0_0_150_0_75.jpg,"Donne che si raccontano. Luoghi iconici, stagioni senza tempo, intriganti compagnie",N/D,C&P Adver Effigi,2026,,https://www.ibs.it/donne-che-si-raccontano-luoghi-libro-vari/e/9791257391744,False,2026-07-08
Altri Editori,https://www.ibs.it/images/9791257144920_0_0_150_0_75.jpg,"Diari d'India e Giappone, 1960-1964",Joanne Kyger,Robin Edizioni,2026,,https://www.ibs.it/diari-d-india-giappone-1960-libro-joanne-kyger/e/9791257144920,False,2026-07-07
Altri Editori,https://www.ibs.it/images/9788892785786_0_0_150_0_75.jpg,Sulla sponda del nulla. Storie di pesca e di libertà,Manuel Pace,Ultra,2026,,https://www.ibs.it/sulla-sponda-del-nulla-storie-libro-manuel-pace/e/9788892785786?inventoryId=996426565,False,2026-07-07
Altri Editori,https://www.ibs.it/images/9791256008087_0_0_150_0_75.jpg,«Bisogna fare della poesia». Lettere di Luigi Ciceri a Pier Paolo Pasolini,Maura Locantore,Ledizioni,2026,,https://www.ibs.it/bisogna-fare-della-poesia-lettere-libro-maura-locantore/e/9791256008087?inventoryId=1048638241,False,2026-07-07
Altri Editori,https://www.ibs.it/images/9791224074373_0_0_150_0_75.jpg,Cammino di Santiago di Compostela,Renzo Addante,Youcanprint,2026,,https://www.ibs.it/cammino-di-santiago-di-compostela-libro-renzo-addante/e/9791224074373,False,2026-07-08
Altri Editori,https://www.ibs.it/images/9788882385422_0_0_150_0_75.jpg,Tommaso Campanella. Iconografia di un filosofo,Francesco Sorgiovanni Errigo,Città del Sole Edizioni,2026,,https://www.ibs.it/tommaso-campanella-iconografia-di-filosofo-libro-francesco-sorgiovanni-errigo/e/9788882385422,False,2026-07-08
Altri Editori,https://www.ibs.it/images/9791224332909_0_0_150_0_75.jpg,"Tarcisio Tizzi. Biografia, poesie inedite, vocabolario del dialetto di Sabbioneta. Ediz. illustrata","Alberto Sarzi Madidini,Ernesto Flisi",Centro Culturale a passo d'uomo Soc. Coop. a rl,2026,,https://www.ibs.it/tarcisio-tizzi-biografia-poesie-inedite-libro-alberto-sarzi-madidini-ernesto-flisi/e/9791224332909,False,2026-07-01
Altri Editori,https://www.ibs.it/images/9788863664638_0_0_150_0_75.jpg,DON DOLINDO RUOTOLO DEVOTO DEL VOLTO SANTO DI GESU',Marcello Stanzione,Gribaudi,2026,,https://www.ibs.it/don-dolindo-ruotolo-devoto-del-libro-marcello-stanzione/e/9788863664638,False,2026-07-01
Altri Editori,https://www.ibs.it/images/9788833835822_0_0_150_0_75.jpg,L'intellettuale nel labirinto. Norberto Bobbio e la «guerra giusta»,Giovanni Scirocco,Biblion,2026,,https://www.ibs.it/intellettuale-nel-labirinto-norberto-bobbio-libro-giovanni-scirocco/e/9788833835822,False,2026-07-08
Altri Editori,https://www.ibs.it/images/9791282069083_0_0_150_0_75.jpg,L'io e il mondo. Cinque meditazioni sull'esistenza,Nikolaj Berdjaev,Iduna,2026,,https://www.ibs.it/io-mondo-cinque-meditazioni-sull-libro-nikolaj-berdjaev/e/9791282069083,True,2026-07-09
Editori Selezionati,https://www.ibs.it/images/9788833947013_0_0_150_0_75.jpg,Psiche e materia,Marie-Louise von Franz,Bollati Boringhieri,2026,"Con questo libro Marie-Louise von Franz contribuisce in modo originale al dibattito sull'interazione problematica tra universo naturale e universo psichico. Nei dodici saggi che compongono il volume l'autrice, servendosi anche di esemplificazioni tratte da sogni e casi clinici, integra psicologia analitica e fisica, matematica e discipline orientali, biologia e astronomia, evidenziando analogie sorprendenti e molteplici punti di contatto. Fra i temi presentati spicca per la sua grande attualità quello del vissuto del tempo. Il riferimento è ovviamente alla teoria junghiana della sincronicità, che la von Franz lucidamente illustra, discute e sviluppa, collegandola con la questione della scelta, o piuttosto dell'integrazione, fra spiegazione causale e attribuzione di senso nella comprensione dei fenomeni.",https://www.ibs.it/psiche-materia-libro-marie-louise-von-franz/e/9788833947013?inventoryId=1028704513,False,2026-07-04
Altri Editori,https://www.ibs.it/images/9788838256486_0_0_150_0_75.jpg,Persona. L'etica di Max Scheler,Francesco Saverio Trincia,Studium,2026,,https://www.ibs.it/persona-etica-di-max-scheler-libro-francesco-saverio-trincia/e/9788838256486?inventoryId=932532763,False,2026-07-04
Editori Selezionati,https://www.ibs.it/images/9791222329567_0_0_150_0_75.jpg,Yoga sutra. Il più antico testo di yoga con i commenti della tradizione. Nuova ediz.,Patañjali,Mimesis,2026,"Lo Yoga é una disciplina che si é sviluppata nel solco di una tradizione millenaria fondata sulla rivelazione vedica, la cui origine si perde nella notte dei tempi; tale disciplina ci è stata tramandata nel corso dei secoli nella forma dello Yoga Sutra, un'opera attribuita a Patanjali e commentata da grandi maestri del passato come Vyasa, Vacaspati Misra e Vijñana Bhiksu. La presente edizione si propone di approfondire, oltre al testo, questi commentari che hanno un'importanza fondamentale nella comprensione dello Yoga, a cominciare da quello di Vyasa ma con particolare attenzione anche all'opera di Vijnana Bhiksu, un grande maestro vissuto nel sedicesimo secolo. Bhiksu rende esplicito il pensiero esposto in estrema sintesi da Vyasa nel suo commento, mettendo in relazione il primo e il secondo capitolo del Sutra con i due grandi sentieri di realizzazione spirituale della tradizione indù, la Via della Conoscenza (jnana marga) e la Via dell'Azione (karma marga). Grazie a questa chiave di lettura il Satra ci svela non l'insegnamento di Patanjali, come si dice comunemente, ma i suoi due insegnamenti, il primo indirizzato ai discepoli già in grado di controllare la propria mente, il secondo dedicato a coloro che non sono ancora in grado di farlo. Vyasa considera questo secondo sentiero di realizzazione uno Yoga a parte, diverso da quello definito nel primo capitolo, e destinato particolarmente a coloro che conducono una vita attiva, come i praticanti occidentali.",https://www.ibs.it/yoga-sutra-piu-antico-testo-libro-patanjali/e/9791222329567?inventoryId=966938992,False,2026-07-04
Altri Editori,https://www.ibs.it/images/9788838256493_0_0_150_0_75.jpg,Complexio oppositorum. Il modello della «polarità» nel pensiero cattolico tedesco-francese tra le due guerre,Alessandro Borghesi,Studium,2026,,https://www.ibs.it/complexio-oppositorum-modello-della-polarita-libro-alessandro-borghesi/e/9788838256493?inventoryId=1029551514,False,2026-07-07
Altri Editori,https://www.ibs.it/images/9788830155190_0_0_150_0_75.jpg,Simposio. Testo greco a fronte,Platone,Bompiani,2026,,https://www.ibs.it/simposio-testo-greco-a-fronte-libro-platone/e/9788830155190?inventoryId=992847881,False,2026-07-01
Altri Editori,https://www.ibs.it/images/9788830155176_0_0_150_0_75.jpg,Fedro. Testo greco a fronte,Platone,Bompiani,2026,,https://www.ibs.it/fedro-testo-greco-a-fronte-libro-platone/e/9788830155176?inventoryId=992847879,False,2026-07-01
Altri Editori,https://www.ibs.it/images/9788830155169_0_0_150_0_75.jpg,Fedone. Testo greco a fronte,Platone,Bompiani,2026,,https://www.ibs.it/fedone-testo-greco-a-fronte-libro-platone/e/9788830155169?inventoryId=992847878,False,2026-07-01
Altri Editori,https://www.ibs.it/images/9788830155152_0_0_150_0_75.jpg,Apologia di Socrate. Testo greco a fronte. Ediz. bilingue,Platone,Bompiani,2026,,https://www.ibs.it/apologia-di-socrate-testo-greco-libro-platone/e/9788830155152?inventoryId=992847877,False,2026-07-01
Altri Editori,https://www.ibs.it/images/9788869835230_0_0_150_0_75.jpg,La terra trema. Filosofia della catastrofe,Lucrezia Ercoli,Il Nuovo Melangolo,2026,,https://www.ibs.it/terra-trema-filosofia-della-catastrofe-libro-lucrezia-ercoli/e/9788869835230?inventoryId=987933991,False,2026-07-07
Altri Editori,https://www.ibs.it/images/9788864406008_0_0_150_0_75.jpg,Olbia. Ovvero saggio sui mezzi per riformare i costumi di una nazione,Jean-Baptiste Say,IBL Libri,2026,,https://www.ibs.it/olbia-ovvero-saggio-sui-mezzi-libro-jean-baptiste-say/e/9788864406008?inventoryId=1048897755,False,2026-07-03
Altri Editori,https://www.ibs.it/images/9788846775900_0_0_150_0_75.jpg,Per un lessico politico del nostro tempo. Saggi in onore di Marco Geuna,N/D,Edizioni ETS,2026,,https://www.ibs.it/per-lessico-politico-del-nostro-libro-vari/e/9788846775900?inventoryId=1034961338,True,2026-07-09
Altri Editori,https://www.ibs.it/images/9791256130979_0_0_150_0_75.jpg,De puella Germanica. Con il volgarizzamento di Giovanni Battista Gelli e il «Prodigio mirabile» di G. Bucoldiano,Simone Porzio,La Scuola di Pitagora,2026,,https://www.ibs.it/de-puella-germanica-con-volgarizzamento-libro-simone-porzio/e/9791256130979?inventoryId=1030496363,False,2026-07-04
Altri Editori,https://www.ibs.it/images/9788860565310_0_0_150_0_75.jpg,Trascendentalismo e immanentismo nelle tre edizioni del «Mondo come volontà e rappresentazione» di Arthur Schopenhauer,Maurizio Morini,Eum - Centro Edizioni Università di Macerata,2026,,https://www.ibs.it/trascendentalismo-immanentismo-nelle-tre-edizioni-libro-maurizio-morini/e/9788860565310?inventoryId=121565982,False,2026-07-04
Altri Editori,https://www.ibs.it/images/9791224338253_0_0_150_0_75.jpg,Nihil theory. Scattered hints on a pedagogical epistemology around Nihil,oaia ubam,Autopubblicato,2026,,https://www.ibs.it/nihil-theory-scattered-hints-on-libro-oaia-ubam/e/9791224338253,False,2026-07-07
