Categoria_App,Copertina,Titolo,Autore,Editore,Anno,Descrizione,Link,Nuovo,Data_Aggiunta
Editori Selezionati,https://www.ibs.it/images/9788836022175_0_0_150_0_75.jpg,Codice interiore. Neuroscienze e coaching per il cambiamento personale e professionale,Suzanne Pilch,Hoepli,2026,"Codice interiore è una mappa strutturata per comprendere ciò che ti ha formato e scegliere consapevolmente ciò che vuoi diventare. Molte identità non nascono dalla scelta ma dall’adattamento. Per anni possiamo apparire performanti, affidabili, professionali: interiorizziamo l’ansia, trasformiamo la sensibilità in ipercompetenza, scambiamo la sopravvivenza per carattere. E, senza accorgercene, costruiamo un’identità che ci tiene in piedi ma non sempre ci rende liberi. In Codice interiore Suzanne Pilch integra casi reali, coaching e neuroscienze applicate per mostrare che cosa succede quando il nostro “copione” interno è guidato dal bisogno di funzionare e compiacere – e come questo influenzi in modo diretto decisioni di carriera, leadership e rapporto con le performance. La Parte 1 – Il prezzo dell’adattamento analizza i meccanismi che modellano la nostra identità: attaccamento, regolazione emotiva, trauma non riconosciuto e dinamiche personali e organizzative che premiano l’iperfunzionamento. La Parte 2 – Riscrivere il codice propone un percorso pratico, supportato da esercizi guidati e contenuti extra accessibili tramite QR code, per trasformare la lettura in un’attività esperienziale che ci permetta di lavorare sui pattern automatici, riconoscere i trigger e ridefinire confini e obiettivi.",https://www.ibs.it/codice-interiore-neuroscienze-coaching-per-libro-suzanne-pilch/e/9788836022175,False,2026-04-11
Editori Selezionati,https://www.ibs.it/images/9788836014170_0_0_150_0_75.jpg,Biologia della conservazione,"Luca Santini,Roberto Cazzolla Gatti,Alessandro Chiarucci",Hoepli,2026,"Un manuale di biologia della conservazione che affronta i temi legati alla biodiversità e mira a individuare le soluzioni più adatte a contrastarne la crisi; il tutto in una prospettiva moderna e aggiornata, illustrando la varietà di idee, approcci e strumenti della disciplina. I temi spaziano dal concetto di biodiversità alle principali minacce e alle strategie di conservazione, dalle popolazioni alle specie, fino agli interi ecosistemi. Completa il volume una panoramica sulla legislazione italiana e sugli accordi internazionali in materia di conservazione. Il libro include inoltre tre appendici che introducono le basi di ecologia di popolazione, ecologia spaziale e genetica. L’opera è arricchita da numerosi approfondimenti curati da esperti, che invitano il lettore ad andare oltre l’aspetto puramente didattico per entrare nel vivo della ricerca e dei progetti attuali. È inoltre ricca di esempi, casi di studio e iniziative di conservazione italiane ed europee, pur mantenendo una prospettiva internazionale. Il volume è disponibile in Edizione HoepliAcademy+ composta da: Libro di testo; E-book+, compreso nel prezzo di acquisto del volume; Risorse online e Piattaforma didattica.",https://www.ibs.it/biologia-della-conservazione-libro-vari/e/9788836014170,False,2026-04-11
Altri Editori,https://www.ibs.it/images/9791282297127_0_0_150_0_75.jpg,Attacco e contrattacco. Soluzioni bio contro insetti nocivi e malattie fungine. Nuova ediz.,Maria Lorena Arpesella,La Memoria del Mondo,2026,,https://www.ibs.it/attacco-contrattacco-soluzioni-bio-contro-libro-maria-lorena-arpesella/e/9791282297127,True,2026-04-17
Altri Editori,https://www.ibs.it/images/9791280484284_0_0_150_0_75.jpg,Poaceae d'Italia. Graminacee della flora italiana-Grasses of Italy. Ediz. bilingue,Enrico Banfi,Libreria della Natura,2026,,https://www.ibs.it/poaceae-d-italia-graminacee-della-libro-enrico-banfi/e/9791280484284,False,2026-04-11
Altri Editori,https://www.ibs.it/images/9791257180799_0_0_150_0_75.jpg,Radici profonde. Alla scoperta dell'olio extravergine di oliva,Mirco Paltrinieri,Edizioni Pendragon,2026,,https://www.ibs.it/radici-profonde-alla-scoperta-dell-libro-mirco-paltrinieri/e/9791257180799,True,2026-04-17
Altri Editori,https://www.ibs.it/images/9791256550913_0_0_150_0_75.jpg,"Pietro Brazzà, il profeta scalzo e la famiglia Savorgnan (X-XX secolo)",Corrado Pirzio-Biroli,Gaspari,2026,,https://www.ibs.it/pietro-brazza-profeta-scalzo-famiglia-libro-corrado-pirzio-biroli/e/9791256550913,True,2026-04-17
Editori Selezionati,https://www.ibs.it/images/9791222328973_0_0_150_0_75.jpg,Evoluzione del pensiero scientifico e trasformazione economico-sociale,Giuseppe Amata,Mimesis,2026,"Lo scopo di questo volume è soprattutto mettere in evidenza come, da un lato, l’evoluzione del pensiero scientifico imprima un’accelerazione ai processi di trasformazione economico-sociale della società, dall’altro, come le rivoluzioni sociali e le trasformazioni economiche determinino la base per l’ulteriore evoluzione della scienza. Facendo leva sulla relazione dialettica tra pensiero scientifico e trasformazione economico-sociale della società, l’autore inquadra i problemi attuali che le formazioni economico-sociali stanno affrontando per rispondere alle crisi sia di natura economica che ambientale, la cui soluzione potrebbe portarci a un salto qualitativo nello sviluppo dell’umanità e al mantenimento delle condizioni naturali di esistenza mentre la loro sottovalutazione ci condurrà a una involuzione catastrofica irreversibile.",https://www.ibs.it/evoluzione-del-pensiero-scientifico-trasformazione-libro-giuseppe-amata/e/9791222328973,True,2026-04-17
Altri Editori,https://www.ibs.it/images/9788882436056_0_0_150_0_75.jpg,Alice nel mondo della realtà,Salvatore Notarrigo,Lussografica,2026,,https://www.ibs.it/alice-nel-mondo-della-realta-libro-salvatore-notarrigo/e/9788882436056,True,2026-04-17
Editori Selezionati,https://www.ibs.it/images/9788863448696_0_0_150_0_75.jpg,Il dataismo: la nuova religione dell'era digitale,"Domenico Di Spalatro,Giulia Morabito",Carabba,2026,"Viviamo immersi in un flusso incessante di dati. Ogni gesto, ogni scelta, ogni emozione lascia una traccia, viene registrata, misurata e trasformata in informazione. I dati permettono efficienza, previsione, controllo. Ma cosa accade quando da strumenti diventano criteri di valore? Quando non descrivono più il mondo, ma pretendono di governarlo? ""Il Dataismo: la Nuova Religione dell'Era Digitale"" esplora questa trasformazione radicale, interrogando l'ideologia silenziosa che pone il dato al centro della conoscenza, della politica, dell'economia e persino dell'identità umana.",https://www.ibs.it/dataismo-nuova-religione-dell-era-libro-domenico-di-spalatro-giulia-morabito/e/9788863448696,False,2026-04-11
Altri Editori,https://www.ibs.it/images/9791298609624_0_0_150_0_75.jpg,Voci dalla Terra. Percorsi di ecologia e risanamento nell'era dell'inquinamento,Francesca Schiavone,Eugenia Edizioni,2026,,https://www.ibs.it/voci-dalla-terra-percorsi-di-libro-francesca-schiavone/e/9791298609624,True,2026-04-17
Altri Editori,https://www.ibs.it/images/9791224069447_0_0_150_0_75.jpg,Licheni medicinali italiani con note di etnofarmacologia ed etnobotanica mondiali,"Adalberto Peroni,Gabriele Peroni",Youcanprint,2026,,https://www.ibs.it/licheni-medicinali-italiani-con-note-libro-adalberto-peroni-gabriele-peroni/e/9791224069447,True,2026-04-17
Altri Editori,https://www.ibs.it/images/9791222817156_0_0_150_0_75.jpg,Le tappe fondamentali della fisica. Capire i concetti basilari: da Galileo a Einstein,Giuseppe Purpura,ilmiolibro self publishing,2026,,https://www.ibs.it/tappe-fondamentali-della-fisica-capire-libro-giuseppe-purpura/e/9791222817156,False,2026-04-15
Altri Editori,https://www.ibs.it/images/9791282549912_0_0_150_0_75.jpg,"De omstreden geest. Neurowetenschappen, AI en het bewustzijnsveld. De strijd om de heerschappij. De grote illusie van controle",Bruno Del Medico,PensareDiverso,2026,,https://www.ibs.it/de-omstreden-geest-neurowetenschappen-ai-libro-bruno-del-medico/e/9791282549912,False,2026-04-15
Altri Editori,https://www.ibs.it/images/9791282549745_0_0_150_0_75.jpg,"Quantumanalogieën in het denken van Carl Jung. Collectief onbewuste, numineuze energieën, synchroniciteit en psychoïde in combinatie met de nieuwe fysica",Bruno Del Medico,PensareDiverso,2026,,https://www.ibs.it/quantumanalogieen-in-het-denken-van-libro-bruno-del-medico/e/9791282549745,False,2026-04-15
Altri Editori,https://www.ibs.it/images/9791282549691_0_0_150_0_75.jpg,"Quantum analogies in the thought of Carl Jung. Collective unconscious, numinous energies, synchronicity, and psychoid conjugated with new physics",Bruno Del Medico,PensareDiverso,2026,,https://www.ibs.it/quantum-analogies-in-the-thought-libro-bruno-del-medico/e/9791282549691,False,2026-04-15
Altri Editori,https://www.ibs.it/images/9791282549530_0_0_150_0_75.jpg,Quantenbiologie und universelles bewusstsein. Die Hypothese der verschränkung in lebewesen,Bruno Del Medico,PensareDiverso,2026,,https://www.ibs.it/quantenbiologie-und-universelles-bewusstsein-die-libro-bruno-del-medico/e/9791282549530,False,2026-04-11
Altri Editori,https://www.ibs.it/images/9791282549523_0_0_150_0_75.jpg,Biologie quantique et conscience universelle. L'hypothèse de l'intrication dans le vivant,Bruno Del Medico,PensareDiverso,2026,,https://www.ibs.it/biologie-quantique-et-conscience-universelle-libro-bruno-del-medico/e/9791282549523,False,2026-04-15
Altri Editori,https://www.ibs.it/images/9791282549516_0_0_150_0_75.jpg,Biologia quântica e consciência universal. A hipótese do entrelaçamento nos seres vivos,Bruno Del Medico,PensareDiverso,2026,,https://www.ibs.it/biologia-quantica-consciencia-universal-a-libro-bruno-del-medico/e/9791282549516,False,2026-04-15
Altri Editori,https://www.ibs.it/images/9791282549509_0_0_150_0_75.jpg,Biología cuántica y conciencia universal. La hipótesis del entrelazamiento en los seres vivos,Bruno Del Medico,PensareDiverso,2026,,https://www.ibs.it/biologia-cuantica-y-conciencia-universal-libro-bruno-del-medico/e/9791282549509,False,2026-04-15
Altri Editori,https://www.ibs.it/images/9791282549493_0_0_150_0_75.jpg,Quantum biology and universal consciousness. The hypothesis of entanglement in living systems,Bruno Del Medico,PensareDiverso,2026,,https://www.ibs.it/quantum-biology-and-universal-consciousness-libro-bruno-del-medico/e/9791282549493,False,2026-04-15
Altri Editori,https://www.ibs.it/images/9791282549486_0_0_150_0_75.jpg,Biologia quantistica e coscienza universale. L’ipotesi dell’entanglement nel vivente,Bruno Del Medico,PensareDiverso,2026,,https://www.ibs.it/biologia-quantistica-coscienza-universale-ipotesi-libro-bruno-del-medico/e/9791282549486,False,2026-04-11
Altri Editori,https://www.ibs.it/images/9791282549462_0_0_150_0_75.jpg,"Quantumfysica en het bewustzijn van het universum. Tweede uitgebreide editie. De dubbele spleet, de superpositie, de verstrengeling. De noodzaak van bewuste waarnemers voor het bestaan van de wereld",Bruno Del Medico,PensareDiverso,2026,,https://www.ibs.it/quantumfysica-en-het-bewustzijn-van-libro-bruno-del-medico/e/9791282549462,False,2026-04-15
Altri Editori,https://www.ibs.it/images/9791282549448_0_0_150_0_75.jpg,"Quantenphysik und das bewusstsein des universums. Zweite erweiterte auflage. Doppelspalt, superposition, verschränkung. Die notwendigkeit bewusster beobachter für die existenz der welt",Bruno Del Medico,PensareDiverso,2026,,https://www.ibs.it/quantenphysik-und-das-bewusstsein-des-libro-bruno-del-medico/e/9791282549448,False,2026-04-15
Altri Editori,https://www.ibs.it/images/9791282549394_0_0_150_0_75.jpg,"La lucha por el dominio de la mente. Neurociencia, IA y el campo de la conciencia. La gran ilusión del control.",Bruno Del Medico,PensareDiverso,2026,,https://www.ibs.it/lucha-por-el-dominio-de-libro-bruno-del-medico/e/9791282549394,False,2026-04-15
Altri Editori,https://www.ibs.it/images/9791282549387_0_0_150_0_75.jpg,"The contested mind. Neuroscience, Ai, and the field of consciousness. The great illusion of control",Bruno Del Medico,PensareDiverso,2026,,https://www.ibs.it/the-contested-mind-neuroscience-ai-libro-bruno-del-medico/e/9791282549387,False,2026-04-15
Altri Editori,https://www.ibs.it/images/9791282549370_0_0_150_0_75.jpg,"L'esprit en jeu. Neurosciences, IA et champ de conscience. La lutte pour la suprématie. La grande illusion du contrôle",Bruno Del Medico,PensareDiverso,2026,,https://www.ibs.it/esprit-en-jeu-neurosciences-ia-libro-bruno-del-medico/e/9791282549370,False,2026-04-15
Altri Editori,https://www.ibs.it/images/9791282549165_0_0_150_0_75.jpg,Kwantumbiologie en universeel bewustzijn. De hypothese van verstrengeling in het levende,Bruno Del Medico,PensareDiverso,2026,,https://www.ibs.it/kwantumbiologie-en-universeel-bewustzijn-de-libro-bruno-del-medico/e/9791282549165,False,2026-04-15
Altri Editori,https://www.ibs.it/images/9791298617629_0_0_150_0_75.jpg,"La frontiera della scienza del clima. Variabilità solare, cicli naturali e l'incertezza dei modelli",Nicola Scafetta,Complexity Insight Press,2026,,https://www.ibs.it/frontiera-della-scienza-del-clima-libro-nicola-scafetta/e/9791298617629,False,2026-04-11
Altri Editori,https://www.ibs.it/images/9788890748547_0_0_150_0_75.jpg,Origini. La tipicità dei formaggi italiani nei disciplinari di produzione,Enrico Surra,ONAF,2026,,https://www.ibs.it/origini-tipicita-dei-formaggi-italiani-libro-enrico-surra/e/9788890748547,False,2026-04-13
Altri Editori,https://www.ibs.it/images/9791259855794_0_0_150_0_75.jpg,Riprendersi l'anima,Paolo Crepet,HarperCollins Italia,2026,,https://www.ibs.it/riprendersi-anima-libro-paolo-crepet/e/9791259855794,False,2026-04-15
Editori Selezionati,https://www.ibs.it/images/9788807175640_0_0_150_0_75.jpg,Manuale pratico di smarrimento,Lorenzo Marone,Feltrinelli,2026,"Manuale pratico di smarrimento è un breviario gentile e disordinato, una raccolta di piccoli diritti non scritti che nessuno ci ha mai concesso ufficialmente, ma che forse è ora di rivendicare: il diritto a smarrirsi, a non piacere, a non scegliere, a non essere rintracciabili, a non ricominciare, a non evolvere, a dimenticare il finale. Un libro per chi si sente un po’ stonato ma ancora capace di canticchiare, per chi ha le idee confuse ma le mani calde, per chi inciampa, si ferma, non sa, ma intanto c’è. Tra pesci incompresi, piccioni viaggiatori e cavallucci marini meditativi, Manuale pratico di smarrimento ci ricorda che non tutto deve avere una direzione, non ogni fine una rinascita, non ogni dolore una lezione. Con una scrittura che oscilla tra l’ironia e la tenerezza, tra la poesia e il paradosso, Lorenzo Marone ci accompagna in un viaggio di calviniana leggerezza nei territori incerti dell’identità, della fragilità e dell’imperfezione.",https://www.ibs.it/manuale-pratico-di-smarrimento-libro-lorenzo-marone/e/9788807175640,False,2026-04-15
Editori Selezionati,https://www.ibs.it/images/9788836021017_0_0_150_0_75.jpg,La scala della ricchezza. Strategie collaudate per ogni fase della tua vita finanziaria,Nick Maggiulli,Hoepli,2026,"Dall’autore di ""Just Keep Buying"", un nuovo metodo rivoluzionario per veder crescere il proprio patrimonio. Avete la sensazione che la vostra vita finanziaria sia a un punto fermo? Lavorate sempre di più cercando di spendere meno, ma non vedete risultati? Allora è tempo di cambiare approccio. Ed è qui che entra in gioco ""La Scala della Ricchezza"". Non è un metodo che promette di far diventare ricchi all’istante né propone una soluzione universale ai problemi economici: è un modo tutto nuovo di pensare al denaro. In un mondo di tassi d’interesse volubili, carriere professionali che prendono nuove direzioni e desideri in continua evoluzione, ""La Scala della Ricchezza"" individua sei livelli distinti, ognuno con una sua diversa strategia. Scoprirete perché una mossa efficace per il Livello1 non può funzionare al Livello 6, e viceversa. E imparerete il modo giusto di gestire le spese, i guadagni, gli investimenti e altro ancora, con consigli su misura per ciascun livello. Crearsi un patrimonio non è solo questione di duro lavoro: serve la strategia giusta al momento giusto per concentrarsi su ciò che conta di più. Ma la buona notizia è che non dovete scervellarvi per sapere su cosa puntare, perché ""La Scala della Ricchezza"" vi dà la risposta. L’unica domanda che rimane è: siete pronti a salire?",https://www.ibs.it/scala-della-ricchezza-strategie-collaudate-libro-nick-maggiulli/e/9788836021017,False,2026-04-11
Editori Selezionati,https://www.ibs.it/images/9791222203294_0_0_150_0_75.jpg,"Il potere metabolico della mente. Cambiare l'alimentazione per ridurre l'ansia, migliorare l'umore, potenziare la salute mentale",Georgia Ede,Vallardi A.,2026,"Attenzione instabile, sbalzi d'umore, ossessione per il cibo, depressione: e se la chiave fosse nel nostro piatto? Grazie alle ultime scoperte sul metabolismo cerebrale e del glucosio, Georgia Ede ribalta tutto ciò che credevamo sulla nutrizione: il modo più potente per modificare la chimica del cervello è attraverso il cibo – poiché è da lì che provengono i neurotrasmettitori stessi. Superfood, integratori e diete vegetali ricche di cereali non sono la soluzione. La verità scientifica è diversa: la carne non è pericolosa, le diete vegetali non sono le più salutari, gli antiossidanti non bastano. Attraverso menu, ricette e testimonianze reali, Ede offre strategie nutrizionali innovative – dalla dieta chetogenica a quella carnivora – che ci restituiscono energia, lucidità e stabilità emotiva, senza privazioni né sensi di colpa. Quasi un miliardo di persone convive con disturbi mentali. Eppure la psichiatria tradizionale continua a trattare il cervello come un semplice insieme di neurotrasmettitori da manipolare chimicamente, ignorando che è un organo metabolico. La dottoressa Georgia Ede introduce la «psichiatria metabolica», dimostrando come insulino-resistenza, infiammazione e carenze nutrizionali siano alla radice di depressione, ansia e declino cognitivo. Attraverso casi clinici e una revisione critica delle linee guida tradizionali, Ede smonta i miti su colesterolo, grassi saturi e proteine animali, rivelando come il cervello necessiti di nutrienti pressoché assenti nelle diete vegetali. Cibo e salute mentale: le soluzioni della dottoressa Ede. Nutrizione mirata vs carenze critiche Omega-3, vitamine del gruppo B, zinco e magnesio sostengono i neurotrasmettitori; la loro carenza compromette la stabilità psichica. Scelte alimentari consapevoli vs instabilità emotiva: Alimenti freschi e naturali mantengono l'equilibrio; zuccheri raffinati e oli vegetali destabilizzano le emozioni. Monitoraggio metabolico vs instabilità glicemica Controllare glicemia e insulina stabilizza energia e umore; l'eccesso di carboidrati provoca sbalzi emotivi. Equilibrio intestino-cervello vs microbioma compromesso: Un microbioma sano rafforza la comunicazione tra gli organi; una dieta povera favorisce il disagio psichico. Diete protettive vs declino cognitivo Strategie chetogeniche, moderate in carboidrati o carnivore sostengono memoria e neuroplasticità; i cibi ultraprocessati danneggiano le funzioni cognitive.",https://www.ibs.it/potere-metabolico-della-mente-cambiare-libro-georgia-ede/e/9791222203294,False,2026-04-11
Altri Editori,https://www.ibs.it/images/9791282526081_0_0_150_0_75.jpg,Parlami di te. Il potere delle relazioni autentiche,Luca D'Aprile,Heisenberg Editore,2026,,https://www.ibs.it/parlami-di-te-potere-delle-libro-luca-d-aprile/e/9791282526081,False,2026-04-11
Altri Editori,https://www.ibs.it/images/9791255941910_0_0_150_0_75.jpg,Il potere segreto dei contratti dell'anima. Guarire le ferite interiori e trasformarle in forza vitale,Desiree Baierl,Edizioni Il Punto d'Incontro,2026,,https://www.ibs.it/potere-segreto-dei-contratti-dell-libro-desiree-baierl/e/9791255941910,False,2026-04-11
Editori Selezionati,https://www.ibs.it/images/9788828218012_0_0_150_0_75.jpg,Tristezza vai via. Perché la depressione non è una colpa e come la medicina aiuta a guarire,"Giancarlo Cerveri,Claudio Mencacci",Solferino,2026,"Una volta era «il male oscuro». Non che ora la luce splenda per chi soffre di depressione, ma il buio un po’ alla volta si sta diradando e su quella che potremmo chiamare impropriamente «tristezza patologica» si sta facendo sempre più chiarezza. E con la chiarezza arrivano anche strategie più nitide per contrastarla, e vincerla, obiettivo oggi davvero possibile grazie a trattamenti sempre più mirati per ogni variante della malattia. E di varianti ce ne sono molte. Non perché i criteri su cui si fonda la diagnosi cambino ma perché i motivi che ne sono all’origine possono essere profondamente diversi fra loro, insistendo su differenti basi neurobiologiche e contesti psicosociali. Per questo motivo si potrebbe azzardare che, se la depressione maggiore è «una», le sue cause, e quindi le cure che merita, possono differire anche sensibilmente. Come nasce e come si riconosce la depressione? Quali sono i sintomi e quale la possibile diagnosi? Quanto conta l’ambiente e quando comanda la biologia? Come influiscono gli stili di vita e i cicli della vita? Quanto pesa la nuova era dell’incertezza? E quali sono le cure più efficaci? Questo libro cerca di rispondere a queste e altre domande. È un manuale divulgativo ampio e aggiornato sul tema ma anche una trattazione utile a medici e psichiatri. Chi vorrà cimentarsi nella lettura troverà un linguaggio e un’esposizione accessibili a tutti, ma anche un livello di trattazione degno di un testo universitario. Per fare chiarezza sull’ex-male oscuro e congedare la tristezza aprendo le porte alla speranza.",https://www.ibs.it/tristezza-vai-via-perche-depressione-libro-giancarlo-cerveri-claudio-mencacci/e/9788828218012,False,2026-04-11
Editori Selezionati,https://www.ibs.it/images/9788815395825_0_0_150_0_75.jpg,L'intelligenza emotiva del team. Come creare gruppi dai risultati straordinari,Vanessa Urch Druskat,Il Mulino,2026,"Molto è stato scritto sul potere dell'intelligenza emotiva a livello individuale, ma poco si è detto su cosa significa applicare questo concetto ai gruppi. Vanessa Urch Druskat, docente universitaria e pioniera nel campo, mette a frutto trent'anni di ricerca e sviluppo dei team per presentare un modello concreto su come creare e guidare gruppi emotivamente intelligenti, fondati su norme condivise, abitudini consapevoli, comprensione reciproca e feedback che aiutano a crescere. Un manuale pratico per costruire una cultura del team che duri nel tempo, aumentare la fiducia, la sicurezza psicologica e il senso di appartenenza di tutti i membri del gruppo e ottenere livelli elevati di performance.",https://www.ibs.it/intelligenza-emotiva-del-team-come-libro-vanessa-urch-druskat/e/9788815395825,False,2026-04-11
Editori Selezionati,https://www.ibs.it/images/9788820085131_0_0_150_0_75.jpg,Dante life coach. Lezioni di sopravvivenza per anime smarrite,Giorgia Chiugi,Sperling & Kupfer,2026,"D'altronde - come ci insegna Italo Calvino -, un classico è un libro che non smette mai di dire ciò che ha da dire, e il grande poema dantesco parla di noi più di quanto immaginiamo. E quindi, dopo aver varcato la porta dell'inferno, tra gli ignavi potremmo riconoscere gli sguardi di chi, nell'era dei social, preferisce osservare le vite degli altri su uno schermo piuttosto che decidere come portare avanti la propria esistenza; nella storia di Francesca da Rimini potremmo percepire l'eco lontana delle passioni tossiche di oggi, e nel racconto di Ulisse l'ossessione della performance che tanto caratterizza la nostra epoca. Fino al purgatorio, alla resilienza, al coraggio di rialzarsi e di rimettersi in marcia per raggiungere i nostri «paradisi possibili». In queste pagine, Dante diventa il life coach di cui abbiamo bisogno, e la sua Commedia una risorsa potentissima per comprendere le insidie, gli inciampi e gli slanci delle nostre vite. In ogni capitolo si traccia un ponte tra il poema dantesco e la vita contemporanea, e i simboli medievali si trasformano in specchi capaci di riflettere le nostre sfide interiori. Perché il nostro tempo può sembrare una selva oscura attraversata da tutti noi: anime smarrite in cerca della «diritta via». Ma a volte per ritrovare la strada basta seguire gli insegnamenti di un Maestro d'eccezione. Oggi più che mai.",https://www.ibs.it/dante-life-coach-lezioni-di-libro-giorgia-chiugi/e/9788820085131,False,2026-04-15
Altri Editori,https://www.ibs.it/images/9791259923165_0_0_150_0_75.jpg,Sensibile. La forza dell'empatia in un mondo indifferente,"Jennifer Granneman,Andre Sólo",Corbaccio,2026,,https://www.ibs.it/sensibile-forza-dell-empatia-in-libro-jennifer-granneman-andre-solo/e/9791259923165,False,2026-04-11
Altri Editori,https://www.ibs.it/images/9791259855848_0_0_150_0_75.jpg,Prendila con filosofia. Manuale di fioritura personale,"Maura Gancitano,Andrea Colamedici",HarperCollins Italia,2026,,https://www.ibs.it/prendila-con-filosofia-manuale-di-libro-maura-gancitano-andrea-colamedici/e/9791259855848,True,2026-04-17
Altri Editori,https://www.ibs.it/images/9791257001247_0_0_150_0_75.jpg,Agopuntura delle emozioni. Armonizzare l'anima e il corpo attraverso l'antica saggezza dei punti energetici,Franco Cracolici,Terra Nuova Edizioni,2026,,https://www.ibs.it/agopuntura-delle-emozioni-armonizzare-anima-libro-franco-cracolici/e/9791257001247,False,2026-04-16
Altri Editori,https://www.ibs.it/images/9791254845738_0_0_150_0_75.jpg,"Vincere al quadrato. Dallo sport al business, le 4 leve per potenziare il talento e competere con i migliori",Tiziana Pregliasco,Il Sole 24 Ore,2026,,https://www.ibs.it/vincere-al-quadrato-dallo-sport-libro-tiziana-pregliasco/e/9791254845738,False,2026-04-11
