Categoria_App,Copertina,Titolo,Autore,Editore,Anno,Descrizione,Link,Nuovo,Data_Aggiunta
Editori Selezionati,https://www.ibs.it/images/9788828219286_0_0_150_0_75.jpg,La cattiva coscienza dei fisici,Carlo Rovelli,Solferino,2026,"Tutto comincia negli anni Trenta, in un laboratorio nel centro di Roma, con una scoperta inizialmente mal compresa, dalla quale nasce un’arma capace di cancellare la nostra stessa civiltà. Rovelli racconta la storia della bomba atomica seguendo il filo sottile che unisce curiosità scientifica, paura, ambizione e responsabilità, in un mondo in cui, con la nuova corsa al riarmo, si riaffaccia in modo drammatico il rischio della catastrofe nucleare. Attraversiamo quasi cento anni tra episodi cruciali e momenti poco noti, dalle ricerche di Enrico Fermi e del gruppo di fisici europei prima della guerra, al Progetto Manhattan e ai bombardamenti atomici americani su Hiroshima e Nagasaki, che causarono oltre 200.000 morti civili; dai dimenticati tentativi italiani di dotarsi di una bomba atomica propria, fino alla situazione attuale, in cui l’Italia, senza che ci sia stata una discussione pubblica su questa scelta, ospita bombe atomiche altrui. Perché la bomba non è stata realizzata in Germania, la nazione scientificamente più avanzata dell’epoca? Perché gli scienziati, rimasti separati da una parte e dall’altra del conflitto mondiale, non sono stati capaci di comprendersi? Cosa insegna il fatto che la Corea del Nord, che ha scelto di avere la bomba, è rimasta intatta, mentre la Libia, che vi ha rinunciato, è un paese devastato? Perché gli Stati Uniti hanno usato l’atomica in Giappone a guerra praticamente vinta? Quanto è diventata instabile oggi, con la crescita del numero delle grandi potenze nucleari, la logica della deterrenza, cioè il fragile equilibrio del terrore?",https://www.ibs.it/cattiva-coscienza-dei-fisici-libro-carlo-rovelli/e/9788828219286,False,2026-04-21
Editori Selezionati,https://www.ibs.it/images/9788804815297_0_0_150_0_75.jpg,Quando tornano le rondini. Friuli 1976: memorie di un terremoto,Giada Messetti,Mondadori,2026,"Alle nove di sera del 6 maggio 1976, a Gemona, la terra comincia a tremare. Mila è a pochi chilometri di distanza, ancora non sa che la sua cittadina è l'epicentro di un sisma di magnitudo 6,5 che in pochi secondi sconvolge il Friuli Venezia Giulia, distruggendo 17.000 edifici, devastando 900 chilometri quadrati di territorio e portandosi via 990 vite. Mila e la sua famiglia si salvano, ma la casa scompare in un attimo e, con essa, anche i nidi delle rondini, che a lungo non faranno ritorno. Per anni Mila vive in una baracca costruita per gli sfollati. Abita lì quando incontra Augusto, giovane volontario del servizio civile venuto per aiutare nella ricostruzione, e se ne innamora. E abita ancora lì quando nasce Giada. ""Figlia del terremoto"", Giada Messetti non ha mai avuto il coraggio di riaprire quel cassetto della memoria. Fino a ora. A cinquant'anni dal sisma che ha ferito a morte il Friuli, decide di tornare alle origini e intrecciare i suoi ricordi con quelli di chi il terremoto lo ha vissuto in prima persona. Ne nasce il racconto di una devastazione, ma anche di una rinascita possibile. Perché al terremoto è seguito il «momento della scelta», la scelta di rialzarsi e di guardare avanti, ma soprattutto la scelta di farlo insieme, in un patto solidale che ha coinvolto istituzioni e cittadini. Se quello che è passato alla storia come ""modello Friuli"" ha funzionato, è stato perché tutti hanno risposto alla chiamata, dando vita a una mobilitazione potente e orchestrata con intelligenza, il primo e purtroppo unico esempio italiano di ricostruzione riuscita. I testimoni di quella tragedia non smettono di ripetere che c'è una vita prima del terremoto e una vita dopo. Di ciò che è successo durante, anche i ricordi sembrano macerie scomposte: il boato, il buio, lo smarrimento, la paura, la polvere ovunque. Restano però alcuni oggetti, che a dispetto del tempo e della confusione continuano a rappresentare un momento, un'emozione, una persona cara che non c'è più. Giada Messetti li raccoglie per noi, per raccontarci una terra ferita, ma coraggiosa e caparbia, che ha saputo ripartire da zero. E ha visto, finalmente, le rondini tornare.",https://www.ibs.it/quando-tornano-rondini-friuli-1976-libro-giada-messetti/e/9788804815297,False,2026-04-21
Editori Selezionati,https://www.ibs.it/images/9788806272999_0_0_150_0_75.jpg,Resistere ai tempi oscuri. Il nuovo sistema totalitario,Asma Mhalla,Einaudi,2026,"Guardatevi attorno. Non avete la vaga impressione di vivere un momento di dissociazione collettiva? Vediamo che tutto sta crollando, eppure andiamo avanti come se niente fosse. Questa non è una crisi della democrazia ma lo smottamento verso un nuovo regime. Scrolling infinito, dopamina sotto controllo. Quando dubiterete di voi stessi, ricordatelo: questo secolo non vi impedisce di pensare, vi tiene occupati finché non saprete più come fare. Il XXI secolo non vi governerà, vi programmerà. Il futuro è dietro di noi. Nei momenti torbidi della storia, spesso ci rendiamo conto troppo tardi degli smottamenti, dei capovolgimenti. Non sempre misuriamo la distanza che separa la nostra epoca dalla comprensione che ha di sé. Questo perché il futuro, temuto o sperato, si è accartocciato su sé stesso. La prova ce l'abbiamo sotto gli occhi: la distopia, come quella dei romanzi di fantascienza, non è una proiezione, è ovunque attorno a noi. È già qui: viviamo nel mondo che temiamo subendone l'incanto. Il fascismo della prima ora è stato anche una reazione alla sofferenza psicologica, alla brutalità esistenziale di esseri che si sentivano privati di qualcosa di cui ancora oggi è difficile cogliere i contorni. Una rabbia del genere non deriva dalla percezione della disuguaglianza sociale in sé o dalla guerra in sé, ed è per questo che riemerge a intervalli regolari fino ai giorni nostri. Deriva da promesse di progresso non mantenute, da questa terribile sensazione di non essere mai padroni di sé stessi, di non essere altro che i depositari di esistenze vaghe e fluttuanti, senza alcun interesse, vite che non contano, a forza di sentir ripetere che contano. Questa dissonanza ci ha uccisi mille volte, in mille modi diversi. Continua a ucciderci a fuoco lento e, per lo stesso meccanismo, siamo costretti ad accettare di vivere malati, senza avere la forza di guarire. Ipermodernità urbana, mondo in multicrisi, onnipresenza delle interfacce, potenza sfrenata dei BigTech, tecnologie di controllo camuffate in nome della sicurezza, senso di solitudine, saturazione cognitiva. Ciò che chiamiamo «realtà» è già un'interfaccia. Quella che crediamo «libertà» forse non è altro che un parametro di comfort in un sistema di controllo invisibile a occhio nudo. Questo non è il futuro, ma solo la quotidianità di un mondo che non sa più dire come si chiama. Benvenuti nel reale. Benvenuti nella Cyberdistopia. ""No Future? Hyper-Future!""",https://www.ibs.it/resistere-ai-tempi-oscuri-nuovo-libro-asma-mhalla/e/9788806272999,False,2026-04-21
Editori Selezionati,https://www.ibs.it/images/9788832858754_0_0_150_0_75.jpg,"Manipolazione. Cos'è, perché è un problema e come difendersi",Cass R. Sunstein,Raffaello Cortina Editore,2026,"Abbiamo l’illusione di poter scegliere liberamente, ma il gioco è truccato e spesso ci spinge in direzioni che compromettono il nostro benessere, la nostra salute e le nostre democrazie. Cass Sunstein, pioniere della teoria del nudge, la “spinta gentile”, ci guida attraverso le nuove forme della manipolazione digitale, che sfrutta tecnologie, algoritmi e AI generativa, e attraverso le minacce poste da deepfake, social media e tecniche di programmazione ingannevoli, che inducono le persone a buttare al vento tempo e denaro. Basato su decenni di ricerche pionieristiche nel campo della scienza del comportamento, questo libro delinea i passi che possiamo compiere per difenderci e contrastare la manipolazione nella nostra vita quotidiana.",https://www.ibs.it/manipolazione-cos-perche-problema-come-libro-cass-r-sunstein/e/9788832858754,False,2026-04-21
Editori Selezionati,https://www.ibs.it/images/2000000164861_0_0_150_0_75.jpg,Instant geopolitica. Idee e teorie per vedere il mondo da una nuova prospettiva,Simone Guida,Gribaudo,2026,"Uno sguardo fresco e a tratti ironico sulla geopolitica, grazie a un libro pensato per chi è completamente a digiuno sul tema ma anche per chi voglia approfondire l’argomento. Il tutto tramite il punto di vista di un giovane divulgatore che raggiunge oggi quasi il milione di utenti grazie ai suoi libri, ai suoi video su YouTube e ai podcast (l’ultimo, appunto, si chiama Storie di Geopolitica). Dunque, per iniziare dalle basi: che cos’è la geopolitica? È vero che la Storia guida il destino di una nazione? E quanto conta la politica all’interno del contesto storico? Quali sono le differenze fra globalismo e localismo? E poi, più nello specifico: perché gli USA sono diventati una potenza globale (e come mai la Cina sarà la prossima?)? Perché la Russia è definita “l’enigma del XXI secolo”? Che ruolo hanno, oggi, i cosiddetti “stati marionetta”? Cosa ci riserva il futuro? Se, parafrasando Yves Lacoste, la geopolitica non è una scienza tradizionale bensì un approccio razionale di un insieme di rappresentazioni che esprimono le rivalità di diversi tipi di potere in un territorio, capire meglio la geopolitica significa vedere il mondo con occhi diversi, lontano da punti di vista monodimensionali o troppo semplificati.",https://www.ibs.it/instant-geopolitica-idee-teorie-per-libro-simone-guida/e/2000000164861,False,2026-04-21
Editori Selezionati,https://www.ibs.it/images/9788833945620_0_0_150_0_75.jpg,La democrazia non esiste in natura. Lezioni di storia politica in difesa dei valori comuni,"Luciano Violante,Marta Cartabia",Bollati Boringhieri,2026,"Nel periodo storico che stiamo vivendo, la democrazia appare in forte crisi. I suoi capisaldi vengono messi in discussione da più parti. Complice anche un sistema informativo mutato rapidamente, spesso inattendibile, più di qualcuno inizia a pensare che la democrazia abbia in effetti perso la propria efficacia. Di conseguenza, una «internazionale illiberale» sta prendendo sempre più piede nel panorama politico internazionale.Ma cosa rischiamo di perdere in questo contesto? Quanto è pericolosa questa involuzione? Marta Cartabia e Luciano Violante – due protagonisti del pensiero democratico del nostro paese –intendono in questo libro tornare ai fondamenti, con un linguaggio chiaro e diretto, per mettere in luce quanto di insostituibile hanno portato, per tutti i cittadini, decenni di sviluppo democratico, e quanto perderemmo abbandonando questa tradizione. Per farlo, partono dalla Costituzione italiana e da undici lezioni esemplari su casi specifici, mettendo in relazione storia, diritto e politica con le sfide attuali, per invitare tutti a un rinnovato impegno collettivo. Come recita il titolo, «la democrazia non esiste in natura», letteralmente: è un patto civile che va curato, protetto, evolve nel tempo e richiede la partecipazione attiva e costante dei cittadini. Lungi dall’essere mero «governo della maggioranza», la democrazia è un sistema articolato che comprende istituzioni rappresentative, diritti inviolabili della persona, separazione dei poteri e organi di garanzia. Indebolendo anche uno solo di questi aspetti, si rischia di mettere in crisi le conquiste così faticosamente raggiunte. A rimetterci saremmo tutti, senza distinzioni.",https://www.ibs.it/democrazia-non-esiste-in-natura-libro-luciano-violante-marta-cartabia/e/9788833945620,False,2026-04-17
Altri Editori,https://www.ibs.it/images/9791256362028_0_0_150_0_75.jpg,Vertigine. ChemSex e mascolinità tossica: la generazione invisibile,Simone Alliva,Fandango Libri,2026,,https://www.ibs.it/vertigine-chemsex-mascolinita-tossica-generazione-libro-simone-alliva/e/9791256362028,False,2026-04-17
Altri Editori,https://www.ibs.it/images/9788849884753_0_0_150_0_75.jpg,Il vaticano e l'intelligence. Osservatore e osservato nella storia politica della Santa Sede,N/D,Rubbettino,2026,,https://www.ibs.it/vaticano-intelligence-osservatore-osservato-nella-libro-vari/e/9788849884753,False,2026-04-17
Altri Editori,https://www.ibs.it/images/9791257070038_0_0_150_0_75.jpg,L'URSS di Italo Calvino,"Mario Alessandro Curletto,Romano Lupi",Sandro Teti Editore,2026,,https://www.ibs.it/urss-di-italo-calvino-libro-mario-alessandro-curletto-romano-lupi/e/9791257070038,False,2026-04-21
Altri Editori,https://www.ibs.it/images/9788879384506_0_0_150_0_75.jpg,Non salvatemi!,Claudio Maneri,Hermes Edizioni,2026,,https://www.ibs.it/non-salvatemi-libro-claudio-maneri/e/9788879384506,False,2026-04-17
Editori Selezionati,https://www.ibs.it/images/9788833945583_0_0_150_0_75.jpg,Ripartire. Perché ci pesa cambiare e come possiamo farlo,Stefan Klein,Bollati Boringhieri,2026,"Il più grande ostacolo alla nostra sopravvivenza non è la mancanza di soluzioni, ma la nostra profonda paura di abbandonare ciò che è conosciuto e familiare. Viviamo in un’epoca di sfide senza precedenti: l’emergenza climatica, l’impatto dell’intelligenza artificiale, l’invecchiamento demografico e le tensioni globali. Per sopravvivere, rinnovare noi stessi e il mondo non è più un’opzione, ma una necessità. Eppure, continuiamo ad aggrapparci a vecchie abitudini e false certezze. Stefan Klein ci pone di fronte a un grande interrogativo: perché, pur conoscendo le sfide che ci attendono, fatichiamo a trasformare la nostra vita e la società in cui viviamo? Quali ostacoli ci bloccano e come possiamo superarli? Coniugando rigore scientifico e una narrazione avvincente, Stefan Klein esplora la nostra naturale resistenza alle novità e smaschera le sette illusioni sul progresso che ci tengono paralizzati (Siamo realisti, Abbiamo voglia di novità, È andata sempre bene, Sapere è potere, La libertà può tutto, Vogliamo il meglio, Le ideologie hanno fatto il loro tempo).",https://www.ibs.it/ripartire-perche-ci-pesa-cambiare-libro-stefan-klein/e/9788833945583,False,2026-04-17
Altri Editori,https://www.ibs.it/images/9791255843351_0_0_150_0_75.jpg,Fact-checking su Israele. L'altra faccia della storia,Nathan Greppi,Lindau,2026,,https://www.ibs.it/fact-checking-su-israele-altra-libro-nathan-greppi/e/9791255843351,False,2026-04-17
Altri Editori,https://www.ibs.it/images/9788838255236_0_0_150_0_75.jpg,Rivista di studi politici internazionali (2025). Vol. 4,N/D,Studium,2026,,https://www.ibs.it/rivista-di-studi-politici-internazionali-libro-vari/e/9788838255236,False,2026-04-17
Editori Selezionati,https://www.ibs.it/images/9791256147908_0_0_150_0_75.jpg,Il principe della Repubblica. Protagonisti e dinamiche della democrazia in Italia,Roberto Deriu,Castelvecchi,2026,"Il principe della Repubblica raccoglie oltre trent’anni di scritti politici di Roberto Deriu, offrendo una riflessione organica sulla natura della democrazia e sulle dinamiche del potere. Attraverso un dialogo tra esperienza e teoria, il volume indaga il ruolo dei partiti, il valore dello Stato di diritto e la tensione tra élite e partecipazione. La politica emerge come pratica concreta, segnata da vincoli, risorse e decisioni, ma anche come arte del servizio e della responsabilità. Tra analisi disincantata e tensione etica, il libro propone strumenti per comprendere e abitare la complessità della vita pubblica, restituendo alla politica il suo significato più esigente e necessario. Prefazione di Arturo Parisi.",https://www.ibs.it/principe-della-repubblica-protagonisti-dinamiche-libro-roberto-deriu/e/9791256147908,False,2026-04-17
Altri Editori,https://www.ibs.it/images/9791259855510_0_0_150_0_75.jpg,Non chiamatelo amore. Una guida per riconoscere e liberarsi da una relazione patologica con personalità disturbate,Carolina Bertolaso,HarperCollins Italia,2026,,https://www.ibs.it/non-chiamatelo-amore-guida-per-libro-carolina-bertolaso/e/9791259855510,False,2026-04-17
Altri Editori,https://www.ibs.it/images/9791256154791_0_0_150_0_75.jpg,Qui c’era la nostra casa. I bambini di Gaza raccontano,N/D,Meltemi,2026,,https://www.ibs.it/qui-c-era-nostra-casa-libro-vari/e/9791256154791,False,2026-04-17
Editori Selezionati,https://www.ibs.it/images/9791256148769_0_0_150_0_75.jpg,L'approccio riparativo. Un confronto tra scienze umane ed ermeneutica biblica,Emanuele Iula,Castelvecchi,2026,"Questo libro nasce da anni di lavoro a contatto con differenti forme di conflittualità e di legami feriti. Da questa esperienza prende vita una riflessione sulla riparazione come pratica concreta di cura: non una tecnica, ma un cammino che attraversa paura, tradimento e vulnerabilità. Dialogando con le scienze umane e con la tradizione biblica, il testo propone uno sguardo capace di tenere insieme esperienza umana e fede cristiana, offrendo al lettore una via per comprendere e abitare i conflitti senza scorciatoie.",https://www.ibs.it/approccio-riparativo-confronto-tra-scienze-libro-emanuele-iula/e/9791256148769,False,2026-04-17
Altri Editori,https://www.ibs.it/images/9788891681133_0_0_150_0_75.jpg,"Donne, dati e algoritmi. Privacy, intelligenza artificiale e nuove discriminazioni digitali",Selina Zipponi,Maggioli Editore,2026,,https://www.ibs.it/donne-dati-algoritmi-privacy-intelligenza-libro-selina-zipponi/e/9788891681133,False,2026-04-15
Altri Editori,https://www.ibs.it/images/9788883627453_0_0_150_0_75.jpg,Ascoltami quando penso. Avventure con i bambini tra filosofia e storie,Sara Gomel,Babalibri,2026,,https://www.ibs.it/ascoltami-quando-penso-avventure-con-libro-sara-gomel/e/9788883627453,False,2026-04-17
Altri Editori,https://www.ibs.it/images/9788872242889_0_0_150_0_75.jpg,Un giorno saremo giaguari. Perché il destino dei popoli dell’Amazzonia è anche il destino di tutti noi,"Nemonte Nenquimo,Anderson Mitch",Sonda,2026,,https://www.ibs.it/giorno-saremo-giaguari-perche-destino-libro-nemonte-nenquimo-anderson-mitch/e/9788872242889,False,2026-04-21
Altri Editori,https://www.ibs.it/images/9788869963407_0_0_150_0_75.jpg,Nunchi. Entrare in connessione con gli altri. Il metodo coreano per una vita armoniosa,"Déborah Romain-Delacour,Lee Jimin",Amrita,2026,,https://www.ibs.it/nunchi-entrare-in-connessione-con-libro-deborah-romain-delacour-lee-jimin/e/9788869963407,False,2026-04-17
Editori Selezionati,https://www.ibs.it/images/9788868338800_0_0_150_0_75.jpg,Resistere,"Noam Chomsky,David Barsamian",Ponte alle Grazie,2026,"In questi dialoghi con David Barsamian, suo interlocutore prediletto da decenni, Noam Chomsky torna ad analizzare le numerose sfide che dobbiamo affrontare per garantirci un futuro: dalla pandemia trascorsa a quelle a venire, dalla distruzione dell’ambiente alla concentrazione del potere economico (con le abnormi disuguaglianze che ne conseguono), dal razzismo sistemico allo strapotere degli oligopoli mediatico-informatici. Molto illuminanti sono le pagine che illustrano la strategia con cui il Partito Repubblicano, ma anche le attuali destre europee, dettano l’agenda da anni e sono diventate egemoni: non dichiarando apertamente il loro impegno in favore del grande capitale (ovviamente), ma deviando sistematicamente l’attenzione sulle cosiddette «questioni culturali» – gender, cristianesimo militante, diritto all’aborto, cultura woke ecc.",https://www.ibs.it/resistere-libro-noam-chomsky-david-barsamian/e/9788868338800,False,2026-04-21
Altri Editori,https://www.ibs.it/images/9788868026165_0_0_150_0_75.jpg,Le alleanze di classe,Pierre-Philippe Rey,Pgreco,2026,,https://www.ibs.it/alleanze-di-classe-libro-pierre-philippe-rey/e/9788868026165,False,2026-04-17
Altri Editori,https://www.ibs.it/images/9788849886481_0_0_150_0_75.jpg,Utopia e realtà. Un'introduzione allo studio della politica internazionale,Edward Hallett Carr,Rubbettino,2026,,https://www.ibs.it/utopia-realta-introduzione-allo-studio-libro-edward-hallett-carr/e/9788849886481,False,2026-04-17
Editori Selezionati,https://www.ibs.it/images/9788828219163_0_0_150_0_75.jpg,La guerra civile d'America,"Seba Pezzani,James Grady",Solferino,2026,"Per disegnare un ritratto dell’America di oggi, in questo libro Seba Pezzani si affida alla voce autorevole di James Grady, classe 1949, figlio della provincia in un’America del dopoguerra trionfante e unita, lanciata verso un destino di superpotenza planetaria. Nato e cresciuto nelle praterie remote del Montana, Grady si è poi trasferito a Washington per proseguire la sua carriera di giornalista e scrittore: conosce quindi tanto l’America profonda che ha eletto Trump quanto i corridoi del potere e i salotti degli intellettuali. Il suo è un punto di vista privilegiato per raccontare la spaccatura che sta incrinando la democrazia statunitense (e non solo): quella tra centro e periferie, tra le metropoli che votano a sinistra e la «pancia del Paese» che si lascia sedurre dal populismo. Una radicalizzazione sempre più simile allo scontro, che negli USA è nutrita anche dall’influenza crescente delle varie chiese e sette religiose fondamentaliste. Trump è davvero «ciò che vuole l’America»? Il mondo diviso, rabbioso, diseguale e sempre più pericoloso che la sua presidenza disegna è il nostro destino irreversibile? Tra storie personali e analisi di una società e di una politica in continua trasformazione, Pezzani e Grady ci aiutano a capire problemi e processi che dagli USA rischiano di travolgere l’Europa, ma, oltre ai dazi e alle guerre, alle violenze dell’ICE e alla corruzione familista, illuminano l’anima più autentica dell’America tra provincia e rock. Quell’anima in cui forse – più che in un partito Democratico in parte responsabile per la crisi del Paese – risiedono le possibilità di ribellione e riscatto della grande democrazia americana.",https://www.ibs.it/guerra-civile-d-america-libro-seba-pezzani-james-grady/e/9788828219163,False,2026-04-17
Editori Selezionati,https://www.ibs.it/images/9788817200387_0_0_150_0_75.jpg,Da soli. Gli europei alla prova di Trump nelle sfide dell'economia globale,Lorenzo Bini Smaghi,Rizzoli,2026,"Sembra una provocazione, ma non lo è. Dal discorso di insediamento al Liberation Day con dazi annessi, dall'epiteto di «parassiti» alle politiche economiche, l'Unione europea, o meglio i suoi cittadini, si trovano costretti a pensarsi «da soli». Dopo ottant'anni di alleanza, vicinanza ideologica e valoriale, gli Stati Uniti hanno chiaramente scelto la priorità; il confronto globale con la Cina, in cui gli europei giocano un ruolo, secondo Washington, trascurabile. Su questo scenario Lorenzo Bini Smaghi, tra gli economisti italiani più acuti e noti nel panorama internazionale, innesta una analisi serrata delle difficoltà che ci aspettano, individua i settori chiave su cui lavorare alla ricerca di una vera indipendenza europea, suggerisce quale strada la Ue potrebbe, anzi dovrebbe, imboccare per diventare potenza globale o, se non altro, per continuare a esistere. Nella consapevolezza che «fin quando ciascun leader si illuderà che agendo da solo, ad esempio nei rapporti bilaterali con Trump, può ottenere vantaggi personali rispetto a una azione comune, l'Europa - e dunque i Paesi che ne fanno parte - non riuscirà a difendere i propri interessi».",https://www.ibs.it/da-soli-europei-alla-prova-libro-lorenzo-bini-smaghi/e/9788817200387,False,2026-04-21
Editori Selezionati,https://www.ibs.it/images/9788804800682_0_0_150_0_75.jpg,"I partigiani di Allah. Dall'Iran all'Arabia Saudita, la lotta per il controllo del Medio Oriente",Laura Silvia Battaglia,Mondadori,2026,"Agli occhi di un occidentale, il Medio Oriente può sembrare puro caos: una trama di conflitti latenti e alleanze precarie che lo rendono, a prima vista, indecifrabile. La verità è che lo definiamo «caos» perché non possediamo le categorie per leggerlo. Eppure è proprio lì che si giocano alcuni degli equilibri decisivi del nostro tempo. Per orientarsi bisogna partire da due domande essenziali: chi esercita davvero il potere nella regione? E quali forze stanno lavorando per ridisegnarne il futuro? Giornalista e profonda conoscitrice del mondo arabo, Laura Silvia Battaglia ci aiuta a seguire i fili che legano Teheran a Doha, Sana'a a Riad. Al centro c'è l'Iran, perno strategico di un sistema di alleanze e milizie noto come Asse della resistenza, alle prese con la sua crisi più profonda dalla fondazione della Repubblica islamica nel 1979. Intorno, si intrecciano i nodi irrisolti di una storia comune: colpi di Stato, guerre per procura, apparati religiosi e poteri economici che si contendono la scena, società civili che resistono in modi inediti e coraggiosi. Dall'ascesa dei Partigiani di Dio yemeniti alla rinnovata importanza dei Paesi del Golfo, dal crollo del regime siriano al fallimento di Hezbollah e dell'ISIS, Battaglia descrive un territorio infiammabile quanto una «scatola di fiammiferi», ora più delicato che mai per via della nuova dottrina della vendetta iraniana. Ma non dimentica la voce di chi vive questi luoghi, offrendo, con le loro storie e testimonianze, una prospettiva interna sugli eventi, capace di superare i pregiudizi e le semplificazioni occidentali. In questo saggio, rigore giornalistico e narrazione in presa diretta si fondono per tracciare un itinerario vivido e attuale, essenziale per restituire al Medio Oriente ciò che spesso gli neghiamo: complessità, razionalità, e una storia che chiede di essere letta con gli strumenti giusti.",https://www.ibs.it/partigiani-di-allah-dall-iran-libro-laura-silvia-battaglia/e/9788804800682,False,2026-04-21
