Categoria_App,Copertina,Titolo,Autore,Editore,Anno,Descrizione,Link,Nuovo,Data_Aggiunta
Altri Editori,https://www.ibs.it/images/9788836164479_0_0_150_0_75.jpg,I mostri nella storia. Creature impossibili tra mito e scienza,Massimo Centini,DIARKOS,2026,,https://www.ibs.it/mostri-nella-storia-creature-impossibili-libro-massimo-centini/e/9788836164479,False,2026-04-01
Editori Selezionati,https://www.ibs.it/images/9788815394934_0_0_150_0_75.jpg,Nata democratica,"Luca Baldissara,Nadia Urbinati",Il Mulino,2026,"La guerra di Liberazione fu insieme guerra civile contro i fascisti e guerriglia contro l'occupante nazista. Costituì il punto d'approdo del distacco popolare dal fascismo e, al contempo, un'assunzione di responsabilità civile. Quell'ansia di riscatto e quella spinta al cambiamento costituirono la volontà fondativa della democrazia italiana. Su di essa si innestò e prese forma una Carta costituzionale dal valore programmatico, che disegnava la democrazia repubblicana per cui si era combattuto. Il libro indaga questa duplice dimensione: la conquista della libertà attraverso la partecipazione e l'impegno nella lotta, e la democrazia che si fa strada nella ricostruzione della vita civile locale e che si afferma nel potere costituente. La Costituzione emerge così come un corpo vivo, frutto originale di un intreccio indissolubile di memoria critica del passato, urgenze del presente e aspettative del futuro. Un prologo, un libro aperto sul futuro.",https://www.ibs.it/nata-democratica-libro-luca-baldissara-nadia-urbinati/e/9788815394934,False,2026-03-27
Editori Selezionati,https://www.ibs.it/images/9788829033515_0_0_150_0_75.jpg,Terra bruciata. Storia della violenza dal Paleolitico al XXI secolo,Alfredo González-Ruibal,Carocci,2026,"«In una manciata di polvere vi mostrerò la paura»: le macerie della guerra evocano, nelle parole di T. S. Eliot, uno scenario desolato. Millenni di violenza collettiva, dal Paleolitico a oggi, hanno lasciato una scia di fosse comuni, rovine, fortificazioni. E, soprattutto, hanno fatto terra bruciata: strati di carbone, ossa e cenere che nascondono storie quotidiane, vite spezzate, memorie cancellate. Con lo sguardo dell'archeologo e la sensibilità dello scrittore, Alfredo González-Ruibal percorre i luoghi devastati dai conflitti in tutto il mondo per ridare voce alle vittime invisibili di queste atrocità. Dalle razzie del Neolitico al genocidio dei nativi americani, dalle campagne militari romane alle trincee del Novecento, fino ai bombardamenti sul Medio Oriente, rivela il lato più crudo e intimo della nostra storia. E ci pone di fronte a una verità scomoda: la nostra inquietante propensione alla violenza.",https://www.ibs.it/terra-bruciata-storia-della-violenza-libro-alfredo-gonzalez-ruibal/e/9788829033515,False,2026-03-27
Altri Editori,https://www.ibs.it/images/9788849888164_0_0_150_0_75.jpg,"L'odissea socialista. Nenni, Lombardi, Craxi 2 giugno 1946 – 19 gennaio 2000",Fabrizio Cicchitto,Rubbettino,2026,,https://www.ibs.it/odissea-socialista-nenni-lombardi-craxi-libro-fabrizio-cicchitto/e/9788849888164,False,2026-03-27
Altri Editori,https://www.ibs.it/images/9788838949753_0_0_150_0_75.jpg,Le crociate di Terrasanta,Marco Meschini,Sellerio Editore Palermo,2026,,https://www.ibs.it/crociate-di-terrasanta-libro-marco-meschini/e/9788838949753,False,2026-04-01
Altri Editori,https://www.ibs.it/images/9788885747999_0_0_150_0_75.jpg,Bologna 1980. Il concerto dei Clash in Piazza Maggiore nell'anno che cambiò l’Italia,N/D,Edizioni Interno4,2026,,https://www.ibs.it/bologna-1980-concerto-dei-clash-libro-vari/e/9788885747999,False,2026-03-27
Editori Selezionati,https://www.ibs.it/images/9788822797575_0_0_150_0_75.jpg,I carnefici di Hitler,Marco Lucchetti,Newton Compton Editori,2026,"Come il Terzo Reich trasformò l'obbedienza in crudeltà. Medici, giudici, militari, religiosi, comuni cittadini: le mille facce della “banalità del male” nazista. La storia dei più feroci e spietati assassini del Terzo Reich. I peggiori assassini del Terzo Reich non furono solo i gerarchi nazisti su cui si soffermano i libri di storia, ma anche medici, poliziotti, militari, giudici, religiosi e comuni cittadini che si trasformarono in strumenti di morte. Marco Lucchetti ricostruisce la rete di individui e istituzioni che, tra il 1933 e il 1945, si resero protagonisti dei crimini di guerra e contro l'umanità più efferati di sempre. Il lettore troverà non soltanto un'ampia e originale introduzione al contesto sociale e politico della Germania nazista, ma soprattutto una serie di biografie dettagliate, da cui emergono responsabilità, percorsi personali e destini di coloro che operarono nei campi di sterminio, nelle prigioni, nelle unità speciali e nei territori militarmente occupati. A conferma della lezione di Hannah Arendt sulla “banalità del male”, la macchina del genocidio di Hitler non è stata alimentata solo dai vertici del regime, ma anche da migliaia di “volenterosi carnefici”. Un'opera necessaria, per una nuova consapevolezza sull'epoca più tragica e buia della storia.",https://www.ibs.it/carnefici-di-hitler-libro-marco-lucchetti/e/9788822797575,False,2026-03-27
Editori Selezionati,https://www.ibs.it/images/9788817195430_0_0_150_0_75.jpg,Tutto è tubercolosi. Storia della malattia infettiva più letale al mondo,John Green,Rizzoli,2026,"La tubercolosi accompagna l'umanità da millenni. Un tempo romanticizzata come il male dei poeti, oggi è una malattia legata alla povertà, che segue le tracce di ingiustizia e disuguaglianza che noi stessi abbiamo tracciato. Nel 2019, John Green incontra Henry Reider, un giovane paziente affetto da tubercolosi all'ospedale di Lakka, in Sierra Leone. Tra i due nasce subito un'amicizia profonda: Henry ha gambe sottili e un sorriso contagioso, pieno di vita. Da quel primo incontro, Green è diventato una delle voci più appassionate nella battaglia per un accesso più equo alle cure e per rompere il silenzio su un'infezione che, pur essendo curabile e prevenibile, continua a uccidere oltre un milione di persone ogni anno.",https://www.ibs.it/tutto-tubercolosi-storia-della-malattia-libro-john-green/e/9788817195430,False,2026-04-01
Altri Editori,https://www.ibs.it/images/9791259582829_0_0_150_0_75.jpg,Restituire. L'elefante nella stanza dei musei occidentali,Maria Pia Guermandi,Nomos Edizioni,2026,,https://www.ibs.it/restituire-elefante-nella-stanza-dei-libro-maria-pia-guermandi/e/9791259582829,False,2026-03-27
Altri Editori,https://www.ibs.it/images/9788866976103_0_0_150_0_75.jpg,Le rivoluzioni borghesi (1789-1848). Nuova ediz.,Eric J. Hobsbawm,Res Gestae,2026,,https://www.ibs.it/rivoluzioni-borghesi-1789-1848-nuova-libro-eric-j-hobsbawm/e/9788866976103,False,2026-03-27
Editori Selezionati,https://www.ibs.it/images/9791256148431_0_0_150_0_75.jpg,Edvard Beneš e Jan Masaryk. Due protagonisti dell’Europa democratica di fronte alle dittature (1938-1948),N/D,Castelvecchi,2026,"Eletto nel 1935 alla successione del suo maestro, Tomáš G. Masaryk, nel ruolo di presidente della Repubblica, Edvard Beneš fu costretto a capitolare davanti al Diktat di Monaco, in cui Mussolini si atteggiò a protagonista della scena diplomatica europea. Il secondo dopoguerra segnò poi il destino della democrazia cecoslovacca, stretta tra l’espansionismo sovietico e il progressivo disimpegno delle potenze occidentali. Jan Masaryk, ministro degli Esteri, visse in prima persona le drammatiche contraddizioni della politica internazionale degli anni Quaranta. Cosmopolita e brillante diplomatico, difese con passione e fiducia il futuro del suo Paese, diventando una figura amatissima grazie ai messaggi che, durante la guerra, trasmetteva settimanalmente ai suoi concittadini dai microfoni della BBC. La sua morte, avvenuta nel marzo 1948 sul selciato del cortile di palazzo Černín a Praga, sotto la finestra della sua stanza, segnò la definitiva spaccatura del Continente e l’inizio della Guerra Fredda. Fu suicidio o omicidio?",https://www.ibs.it/edvard-benes-jan-masaryk-due-libro-vari/e/9791256148431,True,2026-04-03
Editori Selezionati,https://www.ibs.it/images/9788829035083_0_0_150_0_75.jpg,Studi storici (2026). Vol. 1,N/D,Carocci,2026,"La rivista affronta i maggiori quesiti storico-storiografici nell'arco cronologico dall'età antica a quella contemporanea. I temi che hanno costituito il filo conduttore della sua storia sono stati: la formazione dello Stato italiano a partire dalle origini del processo di unificazione nazionale al regime fascista, fino al secondo dopoguerra; le grandi trasformazioni economiche a livello italiano e internazionale; la storia del movimento operaio e del socialismo, sia dal punto di vista della storia del pensiero (con particolare attenzione alla figura di Antonio Gramsci), sia dal punto di vista di ricostruzione storica dei partiti e dei movimenti in Italia, nei paesi dell'Est europeo e nell'Unione sovietica.",https://www.ibs.it/studi-storici-2026-vol-1-libro-vari/e/9788829035083,False,2026-03-27
Altri Editori,https://www.ibs.it/images/9791281577220_0_0_150_0_75.jpg,Storia di una capitale. Napoli dalle origini al 1860,Gino Doria,Grimaldi & C.,2026,,https://www.ibs.it/storia-di-capitale-napoli-dalle-libro-gino-doria/e/9791281577220,True,2026-04-03
Altri Editori,https://www.ibs.it/images/9791257550134_0_0_150_0_75.jpg,Il rapporto segreto Kruscev,Fulvio Mazza,Armando Editore,2026,,https://www.ibs.it/rapporto-segreto-kruscev-libro-fulvio-mazza/e/9791257550134,False,2026-03-27
Altri Editori,https://www.ibs.it/images/9791255633235_0_0_150_0_75.jpg,"Certe canzoni. Settant'anni di musica: rock, pop, cantautori",Antonio Tricomi,Guida,2026,,https://www.ibs.it/certe-canzoni-settant-anni-di-libro-antonio-tricomi/e/9791255633235,True,2026-04-03
Altri Editori,https://www.ibs.it/images/9791255411222_0_0_150_0_75.jpg,"Kharkiv. Complessa, indomita, ferita, indistruttibile",Yaryna Grusha,Paesi Edizioni,2026,,https://www.ibs.it/kharkiv-complessa-indomita-ferita-indistruttibile-libro-yaryna-grusha/e/9791255411222,True,2026-04-03
Altri Editori,https://www.ibs.it/images/9791255212782_0_0_150_0_75.jpg,Dieci giorni che sconvolsero il mondo,John Reed,LEG Edizioni,2026,,https://www.ibs.it/dieci-giorni-che-sconvolsero-mondo-libro-john-reed/e/9791255212782,True,2026-04-03
Altri Editori,https://www.ibs.it/images/9791254802410_0_0_150_0_75.jpg,Uncommon people. Ascesa e caduta delle rockstar,David Hepworth,Nottetempo,2026,,https://www.ibs.it/uncommon-people-ascesa-caduta-delle-libro-david-hepworth/e/9791254802410,False,2026-03-27
Editori Selezionati,https://www.ibs.it/images/9791222327273_0_0_150_0_75.jpg,Oltraggio al regime. La tragica vicenda dei fratelli Gimitelli nell'era fascista,Andrea Cominini,Mimesis,2026,"""Alcuni ricordi di racconti che un bambino ha sentito in casa riaffiorano alla memoria a distanza di anni e il bambino diventato adulto e divenuto uno storico si chiede come mai i fatti che hanno generato quei racconti siano stati completamente cancellati dalla memoria di una comunità. Il dubbio che ci fosse qualcosa che era opportuno non venisse alla luce, che le versioni ufficiali potessero essere di comodo, che sia stata costruita una ‘verità’ confezionata sulle caratteristiche e i ruoli sociali dei protagonisti (forze di polizia da un lato e giovani borderline per di più non allineati al regime fascista dall’altro) nasce spontaneo nella mente dello storico. E inizia la ricerca. Presentare tutte le testimonianze raccolte, escludere che sia possibile dire una parola incontrovertibile, ma anche concludere che le possibilità di manipolazioni e di occultamenti sono praticamente una certezza, mostrare che la convinzione che i fatti non fossero andati come sono stati narrati fosse abbastanza diffusa fra la popolazione, sono tutti elementi che ben risaltano dalla ricerca, che diventa così una sorta di offerta a una comunità, perché possa ritrovare la propria memoria sulla base di documenti non facilmente accessibili, mai precedentemente cercati e ora ampiamente riprodotti e attentamente esaminati. Non un’operazione di ricerca storica fine a sé stessa, ma animata da una intenzione di libertà e di convivenza civile.""",https://www.ibs.it/oltraggio-al-regime-tragica-vicenda-libro-andrea-cominini/e/9791222327273,False,2026-03-27
Altri Editori,https://www.ibs.it/images/9788895561264_0_0_150_0_75.jpg,La restituzione della proprietà,Hilaire Belloc,Arca Edizioni,2026,,https://www.ibs.it/restituzione-della-proprieta-libro-hilaire-belloc/e/9788895561264,False,2026-03-31
Altri Editori,https://www.ibs.it/images/9788884747822_0_0_150_0_75.jpg,Giudizio sull'Occidente. Sapienza Hindū e «modernità»,Rabindranath Tagore,Il Cerchio,2026,,https://www.ibs.it/giudizio-sull-occidente-sapienza-hindu-libro-rabindranath-tagore/e/9788884747822,False,2026-03-27
Altri Editori,https://www.ibs.it/images/9788884747754_0_0_150_0_75.jpg,"Belgica. La nave che visse due volte. De Gerlache, Amundsen, Cook e la drammatica spedizione in Antartide del 1898. Con audiolibro",Donatello Bellomo,Il Cerchio,2026,,https://www.ibs.it/belgica-nave-che-visse-due-libro-donatello-bellomo/e/9788884747754,False,2026-03-27
Altri Editori,https://www.ibs.it/images/9788867671731_0_0_150_0_75.jpg,Venezia lost and found. Fotografie degli anni '60 perdute e ritrovate. Ediz. bilingue,"Alberto Toso Fei,Manfredo Manfroi",Kellermann Editore,2026,,https://www.ibs.it/venezia-lost-and-found-fotografie-libro-alberto-toso-fei-manfredo-manfroi/e/9788867671731,True,2026-04-03
Altri Editori,https://www.ibs.it/images/9788842835615_0_0_150_0_75.jpg,"La miniera del mondo. Artieri, inventori, impostori",Piero Camporesi,Il Saggiatore,2026,,https://www.ibs.it/miniera-del-mondo-artieri-inventori-libro-piero-camporesi/e/9788842835615,False,2026-04-01
Editori Selezionati,https://www.ibs.it/images/9788829035663_0_0_150_0_75.jpg,Raccontare un secolo. Scrittori italiani fra letteratura e storia,Mario Barenghi,Carocci,2026,"Jahier e la Grande Guerra, Sciascia e le possibilità della giustizia, Elsa Morante e la Storia, il 1963 come anno chiave per la generazione degli anni Venti; e ancora il Mussolini di Antonio Scurati, un romanzo distopico di Tommaso Pincio, la letteratura italiana e l'Africa. In questo volume Mario Barenghi passa in rassegna una serie di narrazioni indissolubilmente intrecciate con avvenimenti storici. Il rapporto fra letteratura e storia appare declinato in molti modi diversi: disagio, spaesamento, ripensamento, inchiesta, bilancio, pronostico. A uscirne confermate sono da un lato la capacità della narrativa di modellare e tener viva la memoria del passato, dall'altro la pregnanza delle opere letterarie che si nutrono di un rapporto di interrogazione con il reale.",https://www.ibs.it/raccontare-secolo-scrittori-italiani-fra-libro-mario-barenghi/e/9788829035663,False,2026-03-27
Altri Editori,https://www.ibs.it/images/9791221222845_0_0_150_0_75.jpg,"The queen in pocket. Guida pop, dissacrante e definitiva su Elisabetta II a cento anni dalla nascita",Eva Grippa,De Agostini,2026,,https://www.ibs.it/the-queen-in-pocket-guida-libro-eva-grippa/e/9791221222845,False,2026-04-01
Altri Editori,https://www.ibs.it/images/9788893665599_0_0_150_0_75.jpg,Bronze age treasures. Gold and silver jewellery of the National Museum of Damascus. Ediz. bilingue,Ibrahim Ahmad,Le Lettere,2026,,https://www.ibs.it/bronze-age-treasures-gold-and-libro-ibrahim-ahmad/e/9788893665599,False,2026-03-27
Altri Editori,https://www.ibs.it/images/9788866492771_0_0_150_0_75.jpg,"Milano. Borghi, patrimonio, periferie","Andrea L'erario,Lionella Scazzosi,Roberto Schena",Magenes,2026,,https://www.ibs.it/milano-borghi-patrimonio-periferie-libro-vari/e/9788866492771,False,2026-03-27
Editori Selezionati,https://www.ibs.it/images/9788815395955_0_0_150_0_75.jpg,Mestieri all'opera. Il mondo delle professioni nei libretti del melodramma,Alberto Tanturri,Il Mulino,2026,"I libretti d'opera ci parlano del mondo reale molto più di quanto immaginiamo. Fra arie celebri e intrecci drammatici, si nasconde infatti un mondo brulicante di mestieri: medici avidi o compassionevoli, notai pedanti, servi scaltri, militari valorosi o sbruffoni, ecclesiastici enigmatici popolano il melodramma con i loro vizi, virtù e contraddizioni. Così, figure nate per intrattenere il pubblico diventano, nelle pagine di questo libro, specchi rivelatori delle società d'Antico Regime e dell'età contemporanea. Con rigore e passione, l'autore guida il lettore in un viaggio tra palcoscenico e vita quotidiana, mostrando come i mestieri, con i loro simboli e stereotipi, raccontino molto della mentalità, dei rapporti sociali e delle trasformazioni culturali del loro tempo. Un saggio originale, capace di intrecciare musica, storia e società, che invita a guardare all'opera lirica non solo come arte, ma come uno specchio vivo della nostra identità.",https://www.ibs.it/mestieri-all-opera-mondo-delle-libro-alberto-tanturri/e/9788815395955,False,2026-03-27
Altri Editori,https://www.ibs.it/images/9788869738593_0_0_150_0_75.jpg,Federico II,Fulvio Delle Donne,Salerno Editrice,2026,,https://www.ibs.it/federico-ii-libro-fulvio-delle-donne/e/9788869738593,False,2026-03-27
Editori Selezionati,https://www.ibs.it/images/9788815395047_0_0_150_0_75.jpg,Le istituzioni della Repubblica italiana. 1946-1994,Guido Melis,Il Mulino,2026,"La storia della Repubblica italiana è un dialogo ininterrotto tra le istituzioni e la società in cambiamento. Dal referendum del 2 giugno 1946 alle elezioni del 27-28 marzo 1994 si snodano i quasi cinquant'anni della prima fase del «lungo dopoguerra italiano». Questo volume concentra l'attenzione sul ruolo delle istituzioni repubblicane e sul loro continuo intrecciarsi con le trasformazioni sociali, economiche e politiche del Paese. Le istituzioni in movimento, dunque, mai immobili: dal consolidarsi e poi incrinarsi del sistema politico al protagonismo mutevole dei partiti, dalle metamorfosi del modello di governo al progressivo ridimensionamento del Parlamento. Sullo sfondo, il peso decisivo del presidente della Repubblica, l'entrata in scena delle Regioni a statuto ordinario, la vitalità delle autonomie locali, il ruolo della Corte costituzionale, l'azione dei grandi corpi dello Stato, delle magistrature, dei sindacati e degli interessi organizzati, i primi passi dell'unità europea. Una riflessione che illumina le continuità e le fratture della democrazia italiana nella sua fase più delicata.",https://www.ibs.it/istituzioni-della-repubblica-italiana-1946-libro-guido-melis/e/9788815395047,False,2026-03-27
Editori Selezionati,https://www.ibs.it/images/9788815394972_0_0_150_0_75.jpg,"Roma tradita. Settembre 1943, la mancata difesa e l'occupazione tedesca",Elena Aga Rossi,Il Mulino,2026,"Nonostante la vasta produzione storiografica sull’8 settembre, restano irrisolti nodi fondamentali: perché Roma non fu difesa? Perché, dopo l’annuncio dell’armistizio, Badoglio si rifiutò di dare l’ordine di attaccare i tedeschi? Con la desecretazione degli atti della Commissione parlamentare d’inchiesta, gli studiosi hanno avuto accesso a migliaia di pagine di testimonianze e relazioni. L’analisi di questi documenti ha rivelato omissioni, falsificazioni e contraddizioni da parte dei protagonisti, impegnati a giustificarsi e a scaricare responsabilità. I vertici militari parlarono di resa inevitabile e adottarono, per giustificarsi, una sovrastima delle forze tedesche. Elena Aga Rossi ricostruisce quei giorni per restituire verità a uno dei passaggi più drammatici della storia italiana.",https://www.ibs.it/roma-tradita-settembre-1943-mancata-libro-elena-aga-rossi/e/9788815394972,True,2026-04-03
Altri Editori,https://www.ibs.it/images/9788833673639_0_0_150_0_75.jpg,"Tre élites coloniali. Roma, la Spagna e le Americhe",Ronald Syme,Officina Libraria,2026,,https://www.ibs.it/tre-elites-coloniali-roma-spagna-libro-ronald-syme/e/9788833673639,True,2026-04-03
Altri Editori,https://www.ibs.it/images/9788892785199_0_0_150_0_75.jpg,"Italia d’oro. Tutte le vittorie azzurre in Europei, Mondiali e Olimpiadi degli sport di squadra dal 1934 a oggi",Roberto Condio,Ultra,2026,,https://www.ibs.it/italia-d-oro-tutte-vittorie-libro-roberto-condio/e/9788892785199,True,2026-04-03
Altri Editori,https://www.ibs.it/images/9791255843221_0_0_150_0_75.jpg,La cucina degli dei. Miti e ricette dall'antica Grecia alla Roma imperiale,Anna Ferrari,Lindau,2026,,https://www.ibs.it/cucina-degli-dei-miti-ricette-libro-anna-ferrari/e/9791255843221,False,2026-03-27
Altri Editori,https://www.ibs.it/images/9791282104265_0_0_150_0_75.jpg,"I Capelloni. Mondo beat, 1966-1967 Storia, immagini, documenti",Gianni De Martino,Milieu,2026,,https://www.ibs.it/capelloni-mondo-beat-1966-1967-libro-gianni-de-martino/e/9791282104265,True,2026-04-03
Altri Editori,https://www.ibs.it/images/9788879555739_0_0_150_0_75.jpg,Il secolo di San Siro in 100 date (più una) da ricordare,"Claudio Colombo,Fabio Monti",Meravigli,2026,,https://www.ibs.it/secolo-di-san-siro-in-libro-claudio-colombo-fabio-monti/e/9788879555739,False,2026-03-31
Altri Editori,https://www.ibs.it/images/9791282212090_0_0_150_0_75.jpg,Alessandro il grande,Caterina Franchi,Edizioni LaSerra,2026,,https://www.ibs.it/alessandro-grande-libro-caterina-franchi/e/9791282212090,False,2026-03-27
Altri Editori,https://www.ibs.it/images/9791282062282_0_0_150_0_75.jpg,"Malvinas. Una guerra del secolo scorso, un giornalista e un diario ritrovato","Paolo Argentini,Giancarlo Feliziani",il Millimetro,2026,,https://www.ibs.it/malvinas-guerra-del-secolo-scorso-libro-paolo-argentini-giancarlo-feliziani/e/9791282062282,True,2026-04-03
Altri Editori,https://www.ibs.it/images/9791281956292_0_0_150_0_75.jpg,"La regalità siciliana. Regine e re di Sicilia, dalla fondazione al vicereame",Pasquale Hamel,Kalós,2026,,https://www.ibs.it/regalita-siciliana-regine-re-di-libro-pasquale-hamel/e/9791281956292,True,2026-04-03
Altri Editori,https://www.ibs.it/images/9791256940660_0_0_150_0_75.jpg,Donne invisibili. La Resistenza femminile nella Bassa modenese,Fabio Montella,Bibliotheka Edizioni,2026,,https://www.ibs.it/donne-invisibili-resistenza-femminile-nella-libro-fabio-montella/e/9791256940660,True,2026-04-03
Altri Editori,https://www.ibs.it/images/9791255211501_0_0_150_0_75.jpg,La seconda guerra d'indipendenza italiana,Frederick C. Schneid,LEG Edizioni,2026,,https://www.ibs.it/seconda-guerra-d-indipendenza-italiana-libro-frederick-c-schneid/e/9791255211501,True,2026-04-03
Altri Editori,https://www.ibs.it/images/9788868618872_0_0_150_0_75.jpg,"Rwanda, da qualche parte in Africa. Storia di un genocidio dimenticato",Simone Lumia,Infinito Edizioni,2026,,https://www.ibs.it/rwanda-da-qualche-parte-in-libro-simone-lumia/e/9788868618872,False,2026-03-27
Editori Selezionati,https://www.ibs.it/images/9788858160824_0_0_150_0_75.jpg,L'alba della storia. Una rivoluzione iniziata diecimila anni fa,Guido Barbujani,Laterza,2026,"Quando l’umanità ha cominciato a coltivare i campi e ad addomesticare gli animali è cominciata una storia diversa, che è ancora la nostra. Diecimila anni fa si sono messe in moto trasformazioni che ancora ci riguardano, che ancora influenzano il nostro modo di lavorare, di vestirci, di mangiare, di confrontarci con gli altri membri della nostra comunità. È la rivoluzione neolitica: il momento in cui, più che in qualunque altro, biologia e cultura si sono intrecciate, influenzandosi a vicenda e producendo la nostra storia. Passando dallo studio del DNA a quello delle lingue, dagli scavi archeologici alle manipolazioni genetiche, e anche attraverso il racconto di alcune storie esemplari, Guido Barbujani ci porta indietro nel tempo fino a 10.000 anni fa, alla rivoluzione neolitica.",https://www.ibs.it/alba-della-storia-rivoluzione-iniziata-libro-guido-barbujani/e/9788858160824,True,2026-04-03
Editori Selezionati,https://www.ibs.it/images/9788822791429_0_0_150_0_75.jpg,L'ultimo segreto di Anne Frank,"Joop Van Wijk-Voskuijl,Jeroen De Bruyn",Newton Compton Editori,2026,"Il Diario di Anne Frank è uno dei testi più conosciuti, tradotti e studiati di sempre. La forza della testimonianza di Anne, la voglia di vivere e, non ultimo, lo straordinario talento di scrittrice hanno commosso generazioni di lettori, ma non solo: le sue parole sono state oggetto di ogni tipo di studio, inchiesta, perizia. Sappiamo tutto del nascondiglio in cui trascorse 761 terribili giorni, in compagnia di sette persone, e conosciamo i nomi dei cosiddetti “benefattori” dell'alloggio segreto, cinque cittadini olandesi che, rischiando la vita, aiutarono in vari modi le famiglie ebree lì nascoste. La storia di Bep Voskuijl, però, è rimasta finora sconosciuta. Bep, la più giovane dei “benefattori”, si legò in modo particolare ad Anne e affrontò ogni genere di pericolo nel tentativo di procurare cibo e medicinali per la famiglia Frank. Il suo nome ricorre molto spesso nel Diario, eppure di lei si sa pochissimo. Questo libro, commovente e ricco di dettagli inediti, prova a raccontarne la storia, ricostruendo minuziosamente la sua vita fino a addentrarsi nel fatidico mistero, tuttora irrisolto, della telefonata che portò all'arresto, il 4 agosto del 1944, di Anne e della sua famiglia. Bep conosceva la verità sulla persona che segnò il destino della giovanissima amica? Quel terribile tradimento potrebbe essere stato commesso da qualcuno che le era molto vicino?",https://www.ibs.it/ultimo-segreto-di-anne-frank-libro-joop-van-wijk-voskuijl-jeroen-de-bruyn/e/9788822791429,True,2026-04-03
