Categoria_App,Copertina,Titolo,Autore,Editore,Anno,Descrizione,Link,Nuovo,Data_Aggiunta
Altri Editori,https://www.ibs.it/images/9788833568188_0_0_150_0_75.jpg,Corpi,Giuseppe Ivan Undari,Progetto Cultura,2026,,https://www.ibs.it/corpi-libro-giuseppe-ivan-undari/e/9788833568188,False,2026-04-02
Altri Editori,https://www.ibs.it/images/9788801202670_0_0_150_0_75.jpg,L'Ora di religione (2025-2026). Vol. 7: Aprile-Maggio,N/D,Editrice Elledici,2026,,https://www.ibs.it/ora-di-religione-2025-2026-libro-vari/e/9788801202670,False,2026-04-04
Altri Editori,https://www.ibs.it/images/9791257631048_0_0_150_0_75.jpg,"Dio, l'universo e l'uomo. L'imperscrutabile mente di Dio",Ciro Caiazzo,Kimerik,2026,,https://www.ibs.it/dio-universo-uomo-imperscrutabile-mente-libro-ciro-caiazzo/e/9791257631048,False,2026-04-02
Altri Editori,https://www.ibs.it/images/9791256895472_0_0_150_0_75.jpg,Alla ricerca di Dio. Sulle orme dell’invisibile tra fede e ragione,Riccardo Bonsi,Passione Scrittore selfpublishing,2026,,https://www.ibs.it/alla-ricerca-di-dio-sulle-libro-riccardo-bonsi/e/9791256895472,False,2026-04-07
Altri Editori,https://www.ibs.it/images/9791224446842_0_0_150_0_75.jpg,Scoprirsi creatura. Lessico minimo di una liberazione: dalla prigione del tempo a Gesù,Romano Morelli,StreetLib,2026,,https://www.ibs.it/scoprirsi-creatura-lessico-minimo-di-libro-romano-morelli/e/9791224446842,False,2026-04-04
Altri Editori,https://www.ibs.it/images/9791224061595_0_0_150_0_75.jpg,San Gerardo Majella tra storia e tradizione popolare,Chiara Ponte,Youcanprint,2026,,https://www.ibs.it/san-gerardo-majella-tra-storia-libro-chiara-ponte/e/9791224061595,False,2026-04-03
Altri Editori,https://www.ibs.it/images/9791222782157_0_0_150_0_75.jpg,Diario del cerimoniere del Duomo di Milano (1773-1774),N/D,Youcanprint,2026,,https://www.ibs.it/diario-del-cerimoniere-del-duomo-libro-vari/e/9791222782157,False,2026-04-03
Editori Selezionati,https://www.ibs.it/images/9788837241759_0_0_150_0_75.jpg,Diari (1834-1842). Nuova ediz.. Vol. 1,Søren Kierkegaard,Morcelliana,2026,"La lettura dei Diari – una miniera di intuizioni folgoranti, pensieri, preghiere, polemiche e spunti argomentativi – restituisce la complessità non sistematica ma edificante del pensiero filosofico e teologico di Søren Kierkegaard. Quest'ultima edizione riprende la versione del suo maggiore studioso italiano, Cornelio Fabro, svolta sull'integrale danese (20 voll., 1909-1948), pubblicata da Morcelliana nel 1948 e più volte ristampata. Ma l'attento spoglio compiuto dai curatori sulle carte postume, le lettere, i documenti e le opere complete, nel confronto fra la prima e la nuova edizione critica danese, rende quest'opera del tutto originale nella traduzione e nelle note. Un classico, queste pagine dei Diari parlando del mondo si mettono in dialogo con Dio, la morte, l'amore, e toccano tonalità affettive come la noia, l'inquietudine, la pazienza e l'impazienza, l'angoscia... Un esercizio di pensiero in cui traluce, sotto vari registri, la teoria dei tre stadi dell'esistenza – estetico, etico e religioso. Søren Kierkegaard è stato un filosofo e teologo, considerato il padre dell'esistenzialismo. Cresciuto in un clima di cupa religiosità, ossessionato dal senso del peccato e della colpa, sviluppò un pensiero dominato dall'angoscia e dal pessimismo. Tra le sue opere più importanti Aut-aut (1843, comprendente il celebre Don Giovanni e il Diario del seduttore) e Timore e tremore (1843).",https://www.ibs.it/diari-1834-1842-nuova-ediz-libro-soren-kierkegaard/e/9788837241759,False,2026-04-03
Altri Editori,https://www.ibs.it/images/9791224447696_0_0_150_0_75.jpg,The divine name and the New Testament. Defending the traditional dating of the New Testament,Giuseppe Guarino,StreetLib,2026,,https://www.ibs.it/the-divine-name-and-the-libro-giuseppe-guarino/e/9791224447696,True,2026-04-09
Altri Editori,https://www.ibs.it/images/9791224069683_0_0_150_0_75.jpg,Prega...Sogna...Scrivi,Maria Gabriella Conti,Youcanprint,2026,,https://www.ibs.it/pregasognascrivi-libro-maria-gabriella-conti/e/9791224069683,True,2026-04-09
Altri Editori,https://www.ibs.it/images/9791224068303_0_0_150_0_75.jpg,Il ricino di Giona-Sotto la Sua ombra. Il ginepro di Elia-La fragilità e la cura,Maria Chiara Carulli,Youcanprint,2026,,https://www.ibs.it/ricino-di-giona-sotto-sua-libro-maria-chiara-carulli/e/9791224068303,True,2026-04-09
Altri Editori,https://www.ibs.it/images/9791224067085_0_0_150_0_75.jpg,Radicati nella Parola. Vol. 2: Nutrire la vita spirituale,N/D,Youcanprint,2026,,https://www.ibs.it/radicati-nella-parola-vol-2-libro-vari/e/9791224067085,True,2026-04-09
Altri Editori,https://www.ibs.it/images/9791224061427_0_0_150_0_75.jpg,Guardate i segni del Cielo,Leda Salvaggio,Youcanprint,2026,,https://www.ibs.it/guardate-segni-del-cielo-libro-leda-salvaggio/e/9791224061427,True,2026-04-09
Altri Editori,https://www.ibs.it/images/9788879849906_0_0_150_0_75.jpg,"Scienza, tao e arte del combattere",Flavio Daniele,Luni Editrice,2026,,https://www.ibs.it/scienza-tao-arte-del-combattere-libro-flavio-daniele/e/9788879849906,False,2026-04-07
Altri Editori,https://www.ibs.it/images/9788873673668_0_0_150_0_75.jpg,Rito e potere,N/D,CLV,2026,,https://www.ibs.it/rito-potere-libro-vari/e/9788873673668,False,2026-04-03
Altri Editori,https://www.ibs.it/images/9788860996589_0_0_150_0_75.jpg,Vittorio Bellavite. Testimone e protagonista della democrazia politica e del cattolicesimo conciliare,N/D,Gabrielli Editori,2026,,https://www.ibs.it/vittorio-bellavite-testimone-protagonista-della-libro-vari/e/9788860996589,True,2026-04-09
Altri Editori,https://www.ibs.it/images/9791254777114_0_0_150_0_75.jpg,Quaderni dell'Istituto per la Storia della Chiesa di Bologna. Vol. 2,N/D,Bologna University Press,2026,,https://www.ibs.it/quaderni-dell-istituto-per-storia-libro-vari/e/9791254777114,False,2026-04-03
Altri Editori,https://www.ibs.it/images/9788893606059_0_0_150_0_75.jpg,I Sacri luoghi dell'Arcangelo Michele,Michele Cicatelli,Edizioni Il Saggio,2026,,https://www.ibs.it/sacri-luoghi-dell-arcangelo-michele-libro-michele-cicatelli/e/9788893606059,False,2026-04-07
Altri Editori,https://www.ibs.it/images/9788833568089_0_0_150_0_75.jpg,Breviario americano. L'itinerario di Tina Manferdini attraverso il pensiero nordamericano dai Padri Pellegrini al XIX secolo,Marco Dalbagno,Progetto Cultura,2026,,https://www.ibs.it/breviario-americano-itinerario-di-tina-libro-marco-dalbagno/e/9788833568089,False,2026-04-02
Altri Editori,https://www.ibs.it/images/9788850274703_0_0_150_0_75.jpg,Invasioni controllate,"Emanuele Trevi,Mario Trevi",TEA,2026,,https://www.ibs.it/invasioni-controllate-libro-emanuele-trevi-mario-trevi/e/9788850274703,False,2026-04-04
Editori Selezionati,https://www.ibs.it/images/9791259972811_0_0_150_0_75.jpg,Nel raggio verde. Quaderni di studio su infanzia e adolescenza (2025). Vol. 4: Educare alla cooperazione,N/D,Ronzani Editore,2026,"l quarto numero della rivista affronta un tema cardine per la tenuta del nostro tessuto sociale: l'educazione alla cooperazione. In una fase storica caratterizzata da profonde trasformazioni e da conflitti su scala globale, la capacità di agire in modo coordinato e solidale non rappresenta soltanto un obiettivo pedagogico, ma una vera e propria necessità civile. La costellazione della cooperazione, intesa come superamento dell'individualismo a favore di un bene comune, viene scandagliata attraverso lenti multidisciplinari che intrecciano la clinica, la sociologia, le scienze sociali, la letteratura e l'innovazione tecnologica (con un focus specifico sulla AI).",https://www.ibs.it/nel-raggio-verde-quaderni-di-libro-vari/e/9791259972811,False,2026-04-03
Altri Editori,https://www.ibs.it/images/9791255963684_0_0_150_0_75.jpg,Pensare blu. Dal pensiero critico al problem solving,Roberto Basso,Luiss University Press,2026,,https://www.ibs.it/pensare-blu-dal-pensiero-critico-libro-roberto-basso/e/9791255963684,False,2026-03-27
Altri Editori,https://www.ibs.it/images/9788831946667_0_0_150_0_75.jpg,A piccoli passi si può,Sonia Fraietta,Voglino Editrice,2026,,https://www.ibs.it/a-piccoli-passi-si-puo-libro-sonia-fraietta/e/9788831946667,False,2026-04-03
Altri Editori,https://www.ibs.it/images/9791224068006_0_0_150_0_75.jpg,«Elettra» di Sofocle. Saggio per una interpretazione psicoanalitica,Riccardo Dri,Youcanprint,2026,,https://www.ibs.it/elettra-di-sofocle-saggio-per-libro-riccardo-dri/e/9791224068006,True,2026-04-09
Altri Editori,https://www.ibs.it/images/9788863589986_0_0_150_0_75.jpg,Quaderni de «Gli argonauti». Dalla psicologia dell'io al pluralismo e alla diversità. Un'odissea della psicoanalisi americana,N/D,Phasar Edizioni,2026,,https://www.ibs.it/quaderni-de-argonauti-dalla-psicologia-libro-vari/e/9788863589986,False,2026-04-04
Altri Editori,https://www.ibs.it/images/9788827605387_0_0_150_0_75.jpg,Essere Henry. Il Fonzie e oltre...,Henry Winkler,Il Castello,2026,,https://www.ibs.it/essere-henry-fonzie-oltre-libro-henry-winkler/e/9788827605387,False,2026-04-01
Altri Editori,https://www.ibs.it/images/9791281484795_0_0_150_0_75.jpg,Michael Jackson,Emanuele Aruta,Marotta e Cafiero,2026,,https://www.ibs.it/michael-jackson-libro-emanuele-aruta/e/9791281484795,False,2026-04-08
Altri Editori,https://www.ibs.it/images/9791281484801_0_0_150_0_75.jpg,Rafa Nadal,Giulio Andrea Masi,Marotta e Cafiero,2026,,https://www.ibs.it/rafa-nadal-libro-giulio-andrea-masi/e/9791281484801,False,2026-04-08
Altri Editori,https://www.ibs.it/images/9791280107596_0_0_150_0_75.jpg,Oleg,Frederik Peeters,COMICON Edizioni,2026,,https://www.ibs.it/oleg-libro-frederik-peeters/e/9791280107596,False,2026-04-04
Altri Editori,https://www.ibs.it/images/9788854534360_0_0_150_0_75.jpg,Ricordando i luoghi,Joseph Rykwert,Neri Pozza,2026,,https://www.ibs.it/ricordando-luoghi-libro-joseph-rykwert/e/9788854534360,False,2026-04-04
Altri Editori,https://www.ibs.it/images/9788834622971_0_0_150_0_75.jpg,Come ho fatto cento film a Hollywood senza mai perdere un centesimo,Roger Corman,La nave di Teseo,2026,,https://www.ibs.it/come-ho-fatto-cento-film-libro-roger-corman/e/9788834622971,False,2026-04-04
Altri Editori,https://www.ibs.it/images/9788822920348_0_0_150_0_75.jpg,Scrapbook degli anni '60. Scritti 1954-2010,Jonas Mekas,Quodlibet,2026,,https://www.ibs.it/scrapbook-degli-anni-60-scritti-libro-jonas-mekas/e/9788822920348,False,2026-04-03
Editori Selezionati,https://www.ibs.it/images/9788804805625_0_0_150_0_75.jpg,Il coraggio di chi trema. La mia vita in contropiede,"Valentina Giacinti,Alessandro Alciato",Mondadori,2026,"Mancano 720 minuti al sogno. Poi 630. Poi 540. Il tempo si accorcia e il primo scudetto, con la maglia della Roma, prende forma, partita dopo partita, fino a sciogliersi in un pianto liberatorio che contiene anni di sacrifici, ostinazione e silenzi. Valentina Giacinti non è stata una predestinata. È cresciuta in un calcio femminile ai margini, tra campi sgangherati e allenamenti serali, quando il massimo campionato viveva lontano dai riflettori. Poi i numeri hanno parlato: i 41 gol in una stagione con il Mozzanica, la Supercoppa italiana, la fascia di capitana del Milan, oltre 200 reti in serie A, le partite con la Nazionale e l'ingresso nella Hall of Fame del calcio italiano. E ancora gli scudetti e il passaggio storico al professionismo, vissuto da protagonista, come se ogni rete avesse aperto un varco. Accanto alla crescita sportiva, una battaglia costante contro gli stereotipi che hanno a lungo ostacolato il calcio femminile: spalti attraversati da mormorii velenosi, dirigenti pronti a liquidare un intero movimento con una frase sprezzante, l'idea dura a morire che il sogno di tante ragazze fosse solo un capriccio. Mentre i pregiudizi cercavano di marcarla stretta, Valentina rispondeva con il rumore dei gol, cambiando le regole del gioco per tutte. Eppure, sotto l'armatura dell'attaccante implacabile, c'è sempre stata una sensibilità acuta. In queste pagine Giacinti racconta i suoi lividi invisibili con rara franchezza, mostrando che la forza può convivere con la fragilità. Il coraggio di chi trema, frutto della collaborazione con il giornalista Alessandro Alciato, non racconta solo il percorso di un'atleta straordinaria. È la storia di una donna che ha imparato che la vera vittoria non sta nel non cadere mai, ma nell'avere il coraggio di mostrare le proprie crepe.",https://www.ibs.it/coraggio-di-chi-trema-mia-libro-valentina-giacinti-alessandro-alciato/e/9788804805625,False,2026-04-08
Altri Editori,https://www.ibs.it/images/9791281484429_0_0_150_0_75.jpg,Shigeru Miyamoto,Annamaria Santoro,Marotta e Cafiero,2026,,https://www.ibs.it/shigeru-miyamoto-libro-annamaria-santoro/e/9791281484429,False,2026-04-01
Altri Editori,https://www.ibs.it/images/9791282461009_0_0_150_0_75.jpg,La magia di Bergkamp. Romanzo di un attimo irripetibile,Cosimo Giordano,Garrincha Edizioni,2026,,https://www.ibs.it/magia-di-bergkamp-romanzo-di-libro-cosimo-giordano/e/9791282461009,False,2026-04-01
Altri Editori,https://www.ibs.it/images/9791282399005_0_0_150_0_75.jpg,Controcorrente. Vita a Fumetti di Nikola Tesla,Samira Parasole,Astromica,2026,,https://www.ibs.it/controcorrente-vita-a-fumetti-di-libro-samira-parasole/e/9791282399005,False,2026-04-04
Altri Editori,https://www.ibs.it/images/9791281626997_0_0_150_0_75.jpg,Julius Erving. Il sogno americano di Doctor J,Diego Del Pozzo,Garrincha Edizioni,2026,,https://www.ibs.it/julius-erving-sogno-americano-di-libro-diego-del-pozzo/e/9791281626997,False,2026-04-01
Altri Editori,https://www.ibs.it/images/9791281626980_0_0_150_0_75.jpg,Ginóbili. Il sesto uomo,Michele Zoani,Garrincha Edizioni,2026,,https://www.ibs.it/ginobili-sesto-uomo-libro-michele-zoani/e/9791281626980,False,2026-04-01
Altri Editori,https://www.ibs.it/images/9791281626966_0_0_150_0_75.jpg,Giggs. Il mago gallese,Ivano La Montagna,Garrincha Edizioni,2026,,https://www.ibs.it/giggs-mago-gallese-libro-ivano-la-montagna/e/9791281626966,False,2026-04-01
Altri Editori,https://www.ibs.it/images/9791281626959_0_0_150_0_75.jpg,Pulici. Uno di noi,Andrea Pelliccia,Garrincha Edizioni,2026,,https://www.ibs.it/pulici-di-noi-libro-andrea-pelliccia/e/9791281626959,False,2026-03-31
Altri Editori,https://www.ibs.it/images/9791281626942_0_0_150_0_75.jpg,"Del Piero. Tra Pinturicchio, Godot e l'eternità",Giampiero Frasca,Garrincha Edizioni,2026,,https://www.ibs.it/del-piero-tra-pinturicchio-godot-libro-giampiero-frasca/e/9791281626942,False,2026-04-01
Altri Editori,https://www.ibs.it/images/9791254723203_0_0_150_0_75.jpg,Lettere e scritti sull'arte,Giovanni Segantini,Abscondita,2026,,https://www.ibs.it/lettere-scritti-sull-arte-libro-giovanni-segantini/e/9791254723203,False,2026-04-01
Altri Editori,https://www.ibs.it/images/9791254723159_0_0_150_0_75.jpg,Lettere e taccuini (1869-1895),Berthe Morisot,Abscondita,2026,,https://www.ibs.it/lettere-taccuini-1869-1895-libro-berthe-morisot/e/9791254723159,False,2026-04-01
Altri Editori,https://www.ibs.it/images/9791222113401_0_0_150_0_75.jpg,Francis Bacon. La violenza di una rosa,Cristina Portolano,Gallucci Balloon,2026,,https://www.ibs.it/francis-bacon-violenza-di-rosa-libro-cristina-portolano/e/9791222113401,False,2026-04-04
Altri Editori,https://www.ibs.it/images/9791222113388_0_0_150_0_75.jpg,God save the queen. Le opere e i giorni di Elisabetta II Windsor,Ivan Canu,Gallucci Centauria,2026,,https://www.ibs.it/god-save-the-queen-opere-libro-ivan-canu/e/9791222113388,False,2026-04-03
Altri Editori,https://www.ibs.it/images/9788850276202_0_0_150_0_75.jpg,Audrey. La biografia definitiva di Audrey Hepburn,"Sean Hepburn Ferrer,Wendy Holden",TEA,2026,,https://www.ibs.it/audrey-biografia-definitiva-di-audrey-libro-sean-hepburn-ferrer-wendy-holden/e/9788850276202,False,2026-04-08
Altri Editori,https://www.ibs.it/images/9788833144313_0_0_150_0_75.jpg,Tupac Shakur. Solo Dio può giudicarmi. Nuova ediz.,"Antonio Solinas,Paolo Gallina",Becco Giallo,2026,,https://www.ibs.it/tupac-shakur-solo-dio-puo-libro-antonio-solinas-paolo-gallina/e/9788833144313,False,2026-04-04
Altri Editori,https://www.ibs.it/images/9788831027380_0_0_150_0_75.jpg,Gwyneth. La biografia,Amy Odell,Salani,2026,,https://www.ibs.it/gwyneth-biografia-libro-amy-odell/e/9788831027380,False,2026-04-08
Altri Editori,https://www.ibs.it/images/9791280048868_0_0_150_0_75.jpg,Dall'esilio. Lettere alla moglie (1929-1937),Carlo Rosselli,Edizioni Società Aperta,2026,,https://www.ibs.it/dall-esilio-lettere-alla-moglie-libro-carlo-rosselli/e/9791280048868,False,2026-04-02
Altri Editori,https://www.ibs.it/images/9788888151564_0_0_150_0_75.jpg,Tazio Nuvolari. Compagno del vento,Marco D'Aponte,Töpffer,2026,,https://www.ibs.it/tazio-nuvolari-compagno-del-vento-libro-marco-d-aponte/e/9788888151564,False,2026-04-06
Altri Editori,https://www.ibs.it/images/9788871988665_0_0_150_0_75.jpg,Monte verità,Hermann Hesse,SugarCo,2026,,https://www.ibs.it/monte-verita-libro-hermann-hesse/e/9788871988665,False,2026-04-06
Altri Editori,https://www.ibs.it/images/9788849875997_0_0_150_0_75.jpg,Diari. Gli anni della grande speranza. Vol. 2: 1961-1965,Ettore Bernabei,Rubbettino,2026,,https://www.ibs.it/diari-anni-della-grande-speranza-libro-ettore-bernabei/e/9788849875997,False,2026-04-06
Editori Selezionati,https://www.ibs.it/images/9788807175879_0_0_150_0_75.jpg,Per un mondo migliore. Colloqui con Stefan Müller-Doohm e Roman Yos,Jürgen Habermas,Feltrinelli,2026,"Che cosa significa dedicare un’intera vita alla filosofia? E quale ruolo può ancora avere il pensiero critico nelle società contemporanee? In questo suo ultimo libro Jürgen Habermas torna sui momenti decisivi della propria formazione e ripercorre, in forma di dialogo, le tappe di un itinerario intellettuale che attraversa oltre mezzo secolo di storia europea. Conversando con Stefan Müller-Doohm e Roman Yos, due tra i suoi più attenti biografi, Habermas racconta la propria giovinezza nella Germania del dopoguerra, gli anni all’Istituto per la ricerca sociale di Francoforte accanto a Adorno e Horkheimer, il confronto con la tradizione filosofica incarnata da Gadamer a Heidelberg. Da questi incontri e da queste esperienze è nata una riflessione destinata a incidere profondamente sul pensiero contemporaneo con la teoria dell’agire comunicativo, la difesa della ragione pubblica, l’idea che la democrazia viva nel confronto argomentato tra cittadini liberi e uguali. Il dialogo offre anche l’occasione per tornare sui nodi teorici centrali dell’opera di Habermas: la critica del positivismo e della razionalità puramente strumentale, il rapporto tra linguaggio e società, il progetto di una filosofia post-metafisica capace di misurarsi con la modernità, fino ai temi di più urgente attualità quali la crisi delle democrazie liberali, i conflitti geopolitici e il destino dell’Europa.",https://www.ibs.it/per-mondo-migliore-colloqui-con-libro-jurgen-habermas/e/9788807175879,False,2026-04-08
Altri Editori,https://www.ibs.it/images/9791257430733_0_0_150_0_75.jpg,Massimo Troisi. «Il poeta del cuore»,Giacomo Costanzo,La valle del tempo,2026,,https://www.ibs.it/massimo-troisi-poeta-del-cuore-libro-giacomo-costanzo/e/9791257430733,False,2026-04-03
Altri Editori,https://www.ibs.it/images/9791224065692_0_0_150_0_75.jpg,The stubborn dreamer-Il sognatore testardo. Ediz. bilingue,Simone Di Girolamo,Youcanprint,2026,,https://www.ibs.it/the-stubborn-dreamer-sognatore-testardo-libro-simone-di-girolamo/e/9791224065692,False,2026-04-03
Altri Editori,https://www.ibs.it/images/9791257143619_0_0_150_0_75.jpg,Wilhelm von Gloeden. Fotografo e poeta della bellezza classica. Ediz. illustrata,Raffaele Mambella,Robin Edizioni,2026,,https://www.ibs.it/wilhelm-von-gloeden-fotografo-poeta-libro-raffaele-mambella/e/9791257143619,False,2026-04-03
Altri Editori,https://www.ibs.it/images/9788894785227_0_0_150_0_75.jpg,Santità in bicicletta. Padre Mario Airoldi. I misteri del Rosario,Battista Pellegrino,La Lanterna - Arce,2026,,https://www.ibs.it/santita-in-bicicletta-padre-mario-libro-battista-pellegrino/e/9788894785227,True,2026-04-09
Altri Editori,https://www.ibs.it/images/9788891318541_0_0_150_0_75.jpg,L'imperatore Claudio. Breve introduzione alla vita e al regno,N/D,L'Erma di Bretschneider,2026,,https://www.ibs.it/imperatore-claudio-breve-introduzione-alla-libro-vari/e/9788891318541,False,2026-04-03
Altri Editori,https://www.ibs.it/images/9791298515833_0_0_150_0_75.jpg,Passo e tiro. La vita felice di Davide Ancilotto,"Pillu,Luca Pelosi",Marginalia,2026,,https://www.ibs.it/passo-tiro-vita-felice-di-libro-pillu-luca-pelosi/e/9791298515833,False,2026-04-03
Altri Editori,https://www.ibs.it/images/9791282354059_0_0_150_0_75.jpg,Miguel Vaaz. Mercante e conte nel Regno di Napoli. La fondazione di Casale San Michele,Franco Rossi,Gelsorosso,2026,,https://www.ibs.it/miguel-vaaz-mercante-conte-nel-libro-franco-rossi/e/9791282354059,False,2026-04-03
Altri Editori,https://www.ibs.it/images/9788896905654_0_0_150_0_75.jpg,Agente segreto per caso. Diario a memoria del capitano del Number 1 Special Force nella Resistenza italiana,Henry Boutigny,Primamedia,2026,,https://www.ibs.it/agente-segreto-per-caso-diario-libro-henry-boutigny/e/9788896905654,False,2026-04-03
Altri Editori,https://www.ibs.it/images/9791256154395_0_0_150_0_75.jpg,La logica e l'atto. Quattro studi su Heidegger,Giacomo Clemente,Meltemi,2026,,https://www.ibs.it/logica-atto-quattro-studi-su-libro-giacomo-clemente/e/9791256154395,False,2026-04-03
Editori Selezionati,https://www.ibs.it/images/9788807950636_0_0_150_0_75.jpg,Contro il metodo. Abbozzo di una teoria anarchica della conoscenza,Paul K. Feyerabend,Feltrinelli,2026,"“La scienza è un’impresa essenzialmente anarchica: l’anarchismo è più aperto al progresso che non le sue alternative.” Apparso per la prima volta nel 1975, Contro il metodo si è imposto come spartiacque nella riflessione filosofica intorno al progresso scientifico. Nel suo provocatorio attacco al metodo, Feyerabend si schiera contro una filosofia della scienza che, pur non avendo al suo attivo una sola scoperta importante, pretende di imporsi sulla ricerca con norme e canoni. Perché la scienza, secondo Feyerabend, ha bisogno della libertà più assoluta; è, in questo senso, un’impresa fondamentalmente anarchica, che non riconosce alcuna autorità sopra di sé, neppure la ragione. Le regole che i filosofi sono venuti astraendo hanno creato entità fittizie che non hanno più nulla in comune con il concreto procedere della ricerca. Tant’è che, se avessimo applicato le norme inventate dagli epistemologi, lo sviluppo tecnologico e intellettuale così come lo conosciamo sarebbe stato impossibile. Feyerabend firma un grande classico del pensiero del Novecento – adesso in un’edizione definitiva –, che ci svela come il progresso scientifico, da considerare solo alla luce del contesto storico, richieda che inventività e creatività possano svilupparsi senza freni, lontano da ogni forma di ordine costituito.",https://www.ibs.it/contro-metodo-abbozzo-di-teoria-libro-paul-k-feyerabend/e/9788807950636,False,2026-04-01
Editori Selezionati,https://www.ibs.it/images/9788804802969_0_0_150_0_75.jpg,La città del sole. Testo latino a fronte,Tommaso Campanella,Mondadori,2026,"In un luogo e in un tempo indefiniti, un cavaliere ospitaliere si fa narrare da un nocchiero genovese i suoi viaggi sulla lontana isola di Taprobana. Qui, nella Città del Sole, vive una popolazione governata da leggi e costumi perfetti. Inizia così il dialogo che Tommaso Campanella concepì nel 1602 tra le mura di un carcere, trasfigurando la propria sofferenza nel sogno di una società rigenerata, libera e giusta, tra comunismo dei beni, naturalismo umanistico e sapienza astrale. Capolavoro del tardo Rinascimento, La Città del Sole è una creazione utopica concreta e credibile, incarnata appieno, tra profezia e dissenso, nella biografia dell'autore.",https://www.ibs.it/citta-del-sole-testo-latino-libro-tommaso-campanella/e/9788804802969,False,2026-04-01
Altri Editori,https://www.ibs.it/images/9788867239924_0_0_150_0_75.jpg,Il riso. Saggio sul significato del comico,Henri Bergson,SE,2026,,https://www.ibs.it/riso-saggio-sul-significato-del-libro-henri-bergson/e/9788867239924,False,2026-04-01
Editori Selezionati,https://www.ibs.it/images/9791222329260_0_0_150_0_75.jpg,Preludi. La filosofia dell'invenzione e dei concetti,Ugo Perone,Mimesis,2026,"I concetti sono un'invenzione della filosofia per designare una realtà materiale o astratta, tentativi di coglierne il carattere essenziale e di porre le basi per un confronto con chi ne vorrà fare uso. I grandi concetti della filosofia, come verità, essere o dialettica, contengono strati molteplici, in cui sono sedimentate le varianti ma anche i dubbi e le critiche di chi vi ha fatto ricorso. Non sono clave da usare per combattere o bandiere che contrassegnano un potere, sono al più barche a cui affidarsi per il tragitto della vita. L'usura dei tempi, trascurandone la complessità, li ha talora ridotti ad aggettivi con cui qualificare la legittimità delle proprie pretese. Dicendo, per esempio, ""questo è vero"" attesto per lo più di essermi impossessato della verità, non tanto di volermi dedicare a essa. Il libro ripercorre la storia di otto concetti fondamentali per la filosofia, evidenziandone insieme ricchezza e rischi, così da fare di quel materiale un banco di prova che mette in gioco il nostro stesso modo di essere al mondo.",https://www.ibs.it/preludi-filosofia-dell-invenzione-dei-libro-ugo-perone/e/9791222329260,False,2026-04-07
Editori Selezionati,https://www.ibs.it/images/9788806273521_0_0_150_0_75.jpg,La scrittura e la differenza,Jacques Derrida,Einaudi,2026,,https://www.ibs.it/scrittura-differenza-libro-jacques-derrida/e/9788806273521,True,2026-04-09
