Categoria_App,Copertina,Titolo,Autore,Editore,Anno,Descrizione,Link,Nuovo,Data_Aggiunta
Altri Editori,https://www.ibs.it/images/9788899014919_0_0_150_0_75.jpg,La relazione medico-paziente al tempo dell'intelligenza artificiale,Marco Rossi,Marchetti Editore,2026,,https://www.ibs.it/relazione-medico-paziente-al-tempo-libro-marco-rossi/e/9788899014919,False,2026-04-02
Altri Editori,https://www.ibs.it/images/9788885721616_0_0_150_0_75.jpg,"Ago, filo e marmellata. Come i superiori si fan beffa di noi",Maria Grazia Roselli,Nexus Edizioni,2026,,https://www.ibs.it/ago-filo-marmellata-come-superiori-libro-maria-grazia-roselli/e/9788885721616,True,2026-04-03
Altri Editori,https://www.ibs.it/images/9788866331858_0_0_150_0_75.jpg,Geografie dell'innovazione in dialogo,N/D,Archetipo Libri,2026,,https://www.ibs.it/geografie-dell-innovazione-in-dialogo-libro-vari/e/9788866331858,False,2026-04-01
Altri Editori,https://www.ibs.it/images/9788813391744_0_0_150_0_75.jpg,Rischi cyber e catastrofi naturali nelle compagnie di assicurazione riflessi a livello sistemico,N/D,CEDAM,2026,,https://www.ibs.it/rischi-cyber-catastrofi-naturali-nelle-libro-vari/e/9788813391744,False,2026-03-31
Editori Selezionati,https://www.ibs.it/images/9788804817642_0_0_150_0_75.jpg,"Einstein. La sua vita, il suo universo",Walter Isaacson,Mondadori,2026,"Albert Einstein, il mite rifugiato in fuga dall'oppressione, con la sua aureola di capelli arruffati, gli occhi pensosi, la sua accattivante umanità e il suo limpido genio, spicca come icona suprema del Novecento. A tanti decenni di distanza dalle sue straordinarie scoperte risulta ancora stupefacente che un giovane studioso sia riuscito da solo a ridisegnare l'universo. Come funzionava la sua mente? Quanto influiva l'intuizione e quanto la logica nel suo modo di pensare? Che cosa fece di lui un genio? Walter Isaacson ci offre la prima biografia completa di Einstein, probabilmente lo scienziato più famoso e più amato di tutti i tempi, raccontandoci come un impertinente impiegato, che non riusciva a ottenere un incarico di insegnamento né un dottorato e che si trovava invischiato in un difficile matrimonio, riuscì a divenire l'uomo in grado di svelare i misteri dell'atomo e del cosmo.",https://www.ibs.it/einstein-sua-vita-suo-universo-libro-walter-isaacson/e/9788804817642,True,2026-04-03
Editori Selezionati,https://www.ibs.it/images/9791255970842_0_0_150_0_75.jpg,Il vertebrato che è in noi. Anatomia comparata ed evoluzione del corpo umano,Vincenzo Caputo Barucchi,UTET Università,2026,"«Il retaggio animale di Homo sapiens – scrive l’autore nell’introduzione – è inglobato nel suo corpo come in una serie di “matrioske” incluse l’una nell’altra, dal momento che una specie non emerge dal nulla e l’evoluzione opera attraverso un processo di rifiniture su un piano corporeo precedente, vincolando le successive produzioni di varianti. Dunque, proprio lo studio dell’Anatomia comparata permette di scoprire nella nostra morfologia la testimonianza di un’antichissima fase acquatica (il pesce che è in noi), della progressiva conquista delle terre emerse (il tetrapode che è in noi) e del definitivo affrancamento dalle fluttuazioni termiche dell’ambiente esterno grazie al nostro metabolismo endotermico (il mammifero che è in noi). Siamo anche in grado di dedurre, dallo studio delle nostre caratteristiche anatomiche, che un periodo ancestrale della storia evolutiva umana si è svolto nella chioma di antiche foreste tropicali dove ci slanciavamo, con presa sicura, tra un ramo e l’altro (la scimmia che è in noi). Scopo fondamentale dell’Anatomia comparata è, dunque, quello di analizzare la morfologia dei vertebrati alla luce dell’evoluzione: come sosteneva infatti il biologo e genetista Theodosius Dobzhansky “nulla ha senso in biologia se non alla luce dell’evoluzione”. L’Anatomia comparata, in quanto materia eminentemente evoluzionistica, studia perciò gli adattamenti dei vertebrati nel corso della loro storia evolutiva, attraverso l’analisi comparativa della forma e della funzione dei sistemi o apparati anatomici».",https://www.ibs.it/vertebrato-che-in-noi-anatomia-libro-vincenzo-caputo-barucchi/e/9791255970842,False,2026-03-31
Altri Editori,https://www.ibs.it/images/9791224063957_0_0_150_0_75.jpg,Guardare la scienza attraverso la storia,Davide Neri,Youcanprint,2026,,https://www.ibs.it/guardare-scienza-attraverso-storia-libro-davide-neri/e/9791224063957,True,2026-04-03
Altri Editori,https://www.ibs.it/images/9791224055983_0_0_150_0_75.jpg,"Tempus et regula. Orologi solari medievali italiani. Vol. 1: Le origini, la storia",Mario Arnaldi,Youcanprint,2026,,https://www.ibs.it/tempus-et-regula-orologi-solari-libro-mario-arnaldi/e/9791224055983,True,2026-04-03
Altri Editori,https://www.ibs.it/images/9788893469319_0_0_150_0_75.jpg,Studi di insetti,Lafcadio Hearn,La Vita Felice,2026,,https://www.ibs.it/studi-di-insetti-libro-lafcadio-hearn/e/9788893469319,False,2026-03-27
Altri Editori,https://www.ibs.it/images/9788894423389_0_0_150_0_75.jpg,Le battaglie ambientali in difesa della laguna di Marano,"Gregorio Comar,Nicolò Del Ponte,Samuele Pantanali",Pro Torviscosa,2026,,https://www.ibs.it/battaglie-ambientali-in-difesa-della-libro-vari/e/9788894423389,False,2026-03-28
Altri Editori,https://www.ibs.it/images/9788867884278_0_0_150_0_75.jpg,Filosofia da matemática e da física em Kant,Ramiro Délio Borges de Meneses,If Press,2026,,https://www.ibs.it/filosofia-da-matematica-da-fisica-libro-ramiro-delio-borges-de-meneses/e/9788867884278,False,2026-04-01
Editori Selezionati,https://www.ibs.it/images/9788807175497_0_0_150_0_75.jpg,Diversamente intelligenti. Vivere la neurodivergenza in un mondo omologato,Stefano Vicari,Feltrinelli,2026,"Hai mai avuto la sensazione di funzionare in modo diverso da quello della maggioranza delle persone che ti stanno accanto? O che, magari, sia tuo figlio a percepire, apprendere e capire seguendo percorsi alternativi? Non sei sbagliato né difettoso. E nemmeno tuo figlio lo è. Dopo Adolescenti interrotti, un nuovo libro che affronta un tema delicato, scritto da chi ha fatto della comprensione, della prevenzione e della cura della salute mentale la sua missione di vita. Andrea a cinque anni sapeva a memoria i nomi e le masse dei pianeti, ma la sua giornata era scandita da una serie di routine e di comportamenti ripetitivi. Martina, trentotto anni, per tanto tempo si è sentita “fuori posto” in ufficio ed è stata schernita per la sua incapacità di sintonizzarsi con i colleghi. Forse anche tu ti senti particolarmente a disagio in ambienti e situazioni che gli altri vivono con leggerezza: un abbraccio inaspettato, rumori troppo forti, dettagli che catturano la tua attenzione distraendoti dal quadro d'insieme. Sono storie diverse, ma hanno un filo che le unisce: la neurodivergenza. Partendo dalla sua esperienza clinica, Stefano Vicari racconta come funziona un cervello che non segue le vie convenzionali. Autismo, ADHD, dislessia, plusdotazione e altre forme di pensiero “fuori dallo schema” vengono narrate con chiarezza e rispetto, intrecciando spiegazioni scientifiche, casi concreti e interventi pratici. Si delinea così una mappa che, pur diffidando dell'autodiagnosi, è utile a genitori, insegnanti, professionisti e anche a coloro che stanno scoprendo il proprio profilo neurodivergente. L'obiettivo è di guidare il lettore a riconoscere i segnali, comprendere i comportamenti e valorizzare le risorse di chi percepisce e apprende in modo diverso. Perché la diversità non è un ostacolo da rimuovere, ma un potenziale da sviluppare.",https://www.ibs.it/diversamente-intelligenti-vivere-neurodivergenza-in-libro-stefano-vicari/e/9788807175497,False,2026-03-31
Altri Editori,https://www.ibs.it/images/9788866922391_0_0_150_0_75.jpg,Come accettare la nostra #vitadimmmerda e vivere felici. Strumenti concreti per i giorni storti. I consigli dello psicologo,Rodolfo Vittori,Gremese Editore,2026,,https://www.ibs.it/come-accettare-nostra-vitadimmmerda-vivere-libro-rodolfo-vittori/e/9788866922391,False,2026-03-27
Altri Editori,https://www.ibs.it/images/9791257300326_0_0_150_0_75.jpg,Dal manoscritto al bestseller. 10 passi per il successo del tuo libro,"Lucia Tilde Ingrosso,Silvia Messa",Laurana Editore,2026,,https://www.ibs.it/dal-manoscritto-al-bestseller-10-libro-lucia-tilde-ingrosso-silvia-messa/e/9791257300326,True,2026-04-03
Editori Selezionati,https://www.ibs.it/images/9791223801949_0_0_150_0_75.jpg,"Il codice della fame. Scopri perché mangi, riprogramma la tua dieta",Jason Fung,Piemme,2026,"E se il segreto per restare in forma non risiedesse solo in cosa - o quando - mangiamo, ma nel perché lo facciamo? Da decenni accettiamo l'idea che la perdita di peso non sia mai definitiva, che una volta interrotta la dieta torneremo «quelli di prima», riprendendo peso e trovandoci a dover riniziare tutto da capo. Con la diffusione di nuovi farmaci come Ozempic e Mounjaro, troppo spesso ci affidiamo a soluzioni rapide e a breve termine, senza però conoscere i fattori che determinano un cambiamento sostenibile, che può durare tutta la vita. Si dice che per dimagrire basti contare le calorie, consumandone più di quelle introdotte. In pochi però si soffermano sulla capacità dei cibi ultra-processati di manipolare i segnali che i nostri ormoni inviano al corpo, lasciandoci affamati anche dopo aver mangiato e non permettendoci di bruciare grassi. Attraverso Il codice della fame, il dottor Jason Fung, autore di bestseller internazionali, esplora la scienza del dimagrimento in modo semplice ma rigoroso, partendo dalle sue radici. Perché mangiamo? Perché abbiamo fame. Perché smettiamo di mangiare? Perché siamo sazi. Se mangiamo «troppo», è perché abbiamo troppa fame. È dunque l'appetito che dobbiamo controllare, non la quantità di calorie. Con tre regole d'oro e 45 consigli concreti, Il codice della fame è un manuale pratico su come rallentare la digestione, rompere i cicli alimentari emotivi e superare le pressioni sociali, per vivere sani, prima o dopo la dieta.",https://www.ibs.it/codice-della-fame-scopri-perche-libro-jason-fung/e/9791223801949,False,2026-04-01
Altri Editori,https://www.ibs.it/images/9788848149815_0_0_150_0_75.jpg,Muoversi con lo Spirito. Le Costellazioni secondo Bert Hellinger,"Ursula Steinbach,Thomas Gehrmann",Tecniche Nuove,2026,,https://www.ibs.it/muoversi-con-spirito-costellazioni-secondo-libro-ursula-steinbach-thomas-gehrmann/e/9788848149815,False,2026-03-27
Altri Editori,https://www.ibs.it/images/9788866235897_0_0_150_0_75.jpg,Cristalli e oli essenziali. L’alchimia per il benessere,Flavia Vallarin,Verdechiaro,2026,,https://www.ibs.it/cristalli-oli-essenziali-alchimia-per-libro-flavia-vallarin/e/9788866235897,False,2026-03-27
Altri Editori,https://www.ibs.it/images/9791280722799_0_0_150_0_75.jpg,Le parole dell'amore. Amarsi in età adulta,Filippo Mittino,Edizioni Astragalo,2026,,https://www.ibs.it/parole-dell-amore-amarsi-in-libro-filippo-mittino/e/9791280722799,False,2026-03-27
Altri Editori,https://www.ibs.it/images/9791257550240_0_0_150_0_75.jpg,Sotto la sabbia. Psicologia del lutto e recupero dell'armonia perduta,Roberto Lasagna,Armando Editore,2026,,https://www.ibs.it/sotto-sabbia-psicologia-del-lutto-libro-roberto-lasagna/e/9791257550240,False,2026-03-27
Altri Editori,https://www.ibs.it/images/9791255030485_0_0_150_0_75.jpg,Il potere del momento presente. Con 52 carte ispirazionali,Eckhart Tolle,My Life,2026,,https://www.ibs.it/potere-del-momento-presente-con-libro-eckhart-tolle/e/9791255030485,False,2026-03-27
Editori Selezionati,https://www.ibs.it/images/9788858058107_0_0_150_0_75.jpg,"La scienza del corpo femminile. Ormoni, emozioni e trasformazioni",Sheila De Liz,Gribaudo,2026,"Il corpo femminile non è un mistero. È solo stato ignorato per secoli. Con un libro dirompente, Sheila de Liz mette fine a miti duri a morire, silenzi e informazioni sbagliate, restituendo conoscenza, consapevolezza e libertà. Con esempi memorabili, metafore sorprendenti e solidi dati scientifici, racconta ciò che succede davvero nel corpo delle donne e spiega perché comprenderlo è fondamentale per la salute, il benessere e il piacere. Un vero e proprio atto d’amore verso la biologia femminile: approfondita con chiarezza, ironia e rispetto, senza tabù né paternalismi, e senza semplificazioni fuorvianti. Un viaggio completo e coinvolgente attraverso sesso, ciclo mestruale, piacere, fertilità, contraccezione, salute intima e cambiamenti ormonali nelle diverse fasi della vita, dalla pubertà alla menopausa. Grazie a una voce medica divertente, autorevole e profondamente umana, Sheila de Liz riesce a trasformare la divulgazione scientifica in una lettura appassionante, che informa e rassicura.",https://www.ibs.it/scienza-del-corpo-femminile-ormoni-libro-sheila-de-liz/e/9788858058107,False,2026-04-01
Altri Editori,https://www.ibs.it/images/9788857311470_0_0_150_0_75.jpg,"Manuale pratico di rimedi naturali. Alimenti, ricette e preparazioni curative per migliorare la qualità della vita","Angelica Agosta,Domenica Arcari Morini",Red Edizioni,2026,,https://www.ibs.it/manuale-pratico-di-rimedi-naturali-libro-angelica-agosta-domenica-arcari-morini/e/9788857311470,True,2026-04-03
Editori Selezionati,https://www.ibs.it/images/9788845428289_0_0_150_0_75.jpg,"I segreti della persuasione efficace. Influenza subliminale, messaggi nascosti, illusioni cognitive: gli strumenti di un grande mentalista per convincere gli altri",Henrik Fexeus,Sonzogno,2026,"Ti è mai capitato che un collega, con una frase detta «nel modo giusto», sia riuscito a rifilarti un compito in più? O di uscire da una discussione con la sensazione che il tuo partner abbia avuto la meglio, senza capire esattamente come? Succede perché la persuasione non è una tecnica riservata alla pubblicità o alla politica: è all’opera ogni giorno, nelle interazioni all’apparenza più innocue. Quando una richiesta viene formulata dandoti l’impressione che rifiutare sarebbe scortese. Quando il tono di voce o una pausa strategica ti spingono a cambiare opinione. In questi casi non stai davvero scegliendo: stai reagendo a una serie di stimoli studiati per orientare le tue decisioni. In questo libro Henrik Fexeus, mentalista ed esperto di comunicazione, spiega come e perché le persone si influenzano a vicenda – e come puoi farlo anche tu. Attraverso esperimenti sorprendenti ed esempi concreti, scoprirai come porre una domanda o raccontare una storia in modo da risultare convincente, e come far sì che gli altri si adeguino alle tue aspettative; imparerai a riconoscere i segnali nascosti, a decifrare i messaggi subliminali e i microsegnali non verbali, a evitare di cadere nelle scorciatoie mentali più comuni e a usare questi stessi strumenti in modo consapevole. Non per manipolare, ma per comunicare meglio e muoverti con più sicurezza nelle relazioni personali e professionali. Perché saper leggere tra le righe e guidare una conversazione può fare la differenza tra subire le scelte degli altri e ottenere quello che desideri davvero.",https://www.ibs.it/segreti-della-persuasione-efficace-influenza-libro-henrik-fexeus/e/9788845428289,False,2026-03-27
Editori Selezionati,https://www.ibs.it/images/9788820084349_0_0_150_0_75.jpg,Cerchiamo di ragionare insieme. Guida definitiva per sopravvivere alle relazioni sentimentali,Il Bugatti,Sperling & Kupfer,2026,"Ghosting e match sulle app di incontri, primi appuntamenti tragicomici, riapparizioni improvvise, relazioni a distanza che si consumano sugli schermi di un telefono; e poi l'insana pratica dell'orbiting e del gaslighting, tra relazioni tossiche e incontri ravvicinati con narcisisti patentati (o forse sono semplicemente tipi con la maturità emotiva di un paramecio?). E molto altro ancora. In queste pagine troverete una galleria di situazioni drammaticamente reali e straordinariamente ordinarie che, se messe in fila, ci restituiscono un quadro vivido delle relazioni sentimentali contemporanee. Perché oggi più che mai quello che da millenni chiamiamo «amore» sembra un vero e proprio tour de force capace di mettere a dura prova la nostra sanità mentale. E allora, questo libro corre in aiuto ai tanti che sono rimasti intrappolati nelle sabbie mobili delle relazioni e hanno bisogno di un aiuto per uscirne vivi, o quantomeno per non perdere la bussola nel ginepraio dei sentimenti nell'epoca dei social. Questo non è né un libro di psicologia né una raccolta di massime motivazionali, ma la guida (davvero definitiva) per districarvi nel pantano dei sentimenti moderni, con la consapevolezza che quello che state vivendo, nel bene o nel male, è capitato a tanti come voi. Per fortuna (o purtroppo) in questo viaggio non sarete soli.",https://www.ibs.it/cerchiamo-di-ragionare-insieme-guida-libro-il-bugatti/e/9788820084349,False,2026-04-01
Altri Editori,https://www.ibs.it/images/9791282096119_0_0_150_0_75.jpg,Project management senza gergo. Il kit operativo per portare ordine nella vita e nel lavoro,Ulderico Tiberio,Aras Edizioni,2026,,https://www.ibs.it/project-management-senza-gergo-kit-libro-ulderico-tiberio/e/9791282096119,False,2026-03-27
Altri Editori,https://www.ibs.it/images/9791257550141_0_0_150_0_75.jpg,Studiare per lavorare in banca al tempo dell'Intelligenza Artificiale,Tommaso Gamaleri,Armando Editore,2026,,https://www.ibs.it/studiare-per-lavorare-in-banca-libro-tommaso-gamaleri/e/9791257550141,False,2026-03-27
Altri Editori,https://www.ibs.it/images/9791257032647_0_0_150_0_75.jpg,Herz Intuition Kodex In Freiheit souverän leben und authentisch führen!,Andrea Aupers,Europa Buch,2026,,https://www.ibs.it/herz-intuition-kodex-in-freiheit-libro-andrea-aupers/e/9791257032647,False,2026-03-27
Editori Selezionati,https://www.ibs.it/images/9791223801819_0_0_150_0_75.jpg,Nata Sgarbi. Storia di un padre e di una figlia,Evelina Sgarbi,Piemme,2026,"Questa è la storia di un legame imperfetto. Di un padre magnetico, capace di entusiasmi assoluti e di brusche ritirate, e di una figlia costretta ad amare a intermittenza: nelle confidenze inaspettate, nei gesti teneri e disorientati di chi continua a cercarsi senza trovarsi mai del tutto. Evelina Sgarbi ricostruisce il legame con suo padre Vittorio come si ricompone un mosaico, tassello dopo tassello, incomprensione dopo incomprensione. Luce e ombra: questo significa «nascere Sgarbi». Un'eredità che non ha a che fare con il dna, piuttosto una scrittura segreta, qualcosa che affiora nei tratti del carattere prima ancora che nello specchio. Nei gesti che hai imparato a replicare, nella paura di scoprirti vulnerabile, nella domanda che ritorna ostinata: sarò mai abbastanza? Saprò prendermi il mio spazio, l'affetto incondizionato che merito? Forse è vero che l'amore è fatto di prove da superare, eppure questo libro ci insegna il contrario: che si può amare anche chi ci disattende, che le promesse rimaste sospese, pur nel dolore, nulla tolgono all'affetto profondo. Le persone sono un prisma, e di quel prisma si può amare tutto: ogni faccia, anche quella che non cerca l'approvazione, anche quella che indossiamo proprio quando non sappiamo - e non vogliamo - farci amare. Un libro intimo e lucido, il memoir di una giovane donna che, con coraggio, cerca il proprio posto nel mondo, il proprio cono di luce.",https://www.ibs.it/nata-sgarbi-storia-di-padre-libro-evelina-sgarbi/e/9791223801819,True,2026-04-03
Altri Editori,https://www.ibs.it/images/9791223617076_0_0_150_0_75.jpg,Testamento al pensiero,Daniele Nani,Gruppo Albatros Il Filo,2026,,https://www.ibs.it/testamento-al-pensiero-libro-daniele-nani/e/9791223617076,False,2026-03-27
Altri Editori,https://www.ibs.it/images/9791223616659_0_0_150_0_75.jpg,Riparti da te,Andrea Bonamini,Gruppo Albatros Il Filo,2026,,https://www.ibs.it/riparti-da-te-libro-andrea-bonamini/e/9791223616659,False,2026-03-27
Altri Editori,https://www.ibs.it/images/9791223614976_0_0_150_0_75.jpg,Il coraggio: Una guida alla forza interiore,Pier Luigi Fabrizi,Gruppo Albatros Il Filo,2026,,https://www.ibs.it/coraggio-guida-alla-forza-interiore-libro-pier-luigi-fabrizi/e/9791223614976,False,2026-03-27
Altri Editori,https://www.ibs.it/images/9791221222685_0_0_150_0_75.jpg,"Non sarà una rosa, ma un fantastico girasole. Noi, amici quasi fratelli","Gianmarco Lepre,Ermanno Curti",De Agostini,2026,,https://www.ibs.it/non-sara-rosa-ma-fantastico-libro-gianmarco-lepre-ermanno-curti/e/9791221222685,False,2026-04-01
Altri Editori,https://www.ibs.it/images/9788892923003_0_0_150_0_75.jpg,La felicità allo specchio. La Bellezza come cura e la Felicità come processo per raggiungerla,Patrizia Giugliano,Santelli Editore,2026,,https://www.ibs.it/felicita-allo-specchio-bellezza-come-libro-patrizia-giugliano/e/9788892923003,False,2026-03-27
Altri Editori,https://www.ibs.it/images/9788892785250_0_0_150_0_75.jpg,Keep calm and eat happy. Mangia senza pensieri e vivi felice,Elisa Zanelli,Ultra,2026,,https://www.ibs.it/keep-calm-and-eat-happy-libro-elisa-zanelli/e/9788892785250,False,2026-03-27
Editori Selezionati,https://www.ibs.it/images/9788892249950_0_0_150_0_75.jpg,Siamo soli? Come affrontare la solitudine nell'era della dipendenza da connessione,Salvo Noè,San Paolo Edizioni,2026,"Viviamo in un’epoca in cui siamo costantemente connessi: un messaggio è sufficiente per raggiungere chiunque, ovunque. Eppure, mai come oggi ci sentiamo soli. La “connessitudine"" è la solitudine mascherata da connessione: una condizione in cui le relazioni appaiono superficiali, i legami fragili, e la presenza degli altri non colma il vuoto che sentiamo dentro. Questo libro esplora, con un approccio psicologico accessibile, le cause profonde della solitudine relazionale nel mondo iperconnesso: dall’isolamento emotivo nelle coppie alla mancanza di empatia nei rapporti sociali, fino alla dipendenza da stimoli digitali che anestetizzano il vero incontro umano. Attraverso esempi, riflessioni e strumenti pratici, Siamo soli? guida il lettore verso una consapevolezza più profonda del proprio modo di entrare in relazione. Un invito a ritrovare connessioni autentiche, con gli altri, ma soprattutto con sé stessi. Perché, se impariamo a stare con la nostra solitudine, impariamo anche a incontrare quella degli altri. E lì, in quell’incontro, la solitudine può diventare compagnia. L’attenzione è la prima lettera dell’alfabeto dell’amore: è il dono di essere presenti, di ascoltare con il cuore e di coltivare la cura che dà vita a ogni relazione.",https://www.ibs.it/siamo-soli-come-affrontare-solitudine-libro-salvo-noe/e/9788892249950,False,2026-03-31
Altri Editori,https://www.ibs.it/images/9788869392382_0_0_150_0_75.jpg,Metti in forma il tuo business con il metodo F.I.T.,Vincenzo G. Di Grazia,Mind Edizioni,2026,,https://www.ibs.it/metti-in-forma-tuo-business-libro-vincenzo-g-di-grazia/e/9788869392382,False,2026-03-27
Altri Editori,https://www.ibs.it/images/9788859045212_0_0_150_0_75.jpg,Superare i disturbi dell'alimentazione. Percorso CBT-E per adolescenti e giovani adulti,"Riccardo Dalle Grave,Simona Calugi",Erickson,2026,,https://www.ibs.it/superare-disturbi-dell-alimentazione-percorso-libro-riccardo-dalle-grave-simona-calugi/e/9788859045212,False,2026-03-27
Altri Editori,https://www.ibs.it/images/9788832863307_0_0_150_0_75.jpg,Longevità cognitiva. Saperne di più per favorirla,"Andrea Francescani,Valentina Miramonti,Carla Stangalino",Fabbrica dei Segni,2026,,https://www.ibs.it/longevita-cognitiva-saperne-di-piu-libro-vari/e/9788832863307,False,2026-03-27
Editori Selezionati,https://www.ibs.it/images/9788820085100_0_0_150_0_75.jpg,Corsia di sorpasso per imprenditori. Come trasformare la tua azienda in un sistema che funziona anche senza di te e riprenderti la tua vita,Lorenzo Ait,Sperling & Kupfer,2026,"Imprenditore e stratega della crescita, Lorenzo Ait non insegna solo a «fare business», ma a costruire un'impresa che sia uno strumento di libertà e non una prigione. Crede che il tempo dell'imprenditore libero sia un asset dell'azienda e che il vero obiettivo sia «lavorare per non lavorare nell'operatività», ovvero costruire un'impresa tanto solida da prosperare anche senza il suo fondatore. Questo libro è una guida pratica per l'imprenditore italiano pronto a trasformare la propria attività da un'impresa artigianale a un'azienda scalabile e di alto valore. Il libro sfida il mito tradizionale dell'imprenditore-tecnico, esortando i fondatori a uscire dall'operatività quotidiana per diventare architetti strategici della propria impresa. Attraverso metodologie pratiche, esempi e un approccio diretto, l'autore rivela al lettore un percorso per costruire una C-level Company: un'organizzazione guidata da una solida prima linea manageriale, misurata sulla redditività più che sul fatturato, e progettata per funzionare e crescere indipendentemente dal suo creatore. Il libro fornisce schemi e azioni per diagnosticare le disfunzioni aziendali, implementare gli OKR (Objectives and Key Results) per l'esecuzione, professionalizzare aree chiave come la finanza e le risorse umane, e infine creare un asset di valore e «vendibile», anche se non si ha intenzione di vendere. È un manuale per gli imprenditori che vogliono smettere di «fallire lentamente» e iniziare a costruire un'impresa antifragile, strutturata e strategica.",https://www.ibs.it/corsia-di-sorpasso-per-imprenditori-libro-lorenzo-ait/e/9788820085100,True,2026-04-03
Altri Editori,https://www.ibs.it/images/9788833557915_0_0_150_0_75.jpg,Shrink. Dr. Yowai medico psichiatra. Vol. 11,Jin Nanami,Dynit Manga,2026,,https://www.ibs.it/shrink-dr-yowai-medico-psichiatra-libro-jin-nanami/e/9788833557915,False,2026-03-26
