Categoria_App,Copertina,Titolo,Autore,Editore,Anno,Descrizione,Link,Nuovo,Data_Aggiunta
Editori Selezionati,https://www.ibs.it/images/9788829796625_0_0_150_0_75.jpg,Il grande Medio Oriente. Viaggio al centro della storia tra impero e anarchia,Robert Kaplan,Marsilio,2026,"Oggi più che mai, la storia del Medio Oriente è quella del mondo intero. Per riuscire a intravedere il futuro attraverso il passato, Robert Kaplan racconta in forma di reportage di viaggio il Grande Medio Oriente, ovvero l’area che si estende dal Marocco al Turkestan orientale, fino a lambire la Cina; dai Balcani allo Yemen; dalla realtà della Libia a quella dell’Afghanistan. Tra scoperte e memorie, la narrazione si dipana lungo l’Egitto, l’Etiopia, l’Arabia Saudita, l’Iraq e l’Iran. Mescolando i ricordi delle sue tante esplorazioni alle letture di esperti, storici e scrittori, l’autore riflette su eventi e scenari, millenni e dinastie, caos e imperi, senza esaurire ma moltiplicando gli interrogativi: «Quali dimensioni politiche assumerà questa vasta regione? Riuscirà a trovare un compromesso tra tirannia da un lato e anarchia dall’altro?».",https://www.ibs.it/grande-medio-oriente-viaggio-al-libro-robert-kaplan/e/9788829796625?inventoryId=1001794965,False,2026-07-03
Editori Selezionati,https://www.ibs.it/images/9788804812388_0_0_150_0_75.jpg,Classici senza filtri. Perché il mondo antico ci riguarda ancora,Mary Beard,Mondadori,2026,"L'impero romano è caduto più di millecinquecento anni fa. Quanto all'«età dell'oro» dell'antica Grecia, era già storia vecchia quando la potenza di Roma si affacciava sul Mediterraneo. Eppure, da secoli, quel mondo riemerge testardo, incapace di riposare in pace: nella politica, nell'arte, nella cultura popolare, nelle grandi discussioni del presente. Roma e la Grecia vengono continuamente reinventate, idealizzate, trasformate in simboli identitari o in strumenti di scontro culturale. Tuttavia, dietro l'immagine monumentale dei classici, sopravvive qualcosa di molto più vicino e umano: oggetti quotidiani, vite comuni, tracce fragili e imperfette di persone lontanissime nel tempo, ma non così diverse da noi. È proprio da questa tensione tra distanza e familiarità che prende forma il nuovo libro di Mary Beard. Classicista tra le più autorevoli e autrice di bestseller internazionali, Beard rilegge il modo in cui l'antichità ha continuato nei secoli a esercitare il proprio fascino, interrogandosi su ciò che ancora oggi cerchiamo nei Greci e nei Romani. Non solo le grandi statue o i capolavori celebrati nei manuali, ma anche dettagli marginali e apparentemente insignificanti - un pezzo di pane conservato in un museo, una lettera, un graffito, un oggetto dimenticato - sono ciò che ci permette di percepire davvero il «brivido dell'antico» e di entrare in contatto con un passato che continua ostinatamente a parlarci.",https://www.ibs.it/classici-senza-filtri-perche-mondo-libro-mary-beard/e/9788804812388,False,2026-07-07
Editori Selezionati,https://www.ibs.it/images/9788815396198_0_0_150_0_75.jpg,Fronte orientale. Le truppe tedesche e l'imbarbarimento della guerra 1941-1945,Omer Bartov,Il Mulino,2026,"Nella guerra sul fronte orientale, innescata dall'attacco tedesco all'Unione Sovietica nel giugno 1941, si toccarono livelli di brutalità inaudita: stermini di massa delle popolazioni civili, deportazioni, distruzioni, maltrattamenti dei prigionieri. La responsabilità di questo imbarbarimento è stata solitamente addebitata al regime hitleriano e alle sue formazioni speciali come le SS, o al più agli alti comandi della Wehrmacht, sollevandone ranghi e quadri. Questo libro ha per primo infranto tale verità di comodo. Rovesciando la prospettiva e ricostruendo dal basso il comportamento delle truppe, grazie al ricorso a materiali inediti relativi all'attività di tre divisioni combattenti, Bartov ha potuto mostrare che la Wehrmacht fu pienamente protagonista dell'imbarbarimento della guerra, e che ciò fu dovuto al convergere di tre fattori: le condizioni estremamente dure del conflitto sul fronte orientale, il tipo di formazione degli ufficiali, e infine l'indottrinamento politico delle truppe, educate a considerare «Untermenschen», esseri inferiori, le popolazioni slave.",https://www.ibs.it/fronte-orientale-truppe-tedesche-imbarbarimento-libro-omer-bartov/e/9788815396198?inventoryId=1006110934,False,2026-07-03
Altri Editori,https://www.ibs.it/images/9788867835768_0_0_150_0_75.jpg,La tavola del mondo,N/D,ADD Editore,2026,,https://www.ibs.it/tavola-del-mondo-libro-vari/e/9788867835768?inventoryId=966641834,False,2026-07-03
Altri Editori,https://www.ibs.it/images/9791259793621_0_0_150_0_75.jpg,Avete rotto l’atomo. Il libro che non ti farà cambiare idea sul nucleare,"Matteo De Piccoli,Giovanni L. Montagnani",People,2026,,https://www.ibs.it/avete-rotto-atomo-libro-che-libro-matteo-de-piccoli-giovanni-l-montagnani/e/9791259793621?inventoryId=897395596,False,2026-07-03
Editori Selezionati,https://www.ibs.it/images/9788806267780_0_0_150_0_75.jpg,La ragazza che inventò il kabuki e altre storie,"Fabio Sebastiano Tana,Maria Teresa Orsi",Einaudi,2026,"Una mal sopporta la vita di Corte e dialoga con la luna; una sperimenta quanto sia effimera la gloria e si chiude nel silenzio di un monastero; una è una ragazza di campagna, geniale e anticonformista; una è animata dall'ambizione e dalla sete di vendetta; una è nata sotto il segno del cavallo e del fuoco; una è un'indocile e coraggiosa intellettuale. Sei donne, sei luoghi, sei storie. Un viaggio lungo dieci secoli attraverso la storia del Giappone in compagnia di sei vite, sei donne eccezionali, sei icone della letteratura, dell'arte e della cultura pop del Sol Levante. Quali storie sono racchiuse nei luoghi che visitiamo? E chi sono i personaggi che si nascondono nelle pieghe del tempo? In questo libro di storie e di luoghi, di miti e di viaggi, Maria Teresa Orsi e Fabio Sebastiano Tana ci guidano alla scoperta del Giappone e della sua cultura, attraverso sei storie fuori dal comune. Cosa sentiva Okuni di Izumo, la fondatrice del teatro kabuki, nel momento in cui il suo successo cominciava a tramontare? Qual era la posizione della sfortunata imperatrice Kenreimon'in rispetto agli uomini della sua vita o quella dell'anarchica e femminista Ito Noe rispetto ai suoi compagni? Dal tempio di Ishiyama al castello della Signora di Yodo a Osaka, passando per Kyoto e per Edo, fino a Izumo e al Kyushu, la penna degli autori ci permette di esplorare e di conoscere il Giappone in maniera originale, conducendoci in un viaggio nello spazio e nel tempo. Non siamo però gli unici a viaggiare: Orsi e Tana ci mostrano come le protagoniste dei racconti non rimangono mai cristallizzate nel proprio tempo, ma trasmigrano con leggerezza da un'epoca all'altra, da un'arte all'altra, reincarnandosi di volta in volta in personaggi teatrali, eroine manga, icone televisive. Mutando di continuo le proprie fattezze ma non la propria essenza. L'incrocio di fonti antiche e moderne, classiche e pop, permette agli autori di accedere al cuore del mito, abbattendo le frontiere dei generi e restituendoci una visione inedita e straordinariamente dinamica della cultura giapponese.",https://www.ibs.it/ragazza-che-invento-kabuki-altre-libro-fabio-sebastiano-tana-maria-teresa-orsi/e/9788806267780,False,2026-07-08
Editori Selezionati,https://www.ibs.it/images/9788815396556_0_0_150_0_75.jpg,H2O. L'incredibile storia dell'acqua,"Marco Ciardi,Silvano Fuso",Il Mulino,2026,"Indispensabile per l'individuo e la società, ma talvolta anche temibile nemica, l'acqua ha alimentato per millenni credenze religiose e pratiche virtuali - dal battesimo cristiano al valore sacro del Gange nella tradizione induista - ed è stata un principio intellettuale - i filosofi greci la considerarono l'elemento costitutivo della realtà. Ma il cammino verso la sua comprensione scientifica è lungo e tormentato. Oggi conosciamo la struttura della molecola d'acqua e le sue proprietà chimico-fisiche, ma solo con la rivoluzione chimica tra Sette e Ottocento si giunse alla definizione della formula H2O, fondamento della chimica moderna. Un viaggio tra storia e scienza per riscoprire l'acqua come bene da gestire con responsabilità.",https://www.ibs.it/h2o-incredibile-storia-dell-acqua-libro-marco-ciardi-silvano-fuso/e/9788815396556?inventoryId=973577627,False,2026-07-03
Altri Editori,https://www.ibs.it/images/9788892979314_0_0_150_0_75.jpg,Giovanna D'Arco/Caterina De medici. I protagonisti della storia. Vol. 7,"Jérôme Le Gris,Ignacio Noé,Murielle Gaude-Ferragu",Editoriale Cosmo,2026,,https://www.ibs.it/giovanna-d-arcocaterina-de-medici-libro-vari/e/9788892979314?inventoryId=997537829,False,2026-07-03
Editori Selezionati,https://www.ibs.it/images/9788811022411_0_0_150_0_75.jpg,Autobiografia,Benjamin Franklin,Garzanti,2026,"Tipografo e stampatore; pioniere degli esperimenti scientifici sull'elettricità; promotore instancabile di iniziative di interesse collettivo come la prima biblioteca circolante d'America; paladino dell'indipendenza e “padre della patria”: Benjamin Franklin è la perfetta espressione di quel secolo prodigioso che fu il Settecento, ma anche l'incarnazione del genio di un popolo e del mito dell'uomo pragmatico che si è “fatto da sé”, un mito in cui l'avventura del singolo incrocia il tempo eroico della nascita di una nazione. Se l'autore è «l'emblema vivente delle infinite possibilità che il Nuovo Mondo offre a chi abbia intelligenza e volontà», come scrive Giuseppe Lombardo nella introduzione, allora «l'Autobiografia non è la semplice ricostruzione di una vita, ma la summa dei principi e delle regole che aprono la via al successo». Rimasto incompleto per la morte dell'autore nel 1790 e pubblicato in versione integrale solo nel 1868, modello di prosa letteraria per vigore e chiarezza di stile, il memoir di Franklin risponde a un preciso intento morale: trasformare una storia personale in testimonianza esemplare e patrimonio della collettività.",https://www.ibs.it/autobiografia-libro-benjamin-franklin/e/9788811022411?inventoryId=986260608,False,2026-07-03
Altri Editori,https://www.ibs.it/images/9791255212874_0_0_150_0_75.jpg,La voce del duce. L'agenzia Stefani: l'arma segreta di Mussolini,Romano Canosa,LEG Edizioni,2026,,https://www.ibs.it/voce-del-duce-agenzia-stefani-libro-romano-canosa/e/9791255212874?inventoryId=1025439597,False,2026-07-07
Altri Editori,https://www.ibs.it/images/9791254943601_0_0_150_0_75.jpg,L'idea di Europa e il suo destino. Dalle origini alle sfide globali del XXI secolo,Piero De Luca,Baldini + Castoldi,2026,,https://www.ibs.it/idea-di-europa-suo-destino-libro-piero-de-luca/e/9791254943601?inventoryId=990908278,False,2026-07-07
Altri Editori,https://www.ibs.it/images/9788895368467_0_0_150_0_75.jpg,Culture e sentimenti del Medioevo,Paolo Cammarosano,CERM,2026,,https://www.ibs.it/culture-sentimenti-del-medioevo-libro-paolo-cammarosano/e/9788895368467?inventoryId=957934840,False,2026-07-07
Altri Editori,https://www.ibs.it/images/9788838256165_0_0_150_0_75.jpg,L'età dell'incertezza. L'Italia negli ultimi trent'anni,N/D,Studium,2026,,https://www.ibs.it/eta-dell-incertezza-italia-negli-libro-vari/e/9788838256165?inventoryId=891961804,False,2026-07-07
Editori Selezionati,https://www.ibs.it/images/9788834361306_0_0_150_0_75.jpg,"Maschere tra ritualità e teatro, archeologia e digitalizzazione. Indagini interdisciplinari",N/D,Vita e Pensiero,2026,"Le celebri miniature di maschere di Lipari (IV-III sec. a.C.) erano specifici corredi legati a ritualità funebri o rappresentavano anche proiezioni tangibili della prassi scenica? Attraverso una sistematica sperimentazione della loro funzionalità teatrale, l’indagine ne ha palesato la polivalenza: finora considerate quasi esclusivamente quali modelli per i tipi della commedia, queste raffinate opere d’arte si rivelano, alla prova della scena, una risorsa inattesa anche per la ricostruzione della dimensione performativa della tragedia. L’opera costituisce l’esito della convergenza metodologica del progetto PRIN 2022 (La Maschera tra Ritualità e Teatro), che ha unito le unità di ricerca dell’Università Carlo Bo di Urbino, dell’Università Mediterranea di Reggio Calabria e dell’Università Cattolica del Sacro Cuore di Milano. Il metodo adotta una prospettiva transdisciplinare per restituire la fisionomia del fenomeno teatrale antico e della sua ricezione. Accanto alla prima presentazione organica di un corpus di reperti macedoni, all’analisi dell’acustica del Teatro Greco di Siracusa e allo studio della ceramica figurata italiota e siceliota (con particolare focus sul Pittore Felton), la ricerca perviene a risultati d’avanguardia nella definizione di un protocollo per la digitalizzazione e la prototipazione dei manufatti archeologici di Lipari. L’indagine documenta analiticamente l’intero processo di ricostruzione delle maschere tragiche e comiche: dall’esegesi del testo alla drammaturgia dello spettacolo, dai rilievi 3D delle miniature e dei volti degli attori fino alle fasi tecniche che, muovendo dalla stampa digitale, approdano alla ricreazione artigianale del manufatto per la scena. Tale percorso ha guidato la riproposizione del Prometeo Incatenato di Eschilo e la sperimentazione di una commedia originale, Casinaria, nata dalla contaminatio di modelli plautini. Dalla disamina della frontalità del prosopon dionisiaco alle testimonianze dirette di attori e maestri mascherai, l’opera supera la dimensione meramente storica: integra filologia e tecnologie avanzate per indagare la persistenza della maschera, aprendo nuovi orizzonti di ricerca sulla fenomenologia di questi antichi manufatti.",https://www.ibs.it/maschere-tra-ritualita-teatro-archeologia-libro-vari/e/9788834361306?inventoryId=891961887,False,2026-07-07
Altri Editori,https://www.ibs.it/images/9788833249261_0_0_150_0_75.jpg,Storie in volo. 80 anni di trasporto aereo in Italia,"Filippo Anastasi,Rino Anastasio",Minerva Edizioni (Bologna),2026,,https://www.ibs.it/storie-in-volo-80-anni-libro-filippo-anastasi-rino-anastasio/e/9788833249261?inventoryId=967341431,False,2026-07-07
Altri Editori,https://www.ibs.it/images/9788833249186_0_0_150_0_75.jpg,La colonia cecoslovacca a Cesenatico-Ceskoslovenská osada u more. Ediz. bilingue,"Andrea Collini,Michela Mazzoli",Minerva Edizioni (Bologna),2026,,https://www.ibs.it/colonia-cecoslovacca-a-cesenatico-ceskoslovenska-libro-andrea-collini-michela-mazzoli/e/9788833249186,True,2026-07-09
Altri Editori,https://www.ibs.it/images/9791281704503_0_0_150_0_75.jpg,Dalla parte sbagliata. Storia di un moderno soldato di ventura,"John Murdoch,Leo Dalderup",Oaks Editrice,2026,,https://www.ibs.it/dalla-parte-sbagliata-storia-di-libro-john-murdoch-leo-dalderup/e/9791281704503,True,2026-07-09
Altri Editori,https://www.ibs.it/images/9791256551231_0_0_150_0_75.jpg,Venezia prima di Venezia: l'isola di San Servolo. Ediz. italiana e inglese,"Raffaele Dessì,Pierluigi Masini,Renato Pilutti",Gaspari,2026,,https://www.ibs.it/venezia-prima-di-venezia-isola-libro-vari/e/9791256551231?inventoryId=933559897,False,2026-07-06
Altri Editori,https://www.ibs.it/images/9788892803633_0_0_150_0_75.jpg,Hercules invictus. Musealizzazione del santuario di Ercole Vincitore a Tivoli. Ediz. a colori,Fabio Fabbrizzi,EDIFIR,2026,,https://www.ibs.it/hercules-invictus-musealizzazione-del-santuario-libro-fabio-fabbrizzi/e/9788892803633?inventoryId=1031607068,False,2026-07-07
Altri Editori,https://www.ibs.it/images/9788884213990_0_0_150_0_75.jpg,Campoleggio. Memorie di una comunità. Ediz. a colori,N/D,EdUP,2026,,https://www.ibs.it/campoleggio-memorie-di-comunita-ediz-libro-vari/e/9788884213990?inventoryId=895352464,False,2026-07-07
Editori Selezionati,https://www.ibs.it/images/9788811022367_0_0_150_0_75.jpg,Memorie di un'orologiaia,Rebecca Struthers,Garzanti,2026,,https://www.ibs.it/memorie-di-orologiaia-libro-rebecca-struthers/e/9788811022367?inventoryId=957934854,False,2026-07-04
Editori Selezionati,https://www.ibs.it/images/9791223234372_0_0_150_0_75.jpg,L'Apollo di Pompei. Ricostruzione di un capolavoro classico,Gabriel Zuchtriegel,Giunti Editore,2026,"Nel 1853 viene alla luce una delle più belle statue mai trovate a Pompei: l'Apollo Citarista, rinvenuto in una casa che da esso ha preso il nome. La discussione sul perché stesse lì, sui possibili archetipi greci e sui rapporti tra politica e arte, sacro e profano continua fino a oggi. In questo libro, Gabriel Zuchtriegel, direttore del Parco Archeologico di Pompei, racconta vecchie e nuove ricerche che, nel 2026, hanno portato a un nuovo allestimento rievocativo della casa del Citarista, una delle più grandi domus della città sepolta dal Vesuvio: un viaggio che, partendo da Pompei, attraversa l'Atene di Pericle e la Roma di Augusto, per finire alle origini dell'arte cristiana.",https://www.ibs.it/apollo-di-pompei-ricostruzione-di-libro-gabriel-zuchtriegel/e/9791223234372,False,2026-07-04
Editori Selezionati,https://www.ibs.it/images/9791256149742_0_0_150_0_75.jpg,Mai ci fu pietà. La banda della Magliana dal 1977 a oggi. Nuova ediz.,Angela Camuso,Castelvecchi,2026,"Una vicenda criminale che non smette di porre interrogativi inquietanti, le cui radici affondano nella miseria di borgata e i cui rami arrivano fino ai giorni nostri. È la storia della banda della Magliana, nata alla fine degli anni Settanta da malavitosi di borgata abbastanza scaltri da mettersi al servizio di poteri occulti, della mafia e delle frange eversive che miravano a destabilizzare il Paese. Scritto con il ritmo del romanzo e con rigorosa aderenza ai fatti, Mai ci fu pietà fa parlare i protagonisti senza omettere nomi, luoghi e circostanze in una sequenza agghiacciante di delitti e misteri: dall’omicidio di Mino Pecorelli al sequestro Moro, dai rapporti con camorra e Cosa Nostra alla cupola criminale di Mafia Capitale capeggiata da Massimo Carminati, fino al recente ritorno sulla scena del Palletta, storico braccio destro di Enrico De Pedis. In questa nuova edizione riveduta e ampliata torna anche un caso che ancora oggi divide magistrati e familiari: la scomparsa di Emanuela Orlandi, di cui Camuso fornisce notizie inedite. Attingendo a centinaia di documenti giudiziari e a colloqui con magistrati, investigatori e collaboratori di giustizia, si ricostruisce il ruolo che la banda avrebbe avuto nel rapimento della giovane cittadina vaticana, anche alla luce delle audizioni della commissione parlamentare d’inchiesta del 2024-2025. Un pezzo di storia italiana su cui restano ancora molti interrogativi.",https://www.ibs.it/mai-ci-fu-pieta-banda-libro-angela-camuso/e/9791256149742?inventoryId=996426766,False,2026-07-03
Altri Editori,https://www.ibs.it/images/9791259562289_0_0_150_0_75.jpg,Una storia massonica della musica. Nei labirinti delle armonie. Vol. 1,"Giovanni Greco,Davide Monda",Persiani,2026,,https://www.ibs.it/storia-massonica-della-musica-nei-libro-giovanni-greco-davide-monda/e/9791259562289,False,2026-07-07
Altri Editori,https://www.ibs.it/images/9791256830343_0_0_150_0_75.jpg,"Nordvegr. Vita, Mito e identità dei popoli del nord",Steinar,Anguana Edizioni,2026,,https://www.ibs.it/nordvegr-vita-mito-identita-dei-libro-steinar/e/9791256830343,False,2026-07-03
Altri Editori,https://www.ibs.it/images/9791256694082_0_0_150_0_75.jpg,"Il G8 di Genova. Ieri, oggi, domani",Vittorio Agnoletto,Tab edizioni,2026,,https://www.ibs.it/g8-di-genova-ieri-oggi-libro-vittorio-agnoletto/e/9791256694082,False,2026-07-08
Editori Selezionati,https://www.ibs.it/images/9791223276440_0_0_150_0_75.jpg,Nave Vespucci. Capo Horn. Ediz. a colori,"Massimo Sestini,Maurizio Lapera",Giunti Editore,2026,"Doppiare a vela Capo Horn è un sogno e una sfida, che l'equipaggio di nave Amerigo Vespucci, impegnata nel suo Tour Mondiale, racconta in prima persona nei testi raccolti da Valentina Venturi, con le immagini di Massimo Sestini e Maurizio Lapera e la prefazione di Giordano Bruno Guerri. Acque gelide e cieli lividi, vele e cime rigide per il ghiaccio; uomini e donne, pronti per una manovra pianificata in ogni minimo dettaglio; i fischi del nostromo e dei suoi aiutanti. Poi, il lampo di un faro nel buio e l'urrà di un'intera nave: sono le ore 01:53 del 5 aprile 2024. E questo è il diario di bordo di un'impresa.",https://www.ibs.it/nave-vespucci-capo-horn-ediz-libro-massimo-sestini-maurizio-lapera/e/9791223276440?inventoryId=1038791742,False,2026-07-07
Altri Editori,https://www.ibs.it/images/9788877078445_0_0_150_0_75.jpg,La storia in 24 pezzi mancanti,Luigi Grassia,Edizioni del Capricorno,2026,,https://www.ibs.it/storia-in-24-pezzi-mancanti-libro-luigi-grassia/e/9788877078445?inventoryId=987933644,False,2026-07-07
Altri Editori,https://www.ibs.it/images/9788855253048_0_0_150_0_75.jpg,"Trump, Prevost e il crogiolo americano",Luigi Rossi,Francesco D'Amato,2026,,https://www.ibs.it/trump-prevost-crogiolo-americano-libro-luigi-rossi/e/9788855253048,False,2026-07-07
Altri Editori,https://www.ibs.it/images/9788852608469_0_0_150_0_75.jpg,Nella misère. Dove il rap mi raggiunge,Alberto Capetti,Itaca (Castel Bolognese),2026,,https://www.ibs.it/nella-misere-dove-rap-mi-libro-alberto-capetti/e/9788852608469,False,2026-07-01
Altri Editori,https://www.ibs.it/images/9788833293097_0_0_150_0_75.jpg,Enigma unitario. Guerre d'indipendenza. Guerra per il sud,Aldo Quarta,Milella,2026,,https://www.ibs.it/enigma-unitario-guerre-d-indipendenza-libro-aldo-quarta/e/9788833293097,False,2026-07-08
Altri Editori,https://www.ibs.it/images/9791282630085_0_0_150_0_75.jpg,Il duce in tribuna. Lo sport nell’Italia di Mussolini,Andrea Randighieri,Mucchi Editore,2026,,https://www.ibs.it/duce-in-tribuna-sport-nell-libro-andrea-randighieri/e/9791282630085,False,2026-07-04
Altri Editori,https://www.ibs.it/images/9791281910164_0_0_150_0_75.jpg,Gente di Magenta. Taccuino di persone e luoghi,Emanuele Torreggiani,AGA Editrice (Cusano Milanino),2026,,https://www.ibs.it/gente-di-magenta-taccuino-di-libro-emanuele-torreggiani/e/9791281910164,False,2026-07-02
Altri Editori,https://www.ibs.it/images/9791281562783_0_0_150_0_75.jpg,"Venice at war. Twenty battles from the origins to the fall of the Venetian Republic, 421-1797",Federico Moro,Linea Edizioni,2026,,https://www.ibs.it/venice-at-war-twenty-battles-libro-federico-moro/e/9791281562783,True,2026-07-09
Altri Editori,https://www.ibs.it/images/9791255083696_0_0_150_0_75.jpg,Beata Vergine Maria Annunziata. Regina dei cuori,Santino Epis,Velar,2026,,https://www.ibs.it/beata-vergine-maria-annunziata-regina-libro-santino-epis/e/9791255083696,False,2026-07-08
Editori Selezionati,https://www.ibs.it/images/9791254633984_0_0_150_0_75.jpg,"Mimmo Jodice. Mediterraneo. Ediz. italiana, inglese e francese",N/D,Marsilio Arte,2026,"Il progetto Mediterraneo prende forma tra gli anni Ottanta e Novanta, quando Mimmo Jodice approfondisce la propria riflessione sui temi dell’antico, della memoria e delle origini, inseguendo immagini sospese oltre la dimensione del reale. Da questa ricerca nascono una serie di lavori dedicati alla cultura mediterranea e all’archeologia: un percorso che muove dai luoghi della tradizione partenopea a lui più vicini – Paestum, Neapolis, Pompei, Cuma, Baia – per estendersi progressivamente all’intero Mare Nostrum, dalla Grecia alla Tunisia, dalla Giordania alla Libia, fino ai musei di tutto il mondo. Quello di Jodice è insieme un viaggio dentro il linguaggio della fotografia, inteso come strumento di visione e interpretazione personale, e un attraversamento di un immaginario simbolico condiviso. La sua ricerca diventa così una ricognizione delle radici culturali del Mediterraneo, guidata dall’idea di una “città estesa” che dal golfo di Napoli si apre all’intero bacino mediterraneo e oltre. In occasione di Matera Capitale Mediterranea della Cultura e del Dialogo 2026, questa nuova edizione del progetto si arricchisce di contributi inediti e approfondimenti critici: un testo curatoriale di Carlo Sala, uno scritto poetico sul Mediterraneo del francesista jugoslavo Predrag Matvejević, e un saggio di Salvatore Settis dedicato allo sguardo di Jodice sull’archeologia e sull’arte antica. Il volume, progettato dallo Studio Sonnoli, presenta un ampio apparato fotografico in bianco e nero e testi in italiano, inglese e francese.",https://www.ibs.it/mimmo-jodice-mediterraneo-ediz-italiana-libro-vari/e/9791254633984?inventoryId=1033490629,False,2026-07-04
Altri Editori,https://www.ibs.it/images/9791224338741_0_0_150_0_75.jpg,I conventi francescani di Diso e di Marittima in Terra d’Otranto. Genealogia spirituale di san Francesco d'Assisi nelle comunità di Diso e di Marittima in Terra d'Otranto,Raffaele Paolo Coluccia,Autopubblicato,2026,,https://www.ibs.it/conventi-francescani-di-diso-di-libro-raffaele-paolo-coluccia/e/9791224338741,False,2026-07-08
Altri Editori,https://www.ibs.it/images/9791221509809_0_0_150_0_75.jpg,Meaningful practices. Non-scribal communication in the Aegean and the Near East during the Bronze Age,N/D,Firenze University Press,2026,,https://www.ibs.it/meaningful-practices-non-scribal-communication-libro-vari/e/9791221509809,False,2026-07-07
Altri Editori,https://www.ibs.it/images/9788892987760_0_0_150_0_75.jpg,Amapola. Una famiglia istriana nella tempesta,Daniela Lombardi,Ares,2026,,https://www.ibs.it/amapola-famiglia-istriana-nella-tempesta-libro-daniela-lombardi/e/9788892987760,False,2026-07-07
Altri Editori,https://www.ibs.it/images/9788872976586_0_0_150_0_75.jpg,Diari di Napoli. I manoscritti inediti dei notai. Vol. 3: 1548-1551. Il Principe di Salerno accusato di sodomia,Antonino Castaldo,ABE,2026,,https://www.ibs.it/diari-di-napoli-manoscritti-inediti-libro-antonino-castaldo/e/9788872976586,False,2026-07-01
