Categoria_App,Copertina,Titolo,Autore,Editore,Anno,Descrizione,Link,Nuovo,Data_Aggiunta
Altri Editori,https://www.ibs.it/images/9788825061901_0_0_150_0_75.jpg,Rosario della famiglia,N/D,EMP - Edizioni Messaggero Padova,2026,,https://www.ibs.it/rosario-della-famiglia-libro-vari/e/9788825061901,False,2026-04-01
Altri Editori,https://www.ibs.it/images/9788825061116_0_0_150_0_75.jpg,"Francesco, il papa dai cantieri aperti",Luca Vitali,EMP - Edizioni Messaggero Padova,2026,,https://www.ibs.it/francesco-papa-dai-cantieri-aperti-libro-luca-vitali/e/9788825061116,False,2026-03-31
Editori Selezionati,https://www.ibs.it/images/9788892251113_0_0_150_0_75.jpg,Illuminati da una gloria nascosta,Erik Varden,San Paolo Edizioni,2026,"In queste pagine, nate dalle riflessioni proposte a papa Leone XIV e alla Curia Romana per il ritiro del 2026, Erik Varden accompagna il lettore in un itinerario spirituale che restituisce alla scelta cristiana la sua radicalità e la sua promessa di luce. Assumendo come guida la sapienza di san Bernardo di Chiaravalle e le sue celebri meditazioni sul Salmo 90 (Qui habitat), l’autore esplora le dinamiche della lotta interiore: dal combattimento contro le “passioni nocive- alla ricerca di una libertà autentica che non si piega alle mode del momento. Ponendo in dialogo la grande tradizione monastica e le inquietudini della modernità, Varden affronta con coraggio i temi della verità, della giustizia e delle ferite - personali ed ecclesiali - che attendono di essere trasformate dalla Grazia, e ricorda che la gloria di Dio non è un ideale lontano, ma una presenza operante nel quotidiano. Ne emerge una proposta esigente ma liberante: un testo di meditazione e discernimento per chiunque desideri “portare il proprio fardello fino alla fine"", scoprendo che, nel dono di sé e nel silenzio dell’ascolto, ogni peso può farsi leggero.",https://www.ibs.it/illuminati-da-gloria-nascosta-libro-erik-varden/e/9788892251113,False,2026-03-27
Altri Editori,https://www.ibs.it/images/9788833673714_0_0_150_0_75.jpg,Ex-voto for I Tatti: «Caught by Uneasiness During a Serenade»-Ex voto per i Tatti: «Preso da malore durante una serenata». Ediz. bilingue,Gini Alhadeff,Officina Libraria,2026,,https://www.ibs.it/ex-voto-for-tatti-caught-libro-gini-alhadeff/e/9788833673714,False,2026-03-27
Altri Editori,https://www.ibs.it/images/9791256130757_0_0_150_0_75.jpg,Apologia dei Giudei. Invettiva contro Platina,Battista De'Giudici,La Scuola di Pitagora,2026,,https://www.ibs.it/apologia-dei-giudei-invettiva-contro-libro-battista-de-giudici/e/9791256130757,False,2026-03-27
Editori Selezionati,https://www.ibs.it/images/9788837241278_0_0_150_0_75.jpg,Il post-teismo è ancora cristiano?,Paolo Gamberini,Morcelliana,2026,"Di fronte alla secolarizzazione e alle recenti scoperte scientifiche, il cristianesimo attraversa una crisi di credibilità. L'idea di un Dio personale, separato dal mondo, che pianifica il corso della storia e interviene arbitrariamente nella creazione, è per molti difficilmente conciliabile con la cosmologia e la fisica quantistica, che descrivono l'universo come esito di processi evolutivi e la realtà come struttura di relazioni. Per dialogare con la modernità, la fede ha bisogno di linguaggi e paradigmi nuovi, radicati nella tradizione ma aperti al confronto con la scienza. Il post-teismo propone un'immagine di Dio come forza creativa che permea la realtà, l'evoluzione della natura e la storia degli uomini: tutto il mondo è in Dio, ma Dio non si esaurisce nel mondo. La questione se il post-teismo possa ancora dirsi cristiano dipende da come si definisce l'essenza del cristianesimo, in continuo cambiamento e capace, nel corso dei secoli, di ripensarsi senza tradire il cuore del proprio messaggio: Dio si svuota della sua divinità per incarnarsi nell'uomo e così rendere l'uomo e il mondo simili a sé.",https://www.ibs.it/post-teismo-ancora-cristiano-libro-paolo-gamberini/e/9788837241278,True,2026-04-03
Altri Editori,https://www.ibs.it/images/9788832715538_0_0_150_0_75.jpg,Sempre allegri. Verso l'alto con Pier Giorgio,N/D,AVE,2026,,https://www.ibs.it/sempre-allegri-verso-alto-con-libro-vari/e/9788832715538,False,2026-03-27
Altri Editori,https://www.ibs.it/images/9788897921882_0_0_150_0_75.jpg,101 cose che forse non sai su Gesù e sui Vangeli (e che sono vere),Marco Fasol,Il Timone,2026,,https://www.ibs.it/101-cose-che-forse-non-libro-marco-fasol/e/9788897921882,False,2026-03-31
Altri Editori,https://www.ibs.it/images/9791254782538_0_0_150_0_75.jpg,Gesù il Cristo in Maria Valtorta. Un'indagine sulla verità dell'Uomo-Dio tra scienza e Rivelazione,Ernesto Zucchini,Fede & Cultura,2026,,https://www.ibs.it/gesu-cristo-in-maria-valtorta-libro-ernesto-zucchini/e/9791254782538,False,2026-03-27
Editori Selezionati,https://www.ibs.it/images/9788834360187_0_0_150_0_75.jpg,Diventare umani. Una grammatica della vita spirituale,Luciano Manicardi,Vita e Pensiero,2026,"Di cosa parliamo quando usiamo la parola “spiritualità”? Si tratta di un termine monstre dalla storia recente e dai contenuti talmente estesi e variegati da renderla esemplare per vaghezza. Corpo esile su cui poggia una testa sproporzionata. A partire dall’esame storico del termine e della realtà della “spiritualità”, il libro indica la via di un approccio narrativo alla “vita spirituale” cristiana. La Bibbia non parla di spiritualità ma di vita. Vita guidata, animata, mossa dallo Spirito di Dio che interagisce con lo spirito dell’uomo. E la narrazione biblica presenta il corpo come soggetto della preghiera e della vita spirituale («nulla di spirituale avviene se non nel corpo») giungendo a rivelare la dimensione spirituale dell’esperienza erotica. I vangeli, presentando l’umanità di Gesù come sempre mossa e guidata dallo Spirito di Dio, consegnano al lettore le linee maestre della vita secondo lo Spirito, radicata nella persona e nell’esistenza di Gesù.",https://www.ibs.it/diventare-umani-grammatica-della-vita-libro-luciano-manicardi/e/9788834360187,False,2026-03-27
Altri Editori,https://www.ibs.it/images/9791254782422_0_0_150_0_75.jpg,Sulle strade di Gesù,Gianluigi Porrà,Fede & Cultura,2026,,https://www.ibs.it/sulle-strade-di-gesu-libro-gianluigi-porra/e/9791254782422,True,2026-04-03
Editori Selezionati,https://www.ibs.it/images/9788892250895_0_0_150_0_75.jpg,"Sale, non miele. Per una Fede che brucia",Luigi Maria Epicoco,San Paolo Edizioni,2026,"Luigi Maria Epicoco accompagna il lettore in un vero e proprio ripensamento delle potenzialità della vita cristiana, partendo dalla contestazione di una certa visione “buonista"" della fede e ricordandoci che la vita del credente non dipende da nessuna legge che non sia quella della Carità di Cristo a noi donata nel Battesimo. Non a caso «i santi sono quelli a cui funziona il Battesimo», è scritto in queste pagine; e le potenzialità che il Battesimo immette in noi sono riassumibili nelle tre virtù teologali — Fede, Speranza e Carità — che sfociano in quella che è la condizione della vita secondo Cristo: un’esistenza gioiosa e libera, perché amata. Il libro di Luigi Maria Epicoco si propone, dunque, di riflettere e ripensare queste “tre virtù- a partire dalla vita stessa, illuminata da alcune storie bibliche, che divengono traccia e provocazione per l’esistenza di ognuno.",https://www.ibs.it/sale-non-miele-per-fede-libro-luigi-maria-epicoco/e/9788892250895,False,2026-03-31
Editori Selezionati,https://www.ibs.it/images/9788837241261_0_0_150_0_75.jpg,Otium e culto,Josef Pieper,Morcelliana,2026,"Un libro che interpella la vita, lo stare al mondo e il lavorare: scritto nel 1948, dopo la seconda guerra mondiale, la prima in cui i bombardamenti colpirono deliberatamente città e civili, propone una modalità di ricostruzione che, in contrapposizione al marxismo, tenga conto di uno sguardo più profondo sulla natura umana, che comprenda anche la dimensione spirituale. Cuore della riflessione è il concetto di otium, strettamente legato alla capacità di contemplazione, approccio alla realtà di cui solo l'uomo è capace, liberandosi dalla schiavitù della prestazione, dell'affermazione di sé contro gli altri e di una visione del lavoro alienante. Non si vive per lavorare, ma, seguendo Aristotele, si lavora per avere otium, che è tale in quanto legato a un tempo altro, quello della festa e in particolare della festa religiosa – cristiana – che ha il suo culmine nel culto di Dio.",https://www.ibs.it/otium-culto-libro-josef-pieper/e/9788837241261,True,2026-04-03
Altri Editori,https://www.ibs.it/images/9788810219355_0_0_150_0_75.jpg,Il corpo e l’alleanza. I doni di Gesù nell’ultima cena,Ermenegildo Manicardi,EDB,2026,,https://www.ibs.it/corpo-alleanza-doni-di-gesu-libro-ermenegildo-manicardi/e/9788810219355,False,2026-03-27
Altri Editori,https://www.ibs.it/images/9791280736789_0_0_150_0_75.jpg,Prego per te. Insieme preghiamo per Leone XIV,Vincenzo Siracusa,Dottrinari,2026,,https://www.ibs.it/prego-per-te-insieme-preghiamo-libro-vincenzo-siracusa/e/9791280736789,False,2026-04-01
Altri Editori,https://www.ibs.it/images/9791280736772_0_0_150_0_75.jpg,Egidio Bullesi. Il marinaio santo,Giuseppe Valsecchi,Dottrinari,2026,,https://www.ibs.it/egidio-bullesi-marinaio-santo-libro-giuseppe-valsecchi/e/9791280736772,False,2026-04-01
Altri Editori,https://www.ibs.it/images/9791280736765_0_0_150_0_75.jpg,Non lasciatevi rubare la speranza! Papa Francesco parla ai giovani,Vincenzo Siracusa,Dottrinari,2026,,https://www.ibs.it/non-lasciatevi-rubare-speranza-papa-libro-vincenzo-siracusa/e/9791280736765,False,2026-04-01
Altri Editori,https://www.ibs.it/images/9791257920005_0_0_150_0_75.jpg,"Vangelo secondo Marco. Una ricerca storica, antropologica e filosofica. Ediz. integrale",N/D,Divergenze,2026,,https://www.ibs.it/vangelo-secondo-marco-ricerca-storica-libro-vari/e/9791257920005,True,2026-04-03
Altri Editori,https://www.ibs.it/images/9791257890018_0_0_150_0_75.jpg,La sofferenza è un dono,Bruno Coccoluto,EBS Print,2026,,https://www.ibs.it/sofferenza-dono-libro-bruno-coccoluto/e/9791257890018,True,2026-04-03
Altri Editori,https://www.ibs.it/images/9791220158039_0_0_150_0_75.jpg,Teoísmo. Viver é carregar uma vida,Adhemar Ramires,Europa Edizioni,2026,,https://www.ibs.it/teoismo-viver-carregar-uma-vida-libro-adhemar-ramires/e/9791220158039,False,2026-03-27
Editori Selezionati,https://www.ibs.it/images/9788892250505_0_0_150_0_75.jpg,"Padre Pancrazio. Vita di un uomo di Dio, fratello e padre",N/D,San Paolo Edizioni,2026,"Chi è stato davvero Padre Pancrazio? Non solo il fondatore della Fraternità Francescana di Betania, ma un Cappuccino, uomo di Dio, amico di Padre Pio, capace di trasformare l’incontro con il Vangelo in una forma di vita concreta, semplice e profondamente fraterna. Questa biografia, la prima ufficiale realizzata dalla sua più grande Fondazione, la Fraternità Francescana di Betania, ripercorre il suo cammino umano e spirituale: dall’infanzia segnata dalla povertà e dalla fede genuina, agli anni della formazione cappuccina, fino alla lunga esperienza a Loreto e alla nascita di una fraternità ispirata alla Betania evangelica. Attraverso ricordi, testimonianze e scritti, emerge il volto di un padre, di un fratello e di un uomo innamorato di Dio, che ha saputo indicare a molti una strada di comunione, minorità e speranza. Un racconto che non idealizza, ma custodisce una memoria viva, capace ancora oggi di parlare al cuore.",https://www.ibs.it/padre-pancrazio-vita-di-uomo-libro-vari/e/9788892250505,False,2026-03-31
Altri Editori,https://www.ibs.it/images/9788879624923_0_0_150_0_75.jpg,Chiara «altera Maria»,Camilla Mrad,Biblioteca Francescana,2026,,https://www.ibs.it/chiara-altera-maria-libro-camilla-mrad/e/9788879624923,False,2026-04-01
Altri Editori,https://www.ibs.it/images/9788867884216_0_0_150_0_75.jpg,"Il Vangelo e la politica. Valori, modelli, esperienze. Giornate di studio 2023",N/D,If Press,2026,,https://www.ibs.it/vangelo-politica-valori-modelli-esperienze-libro-vari/e/9788867884216,False,2026-04-02
Altri Editori,https://www.ibs.it/images/9788852608384_0_0_150_0_75.jpg,Marco Gallo. Anche i sassi si sarebbero messi a saltellare,N/D,Itaca (Castel Bolognese),2026,,https://www.ibs.it/marco-gallo-anche-sassi-si-libro-vari/e/9788852608384,False,2026-04-02
Altri Editori,https://www.ibs.it/images/9788846513519_0_0_150_0_75.jpg,Lineamenti di ecclesiologia,N/D,Lateran University Press,2026,,https://www.ibs.it/lineamenti-di-ecclesiologia-libro-vari/e/9788846513519,True,2026-04-03
Altri Editori,https://www.ibs.it/images/9788840190945_0_0_150_0_75.jpg,Syntaxe du verbe hebraique dans la prose biblique classique,N/D,Urbaniana University Press,2026,,https://www.ibs.it/syntaxe-du-verbe-hebraique-dans-libro-vari/e/9788840190945,True,2026-04-03
Editori Selezionati,https://www.ibs.it/images/9788826610542_0_0_150_0_75.jpg,"Apostoli di Cristo Gesù, nostra speranza",N/D,Libreria Editrice Vaticana,2026,,https://www.ibs.it/apostoli-di-cristo-gesu-nostra-libro-vari/e/9788826610542,True,2026-04-03
Altri Editori,https://www.ibs.it/images/9788810903926_0_0_150_0_75.jpg,Parola spirito e vita. Quaderni di lettura biblica (2025). Vol. 2: Quella terra dove scorrono latte e miele,N/D,EDB,2026,,https://www.ibs.it/parola-spirito-vita-quaderni-di-libro-vari/e/9788810903926,False,2026-03-31
Altri Editori,https://www.ibs.it/images/9791282147361_0_0_150_0_75.jpg,La sintesi scientifica di S. Tommaso d'Aquino,Alessandro Horváth,Effedieffe,2026,,https://www.ibs.it/sintesi-scientifica-di-s-tommaso-libro-alessandro-horvath/e/9791282147361,False,2026-04-01
Altri Editori,https://www.ibs.it/images/9791282298216_0_0_150_0_75.jpg,Le relazioni della Madre di Dio colla Chiesa cattolica,Giuseppe Vercillo,Bartolina Editoria Digitale,2026,,https://www.ibs.it/relazioni-della-madre-di-dio-libro-giuseppe-vercillo/e/9791282298216,True,2026-04-03
Altri Editori,https://www.ibs.it/images/9791257631048_0_0_150_0_75.jpg,"Dio, l'universo e l'uomo. L'imperscrutabile mente di Dio",Ciro Caiazzo,Kimerik,2026,,https://www.ibs.it/dio-universo-uomo-imperscrutabile-mente-libro-ciro-caiazzo/e/9791257631048,False,2026-04-02
Altri Editori,https://www.ibs.it/images/9791224061595_0_0_150_0_75.jpg,San Gerardo Majella tra storia e tradizione popolare,Chiara Ponte,Youcanprint,2026,,https://www.ibs.it/san-gerardo-majella-tra-storia-libro-chiara-ponte/e/9791224061595,True,2026-04-03
Altri Editori,https://www.ibs.it/images/9791222782157_0_0_150_0_75.jpg,Diario del cerimoniere del Duomo di Milano (1773-1774),N/D,Youcanprint,2026,,https://www.ibs.it/diario-del-cerimoniere-del-duomo-libro-vari/e/9791222782157,True,2026-04-03
Editori Selezionati,https://www.ibs.it/images/9788837241759_0_0_150_0_75.jpg,Diari (1834-1842). Nuova ediz.. Vol. 1,Søren Kierkegaard,Morcelliana,2026,"La lettura dei Diari - una miniera di intuizioni folgoranti, pensieri, preghiere, polemiche e spunti argomentativi - restituisce la complessità non sistematica ma edificante del pensiero filosofico e teologico di Søren Kierkegaard. Questa ultima edizione, di molto ampliata e rivista, riprende la versione del suo maggiore studioso italiano, Cornelio Fabro, svolta sull'integrale danese (20 voll., 1909-1948), pubblicata da Morcelliana nel 1948 e più volte ristampata. Ma l'attento spoglio compiuto dai curatori sulle carte postume, le lettere, i documenti e le opere complete, nel confronto fra la prima e i volumi già disponibili della nuova edizione critica danese, rende quest'opera del tutto originale nella traduzione e nelle note. Un classico, queste pagine dei Diari parlando del mondo si mettono in dialogo con Dio, la morte, l'amore, e toccano tonalità affettive come la noia, l'inquietudine, la pazienza e l'impazienza, l'angoscia... Un esercizio di pensiero quotidiano in cui traluce, sotto vari registri, la teoria dei tre stadi dell'esistenza estetico, etico e religioso.",https://www.ibs.it/diari-1834-1842-nuova-ediz-libro-soren-kierkegaard/e/9788837241759,True,2026-04-03
Altri Editori,https://www.ibs.it/images/9791282147392_0_0_150_0_75.jpg,Gesù: quadri evangelici,Girolamo Dal-Gal,Effedieffe,2026,,https://www.ibs.it/gesu-quadri-evangelici-libro-girolamo-dal-gal/e/9791282147392,False,2026-04-01
Altri Editori,https://www.ibs.it/images/9791282147385_0_0_150_0_75.jpg,Vita interiore di Gesù e Maria. Vol. 2,S. J. Jean-Nicolas Grou,Effedieffe,2026,,https://www.ibs.it/vita-interiore-di-gesu-maria-libro-s-j-jean-nicolas-grou/e/9791282147385,False,2026-04-01
Altri Editori,https://www.ibs.it/images/9791282147378_0_0_150_0_75.jpg,Esposizione del dogma cattolico. Vol. 3: Conferenze XXV-XXXVI,Padre Jacques-Marie-Louis Monsabré,Effedieffe,2026,,https://www.ibs.it/esposizione-del-dogma-cattolico-vol-libro-padre-jacques-marie-louis-monsabre/e/9791282147378,False,2026-04-01
Altri Editori,https://www.ibs.it/images/9788873673668_0_0_150_0_75.jpg,Rito e potere,N/D,CLV,2026,,https://www.ibs.it/rito-potere-libro-vari/e/9788873673668,True,2026-04-03
Altri Editori,https://www.ibs.it/images/9791280233523_0_0_150_0_75.jpg,"Elogio della grande compassione. Coltivare bodhicitta, diventare bodhisattva",Thubten Chodron,Nalanda,2026,,https://www.ibs.it/elogio-della-grande-compassione-coltivare-libro-thubten-chodron/e/9791280233523,False,2026-04-02
Editori Selezionati,https://www.ibs.it/images/9791256148387_0_0_150_0_75.jpg,Urgenza evangelica. Manifesto per un universalismo egualitario alternativo alla globalizzazione capitalista,N/D,Castelvecchi,2026,"Il capitalismo devasta il pianeta, approfondisce le disuguaglianze e riduce il lavoro e la natura a strumenti di profitto. Allo stesso tempo, in molte parti del mondo il cristianesimo viene mobilitato per giustificare nazionalismi, razzismi e nuove forme di dominio politico. Di fronte a queste derive, il collettivo Anastasis propone una rilettura radicale del Vangelo e del suo significato politico. Partendo dalla tradizione cristiana e dalle esperienze dei movimenti sociali contemporanei, Urgenza evangelica difende un’idea semplice: la fede cristiana tradisce se stessa quando si mette al servizio di sistemi ingiusti. Al contrario, chiama a costruire forme di vita collettive fondate sulla giustizia, sulla condivisione dei beni e sulla dignità di ogni persona. Questo manifesto invita i credenti e le credenti a riscoprire la forza sovversiva del Vangelo e a impegnarsi nella trasformazione del mondo, per un universalismo egualitario capace di opporsi alla globalizzazione capitalista. Prefazione di Marcello Tarì.",https://www.ibs.it/urgenza-evangelica-manifesto-per-universalismo-libro-vari/e/9791256148387,False,2026-03-27
Altri Editori,https://www.ibs.it/images/9791280736734_0_0_150_0_75.jpg,Carta d'identità di Maria di Nazaret. Madre di Gesù Cristo e della Chiesa,Remo Lupi,Dottrinari,2026,,https://www.ibs.it/carta-d-identita-di-maria-libro-remo-lupi/e/9791280736734,False,2026-04-01
Altri Editori,https://www.ibs.it/images/9791255843368_0_0_150_0_75.jpg,Tantra yoga,Daniel Odier,Lindau,2026,,https://www.ibs.it/tantra-yoga-libro-daniel-odier/e/9791255843368,False,2026-04-02
Altri Editori,https://www.ibs.it/images/9791254777114_0_0_150_0_75.jpg,Quaderni dell'Istituto per la Storia della Chiesa di Bologna. Vol. 2,N/D,Bologna University Press,2026,,https://www.ibs.it/quaderni-dell-istituto-per-storia-libro-vari/e/9791254777114,True,2026-04-03
Altri Editori,https://www.ibs.it/images/9788887303971_0_0_150_0_75.jpg,Si revera Deum quaerit. Linee guida per il discernimento monastico,"André Ouedraogo,Roberto Ferrari",Mamma,2026,,https://www.ibs.it/si-revera-deum-quaerit-linee-libro-andre-ouedraogo-roberto-ferrari/e/9788887303971,False,2026-04-01
Altri Editori,https://www.ibs.it/images/9788885721531_0_0_150_0_75.jpg,Balthazar. Il vangelo dei Magi,Teodoro Brescia,Nexus Edizioni,2026,,https://www.ibs.it/balthazar-vangelo-dei-magi-libro-teodoro-brescia/e/9788885721531,False,2026-04-01
Altri Editori,https://www.ibs.it/images/9788833568188_0_0_150_0_75.jpg,Corpi,Giuseppe Ivan Undari,Progetto Cultura,2026,,https://www.ibs.it/corpi-libro-giuseppe-ivan-undari/e/9788833568188,False,2026-04-02
Altri Editori,https://www.ibs.it/images/9788833568089_0_0_150_0_75.jpg,Breviario americano. L'itinerario di Tina Manferdini attraverso il pensiero nordamericano dai Padri Pellegrini al XIX secolo,Marco Dalbagno,Progetto Cultura,2026,,https://www.ibs.it/breviario-americano-itinerario-di-tina-libro-marco-dalbagno/e/9788833568089,False,2026-04-02
Editori Selezionati,https://www.ibs.it/images/9788832858556_0_0_150_0_75.jpg,Il prezzo della certezza. Perché i nostri valori più radicati ci inducono in errore,Steven Sloman,Raffaello Cortina Editore,2026,"Quando ti trovi di fronte a una decisione, stabilisci quali azioni siano appropriate considerando il miglior risultato possibile oppure i tuoi valori più profondi? Il prezzo della certezza mette a confronto queste due strategie decisionali contrapponendo le scelte basate sulle conseguenze con il privilegiare i propri valori. Steven Sloman sostiene che, sebbene entrambi i modi di decidere siano strumenti necessari per un buon decisore, le persone commettono l’errore di ricorrere ai propri valori più spesso di quanto dovrebbero, specialmente in ambito sociopolitico. Di conseguenza, semplifichiamo eccessivamente, proviamo disgusto e rabbia, e agiamo in modi che alimentano la polarizzazione sociale. Attraverso esempi storici e attuali delle due strategie decisionali in azione, l’autore fornisce una panoramica approfondita della psicologia dei processi decisionali, includendo studi sui giudizi, sul decision-making consapevole e inconsapevole, sul ruolo delle emozioni e persino un’analisi delle abitudini e delle dipendenze.",https://www.ibs.it/prezzo-della-certezza-perche-nostri-libro-steven-sloman/e/9788832858556,False,2026-03-27
Editori Selezionati,https://www.ibs.it/images/9788832858525_0_0_150_0_75.jpg,Psicodinamica della genitorialità. Comprendere e sostenere i legami familiari,Nicola Carone,Raffaello Cortina Editore,2026,"La genitorialità è una funzione psichica fondamentale per lo sviluppo del bambino, prima ancora che un ruolo sociale: riguarda il modo in cui il genitore pensa, sente e tiene nella mente il figlio. Integrando psicoanalisi, teoria dell’attaccamento, Infant Research, mentalizzazione e neurobiologia all’interno di una cornice psicodinamica, il volume offre una mappa teorica e clinica del “mestiere del genitore”, con l’obiettivo di cogliere le rappresentazioni, i legami e le trame familiari che sostengono, o ostacolano, la cura. Dopo aver delineato le coordinate teoriche essenziali, l’autore illustra le principali funzioni genitoriali e i rischi che possono compromettere il sistema di caregiving e la relazione genitori-figli. Il volume invita, infine, a considerare funzioni genitoriali e fattori di rischio in modo trasversale alla pluralità delle famiglie contemporanee e propone modelli di intervento a sostegno della genitorialità.",https://www.ibs.it/psicodinamica-della-genitorialita-comprendere-sostenere-libro-nicola-carone/e/9788832858525,False,2026-03-27
Altri Editori,https://www.ibs.it/images/9788893628631_0_0_150_0_75.jpg,EdiTEST. Kit completo scienze psicologiche. Con software di simulazione. Con video-corso,N/D,Editest,2026,,https://www.ibs.it/editest-kit-completo-scienze-psicologiche-libro-vari/e/9788893628631,True,2026-04-03
Editori Selezionati,https://www.ibs.it/images/9791256110513_0_0_150_0_75.jpg,La genitorialità. Strumenti di valutazione e interventi di sostegno,N/D,Carocci,2026,"La genitorialità costituisce la base per lo sviluppo delle principali competenze evolutive del bambino e dell'adolescente; sostenere la crescita significa quindi, prima di tutto, aiutare i genitori e prendersi cura di chi si prende cura. Il volume, nella nuova edizione, integra prospettive cliniche e risultati aggiornati della ricerca, approfondendo sia la valutazione sia il supporto delle competenze genitoriali, poiché un intervento efficace parte da un'analisi accurata di punti di forza e aree di fragilità. Nella prima parte vengono presentate procedure osservative fondamentali per esaminare l'interazione genitore-bambino e il funzionamento familiare, includendo il ruolo del temperamento. La seconda parte illustra i programmi di intervento di orientamento cognitivo-comportamentale e la terza esplora i modelli centrati sull'attaccamento: VIPP-SD, Connect, Circle of Security® e Video Intervention Therapy.",https://www.ibs.it/genitorialita-strumenti-di-valutazione-interventi-libro-vari/e/9791256110513,False,2026-03-27
Altri Editori,https://www.ibs.it/images/9791259849991_0_0_150_0_75.jpg,Dall’oggetto al soggetto. Teoria e psicoterapia psicoanalitica interpersonale contemporanea,Yari Ferrone,Armando Editore,2026,,https://www.ibs.it/dall-oggetto-al-soggetto-teoria-libro-yari-ferrone/e/9791259849991,False,2026-03-27
Altri Editori,https://www.ibs.it/images/9791257550233_0_0_150_0_75.jpg,La psicoanalisi di fronte alla sessualità. Espressioni attuali,N/D,Armando Editore,2026,,https://www.ibs.it/psicoanalisi-di-fronte-alla-sessualita-libro-vari/e/9791257550233,False,2026-03-27
Altri Editori,https://www.ibs.it/images/9791257550059_0_0_150_0_75.jpg,Scalare nel profondo. Una metodologia di Climbing Therapy,Marco Bruci,Armando Editore,2026,,https://www.ibs.it/scalare-nel-profondo-metodologia-di-libro-marco-bruci/e/9791257550059,False,2026-03-27
Altri Editori,https://www.ibs.it/images/9791256650767_0_0_150_0_75.jpg,"Pronto intervento di facilitazione. Trasformare conflitti, malessere ed errori in relazioni, gruppi, affetti, lavoro",Pino De Sario,Alpes Italia,2026,,https://www.ibs.it/pronto-intervento-di-facilitazione-trasformare-libro-pino-de-sario/e/9791256650767,False,2026-03-27
