Categoria_App,Copertina,Titolo,Autore,Editore,Anno,Descrizione,Link,Nuovo,Data_Aggiunta
Editori Selezionati,https://www.ibs.it/images/2000000164878_0_0_150_0_75.jpg,"Instant finance. La finanza e l'economia semplici, comprensibili, indispensabili. Per tutti",N/D,Gribaudo,2026,"Quando si sente parlare di finanza, spesso vengono alla mente le scene iconiche di famosi film sull’argomento. Ma conoscere la finanza non significa per forza calarsi nei panni di Jordan Belfort, il cinico e spietato protagonista di The Wolf of Wall Street interpretato da Leonardo DiCaprio: l’educazione finanziaria è molto altro e, come scopriremo in questo nostro percorso, è alla base della vita di tutti i giorni. Viviamo in una società caratterizzata da un sistema previdenziale fragile, da un mondo del lavoro con crescenti incertezze e spesso precario, dall’avanzata di nuovi paradigmi e di strumenti finanziari accessibili a tutti, da coloro che agiscono con maggiore consapevolezza ai meno esperti. Saremo sempre più chiamati a decidere, autonomamente, come gestire il nostro denaro e i nostri risparmi, anche in un’ottica di tipo precauzionale di lungo periodo. Ecco il punto: abbiamo tutte le conoscenze di base per poter prendere delle scelte davvero consapevoli? Piccolo spoiler: no! A dirlo sono ormai diversi studi fatti in questi anni a livello nazionale e internazionale. Tutto questo ha degli impatti importanti sul benessere delle persone, delle famiglie e quindi della società intera. Anche se a volte non ce ne rendiamo conto, economia e finanza sono parte della vita di tutti i giorni: se non ne conosciamo le regole, finiremo per fare scelte (o peggio “non scelte”) che influenzeranno negativamente il nostro benessere, presente e futuro. Questo libro, scritto e pensato dalla società leader nell’informazione e nell’educazione economico-finanziaria per i giovani in Italia, racconta finalmente l’economia e la finanza in termini semplici e comprensibili per tutti, andando in profondità ma mantenendo sempre un linguaggio chiaro e immediato. Inflazione, banche centrali, mutui, azioni, spread, ma anche trading e criptovalute non saranno più un mistero. Anzi, potranno trasformarsi in eccezionali opportunità di crescita personale ed economica.",https://www.ibs.it/instant-finance-finanza-economia-semplici-libro-vari/e/2000000164878,False,2026-04-21
Editori Selezionati,https://www.ibs.it/images/2000000164700_0_0_150_0_75.jpg,"Dormire bene, vivere meglio",Enrico Rolla,Gribaudo,2026,"L’insonnia è un male che affligge quasi dieci milioni di italiani nella sua forma cronica, e il 45% della popolazione nella sua forma transitoria. Questo libro, che attinge dalla grande esperienza dell’autore e si basa sulla terapia cognitivo comportamentale, offre la chiave per tornare a dormire finalmente sonni sereni. Esercizi – casi di studio – test – consigli e informazioni utili Il “buon” dormitore è chi aspetta che il sonno lo raggiunga (e, secondo alcuni studi, passa dalla veglia al sonno in un periodo che dura da uno a sette minuti). Il “cattivo” dormitore è chi insegue sempre il sonno. Questa semplice “formula” esprime una grande verità ed è il primo passo per capire e affrontare l’insonnia.",https://www.ibs.it/dormire-bene-vivere-meglio-libro-enrico-rolla/e/2000000164700,False,2026-04-21
Altri Editori,https://www.ibs.it/images/9791259855817_0_0_150_0_75.jpg,Reversione. La scoperta scientifica che sta cambiando la nostra visione del tumore,Andrea Pensotti,HarperCollins Italia,2026,,https://www.ibs.it/reversione-scoperta-scientifica-che-sta-libro-andrea-pensotti/e/9791259855817,False,2026-04-17
Editori Selezionati,https://www.ibs.it/images/2000000164892_0_0_150_0_75.jpg,HCE. La vendita e l'ingaggio del cliente,"Paolo Borzacchiello,Luca Mazzilli",Gribaudo,2026,"Un testo che rivoluziona l'idea di vendita, offrendo al lettore concetti e strumenti radicalmente nuovi. Il venditore diventa, così, colui che riesce a intuire e a soddisfare le necessità delle persone ancora prima che queste se ne rendano conto, grazie a un approccio rigorosamente scientifico e basato sulla scienza delle interazioni umane, che interpreta la vendita come il risultato di processi prevedibili e determinabili. HCE, la scienza che studia le interazioni umane, rappresenta un vero e proprio salto evolutivo nel mondo del commercio e del business: sulla base delle più moderne ricerche neuroscientifiche, finalmente un approccio rigoroso, serio e pratico al mondo delle vendite. Soprattutto, finalmente un approccio che funziona davvero.",https://www.ibs.it/hce-vendita-ingaggio-del-cliente-libro-paolo-borzacchiello-luca-mazzilli/e/2000000164892,False,2026-04-21
Editori Selezionati,https://www.ibs.it/images/9791222203775_0_0_150_0_75.jpg,La mia casa a prima vista. Comprare casa con i segreti della trasmissione TV,N/D,Vallardi A.,2026,"Sogniamo di cambiare vita, di trasferirci in un quartiere diverso, magari più vicini alla città o, al contrario, lontani dal traffico: come trovare la soluzione giusta per noi? Monolocale vicino al centro ma minuscolo, trilocale confortevole ma al piano terra, bifamiliare con giardino ma fuori città, attico di design ma senza ascensore: per acquistare serve capire prima di tutto cosa vogliamo davvero – ma anche a cosa siamo disposti a rinunciare. E in questa scelta non siamo soli: dagli schermi di ""Casa a prima vista"", il programma a tema immobiliare più amato d'Italia, tutto quello che serve sapere per fare il «grande passo» senza errori né rimpianti. Dalle tipologie di immobili all'identikit delle zone, fino ai segreti dietro il conteggio della metratura, una guida immobiliare a 360 gradi che ti accompagna step by step nel tuo nuovo progetto di vita, dal primo annuncio in agenzia alla firma dal notaio, per diventare tu stesso l'agente giusto per te. A cura di Matteo Corfiati, autore della trasmissione tv ""Casa a prima vista"" è un programma prodotto da Blu Yazmine e trasmesso su Real Time, in cui tre agenti immobiliari si sfidano per trovare la casa dei sogni a potenziali acquirenti. I partecipanti devono scegliere l'immobile perfetto dopo averne visitati tre, decretando così quale delle proposte si avvicina maggiormente alle loro richieste. Il programma ha debuttato nel maggio 2023.",https://www.ibs.it/mia-casa-a-prima-vista-libro-vari/e/9791222203775,False,2026-04-17
Editori Selezionati,https://www.ibs.it/images/9788804811053_0_0_150_0_75.jpg,Guarire la mente dopo un lutto,Thich Nhat Hanh,Mondadori,2026,"Quando perdiamo una persona che amiamo, il dolore può sembrarci un oceano in tempesta capace di travolgerci. In questo libro, il maestro zen Thich Nhat Hanh ci offre una ""zattera di salvataggio"", mostrandoci che la guarigione non è una meta lontana, ma un sentiero che inizia con un singolo respiro consapevole. Attraverso insegnamenti profondi, esercizi di meditazione e pratiche di cura di sé tratte dalla tradizione di Plum Village, dalla meditazione camminata alla consapevolezza del corpo, impariamo a non respingere la sofferenza, ma ad abbracciarla con la stessa tenerezza con cui una madre culla il suo bambino che piange, trasformando il ""fango"" del lutto nel ""fiore"" della compassione. Scopriremo così il miracolo dell'interconnessione: i nostri cari non sono scomparsi nel nulla, ma continuano a vivere in noi, in ogni nostra cellula e in ogni nostra azione.",https://www.ibs.it/guarire-mente-dopo-lutto-libro-thich-nhat-hanh/e/9788804811053,False,2026-04-22
Altri Editori,https://www.ibs.it/images/9788850274857_0_0_150_0_75.jpg,Secure. La guida rivoluzionaria per costruire una vita emotivamente stabile e sicura,Amir Levine,TEA,2026,,https://www.ibs.it/secure-guida-rivoluzionaria-per-costruire-libro-amir-levine/e/9788850274857,False,2026-04-21
Editori Selezionati,https://www.ibs.it/images/9791223801772_0_0_150_0_75.jpg,Non è ciò che volevo. I principi naturali della crescita personale contro il mito del successo per obiettivi,Enzo Celli,Piemme,2026,"Ci hanno convinti che crescere significhi salire, correre e spingersi sempre oltre. Che il successo sia una vetta da scalare a forza di volontà, sacrificando il nostro tempo e la nostra autenticità. Ma se non fosse così? Se la vera trasformazione non richiedesse sforzo, ma ascolto? In questo libro Enzo Celli ci invita a smettere di rincorrere versioni ideali di noi stessi per tornare alla nostra natura più profonda. Con una voce intima e diretta, l'autore smonta i miti tossici dello sviluppo personale moderno - l'ossessione per i risultati, l'uscita violenta dalla comfort zone, la paura vista come nemico - e ci riconsegna una saggezza dimenticata. Attraverso riflessioni e storie personali, scopriamo che in natura nulla accade all'improvviso: le crisi non sono fallimenti, ma soglie vitali in cui una forma vecchia fa spazio al nuovo; la crescita non è una linea retta verso l'alto, ma una radice che scende per darci stabilità. E per accompagnare questo percorso, il libro, alla fine di ogni capitolo, offre alcuni «gesti di natura»: pratiche semplici e potenti che aiutano a riportare le intuizioni dalla mente al corpo. Questo volume non è un manuale per raggiungere il successo o l'equilibrio interiore, ma una mappa per riscoprire la propria unicità e la nostra autenticità. Perché il vero successo non si misura da quanto in alto si arriva, ma dalla capacità di non tradirsi mai lungo il tragitto.",https://www.ibs.it/non-cio-che-volevo-principi-libro-enzo-celli/e/9791223801772,False,2026-04-21
Altri Editori,https://www.ibs.it/images/9791282435079_0_0_150_0_75.jpg,"Addio a sta c***o di ansia. Il geniale, irriverente metodo scientifico per liberarsene una volta per tutte e riappropriarsi finalmente della vita",Faith G. Harper,Libreria Pienogiorno,2026,,https://www.ibs.it/addio-a-sta-co-di-libro-faith-g-harper/e/9791282435079,True,2026-04-23
Altri Editori,https://www.ibs.it/images/9791259923110_0_0_150_0_75.jpg,L'arte di rimanere concentrati,"Mark Tigchelaar,Oscar de Boos",Corbaccio,2026,,https://www.ibs.it/arte-di-rimanere-concentrati-libro-mark-tigchelaar-oscar-de-boos/e/9791259923110,False,2026-04-17
Altri Editori,https://www.ibs.it/images/9791259855848_0_0_150_0_75.jpg,Prendila con filosofia. Manuale di fioritura personale,"Maura Gancitano,Andrea Colamedici",HarperCollins Italia,2026,,https://www.ibs.it/prendila-con-filosofia-manuale-di-libro-maura-gancitano-andrea-colamedici/e/9791259855848,False,2026-04-17
Altri Editori,https://www.ibs.it/images/9791255941927_0_0_150_0_75.jpg,La via del guerriero interiore,Alberto Leonardi,Edizioni Il Punto d'Incontro,2026,,https://www.ibs.it/via-del-guerriero-interiore-libro-alberto-leonardi/e/9791255941927,False,2026-04-17
Editori Selezionati,https://www.ibs.it/images/9791224201816_0_0_150_0_75.jpg,L'arte di non fare un ca**o senza sensi di colpa,Johan Anderberg,Newton Compton Editori,2026,"Quando tutti intorno a te stanno facendo la cosa sbagliata, non farti prendere dal panico. Non fare nulla. Non è pigrizia, è strategia. E ora ne hai le prove. Alcuni anni fa, un gruppo di ricercatori di Harvard ha condotto uno studio che ha evidenziato quanto sia difficile stare seduti da soli in una stanza senza alcuna distrazione. Dopo solo pochi minuti, quando ai partecipanti è stata offerta la possibilità di autoinfliggersi una scossa elettrica anziché restare inattivi, la maggior parte ha scelto un'esperienza spiacevole piuttosto che l'inazione. È proprio questo impulso che porta noi esseri umani a decisioni spesso disastrose. Ma può essere contrastato. Come? Imparando a non fare un ca**o. Grazie alle preziose lezioni e ai numerosi aneddoti storici contenuti in questo libro, possiamo essere passivi – non pigri – e imparare a vincere restando immobili, soli con i nostri pensieri. Un antidoto alla pressione moderna di essere veloci a ogni costo, alla frenesia della routine quotidiana e alla montagna di ansia e di stress che ne deriva. Per risolvere davvero i tuoi problemi e prendere le decisioni migliori, scopri il potere liberatorio dell'inazione.",https://www.ibs.it/arte-di-non-fare-cao-libro-johan-anderberg/e/9791224201816,False,2026-04-21
Editori Selezionati,https://www.ibs.it/images/9791223208557_0_0_150_0_75.jpg,L'arte di essere umani. Perché la creatività ci rende vivi,David Bueno,Giunti Editore,2026,"L'obiettivo di David Bueno è quello di dimostrare che arte, scienza, filosofia, linguaggio, gioco e movimento sono funzioni biologiche, non solo culturali, e che educare attraverso le arti significa coltivare empatia, pensiero critico, identità e benessere. Con uno stile chiaro e accessibile, l'autore propone un'educazione più umana, integrata e completa, capace di preparare persone libere, consapevoli e creative.",https://www.ibs.it/arte-di-essere-umani-perche-libro-david-bueno/e/9791223208557,False,2026-04-16
Editori Selezionati,https://www.ibs.it/images/9791222203836_0_0_150_0_75.jpg,Il metodo meno tempo più resa. L'arte della concentrazione per studiare e lavorare meglio,Chris Bailey,Vallardi A.,2026,"Riusciamo a concentrarci per un massimo di 40 secondi: lavoriamo di più ma otteniamo meno, studiamo tanto ma ricordiamo poco. Tutti sanno che spegnere le notifiche, lavorare senza interruzioni e ritagliarsi tempo per pensare porta a risultati straordinari, ma è proprio tra call online, social che lampeggiano e mail «urgenti» che la vita reale ci mette alla prova. Chris Bailey, esperto mondiale di produttività, ha studiato per anni la scienza della concentrazione, dimostrando che non è un talento innato ma un’abilità da allenare. Il suo metodo «meno tempo più resa» è basato su due strategie complementari: l’hyperfocus, concentrazione profonda su un singolo compito che permette di completare in poche ore ciò che richiederebbe giorni, e lo scatterfocus, modalità strategica di pensiero libero che stimola connessioni creative e ricarica la mente. Alternandole consapevolmente, Bailey ci mostra come riconoscere e neutralizzare le distrazioni prima che frammentino l’attenzione, come creare ambienti favorevoli alla concentrazione, gestire smartphone e tecnologia, sfruttare i propri ritmi biologici e trasformare le pause in autentici momenti di rigenerazione creativa.",https://www.ibs.it/metodo-meno-tempo-piu-resa-libro-chris-bailey/e/9791222203836,False,2026-04-17
Altri Editori,https://www.ibs.it/images/9788872242940_0_0_150_0_75.jpg,Un attimo e arrivo! Gestire gli schermi per crescere una generazione attenta,Simone Lanza,Sonda,2026,,https://www.ibs.it/attimo-arrivo-gestire-schermi-per-libro-simone-lanza/e/9788872242940,False,2026-04-17
Altri Editori,https://www.ibs.it/images/9788857311364_0_0_150_0_75.jpg,"Crescere a tavola. Dallo svezzamento ai primi anni di scuola, come costruire un rapporto sereno con il cibo",Arianna Mazzoni,Red Edizioni,2026,,https://www.ibs.it/crescere-a-tavola-dallo-svezzamento-libro-arianna-mazzoni/e/9788857311364,True,2026-04-23
Altri Editori,https://www.ibs.it/images/9788827234273_0_0_150_0_75.jpg,Micomedicina,Maria Letizia Primo,Edizioni Mediterranee,2026,,https://www.ibs.it/micomedicina-libro-maria-letizia-primo/e/9788827234273,False,2026-04-17
Editori Selezionati,https://www.ibs.it/images/9788820085421_0_0_150_0_75.jpg,Faccio sempre tutto io,Luigi Di Razza,Sperling & Kupfer,2026,"Cosa accadrebbe se, una mattina qualunque, ti svegliassi e tua moglie fosse sparita? Non per fare la spesa. Non per una colazione con le amiche. Sparita. Punto. È quello che accade a Luca - marito convinto di avere tutto sotto controllo e padre affettuoso ma strategicamente «distratto» - quando scopre che non solo Elena non è in casa, ma che anche tutte le altre mamme del paese sono svanite nel nulla. Restano bambini urlanti, frigoriferi vuoti e uomini in pigiama poco preparati alla verità che li attende: scoprire che «tutto sotto controllo», a volte, significa anche sapere dove sono le salviettine umidificate quando servono davvero. Incredibile. Nel giro di poche ore il paese precipita in una tragicomica distopia domestica: uomini che assaltano il supermercato come fosse il Black Friday, pannolini cambiati con i guanti da forno, robot aspirapolvere elevati a eroi nazionali; e intanto, mentre i padri cercano disperatamente qualcuno che sappia come avviare una lavatrice (che, strano a dirsi, non si avvia «da sola»), i bambini più grandi proclamano l'anarchia. Con il suo sguardo ironico e autoironico - lo stesso che più di 250.000 follower amano sui social - Luigi Di Razza racconta un mondo capovolto, che fa ridere e al tempo stesso ci costringe a riflettere sul carico mentale delle donne. Una storia contemporanea che parla di responsabilità, amore, consapevolezza, e che nasconde domande scomode: cosa diamo per scontato ogni giorno? E se le mamme non fossero sparite per fuggire, ma solo per... farsi vedere?",https://www.ibs.it/faccio-sempre-tutto-io-libro-luigi-di-razza/e/9788820085421,False,2026-04-21
Editori Selezionati,https://www.ibs.it/images/9788820085148_0_0_150_0_75.jpg,Cosa non è l'amore. Smascherare le illusioni per riscoprire la verità,Luana Di Pietro,Sperling & Kupfer,2026,"«L'amore, proprio come altre cose in natura, acquista senso solo per contrasto.» Questa verità, posta in apertura del volume che avete tra le mani, traccia in poche parole il percorso che Luana Di Pietro ha voluto seguire in questo libro. Infatti, per capire cosa sia davvero l'amore bisogna imparare a individuare il suo opposto e le maschere che troppo spesso le relazioni sentimentali indossano per celare la propria natura. Insomma: per cogliere il bianco dobbiamo essere in grado di riconoscere il nero, e per riconoscere l'amore dobbiamo prima di tutto comprendere cosa l'amore non è. Perché quando parliamo di sentimenti è facile prendere abbagli e rimanere impigliati in rapporti che svuotano invece di nutrire, logorano anziché arricchire. In queste pagine si parla di manipolazione affettiva, di trauma bonding, del perché si resta quando sarebbe il caso di lasciar andare; si affrontano casi di «quasi amore», si racconta di amori impossibili, delle relazioni virtuali e di molto altro. Finché, un capitolo alla volta - attraverso l'analisi di storie e casi reali -, riconosceremo le trappole emotive nelle quali è così semplice cadere e impareremo a disinnescarle per evitare di inciamparci nuovamente. Fino a comprendere che cos'è davvero l'amore, dove si crea, come possiamo proteggerlo.",https://www.ibs.it/cosa-non-amore-smascherare-illusioni-libro-luana-di-pietro/e/9788820085148,False,2026-04-21
Editori Selezionati,https://www.ibs.it/images/2000000164922_0_0_150_0_75.jpg,"Attivi, sani felici",Gianfranco Trapani,Gribaudo,2026,"Un manuale per tutte le età, da zero a 99 anni e oltre, scritto e pensato da un gruppo di autorevoli studiosi che ribadisce come, con le informazioni e le pratiche giuste, sia facile vivere in salute. Fondamentale un’alimentazione corretta, basata non su un’ipotetica dieta mediterranea, ma sulla versione migliore di essa, cioè quella che comprende gli ingredienti più vicini alla nostra cultura e al nostro territorio, ma è importantissima anche l’attività fisica, da svolgersi con ritmi e modi diversi a seconda dell’età e della nostra forma. Un libro pratico – supportato dalle ricerche e dagli studi più aggiornati – da portare sempre con sé, impreziosito anche da una serie di esercizi per iniziare, fin da subito, a vivere una vita più attiva, più sana e, dunque, più felice.",https://www.ibs.it/attivi-sani-felici-libro-gianfranco-trapani/e/2000000164922,False,2026-04-21
Editori Selezionati,https://www.ibs.it/images/2000000164908_0_0_150_0_75.jpg,"Crescere con la testa e con il cuore. Ispirato agli insegnamenti di tre grandi maestri: Bowlby, Montessori, Doman",Nicola Tomba,Gribaudo,2026,"Fare il genitore è il mestiere più bello e nello stesso tempo più difficile del mondo, un mestiere che si impara quotidianamente, giorno dopo giorno, con il cuore e con la testa. \Questo libro è nato per farti scoprire i principi chiave che possono aiutarti davvero a far maturare un sano equilibrio psicologico nel tuo bambino, e a fargli acquisire competenze di altissimo livello, che lo accompagneranno per tutta la vita. In questa affascinante e impegnativa avventura abbiamo chiesto aiuto a tre grandi maestri della pedagogia e della psicologia come John Bowlby, Maria Montessori e Glenn Doman. Mettendo in pratica i loro insegnamenti, grazie a piccole attenzioni quotidiane, potrai aiutare i tuoi figli a crescere con l'autonomia, la sicurezza e le capacità necessarie per realizzare i propri sogni e diventare gli adulti di domani.""",https://www.ibs.it/crescere-con-testa-con-cuore-libro-nicola-tomba/e/2000000164908,False,2026-04-21
Editori Selezionati,https://www.ibs.it/images/2000000164809_0_0_150_0_75.jpg,Il cibo buono. C'è più gusto a nutrirsi bene,"Antonella Viola,Daniele Nucci",Gribaudo,2026,"C'è più gusto a nutrirsi bene, con cibi che fanno bene al corpo, alla mente e al Pianeta. Grazie a ingredienti facilmente reperibili, che costituiscono fra l'altro i cardini della Dieta Mediterranea, e a moltissimi consigli e informazioni utili, gli autori propongono un libro a metà strada fra saggio e ricettario, con un unico obiettivo in mente: il benessere della persona e la sostenibilità. Perché, al di là delle tante mode del momento, esiste un \cibo buono, buono per noi e per chi ci sta accanto. Scopriamolo insieme.""",https://www.ibs.it/cibo-buono-c-piu-gusto-libro-antonella-viola-daniele-nucci/e/2000000164809,False,2026-04-21
Editori Selezionati,https://www.ibs.it/images/2000000164687_0_0_150_0_75.jpg,Psicologia al tuo servizio. Migliora la tua vita psicoaggiornando il tuo sistema operativo cerebrale,Alessio Rocco Ranieri,Gribaudo,2026,"Il libro si divide in due parti. La prima, da assimilare, che ti farà porre le fondamenta per meglio attuare (e comprendere) gli psicoaggiornamenti. Qui verranno illustrate le basi della psicologia, ma anche le scoperte più recenti, con un linguaggio sempre fresco, chiaro e originale. La seconda è da scrivere, stropicciare, strappare, meditare e abbracciare. Qui troverai gli psicoaggiornamenti, cioè quelle piccole e grandi accortezze che, per usare le parole dell'autore, ti permetteranno di «vivere una vita che sia sincronizzata con la tua personalità eppure lontana dalle trappole dell'ego, stimolante eppure equilibrata, profonda eppure leggera, serena eppure colma di esperienze arricchenti».",https://www.ibs.it/psicologia-al-tuo-servizio-migliora-libro-alessio-rocco-ranieri/e/2000000164687,False,2026-04-21
Editori Selezionati,https://www.ibs.it/images/2000000164656_0_0_150_0_75.jpg,Allena la tua mente,Matteo Salvo,Gribaudo,2026,"Un manuale di istruzioni pratiche, con tanti esercizi per migliorare le tue capacità. L'allenamento della mente è diviso in aree specifiche, ciascuna delle quali comprende esercizi mirati allo sviluppo delle singole competenze. Abilità mentali non tecniche: agilità, creatività, lucidità, autocontrollo focalizzazione, problem solving. Abilità mentali tecniche: pensiero logico, calcoli mentali, memorizzazione, lettura veloce. In treno, in autobus, in sala d'attesa, in coda e ovunque tu voglia dedicarti 5 minuti... leggere, divertirsi e mettersi alla prova focalizzandosi sulle priorità e sfruttando ogni piccola pausa.",https://www.ibs.it/allena-tua-mente-libro-matteo-salvo/e/2000000164656,False,2026-04-21
Editori Selezionati,https://www.ibs.it/images/2000000164632_0_0_150_0_75.jpg,La rana bollita. Il libro che prende per mano chi soffre di ansia e attacchi di panico,Marina Innorta,Gribaudo,2026,"Una sera, all’improvviso, Marina sviene. Il malessere pare coglierla alla sprovvista, ma in realtà sono almeno due anni che soffre di vertigini, tachicardia, nausea e insonnia. Sa di cosa si tratta: è l’ansia, sua compagna di vita dai tempi dell’università. Ha imparato a riconoscerla, eppure ha cercato di ignorarla, convinta di poter tirare avanti. È quello che, secondo una famosa metafora, succede alla rana: se viene messa nell’acqua tiepida con la fiamma bassa, non avverte il calore e finisce bollita, senza trovare la forza di reagire. Con il tono autentico di chi l’ha vissuto in prima persona, Marina Innorta approfondisce le origini del disturbo, i sintomi più gravi e le cure più diffuse, raccontando com’è fuggita dal pentolone di panico che la stava intrappolando e aiutandoci a conquistare un nuovo equilibrio.",https://www.ibs.it/rana-bollita-libro-che-prende-libro-marina-innorta/e/2000000164632,False,2026-04-21
Editori Selezionati,https://www.ibs.it/images/2000000164625_0_0_150_0_75.jpg,Non mi freghi! I segreti del linguaggio del corpo svelati da un agente FBI,"Joe Navarro,Marvin Karlins",Gribaudo,2026,"«In ogni interazione umana sono contenute informazioni non dette che rivelano ciò che la gente pensa, sente e intende fare. Facendo buon uso della conoscenza del linguaggio non verbale sarete in grado di migliorare il vostro rapporto con gli altri, di sentirvi più sicuro e di carpire i segreti del comportamento umano.» Nei venticinque anni in cui ha lavorato per l'FBI come esperto di comunicazione non verbale, Joe Navarro ha interrogato sospetti, smascherato spie e sgominato complotti. Il suo segreto? Osservare attentamente l'interlocutore. Un movimento appena accennato delle sopracciglia, la posizione delle gambe, una smorfia rapida del viso: saper interpretare questi gesti permette di decodificare le intenzioni nascoste di chi abbiamo di fronte. In questo libro, Joe Navarro ci guida nell'affascinante mondo del linguaggio del corpo, accompagnandoci alla scoperta dei segreti che espressioni e posture involontariamente svelano.",https://www.ibs.it/non-mi-freghi-segreti-del-libro-joe-navarro-marvin-karlins/e/2000000164625,False,2026-04-21
