Categoria_App,Copertina,Titolo,Autore,Editore,Anno,Descrizione,Link,Nuovo,Data_Aggiunta
Altri Editori,https://www.ibs.it/images/9791259756114_0_0_150_0_75.jpg,Il santo di Assisi. Considerazioni inattuali,Stefano Bocciolesi,Tau,2026,,https://www.ibs.it/santo-di-assisi-considerazioni-inattuali-libro-stefano-bocciolesi/e/9791259756114,False,2026-07-20
Altri Editori,https://www.ibs.it/images/9791259756169_0_0_150_0_75.jpg,Francesco. Il dito e la luna,"Franco Nembrini,Fabio Rosini",Tau,2026,,https://www.ibs.it/francesco-dito-luna-libro-franco-nembrini-fabio-rosini/e/9791259756169,False,2026-07-22
Altri Editori,https://www.ibs.it/images/9788816307612_0_0_150_0_75.jpg,Ambrogio vescovo di Milano. Nuova ediz.,Ildefonso Schuster,Jaca Book,2026,,https://www.ibs.it/ambrogio-vescovo-di-milano-nuova-libro-ildefonso-schuster/e/9788816307612?inventoryId=895705393,False,2026-07-17
Altri Editori,https://www.ibs.it/images/9791255049586_0_0_150_0_75.jpg,"Un tracio chiamato Orfeo. L'Orfismo, tra sciamanesimo e ricerca dell'immortalità",Nicola Bizzi,Aurora Boreale,2026,,https://www.ibs.it/tracio-chiamato-orfeo-orfismo-tra-libro-nicola-bizzi/e/9791255049586?inventoryId=1036417111,False,2026-07-16
Altri Editori,https://www.ibs.it/images/9791281917637_0_0_150_0_75.jpg,I miei 25 anni di attività esorcistica,Benigno (Fra),Sanpino,2026,,https://www.ibs.it/miei-25-anni-di-attivita-libro-benigno-fra/e/9791281917637,False,2026-07-22
Altri Editori,https://www.ibs.it/images/9788831475471_0_0_150_0_75.jpg,Un sogno di Fraternità. Tutti gli scritti di don Tonino Bello in sintesi,N/D,Metis Academic Press,2026,,https://www.ibs.it/sogno-di-fraternita-tutti-scritti-libro-vari/e/9788831475471,False,2026-07-21
Altri Editori,https://www.ibs.it/images/9791280736833_0_0_150_0_75.jpg,Compendio della Dottrina Cristiana di P. Ottavio Imberti,Ottavio Imberti,Dottrinari,2026,,https://www.ibs.it/compendio-della-dottrina-cristiana-di-libro-ottavio-imberti/e/9791280736833,True,2026-07-23
Altri Editori,https://www.ibs.it/images/9791259756251_0_0_150_0_75.jpg,L'ultimo viaggio di san Francesco,Angelo Menichelli,Tau,2026,,https://www.ibs.it/ultimo-viaggio-di-san-francesco-libro-angelo-menichelli/e/9791259756251,False,2026-07-21
Altri Editori,https://www.ibs.it/images/9791257011918_0_0_150_0_75.jpg,"Archivum fratrum praedicatorum. Ediz. italiana, francese, inglese e spagnola (2026). Vol. 2",N/D,Viella,2026,,https://www.ibs.it/archivum-fratrum-praedicatorum-ediz-italiana-libro-vari/e/9791257011918,False,2026-07-21
Altri Editori,https://www.ibs.it/images/9791256272297_0_0_150_0_75.jpg,"Maria, verso l'unità. La svolta anglicana dal sec. XVII alla Dichiarazione congiunta di Seattle del 2005",Marco Torraca,Marcianum Press,2026,,https://www.ibs.it/maria-verso-unita-svolta-anglicana-libro-marco-torraca/e/9791256272297?inventoryId=975562873,False,2026-07-17
Altri Editori,https://www.ibs.it/images/9791255950691_0_0_150_0_75.jpg,"«Chi dite che io sia?» (Mc 8,29). In ascolto del Vangelo secondo Marco. Sussidio per gli incontri dei partecipanti ai gruppi di ascolto della parola 2026/27",N/D,In Dialogo,2026,,https://www.ibs.it/chi-dite-che-io-sia-libro-vari/e/9791255950691,False,2026-07-22
Altri Editori,https://www.ibs.it/images/9791255950684_0_0_150_0_75.jpg,"«Egli vi precede in Galilea» (Mc 16,7b). In ascolto del vangelo di Marco. Sussidio per gli animatori dei gruppi di ascolto della parola 2026/27",N/D,In Dialogo,2026,,https://www.ibs.it/egli-vi-precede-in-galilea-libro-vari/e/9791255950684,False,2026-07-22
Altri Editori,https://www.ibs.it/images/9791255083467_0_0_150_0_75.jpg,Antonio Gaudì. L'architetto di Dio. Ediz. illustrata,Massimiliano Taroni,Velar,2026,,https://www.ibs.it/antonio-gaudi-architetto-di-dio-libro-massimiliano-taroni/e/9791255083467,False,2026-07-22
Altri Editori,https://www.ibs.it/images/9791255060680_0_0_150_0_75.jpg,Cinque Pani d'orzo 2027,N/D,VITREND,2026,,https://www.ibs.it/cinque-pani-d-orzo-2027-libro-vari/e/9791255060680,False,2026-07-22
Altri Editori,https://www.ibs.it/images/9791254825174_0_0_150_0_75.jpg,"Breviarium Hispano-Mozarabicum. Una reconstrucción desde sus fuentes. Vol. 1: Introducción general, fuentes, Ordinario, Adviento y Navidad",Gabriel Ramis Miquel,Edusc,2026,,https://www.ibs.it/breviarium-hispano-mozarabicum-reconstruccion-desde-libro-gabriel-ramis-miquel/e/9791254825174,True,2026-07-23
Altri Editori,https://www.ibs.it/images/9788898999941_0_0_150_0_75.jpg,Rivelazione. Leggere il libro dell'Apocalisse,Paul Van Oosten,Eternity Libri,2026,,https://www.ibs.it/rivelazione-leggere-libro-dell-apocalisse-libro-paul-van-oosten/e/9788898999941,False,2026-07-21
Editori Selezionati,https://www.ibs.it/images/9788892251724_0_0_150_0_75.jpg,Ulderico Lambertucci. Al passo dell'anima,"Daniele Morini,Michele Marinangeli",San Paolo Edizioni,2026,"Un uomo che corre per pregare, un muratore che trasforma la fatica in testimonianza, un pellegrino capace di attraversare il mondo inseguendo la pace. In queste pagine Daniele Morini e Michele Marinangeli raccontano la straordinaria avventura di Ulderico Lambertucci, maratoneta marchigiano che, superati i cinquant'anni, decide di affidare ai propri passi una missione spirituale. Da Loreto a Lourdes, da Fatima a Częstochowa, fino alle grandi sfide verso Gerusalemme e la Cina di Matteo Ricci, ogni viaggio diventa un dialogo tra corpo e anima, tra strada e fede. Con una forza semplice e ostinata, Ulderico dimostra che il limite può essere superato quando il cuore trova una direzione. Un racconto intenso di sacrificio, amicizia e speranza, che invita il lettore a interrogarsi sul proprio cammino e sul significato più profondo del viaggio umano.",https://www.ibs.it/ulderico-lambertucci-al-passo-dell-libro-daniele-morini-michele-marinangeli/e/9788892251724,False,2026-07-22
Editori Selezionati,https://www.ibs.it/images/9788892251243_0_0_150_0_75.jpg,Santa Monica,Giovanni Falbo,San Paolo Edizioni,2026,"Nata a Tagaste in Numidia nel 331, Monica sposò un nobile pagano di nome Patrizio, dal temperamento impulsivo e irascibile. Si trovò dunque a vivere un matrimonio impegnativo, reso ancor più difficile dalla nascita di Agostino, figlio tanto geniale quanto inquieto. Donna forte, tuttavia, fu all'altezza della situazione. Con la sua opera paziente tenne unita la famiglia, si guadagnò il rispetto e l'amore del marito e seguì instancabile il cammino del figlio fino a guidarlo alla conversione. L'Autore, patrologo e storico della Chiesa antica, ne ricostruisce la vita e la personalità sullo sfondo della storia e della società del tempo. Donna sensibile e attenta, Monica non solo comprese le doti del figlio, ma fece di tutto per orientarne i passi nella giusta direzione. Monica morì nel 387 alle porte di Roma, dove è particolarmente venerata. I fedeli riconoscono in lei la madre che dovette affrontare le difficoltà proprie della vita di famiglia. Per questo, al di là della lontananza nel tempo, è ancora oggi una santa attuale, venerata e amata.",https://www.ibs.it/santa-monica-libro-giovanni-falbo/e/9788892251243,False,2026-07-21
Editori Selezionati,https://www.ibs.it/images/9788892251052_0_0_150_0_75.jpg,101 pensieri per una vita buona,Sant'Agostino,San Paolo Edizioni,2026,"Che cosa rende davvero felice l'uomo? Dove si trova la verità? Come si impara ad amare, a perdonare, a vivere con giustizia e pace? Da oltre sedici secoli sant'Agostino continua a provocare e interrogare la mente e il cuore umano con una sorprendente attualità. Vescovo, pensatore e grande testimone della fede, Agostino è stato prima di tutto un instancabile cercatore della verità. La sua esperienza personale — fatta di inquietudine, ricerca e conversione — attraversa le sue opere e dà alle sue parole una forza capace di parlare ancora oggi a ogni lettore. Questa raccolta propone 101 brevi testi, scelti tra le pagine più intense delle opere agostiniane, dalle Confessioni ai Sermoni, dai commenti biblici ai trattati spirituali. Sono pensieri brevi ma profondi, che toccano i grandi temi della vita, e nei quali ciascuno potrà riconoscere le proprie personali inquietudini. Un piccolo libro da leggere lentamente, un pensiero alla volta, lasciandosi guidare da una delle voci più luminose della tradizione cristiana. Perché, come scrive Agostino, la verità non è lontana: abita nel cuore dell'uomo che ha il coraggio di cercarla.",https://www.ibs.it/101-pensieri-per-vita-buona-libro-sant-agostino/e/9788892251052,False,2026-07-21
Editori Selezionati,https://www.ibs.it/images/9788892250932_0_0_150_0_75.jpg,Somebody to love. La spiritualità nelle canzoni dei Queen,Federico Russo,San Paolo Edizioni,2026,"La spiritualità è un ingrediente privilegiato della musica, la troviamo in un assolo di chitarra che sembra una preghiera, in un acuto che squarcia il cielo, in un ritornello che diventa coro collettivo. È proprio lì che questo libro ci conduce: nel cuore mistico e visionario delle canzoni dei Queen. Da Bohemian Rhapsody, con il suo drammatico “Is this the real life? Is this just fantasy?"", fino all'invocazione quasi evangelica di Somebody to Love (“Can anybody find me somebody to love?""), passando per l'inno cosmico di The Show Must Go On (“Inside my heart is breaking, my make-up may be flaking""), le loro note non parlano solo d'amore o di ribellione, ma di ricerca, caduta e redenzione. Attraverso la voce carismatica di Freddie Mercury, l'eleganza compositiva di Brian May, la solidità di John Deacon e la sensibilità ritmica di Roger Taylor, i Queen hanno costruito un universo simbolico in cui convivono sacro e profano, luce e ombra, dubbio e fede. “Who wants to live forever?"" si chiedono nell'omonima canzone, trasformando una ballata in una meditazione sull'eternità e sul limite umano. Questo libro esplora i riferimenti biblici, le suggestioni e la tensione verso l'assoluto che attraversano la loro produzione. Non è solo un viaggio musicale: è un cammino interiore. Perché nelle canzoni dei Queen la spiritualità è esperienza viva; non è risposta definitiva, ma domanda ardente. È il grido dell'uomo che cade e si rialza, che dubita e canta, che teme la fine ma continua a creare bellezza.",https://www.ibs.it/somebody-to-love-spiritualita-nelle-libro-federico-russo/e/9788892250932,False,2026-07-21
Editori Selezionati,https://www.ibs.it/images/9788892250673_0_0_150_0_75.jpg,La collina in fiore. La vita rinasce nella landa atomica,Takashi Paolo Nagai,San Paolo Edizioni,2026,"Nella primavera del 1948 — tre anni dopo l'esplosione nucleare che aveva ridotto Urakami, l'area nord di Nagasaki, a un deserto di cenere — Takashi Nagai, medico affetto da leucemia, decide di trasferirsi a vivere in una piccola capanna costruita nel cuore della landa atomica. Questo libro è una sorta di diario fatto di brevi racconti, meditazioni e haiku, attraverso i quali l'autore racconta con stupore la rinascita spirituale e materiale dell'antico quartiere cristiano di Urakami, concentrandosi sulle storie di coloro che hanno saputo dare testimonianza di speranza e gratuità, trasformando quel luogo deserto in una “collina in fiore"". Il testo è permeato da un grande respiro cosmico e una nota lirica che esprimono la sensibilità della tradizione millenaria del popolo giapponese e che l'autore vive come propria fino in fondo, sviluppandola però in modo del tutto nuovo in forza della fede cristiana. Come in tutte le sue opere, anche qui traspare quell'incredibile positività con cui Takashi Nagai guarda la realtà e che sempre colpisce i suoi numerosi lettori.",https://www.ibs.it/collina-in-fiore-vita-rinasce-libro-takashi-paolo-nagai/e/9788892250673,False,2026-07-22
Editori Selezionati,https://www.ibs.it/images/9788892250413_0_0_150_0_75.jpg,La via del ritorno. Esercizi spirituali,Divo Barsotti,San Paolo Edizioni,2026,"Questo libro propone un corso di esercizi spirituali. Barsotti, con la sua consueta profondità teologica che illumina l'ineffabile piano di Dio in Cristo, rivelatore dell'uomo all'uomo, presenta lo sviluppo della vita cristiana come cammino di ritorno al paradiso da cui il peccato ha allontanato. Nelle singole meditazioni egli riflette sulle leggi secondo le quali il ritorno si realizza: la conversione, l'umiltà, il distacco, l'obbedienza, l'infanzia spirituale, la verginità, il lavoro, il silenzio. Tutto in dipendenza dalla Parola di Dio e dall'azione dello Spirito Santo, nell'inserimento sacramentale, al fine che nasca e viva l'uomo secondo l'immagine, Cristo, che porta al Padre. È veramente singolare la capacità di Barsotti di essere diverso e nuovo ogni volta. Egli ha il magistrale potere di portare alla luce il significato e la necessità del percorso ascetico-mistico nella vita cristiana.",https://www.ibs.it/via-del-ritorno-esercizi-spirituali-libro-divo-barsotti/e/9788892250413,False,2026-07-21
Altri Editori,https://www.ibs.it/images/9788884249579_0_0_150_0_75.jpg,I sette santuari dell'arcangelo Michele. I sette luoghi dove lo Spirito ci parla,Andrea Rusconi,Mimep-Docete,2026,,https://www.ibs.it/sette-santuari-dell-arcangelo-michele-libro-andrea-rusconi/e/9788884249579,True,2026-07-23
Altri Editori,https://www.ibs.it/images/9788878365346_0_0_150_0_75.jpg,Santiago e il pellegrino. Dialoghi lungo il cammino,Paolo Gessaga,IPL,2026,,https://www.ibs.it/santiago-pellegrino-dialoghi-lungo-cammino-libro-paolo-gessaga/e/9788878365346,False,2026-07-22
Altri Editori,https://www.ibs.it/images/9788868948702_0_0_150_0_75.jpg,Agenda liturgico pastorale 2026/2027 (piccola). Rito ambrosiano,N/D,Centro Ambrosiano,2026,,https://www.ibs.it/agenda-liturgico-pastorale-20262027-piccola-libro-vari/e/9788868948702,False,2026-07-22
Altri Editori,https://www.ibs.it/images/9788868948696_0_0_150_0_75.jpg,Agenda liturgico pastorale 2026/2027 (grande). Rito ambrosiano,N/D,Centro Ambrosiano,2026,,https://www.ibs.it/agenda-liturgico-pastorale-20262027-grande-libro-vari/e/9788868948696,True,2026-07-23
Altri Editori,https://www.ibs.it/images/9788863664485_0_0_150_0_75.jpg,Madeleine Delbrêl e lo scautismo,Sayed Marroun,Gribaudi,2026,,https://www.ibs.it/madeleine-delbrel-scautismo-libro-sayed-marroun/e/9788863664485,False,2026-07-22
Altri Editori,https://www.ibs.it/images/9788851431709_0_0_150_0_75.jpg,"Cristo nei suoi misteri tra liturgia, arte e poesia","Sandro Carotta,Maria Manuela Cavrini",Ancora,2026,,https://www.ibs.it/cristo-nei-suoi-misteri-tra-libro-sandro-carotta-maria-manuela-cavrini/e/9788851431709,True,2026-07-23
Altri Editori,https://www.ibs.it/images/9788839910806_0_0_150_0_75.jpg,In difesa del pane e del vino,Sibille Benoit,Queriniana,2026,,https://www.ibs.it/in-difesa-del-pane-del-libro-sibille-benoit/e/9788839910806,False,2026-07-21
Altri Editori,https://www.ibs.it/images/9788838256615_0_0_150_0_75.jpg,Monsignor Tarcisio Vincenzo Benedetti. Un carmelitano di fiamma,Andrea Formenti,Studium,2026,,https://www.ibs.it/monsignor-tarcisio-vincenzo-benedetti-carmelitano-libro-andrea-formenti/e/9788838256615?inventoryId=975563061,False,2026-07-17
Altri Editori,https://www.ibs.it/images/9788831288590_0_0_150_0_75.jpg,In viaggio con Romena,N/D,Edizioni Romena,2026,,https://www.ibs.it/in-viaggio-con-romena-libro-vari/e/9788831288590,True,2026-07-23
Altri Editori,https://www.ibs.it/images/9788831288583_0_0_150_0_75.jpg,Grazie,Luigi Verdi,Edizioni Romena,2026,,https://www.ibs.it/grazie-libro-luigi-verdi/e/9788831288583,True,2026-07-23
Altri Editori,https://www.ibs.it/images/9788831135351_0_0_150_0_75.jpg,Noergia Trinitaria. La experiencia de Dios en Xavier Zubiri,Jesus Moran Cepedano,Città Nuova,2026,,https://www.ibs.it/noergia-trinitaria-experiencia-de-dios-libro-jesus-moran-cepedano/e/9788831135351,True,2026-07-23
Editori Selezionati,https://www.ibs.it/images/9788826611082_0_0_150_0_75.jpg,The challenge of synodality,N/D,Libreria Editrice Vaticana,2026,,https://www.ibs.it/the-challenge-of-synodality-libro-vari/e/9788826611082,True,2026-07-23
Editori Selezionati,https://www.ibs.it/images/9788826610665_0_0_150_0_75.jpg,Atti e documenti I-LXX,N/D,Libreria Editrice Vaticana,2026,,https://www.ibs.it/atti-documenti-lxx-libro-vari/e/9788826610665,True,2026-07-23
Altri Editori,https://www.ibs.it/images/9788801070057_0_0_150_0_75.jpg,Camminare nella luce del Vangelo. Contemplativi nell'azione. Itinerario di catechesi per bambini e ragazzi,N/D,Editrice Elledici,2026,,https://www.ibs.it/camminare-nella-luce-del-vangelo-libro-vari/e/9788801070057,True,2026-07-23
Altri Editori,https://www.ibs.it/images/9791223621547_0_0_150_0_75.jpg,Gesù: vero dio o vero uomo?,Francesco Lambrocco,Gruppo Albatros Il Filo,2026,,https://www.ibs.it/gesu-vero-dio-o-vero-libro-francesco-lambrocco/e/9791223621547?inventoryId=1025499311,True,2026-07-23
Altri Editori,https://www.ibs.it/images/9791257631857_0_0_150_0_75.jpg,"La volontà divina e la condotta morale. Ebraismo, Cristianesimo e Islam a confronto",Maria De Fazio,Kimerik,2026,,https://www.ibs.it/volonta-divina-condotta-morale-ebraismo-libro-maria-de-fazio/e/9791257631857,True,2026-07-23
Altri Editori,https://www.ibs.it/images/9791281251281_0_0_150_0_75.jpg,San Pantaleone. Testimonianze di fede per intercessione del «medico miracoloso»,N/D,D&P Editori,2026,,https://www.ibs.it/san-pantaleone-testimonianze-di-fede-libro-vari/e/9791281251281,True,2026-07-23
Altri Editori,https://www.ibs.it/images/9788867884438_0_0_150_0_75.jpg,Don Bosco e lo Stato Pontificio,Bruno Bordignon,If Press,2026,,https://www.ibs.it/don-bosco-stato-pontificio-libro-bruno-bordignon/e/9788867884438,False,2026-07-21
Altri Editori,https://www.ibs.it/images/9791221828023_0_0_150_0_75.jpg,Gli scritti teologici giovanili di G.W.F. Hegel. Analisi e commento di alcuni brani hegeliani,Stefano Ulliana,Aracne (Genzano di Roma),2026,,https://www.ibs.it/scritti-teologici-giovanili-di-gwf-libro-stefano-ulliana/e/9791221828023,False,2026-07-22
Altri Editori,https://www.ibs.it/images/9791281656628_0_0_150_0_75.jpg,Sociopatica. Un memoir,Patric Gagne,Mercurio Books,2026,,https://www.ibs.it/sociopatica-memoir-libro-patric-gagne/e/9791281656628?inventoryId=969057860,False,2026-07-18
Altri Editori,https://www.ibs.it/images/9788885806948_0_0_150_0_75.jpg,La questione Verdiglione,N/D,Spirali,2026,,https://www.ibs.it/questione-verdiglione-libro-vari/e/9788885806948,False,2026-07-21
Altri Editori,https://www.ibs.it/images/9788873136811_0_0_150_0_75.jpg,Non ci sono altri giorni che questi. Lettera sulle stagioni della vita,Maria Teresa Vigiani,Edizioni Lavoro,2026,,https://www.ibs.it/non-ci-sono-altri-giorni-libro-maria-teresa-vigiani/e/9788873136811,False,2026-07-22
Altri Editori,https://www.ibs.it/images/9791222818825_0_0_150_0_75.jpg,Anatomia del male. Analisi psicologica e profilo comportamentale dell'omicida seriale,Sabina Cristillo,ilmiolibro self publishing,2026,,https://www.ibs.it/anatomia-del-male-analisi-psicologica-libro-sabina-cristillo/e/9791222818825,False,2026-07-22
Altri Editori,https://www.ibs.it/images/9791257720988_0_0_150_0_75.jpg,Zero likes,Associazione Psicogeografica Romana,PAB Editore,2026,,https://www.ibs.it/zero-likes-libro-associazione-psicogeografica-romana/e/9791257720988,False,2026-07-21
Altri Editori,https://www.ibs.it/images/9791298654129_0_0_150_0_75.jpg,Pasic. L'autopsia psicologica strutturata sul singolo caso. Guida all’applicazione per gli operatori forensi,"Franco Posa,Camilla Trussardi",NeuroIntelligence Edizioni,2026,,https://www.ibs.it/pasic-autopsia-psicologica-strutturata-sul-libro-franco-posa-camilla-trussardi/e/9791298654129,False,2026-07-20
Altri Editori,https://www.ibs.it/images/9788850276608_0_0_150_0_75.jpg,Donna con libro. Autoritratto delle mie letture,Bianca Pitzorno,TEA,2026,,https://www.ibs.it/donna-con-libro-autoritratto-delle-libro-bianca-pitzorno/e/9788850276608?inventoryId=984566460,False,2026-07-18
Altri Editori,https://www.ibs.it/images/9788842836520_0_0_150_0_75.jpg,Tra i rododendri. Memorie in compagnia di Virginia Woolf,Heather Christle,Il Saggiatore,2026,,https://www.ibs.it/tra-rododendri-memorie-in-compagnia-libro-heather-christle/e/9788842836520?inventoryId=987933625,False,2026-07-17
Altri Editori,https://www.ibs.it/images/9788836165650_0_0_150_0_75.jpg,Le leggende del calcio. I campioni che hanno fatto sognare il mondo intero,Fabio Fagnani,DIARKOS,2026,,https://www.ibs.it/leggende-del-calcio-campioni-che-libro-fabio-fagnani/e/9788836165650,True,2026-07-23
Altri Editori,https://www.ibs.it/images/9788836174737_0_0_150_0_75.jpg,Sotto il magico orologio. Carteggio (1935-1974),"Aldo Palazzeschi,M. Luisa Belleli",Manni,2026,,https://www.ibs.it/sotto-magico-orologio-carteggio-1935-libro-aldo-palazzeschi-m-luisa-belleli/e/9788836174737?inventoryId=988997797,False,2026-07-17
Altri Editori,https://www.ibs.it/images/9788833249285_0_0_150_0_75.jpg,William «Carburo» Negri. L'eroe del Prater,"Lamberto Bertozzi,Giuliano Musi,Michael Negri",Minerva Edizioni (Bologna),2026,,https://www.ibs.it/william-carburo-negri-eroe-del-libro-vari/e/9788833249285,True,2026-07-23
Altri Editori,https://www.ibs.it/images/9791254882078_0_0_150_0_75.jpg,Francesco Paolo Michetti. Il genio senza tempo,Sandro Lucio Giardinelli,Ianieri,2026,,https://www.ibs.it/francesco-paolo-michetti-genio-senza-libro-sandro-lucio-giardinelli/e/9791254882078,True,2026-07-23
Altri Editori,https://www.ibs.it/images/9791254867389_0_0_150_0_75.jpg,La storia di Vittorio Lapolla. I 50 marchi nel calzino. Dai campi della Basilicata al cuore del distretto,N/D,Pacini Editore,2026,,https://www.ibs.it/storia-di-vittorio-lapolla-50-libro-vari/e/9791254867389,False,2026-07-17
Altri Editori,https://www.ibs.it/images/9791224339090_0_0_150_0_75.jpg,"Io, in 6 milioni di chilometri. Da figlio di contadini ad imprenditore",Gianpiero Martinetti,Autopubblicato,2026,,https://www.ibs.it/io-in-6-milioni-di-libro-gianpiero-martinetti/e/9791224339090,False,2026-07-21
Altri Editori,https://www.ibs.it/images/9791224333104_0_0_150_0_75.jpg,Miraggio. 1911-1993 Memorie di un nonno aviatore,"Marco Miraglia,Michele Miraglia",Autopubblicato,2026,,https://www.ibs.it/miraggio-1911-1993-memorie-di-libro-marco-miraglia-michele-miraglia/e/9791224333104,False,2026-07-17
Altri Editori,https://www.ibs.it/images/9791220505123_0_0_150_0_75.jpg,Grazie,Silvana Alessio,Pellegrini,2026,,https://www.ibs.it/grazie-libro-silvana-alessio/e/9791220505123,False,2026-07-22
Altri Editori,https://www.ibs.it/images/9788884356352_0_0_150_0_75.jpg,Di colori e di ricordi,Francesca Gambino,Antiga Edizioni,2026,,https://www.ibs.it/di-colori-di-ricordi-libro-francesca-gambino/e/9788884356352,False,2026-07-22
Altri Editori,https://www.ibs.it/images/9788849883817_0_0_150_0_75.jpg,Sai cosa faceva Maurizio Liverani al cinema italiano?,N/D,Rubbettino,2026,,https://www.ibs.it/sai-cosa-faceva-maurizio-liverani-libro-vari/e/9788849883817?inventoryId=814779143,False,2026-07-17
Altri Editori,https://www.ibs.it/images/9788863821833_0_0_150_0_75.jpg,Telemaco Signorini e il prete pittore di Riomaggiore. Il borgo e la sua gente nelle lettere inedite a don Antonio Pasini,Attilio Casavecchia,Giacché Edizioni,2026,,https://www.ibs.it/telemacosignorinie-pretepittorediriomaggiore-borgo-sua-gente-libro-attilio-casavecchia/e/9788863821833,True,2026-07-23
Altri Editori,https://www.ibs.it/images/9791281614390_0_0_150_0_75.jpg,"Lettere «inutili». Lettere e carteggi. Vol. 3: A bibliotecari, professori, editori, traduttrici e altri",Luciano Bianciardi,ExCogita,2026,,https://www.ibs.it/lettere-inutili-lettere-carteggi-vol-libro-luciano-bianciardi/e/9791281614390,True,2026-07-23
Altri Editori,https://www.ibs.it/images/9791281485600_0_0_150_0_75.jpg,La mia vita scientifica. Intervista di Santo Strati,Giuseppe Nisticò,Mediabooks,2026,,https://www.ibs.it/mia-vita-scientifica-intervista-di-libro-giuseppe-nistico/e/9791281485600,False,2026-07-22
Altri Editori,https://www.ibs.it/images/9791281382664_0_0_150_0_75.jpg,Per Giovanni Farris. Con indice delle opere,Matteo Borreani,Sabatelli,2026,,https://www.ibs.it/per-giovanni-farris-con-indice-libro-matteo-borreani/e/9791281382664,False,2026-07-21
Altri Editori,https://www.ibs.it/images/9791282555043_0_0_150_0_75.jpg,Una vita sotto forma di pagina. Una primavera di scrittura,Gennaro Oliviero,Kairòs,2026,,https://www.ibs.it/vita-sotto-forma-di-pagina-libro-gennaro-oliviero/e/9791282555043,False,2026-07-22
Altri Editori,https://www.ibs.it/images/9791282416276_0_0_150_0_75.jpg,Alda e io. Favole,"Sabino Scia,Alda Merini",Balzano Editore - Librerie Il giardino della cultura,2026,,https://www.ibs.it/alda-io-favole-libro-sabino-scia-alda-merini/e/9791282416276,False,2026-07-21
Altri Editori,https://www.ibs.it/images/9791281227309_0_0_150_0_75.jpg,Giochi finiti e infiniti. La vita come gioco e come possibilità,James P. Carse,Timeo (Palermo),2026,,https://www.ibs.it/giochi-finiti-infiniti-vita-come-libro-james-p-carse/e/9791281227309,False,2026-07-22
Altri Editori,https://www.ibs.it/images/9788892923461_0_0_150_0_75.jpg,Storia delle mie disgrazie,Pietro Abelardo,Santelli Editore,2026,,https://www.ibs.it/storia-delle-mie-disgrazie-libro-pietro-abelardo/e/9788892923461?inventoryId=992848133,False,2026-07-17
Altri Editori,https://www.ibs.it/images/9788892923355_0_0_150_0_75.jpg,Elogio della follia,Erasmo da Rotterdam,Santelli Editore,2026,,https://www.ibs.it/elogio-della-follia-libro-erasmo-da-rotterdam/e/9788892923355?inventoryId=992848157,False,2026-07-17
Altri Editori,https://www.ibs.it/images/9788844072889_0_0_150_0_75.jpg,"Ikigai. Il senso della vita nel Giappone meraviglioso. Calendario 2027 da parete (12,5 X 48 cm)",N/D,Demetra,2026,,https://www.ibs.it/ikigai-senso-della-vita-nel-libro-vari/e/9788844072889,True,2026-07-23
Altri Editori,https://www.ibs.it/images/9791255591320_0_0_150_0_75.jpg,Quaderni delle Medical Humanities (2026). Vol. 7: Etica,N/D,Casagrande,2026,,https://www.ibs.it/quaderni-delle-medical-humanities-2026-libro-vari/e/9791255591320,False,2026-07-21
