Categoria_App,Copertina,Titolo,Autore,Editore,Anno,Descrizione,Link,Nuovo,Data_Aggiunta
Editori Selezionati,https://www.ibs.it/images/9788829035724_0_0_150_0_75.jpg,"Il potere coercitivo. Forze dell'ordine, democrazia, diritti","Giuseppe Campesi,Carlo Caprioglio",Carocci,2026,"Negli Stati democratici di diritto, alla polizia è affidato il compito cruciale di garantire il godimento dei diritti e delle libertà fondamentali. Per farlo, essa dispone di un rilevante potere coercitivo, che in determinate circostanze l’autorizza all’uso della forza. Ciò genera tuttavia un paradosso: chi è chiamato a proteggere i diritti è anche potenzialmente chi li minaccia. Il controllo sulle attività delle forze dell’ordine costituisce dunque uno dei più importanti indicatori della qualità democratica delle istituzioni politiche e civili di un paese. In una fase storica in cui la condotta della polizia è tornata al centro del dibattito pubblico, il volume esplora il complesso rapporto tra la sua attività e la tutela dei diritti nell’Italia contemporanea adottando una prospettiva che integra l’analisi giuridica con quella delle scienze politiche e sociali.",https://www.ibs.it/potere-coercitivo-forze-dell-ordine-libro-giuseppe-campesi-carlo-caprioglio/e/9788829035724,False,2026-03-27
Editori Selezionati,https://www.ibs.it/images/9788829035519_0_0_150_0_75.jpg,"La censura cinematografica in Italia. Pratiche, modelli, archivio digitale (1944-1999)",N/D,Carocci,2026,"La censura cinematografica, rimasta in vigore in Italia per oltre cento anni, ha dato origine a una mole sterminata di documenti e materiali. Nell'ambito del progetto di ricerca changes, i fascicoli dal 1944 in poi sono stati interamente digitalizzati, gli sono stati attribuiti dei metadati e sono stati resi disponibili in un database online ad accesso aperto. I saggi raccolti nel volume presentano alcuni tra i primi esiti dello studio di questa ampia documentazione d'archivio, contribuendo a proporre una nuova periodizzazione del fenomeno e a ripensare il controllo sui film in chiave non solo repressiva ma altresì creativa e produttiva. Anche grazie alla censura, infatti, si sono definiti i confini del visibile.",https://www.ibs.it/censura-cinematografica-in-italia-pratiche-libro-vari/e/9788829035519,False,2026-03-27
Editori Selezionati,https://www.ibs.it/images/9788829035373_0_0_150_0_75.jpg,Che cos’è Netflix,Valentina Re,Carocci,2026,"Il libro ricostruisce la storia culturale, economica e tecnologica di Netflix, mostrando come i media digitali hanno trasformato il cinema e la televisione e, contemporaneamente, come le forme e le logiche dell'audiovisivo hanno orientato lo sviluppo dei media digitali. In tal modo affronta i principali snodi e le zone di conflitto che hanno segnato le traiettorie dei media audiovisivi negli ultimi trent'anni, ben prima dello streaming, di House of Cards e della cosiddetta peak TV. Analizzando modelli di distribuzione, retoriche algoritmiche, pratiche di consumo e produzioni “originali”, l'autrice offre una mappa critica utile per orientarsi nell'ecosistema audiovisivo contemporaneo e interpretare l'impatto culturale delle piattaforme streaming nel contesto italiano ed europeo.",https://www.ibs.it/che-cos-netflix-libro-valentina-re/e/9788829035373,False,2026-03-27
Editori Selezionati,https://www.ibs.it/images/9788829034864_0_0_150_0_75.jpg,Postumanismo. Una guida al pensiero del futuro,Manuela Macelloni,Carocci,2026,"Il postumanismo può essere considerato il grande varco epocale che stiamo attraversando. Il volume ricostruisce i passaggi che hanno portato dall'origine del postumanismo come pensiero critico e poi teoretico fino a oggi, quando, indossando le vesti di una filosofia esistenzialista, è divenuto una vera e propria pratica di vita. Questo viaggio articolato e complesso è condotto illustrando i grandi temi affrontati dalla filosofia postumanista e i pensatori che sono stati protagonisti di tale innovazione. La rivoluzione tecnologica degli ultimi cinquant'anni ha determinato una rilettura profonda dell'identità umana, che ne coglie la dimensione plastica, e una prospettiva differente sul mondo che ci circonda. Ciò ha consentito una nuova estetica, nuove politiche estensive e inclusive, oltre che la necessità di trovare – in una riscoperta alleanza con la realtà animale, ecologica e tecnologica – una possibile strada per concepire il futuro. Il postumanismo non è quindi il crepuscolo dell'umanità, ma un segnavia per l'alba di una condizione rinnovata dell'umano e della vita sul pianeta.",https://www.ibs.it/postumanismo-guida-al-pensiero-del-libro-manuela-macelloni/e/9788829034864,False,2026-03-27
Editori Selezionati,https://www.ibs.it/images/9788815393425_0_0_150_0_75.jpg,Le ragioni della cultura. Saggi di teoria antropologica,Fabio Dei,Il Mulino,2026,"La recente teoria antropologica ha polemizzato con la classica nozione di «cultura», criticandone le basi idealistiche e la tendenza a svalutare le fondamenta economico-politiche dell'azione sociale. Pur se talvolta giustificata, tale critica ha condotto gli indirizzi postcoloniali e poststrutturali a negare la relativa autonomia della dimensione culturale come costitutiva della soggettività umana, e a considerare quest'ultima come interamente plasmata da dispositivi impersonali di potere. I saggi raccolti in questo volume mettono in discussione questi esiti radicalmente antiumanistici, rivendicando la centralità dell'analisi culturale per la comprensione antropologica - in relazione a campi specifici come il corpo e l'incorporazione, la razionalità di religione e magia, le forme contemporanee di mitopoiesi, e soprattutto la violenza di massa e il problema della comprensione del comportamento dei «carnefici». Filo rosso della trattazione è il recupero di una antropologia storicista e razionalista, che non liquidi la cultura come semplice mascheramento ideologico dei rapporti di forza, né la ragione come mero sottoprodotto delle disuguaglianze strutturali e identitarie.",https://www.ibs.it/ragioni-della-cultura-saggi-di-libro-fabio-dei/e/9788815393425,False,2026-03-27
Editori Selezionati,https://www.ibs.it/images/9788804800880_0_0_150_0_75.jpg,Patriot. La mia storia,Alexei Navalny,Mondadori,2026,"Navalny ha iniziato a scrivere Patriot nel 2020, poco dopo l'avvelenamento che gli è quasi costato la vita. Il libro racconta tutta la sua storia: la gioventù nell'Unione Sovietica, l'attivismo, il matrimonio con l'amata Yulia, l'impegno con il quale ha sfidato una superpotenza mondiale determinata a ridurlo al silenzio, il profondo amore per il proprio paese, la Russia, e il suo popolo, fino agli ultimi anni trascorsi nel più brutale carcere al mondo. Con una scrittura vivida e profonda lucidità, Navalny ripercorre l'ascesa di Vladimir Putin e del suo regime, sempre più dittatoriale, e racconta la propria carriera politica, i tanti arresti e i diversi attentati alla sua vita e a quella delle persone a lui più vicine. Leggere le sue parole fa capire perché Navalny ritenesse essenziale non abbandonare la Russia, nonostante i pericoli. I diari della sua prigionia mostrano un uomo che, pur nelle circostanze più terribili, ha conservato una straordinaria forza d'animo e un'inscalfibile determinazione, e ci ricordano una volta di più l'importanza della libertà individuale, esortando a continuare il lavoro per il quale Navalny ha dato la vita.",https://www.ibs.it/patriot-mia-storia-libro-alexei-navalny/e/9788804800880,False,2026-04-01
Editori Selezionati,https://www.ibs.it/images/9788804783756_0_0_150_0_75.jpg,Controcanto. Quando il pensiero maschile celebra le donne,Giulia Sissa,Mondadori,2026,"La riscoperta di questi alleati è un atto di onestà intellettuale e politica, perché ci ricorda che la vocazione al femminismo non è - e non può essere - solamente femminile. È ora di prendere sul serio questo controcanto, che non può più rimanere inascoltato. Volubili, incostanti, vittime delle passioni: le donne sono inadatte al potere e al pensiero. Non sono fatte per comandare, ma per curare e servire. Gli uomini, invece, sono risoluti e autorevoli, nati per governare. Questo pregiudizio permea da sempre la filosofia occidentale. Da Aristotele a Nietzsche, passando per i Padri della Chiesa, il nostro canone è tristemente ostile alle donne e ha nutrito negli anni una cultura incline alla misoginia e alla diseguaglianza. Ma ci sono pensatori che, nonostante il loro genere, sono usciti dal coro. Giulia Sissa ripercorre la storia della filosofia con attenzione, alla ricerca di questo controcanto. Incontra così tre filosofi, lucidi e lungimiranti, che hanno superato i binarismi di genere e coltivato la solidarietà intellettuale: Sofocle, Platone e Derrida. Sofocle, poeta teatrale e autore dell'Antigone, ha scritto una tragedia in cui una donna lotta eroicamente contro un potere ingiusto, diventando una vera e propria forza sovversiva. Platone immagina una città ideale in cui ragazze e ragazzi ricevono la stessa educazione e ridefinisce l'amore, trasformandolo da gesto di possesso in atto di generazione. Secoli dopo, la teoria della decostruzione di Derrida rivoluziona il clima culturale novecentesco e incrina il pensiero dicotomico, fondato su fratture e gerarchie.",https://www.ibs.it/controcanto-quando-pensiero-maschile-celebra-libro-giulia-sissa/e/9788804783756,True,2026-04-03
Altri Editori,https://www.ibs.it/images/9791259849960_0_0_150_0_75.jpg,Sunt lacrimae rerum... Scenari dell'anima,Mario Aldo Toscano,Armando Editore,2026,,https://www.ibs.it/sunt-lacrimae-rerum-scenari-dell-libro-mario-aldo-toscano/e/9791259849960,False,2026-03-27
Altri Editori,https://www.ibs.it/images/9791259793805_0_0_150_0_75.jpg,Senza quasi lasciare traccia. Il Tuscany Trail e la storia di un movimento in bicicletta,Luigi Torreggiani,People,2026,,https://www.ibs.it/senza-quasi-lasciare-traccia-tuscany-libro-luigi-torreggiani/e/9791259793805,False,2026-03-27
Altri Editori,https://www.ibs.it/images/9791257550073_0_0_150_0_75.jpg,Politiche cristiane,Agostino Migliorini,Armando Editore,2026,,https://www.ibs.it/politiche-cristiane-libro-agostino-migliorini/e/9791257550073,False,2026-03-27
Altri Editori,https://www.ibs.it/images/9791257011178_0_0_150_0_75.jpg,"La notte delle anguille. Donne, lavoro e relazioni di genere nella Laguna di Venezia",Elena Zapponi,Viella,2026,,https://www.ibs.it/notte-delle-anguille-donne-lavoro-libro-elena-zapponi/e/9791257011178,True,2026-04-03
Altri Editori,https://www.ibs.it/images/9791256930609_0_0_150_0_75.jpg,Lettere a «La Riviera Ligure». Vol. 8: 1918-1919 e lettere ritrovate,N/D,Edizioni di Storia e Letteratura,2026,,https://www.ibs.it/lettere-a-riviera-ligure-vol-libro-vari/e/9791256930609,False,2026-03-27
Altri Editori,https://www.ibs.it/images/9791256751143_0_0_150_0_75.jpg,"Algoritmi e comunità. Internet, social media e intelligenza artificiale. Le comunicazioni sociali della Chiesa cattolica italiana di fronte alla sfida digitale","Vincenzo Grienti,Giampiero Neri",Effatà Editrice,2026,,https://www.ibs.it/algoritmi-comunita-internet-social-media-libro-vincenzo-grienti-giampiero-neri/e/9791256751143,False,2026-03-27
Altri Editori,https://www.ibs.it/images/9791256630486_0_0_150_0_75.jpg,La volgare ingordigia. Dall'avidità dell'homo oeconomicus alla speranza nell'homo reciprocans,Rossano Orlando,Edizioni IlViandante,2026,,https://www.ibs.it/volgare-ingordigia-dall-avidita-dell-libro-rossano-orlando/e/9791256630486,False,2026-03-27
Altri Editori,https://www.ibs.it/images/9791256153701_0_0_150_0_75.jpg,"Posizionamenti. Traiettorie, configurazioni e pratiche nei campi di produzione intellettuale","Carmelo Lombardo,Gerardo Ienna",Meltemi,2026,,https://www.ibs.it/posizionamenti-traiettorie-configurazioni-pratiche-nei-libro-carmelo-lombardo-gerardo-ienna/e/9791256153701,False,2026-03-27
Editori Selezionati,https://www.ibs.it/images/9791256148363_0_0_150_0_75.jpg,Si salvatti chi può. 201 cose insopportabili di noi italiani,Matteo Salvatti,Castelvecchi,2026,"Un viaggio dentro i piccoli, grandi tic del Belpaese. Dopo anni passati a osservare l’Italia per strada, nei bar, negli uffici e sui social, Matteo Salvatti mette sotto la lente tutto ciò che, nella vita quotidiana, ci fa sbuffare, imbestialire o sorridere con complicità. Dalle code al supermercato alle stranezze dei ristoranti, dalle manie al telefono alle piccole furbizie di ogni giorno, l’autore passa in rassegna 201 situazioni capaci di farci perdere la pazienza. Con uno stile ironico e tagliente, Si Salvatti chi può smonta le abitudini più irritanti della nostra vita quotidiana e restituisce il ritratto di un’Italia che si riconosce, si arrabbia e ride di sé: il Paese dei poeti, dei santi, dei navigatori… e delle cose insopportabili.",https://www.ibs.it/si-salvatti-chi-puo-201-libro-matteo-salvatti/e/9791256148363,True,2026-04-03
Editori Selezionati,https://www.ibs.it/images/9791256146802_0_0_150_0_75.jpg,Io sono confine-I am border. Una mostra come dispositivo di ricerca sociale sul fenomeno migratorio. Ediz. bilingue,Antonino Milotta,Castelvecchi,2026,"Si può fare un’etnografia all’interno di una mostra? Quali strategie si possono adottare? Partendo da una concezione di spazio in quanto dispositivo più che espositivo, la mostra Io sono confine/I am border, curata dal collettivo Pierre Dupont con Anna Daneri sotto la supervisione dell’autore, è stata concepita come un vero e proprio spazio di ricerca sociale. Un dispositivo multisensoriale, con cui si sono stabiliti e ordinati i lavori di artisti e artiste legati al contesto italiano di generazioni differenti, a partire da opere realizzate tra i primi anni Duemila e oggi, legati dal filo rosso degli studi sulle migrazioni. Confini e identità vengono quindi esplorati artisticamente al fine di ragionare sulle capacità esperienziali e trasformative dell’arte. Prefazione di Shahram Khosravi; Postfazione di Iain Chambers.",https://www.ibs.it/io-sono-confine-am-border-libro-antonino-milotta/e/9791256146802,False,2026-03-27
Editori Selezionati,https://www.ibs.it/images/9791256145447_0_0_150_0_75.jpg,I limiti della democrazia. La partecipazione come problema di distribuzione,Stephan Lessenich,Castelvecchi,2026,"La democrazia è davvero il regime dell’uguaglianza? O la sua promessa universale poggia su confini invisibili che includono alcuni ed escludono altri? In questo libro Stephan Lessenich mette in discussione l’immagine rassicurante della democrazia come estensione progressiva degli «spazi di attribuzione di diritti»: ogni apertura ridefinisce infatti chi può prendere parte alla vita collettiva e a quali condizioni, tracciando nuove soglie e nuove chiusure. Con sguardo sociologico, Lessenich individua quattro assi di conflitto che attraversano l’ordine democratico: la frattura tra chi possiede e chi non possiede; le tensioni interne alle classi non possidenti; la distinzione tra cittadini e non cittadini; il rapporto tra società e «ambiente naturale». Ne emerge un quadro lontano tanto dalla celebrazione quanto dalla nostalgia, in cui la democrazia appare per ciò che è: un terreno di lotte di classe per la distribuzione di diritti, risorse, potere. Ripensarne i limiti significa allora interrogare le sue condizioni materiali e immaginare forme di solidarietà capaci di oltrepassare le barriere che essa stessa ha contribuito a costruire.",https://www.ibs.it/limiti-della-democrazia-partecipazione-come-libro-stephan-lessenich/e/9791256145447,False,2026-03-27
Editori Selezionati,https://www.ibs.it/images/9791256110483_0_0_150_0_75.jpg,Fare supervisione. Teorie e pratiche professionali,N/D,Carocci,2026,"Il volume intende consolidare una pratica cruciale per lo sviluppo dei nostri sistemi di welfare: la supervisione, uno strumento di crescita professionale e organizzativa necessario per vivere in modo più consapevole le tensioni che il lavoro nei servizi sociali comporta. Scritto da supervisori accomunati dall'analisi transazionale come teoria di riferimento, è diviso in due parti: la prima è di natura teoricometodologica, la seconda descrive alcune esperienze pratiche che offrono spunti di riflessione e apprendimento su aspetti specifici della supervisione e sui suoi esiti nei professionisti coinvolti. Si rivolge ad assistenti sociali, psicologi, educatori, pedagogisti, sociologi che si trovano o si troveranno a esercitare il ruolo di supervisori e a tutte le figure operanti nel sociale che, avendo sperimentato la supervisione, desiderano approfondirne metodi e pratiche.",https://www.ibs.it/fare-supervisione-teorie-pratiche-professionali-libro-vari/e/9791256110483,False,2026-03-27
Altri Editori,https://www.ibs.it/images/9791256006649_0_0_150_0_75.jpg,"Dalle coccole all'ascolto. Nonne, nonni e nipoti adolescenti",N/D,Ledizioni,2026,,https://www.ibs.it/dalle-coccole-all-ascolto-nonne-libro-vari/e/9791256006649,False,2026-03-27
Altri Editori,https://www.ibs.it/images/9791255950530_0_0_150_0_75.jpg,"Amare la politica. Democrazia, cittadinanza, partecipazione",N/D,In Dialogo,2026,,https://www.ibs.it/amare-politica-democrazia-cittadinanza-partecipazione-libro-vari/e/9791255950530,False,2026-03-31
Altri Editori,https://www.ibs.it/images/9791254782460_0_0_150_0_75.jpg,L'arte di comprare senza farsi fregare,Giuseppe De Pasquale,Fede & Cultura,2026,,https://www.ibs.it/arte-di-comprare-senza-farsi-libro-giuseppe-de-pasquale/e/9791254782460,True,2026-04-03
Altri Editori,https://www.ibs.it/images/9791223617489_0_0_150_0_75.jpg,L'età dell’angoscia. Sopravvivenza in tempi di crisi,Luca Sebastian Mereu,Gruppo Albatros Il Filo,2026,,https://www.ibs.it/eta-dell-angoscia-sopravvivenza-in-libro-luca-sebastian-mereu/e/9791223617489,False,2026-03-27
Altri Editori,https://www.ibs.it/images/9788892923263_0_0_150_0_75.jpg,Mario Draghi. Hope is not a strategy,Cristina La Bella,Santelli Editore,2026,,https://www.ibs.it/mario-draghi-hope-is-not-libro-cristina-la-bella/e/9788892923263,False,2026-03-27
Altri Editori,https://www.ibs.it/images/9788892923126_0_0_150_0_75.jpg,Per la causa delle donne,Maria Montessori,Santelli Editore,2026,,https://www.ibs.it/per-causa-delle-donne-libro-maria-montessori/e/9788892923126,False,2026-03-27
Altri Editori,https://www.ibs.it/images/9788892923065_0_0_150_0_75.jpg,L'arte della guerra,Tzu Sun,Santelli Editore,2026,,https://www.ibs.it/arte-della-guerra-libro-tzu-sun/e/9788892923065,False,2026-03-27
Altri Editori,https://www.ibs.it/images/9788864969053_0_0_150_0_75.jpg,I maestri nascosti,Michele Gotuzzo,Tipheret,2026,,https://www.ibs.it/maestri-nascosti-libro-michele-gotuzzo/e/9788864969053,False,2026-03-27
Altri Editori,https://www.ibs.it/images/9788846773647_0_0_150_0_75.jpg,Conversazioni con i genitori. Riflessioni su adolescenza e crisi nelle famiglie biologiche e adottive,Leonardo Luzzatto,Edizioni ETS,2026,,https://www.ibs.it/conversazioni-con-genitori-riflessioni-su-libro-leonardo-luzzatto/e/9788846773647,False,2026-03-27
Altri Editori,https://www.ibs.it/images/9788832087420_0_0_150_0_75.jpg,Vico esclamativo. Voci dal rione Sanità,Chiara Nocchetti,San Gennaro F.S.G.,2026,,https://www.ibs.it/vico-esclamativo-voci-dal-rione-libro-chiara-nocchetti/e/9788832087420,False,2026-04-01
Editori Selezionati,https://www.ibs.it/images/9788829035199_0_0_150_0_75.jpg,Il Libro bianco di Lord Cockfield e l'identità economica europea. 1985-1992,Simone Oggionni,Carocci,2026,"A metà degli anni Ottanta, dopo un lungo periodo di crisi politica ed economica, l'integrazione europea conosce una fase di straordinario rilancio. Al centro di questa svolta si colloca il completamento del mercato interno, un obiettivo ambizioso destinato a diventare il perno di una nuova strategia comunitaria. Grazie a un'ampia e rigorosa ricerca sulle fonti archivistiche, il volume ricostruisce la genesi e l'attuazione del celebre Libro bianco del 1985, redatto dal commissario Lord Cockfield su impulso del presidente Jacques Delors, offrendo una prospettiva originale sugli equilibri politici ed economici che ne hanno determinato l'esito. Sul piano interpretativo, il testo mostra come il mercato interno si trasformi nel motore di una nuova identità economica europea. Tra esigenze di competitività, rafforzamento industriale e desideri di coesione sociale, analizza la realizzazione di un compromesso inedito fra culture economiche differenti, attraverso cui l'Europa – in vista del traguardo del 1992 – tenta di “cavalcare la tigre” della globalizzazione. Un contributo essenziale per comprendere le radici dell'Europa contemporanea e le tensioni irrisolte di un modello economico che, ancora oggi, ne definisce possibilità e limiti.",https://www.ibs.it/libro-bianco-di-lord-cockfield-libro-simone-oggionni/e/9788829035199,False,2026-03-27
Editori Selezionati,https://www.ibs.it/images/9788820084554_0_0_150_0_75.jpg,Il futuro che non c'era. La mia vita tra umanità e tecnologia,Enrica Porcari,Sperling & Kupfer,2026,"Può una formazione umanistica diventare la chiave per guidare la strategia digitale del santuario della scienza mondiale? Si può essere presente in famiglia e, al contempo, esercitare una leadership capace di gestire crisi planetarie? In queste pagine, intime e vibranti, Enrica Maria Porcari intreccia vita privata e responsabilità professionale in un percorso fatto di deviazioni, cadute, ripartenze e conquiste attraverso realtà diverse, quella delle organizzazioni mondiali, delle emergenze umanitarie e delle opportunità che ha saputo vedere per cambiare migliaia di vite. Dall'infanzia ribelle e curiosa agli anni della formazione umanistica, fino alla guida in contesti scientifici e internazionali, l'autrice ha imparato a trovare un senso nelle svolte impreviste, a fidarsi di sé stessa e a costruire ponti tra mondi apparentemente estranei. Lontana dai modelli esasperati di perfezione e dalle narrazioni semplificate del successo, Porcari, la prima chief information officer del CERN, l'Organizzazione europea per la ricerca nucleare, racconta una storia di scelte imperfette, sensi di colpa e sfide personali. Ogni volta ha scelto di non tirarsi indietro, anche quando il prezzo da pagare era alto, riuscendo a trasformare paura, burnout e responsabilità in consapevolezza e forza interiore. Una voce potente e luminosa che parla a chi si sente fuori posto, a chi prova a tenere tutto insieme, a chi sogna di osare senza rinunciare alla propria autenticità.",https://www.ibs.it/futuro-che-non-c-era-libro-enrica-porcari/e/9788820084554,False,2026-04-01
Altri Editori,https://www.ibs.it/images/9791254846513_0_0_150_0_75.jpg,Tsunami Trump. Il nazionalismo americano e l'Europa,Sergio Fabbrini,Il Sole 24 Ore,2026,,https://www.ibs.it/tsunami-trump-nazionalismo-americano-europa-libro-sergio-fabbrini/e/9791254846513,True,2026-04-03
Altri Editori,https://www.ibs.it/images/9788878276864_0_0_150_0_75.jpg,Oltre due calci nel sedere. 12 principi per accompagnare gli adolescenti,Erminio Salcuni,Bolis,2026,,https://www.ibs.it/oltre-due-calci-nel-sedere-libro-erminio-salcuni/e/9788878276864,False,2026-03-27
Altri Editori,https://www.ibs.it/images/9791280132529_0_0_150_0_75.jpg,"La minaccia di Allah. Islam politico, sicurezza e libertà negate in Europa",Anna Maria Cisint,Signs Publishing,2026,,https://www.ibs.it/minaccia-di-allah-islam-politico-libro-anna-maria-cisint/e/9791280132529,False,2026-03-27
Editori Selezionati,https://www.ibs.it/images/9788858160411_0_0_150_0_75.jpg,A tu per tu con «Il capitale»,Roberto Fineschi,Laterza,2026,"Il capitale è un testo fondamentale della modernità, una pietra miliare del pensiero filosofico, economico e politico. C’è poco da fare: per capire qualcosa del mondo che ci circonda, nel bene e nel male, non si può proprio ignorarlo. Anche i suoi detrattori più accaniti e quanti si erano affrettati a relegarlo in soffitta, sono dovuti correre a rispolverarlo per cercare spiegazioni a fatti attualissimi come la formazione di grandi monopoli, la crisi economica, la disoccupazione di massa, l’ipersfruttamento di umani e ambiente, e molto altro ancora. Tutti fenomeni per i quali le teorie economiche mainstream offrono poche risposte e ancor meno soluzioni. Sembra, insomma, che Marx abbia ancora molto da dirci e che le sue chiavi di lettura abbiano conservato intatto il proprio valore. Vale dunque la pena rimettere mano al Capitale, senza dubbio la sua opera più importante. E qui viene il difficile, perché è un testo lungo e laborioso, di una complessità spesso scoraggiante per chi è sprovvisto di una formazione specifica. Questo libro viene incontro a chi desidera afferrare le geniali intuizioni contenute nel Capitale ma, per un motivo o per l’altro, non possa imbarcarsi da solo in una simile impresa. A farci da timoniere è allora uno dei maggiori esperti di Marx, Roberto Fineschi, che ha dedicato una vita a studiare l’opera del pensatore tedesco. Ripercorrendo con grande chiarezza la struttura e i concetti principali, senza mai banalizzarli, ma con una scrittura capace di sciogliere anche i nodi più intricati, Fineschi ci accompagna alla scoperta del Capitale. Un classico che rimane, a più di un secolo e mezzo dalla pubblicazione, insuperato e insuperabile.",https://www.ibs.it/a-tu-per-tu-con-libro-roberto-fineschi/e/9788858160411,True,2026-04-03
