Categoria_App,Copertina,Titolo,Autore,Editore,Anno,Descrizione,Link,Nuovo,Data_Aggiunta
Editori Selezionati,https://www.ibs.it/images/9788804807711_0_0_150_0_75.jpg,La valle del silicio. Cronache letterarie dal cuore della California,Alain Damasio,Mondadori,2026,"A San Francisco, nel cuore della Silicon Valley, Alain Damasio mette alla prova il suo pensiero tecnocritico, con l'obiettivo di cambiare prospettiva. Attraversa il «centro del mondo» lasciandosi permeare da una realtà che lo sconvolge. Composto da sette cronache letterarie e un racconto di fantascienza, La valle del silicio si dispiega come un saggio punteggiato da visioni in cui si intrecciano poesia, nostalgia e speranza. Dalla sede di Apple ai quartieri devastati dalla droga, tra incontri e ritratti, l'autore affronta temi come la proliferazione dell'intelligenza artificiale, l'arte del coding, il metaverso, le auto a guida autonoma e il futuro dei nostri corpi. Ne emerge una lettura politica del tempo presente e un'anticipazione delle bizzarre, stranianti esistenze che ci attendono. Potere o potenza?, settima delle cronache letterarie qui raccolte, diventerà presto un graphic novel e un progetto cinematografico.",https://www.ibs.it/valle-del-silicio-cronache-letterarie-libro-alain-damasio/e/9788804807711,False,2026-07-08
Altri Editori,https://www.ibs.it/images/9791281925052_0_0_150_0_75.jpg,"Vik vide il futuro. I pensieri di Vittorio Arrigoni sul mondo, Gaza e la Nakba globale",Vittorio Arrigoni,Pagine Esteri,2026,,https://www.ibs.it/vik-vide-futuro-pensieri-di-libro-vittorio-arrigoni/e/9791281925052,True,2026-07-09
Altri Editori,https://www.ibs.it/images/9788865166727_0_0_150_0_75.jpg,Frontiera Albania. Come la deportazione si è fatta «modello». E chi ci guadagna,Luca Rondi,Altreconomia,2026,,https://www.ibs.it/frontiera-albania-come-deportazione-si-libro-luca-rondi/e/9788865166727?inventoryId=963972576,False,2026-07-05
Altri Editori,https://www.ibs.it/images/9791254622346_0_0_150_0_75.jpg,Femminocrazia. Come e perché il femminismo danneggia tutti,Roberto Lobosco,Passaggio al Bosco,2026,,https://www.ibs.it/femminocrazia-come-perche-femminismo-danneggia-libro-roberto-lobosco/e/9791254622346,False,2026-07-07
Altri Editori,https://www.ibs.it/images/9791221113266_0_0_150_0_75.jpg,"EU product liability law: platforms, internet of things and artificial intelligence",N/D,Giappichelli,2026,,https://www.ibs.it/eu-product-liability-law-platforms-libro-vari/e/9791221113266,False,2026-07-04
Altri Editori,https://www.ibs.it/images/9791221120523_0_0_150_0_75.jpg,Il divieto di discriminazioni di genere e la parità uomo-donna in ambito lavorativo. Il dialogo tra Corte di giustizia e corti nazionali,Domenico Mezzacapo,Giappichelli,2026,,https://www.ibs.it/divieto-di-discriminazioni-di-genere-libro-domenico-mezzacapo/e/9791221120523,False,2026-07-07
Altri Editori,https://www.ibs.it/images/9791259632999_0_0_150_0_75.jpg,Rinascita. Rivista di politica e cultura. Vol. 1: L' impero del disordine,N/D,Bordeaux,2026,,https://www.ibs.it/rinascita-rivista-di-politica-cultura-libro-vari/e/9791259632999,False,2026-07-07
Editori Selezionati,https://www.ibs.it/images/9791257910396_0_0_150_0_75.jpg,Gaza come evento-mondo,Nancy Fraser,Castelvecchi,2026,"Gaza non è solo la tragedia umanitaria e politica che colpisce un popolo in uno specifico luogo geografico, ma è anche il segno di una rottura dell’ordine morale che si è costruito dopo Auschwitz e ha dominato l’Occidente negli ultimi decenni. È ancora possibile, “dopo Gaza”, interpretare gli accadimenti della storia con le categorie elaborate nel secondo Dopoguerra? Nancy Fraser legge il massacro del popolo palestinese da parte di Israele come un “evento-mondo”, emblema dell’atrocità umana che ci pone di fronte alla sfida di pensare altrimenti, abbandonando paradigmi che non riescono più a rendere conto del nostro presente. In un percorso che intreccia riflessione filosofica, analisi politica, osservazione sociale e testimonianza personale, l’autrice ricostruisce una sorta di diario di viaggio – che passa per la Germania, gli Stati Uniti e il Giappone – e ci fa incontrare anche una comunità ebraica, fuori e dentro Israele, alle prese con una profonda crisi d’identità. Sottolineando la portata mondiale di un evento che interpella ogni essere umano, Fraser si domanda se proprio da Gaza possa sorgere un nuovo principio di speranza, fondato sulla solidarietà e sulla giustizia sociale. Introduzione di Giorgio Fazio.",https://www.ibs.it/gaza-come-evento-mondo-libro-nancy-fraser/e/9791257910396?inventoryId=1029551196,False,2026-07-07
Altri Editori,https://www.ibs.it/images/9791256155248_0_0_150_0_75.jpg,Disumanità e misantropia,Helmuth Plessner,Meltemi,2026,,https://www.ibs.it/disumanita-misantropia-libro-helmuth-plessner/e/9791256155248?inventoryId=969057609,False,2026-07-07
Altri Editori,https://www.ibs.it/images/9788884533395_0_0_150_0_75.jpg,Reti sociali e innovazione. I sistemi locali dell'informatica,N/D,Firenze University Press,2026,,https://www.ibs.it/reti-sociali-innovazione-sistemi-locali-libro-vari/e/9788884533395?inventoryId=47003217,False,2026-07-04
Altri Editori,https://www.ibs.it/images/9788861102637_0_0_150_0_75.jpg,Catastrofi. Leggere e scrivere i finimondi,N/D,Del Vecchio Editore,2026,,https://www.ibs.it/catastrofi-leggere-scrivere-finimondi-libro-vari/e/9788861102637?inventoryId=1037205648,False,2026-07-03
Altri Editori,https://www.ibs.it/images/9791281655683_0_0_150_0_75.jpg,Restare è resistere. Per il futuro di una generazione,Giuseppe Trovato,Navarra Editore,2026,,https://www.ibs.it/restare-resistere-per-futuro-di-libro-giuseppe-trovato/e/9791281655683?inventoryId=1038791873,False,2026-07-04
Altri Editori,https://www.ibs.it/images/9791281265196_0_0_150_0_75.jpg,Storie che non sono le nostre,Francesco Neri,Terra Somnia Editore,2026,,https://www.ibs.it/storie-che-non-sono-nostre-libro-francesco-neri/e/9791281265196?inventoryId=995935653,False,2026-07-03
Altri Editori,https://www.ibs.it/images/9791280497499_0_0_150_0_75.jpg,Manifesto contro la gestione e la digitalizzazione delle nostre vite,Écran total,Edizioni Malamente,2026,,https://www.ibs.it/manifesto-contro-gestione-digitalizzazione-delle-libro-ecran-total/e/9791280497499,True,2026-07-09
Altri Editori,https://www.ibs.it/images/9791280497482_0_0_150_0_75.jpg,"Il sentimento della natura, forza rivoluzionaria",Bernard Charbonneau,Edizioni Malamente,2026,,https://www.ibs.it/sentimento-della-natura-forza-rivoluzionaria-libro-bernard-charbonneau/e/9791280497482,True,2026-07-09
Altri Editori,https://www.ibs.it/images/9791257431105_0_0_150_0_75.jpg,Cinema in periferia. I primi trentacinque anni dell'Arci Movie. Associazione per la promozione sociale a Ponticelli 1990-2025,Antonio Borrelli,La valle del tempo,2026,,https://www.ibs.it/cinema-in-periferia-primi-trentacinque-libro-antonio-borrelli/e/9791257431105,False,2026-07-08
Altri Editori,https://www.ibs.it/images/9791257410162_0_0_150_0_75.jpg,Brevis (2026). Vol. 44,"Giuseppina Fleres,Lorenzo Bordonaro,Mariano Mascena",GAEditori,2026,,https://www.ibs.it/brevis-2026-vol-44-libro-vari/e/9791257410162,False,2026-07-04
Altri Editori,https://www.ibs.it/images/9791256551576_0_0_150_0_75.jpg,Santa Maria del Castello,Cesare Scalon,Gaspari,2026,,https://www.ibs.it/santa-maria-del-castello-libro-cesare-scalon/e/9791256551576,False,2026-07-08
Altri Editori,https://www.ibs.it/images/9791256007967_0_0_150_0_75.jpg,Comunicare ai tempi dell'Intelligenza Artificiale generativa,Canzio Dusi,Ledizioni,2026,,https://www.ibs.it/comunicare-ai-tempi-dell-intelligenza-libro-canzio-dusi/e/9791256007967?inventoryId=1030496360,False,2026-07-07
Altri Editori,https://www.ibs.it/images/9791255950721_0_0_150_0_75.jpg,La cura riguarda tutti. Nessuno è escluso,"Fortunato Nicoletti,Maria Coppola",In Dialogo,2026,,https://www.ibs.it/cura-riguarda-tutti-nessuno-escluso-libro-fortunato-nicoletti-maria-coppola/e/9791255950721,True,2026-07-09
Altri Editori,https://www.ibs.it/images/9791254867471_0_0_150_0_75.jpg,La bugia,N/D,Pacini Editore,2026,,https://www.ibs.it/bugia-libro-vari/e/9791254867471,True,2026-07-09
Altri Editori,https://www.ibs.it/images/9791224340010_0_0_150_0_75.jpg,Pietro Capodiferro jazz and lyrical trumpeter. Storia di una migrazione del 1898 da Gioia del Colle a New York City,Francesco Capodiferro,Autopubblicato,2026,,https://www.ibs.it/pietro-capodiferro-jazz-and-lyrical-libro-francesco-capodiferro/e/9791224340010,False,2026-07-08
Altri Editori,https://www.ibs.it/images/9791224338659_0_0_150_0_75.jpg,"La schiena dritta, dieci anni di sindacato, tra battaglie responsabilità e verità",Fabrizio Maniago,Autopubblicato,2026,,https://www.ibs.it/schiena-dritta-dieci-anni-di-libro-fabrizio-maniago/e/9791224338659,False,2026-07-08
Altri Editori,https://www.ibs.it/images/9791224332268_0_0_150_0_75.jpg,Melchizedek. Il sommo sacerdote del Dio Altissimo a NAG HAMMADI (NHC IX.1). Nuova ediz.,David Casulli,Autopubblicato,2026,,https://www.ibs.it/melchizedek-sommo-sacerdote-del-dio-libro-david-casulli/e/9791224332268,False,2026-07-07
Altri Editori,https://www.ibs.it/images/9791221120288_0_0_150_0_75.jpg,"Sovraffollamento carcerario e clemenza: se non ora, quando? Atti del convegno (Napoli, 27 novembre 2025)",N/D,Giappichelli,2026,,https://www.ibs.it/sovraffollamento-carcerario-clemenza-se-non-libro-vari/e/9791221120288,False,2026-07-04
Altri Editori,https://www.ibs.it/images/9791221119169_0_0_150_0_75.jpg,Diritto internazionale dei conflitti armati,Natalino Ronzitti,Giappichelli,2026,,https://www.ibs.it/diritto-internazionale-dei-conflitti-armati-libro-natalino-ronzitti/e/9791221119169,False,2026-07-08
Editori Selezionati,https://www.ibs.it/images/9788892250239_0_0_150_0_75.jpg,Giovanni Falcone. Le idee restano,"Maria Falcone,Monica Mondo",San Paolo Edizioni,2026,"Giovanni Falcone non era un eroe, ma un uomo vero, retto, sorridente, coraggioso e prudente. Spesso sfiancato dalla responsabilità e dall'incomprensione, disposto però a offrire sempre tutto di sé, per un ideale. A venticinque anni dalla strage di Capaci, la sorella Maria con Monica Mondo rilegge l'album dei ricordi: l'infanzia con i fratelli, la famiglia e gli insegnamenti, la Palermo in cui sono cresciuti, gli incontri e le amicizie, le gioie e i dolori. Il ricordo non appartiene solo al passato, è lo strumento per capire il presente, per trasformare il timore in ricerca di giustizia, per non ridurre un uomo al ruolo di sola icona, piuttosto per ribadirne legami, affetti, ideali e passioni. Il corpo fa l'uomo mortale, le idee lo consegnano alla storia. Gli ideali di Giovanni Falcone restano, bandiera delle quotidiane lotte per lo stato di diritto.",https://www.ibs.it/giovanni-falcone-idee-restano-libro-maria-falcone-monica-mondo/e/9788892250239,True,2026-07-09
Altri Editori,https://www.ibs.it/images/9788891682529_0_0_150_0_75.jpg,"La logica del Servizio Sociale. Tendenze, dilemmi e prospettive",Angelo Mari,Maggioli Editore,2026,,https://www.ibs.it/logica-del-servizio-sociale-tendenze-libro-angelo-mari/e/9788891682529,False,2026-07-04
Altri Editori,https://www.ibs.it/images/9788891677051_0_0_150_0_75.jpg,La genitorialità risorsa sociale. Per un'integrazione delle politiche familiari. Metodologia pedagogia dei genitori,"Riziero Zucchi,Fiorella Miotti",Maggioli Editore,2026,,https://www.ibs.it/genitorialita-risorsa-sociale-per-integrazione-libro-riziero-zucchi-fiorella-miotti/e/9788891677051,False,2026-07-04
Altri Editori,https://www.ibs.it/images/9788868399856_0_0_150_0_75.jpg,"Wie eigenständig ist Südtirol? Geschichte, Recht und Politik",Oskar Peterlini,Athesia,2026,,https://www.ibs.it/wie-eigenstandig-ist-sudtirol-geschichte-libro-oskar-peterlini/e/9788868399856,False,2026-07-01
Altri Editori,https://www.ibs.it/images/9788862507189_0_0_150_0_75.jpg,Il presentatore perfetto. Organizzare e moderare un evento per far circolare idee e non insulti,Filippo Poletti,Guerini e Associati,2026,,https://www.ibs.it/presentatore-perfetto-organizzare-moderare-evento-libro-filippo-poletti/e/9788862507189?inventoryId=989313564,False,2026-07-06
Altri Editori,https://www.ibs.it/images/9788859047254_0_0_150_0_75.jpg,Il verde e la cura. Dai balconi fioriti ai giardini terapeutici nelle RSA,N/D,Erickson,2026,,https://www.ibs.it/verde-cura-dai-balconi-fioriti-libro-vari/e/9788859047254,False,2026-07-07
Altri Editori,https://www.ibs.it/images/9788846776235_0_0_150_0_75.jpg,Immagini femminili nell'arte pisana. Nuovi sguardi dalla città al territorio,N/D,Edizioni ETS,2026,,https://www.ibs.it/immagini-femminili-nell-arte-pisana-libro-vari/e/9788846776235,True,2026-07-09
Altri Editori,https://www.ibs.it/images/9788846775832_0_0_150_0_75.jpg,Comunicare è avere cura. Pragmatica della comunicazione interpersonale in ambito sanitario,Riccardo Ruffoli,Edizioni ETS,2026,,https://www.ibs.it/comunicare-avere-cura-pragmatica-della-libro-riccardo-ruffoli/e/9788846775832,True,2026-07-09
Altri Editori,https://www.ibs.it/images/9788846775610_0_0_150_0_75.jpg,Le virtù delle donne. L'iconografia delle eroine del mondo antico e la ricezione dei classici a Siena dall’Umanesimo alla Maniera,Marilena Caciorgna,Edizioni ETS,2026,,https://www.ibs.it/virtu-delle-donne-iconografia-delle-libro-marilena-caciorgna/e/9788846775610?inventoryId=1034961337,True,2026-07-09
Altri Editori,https://www.ibs.it/images/9788831559317_0_0_150_0_75.jpg,Dizionario della lingua inaudita. La lingua e la Rivoluzione. Nuova ediz.,Marco Guzzi,Paoline Editoriale Libri,2026,,https://www.ibs.it/dizionario-della-lingua-inaudita-lingua-libro-marco-guzzi/e/9788831559317,True,2026-07-09
Editori Selezionati,https://www.ibs.it/images/9788804821533_0_0_150_0_75.jpg,"Florario. Miti, leggende e simboli di fiori e piante",Alfredo Cattabiani,Mondadori,2026,"Questo libro è un viaggio nell'immaginario ispirato dall'universo vegetale. Un percorso tra paesi reali e fantastici, attraverso riti pagani, ebraici, cristiani, musulmani, induisti, shintoisti, taoisti e buddhisti, lungo il quale si incontrano divinità e protagonisti di favole, miti e leggende, si rievocano proverbi e usanze, si riscoprono poesie e opere d'arte. Ma Florario è anche un itinerario religioso, non solo perché vi compaiono personaggi biblici e santi ma anche perché, come ha scritto Ernst Jünger, «un arcobaleno invisibile circonda quello visibile» e il mondo delle piante non è che una delle molte manifestazioni delle energie sovracosmiche. Alfredo Cattabiani ricostruisce sapientemente questo mondo verde e fiorito grazie alle sue conoscenze nel campo della fenomenologia religiosa, del simbolismo e delle tradizioni popolari, e suggerisce, pagina dopo pagina, in uno stile che sposa la chiarezza alla levità, percorsi di approfondimento per chi voglia giungere là dove una pianta non è soltanto una pianta.",https://www.ibs.it/florario-miti-leggende-simboli-di-libro-alfredo-cattabiani/e/9788804821533,False,2026-07-08
Editori Selezionati,https://www.ibs.it/images/9788804791119_0_0_150_0_75.jpg,Il mistero di Torino. Due ipotesi su una capitale incompresa,"Vittorio Messori,Aldo Cazzullo",Mondadori,2026,"Esiste un ""mistero di Torino""? Cosa nasconde la città della Sindone e dell'autoritratto di Leonardo, dei tecnici della Fiat e dei satanisti, di san Giuseppe Cottolengo e del re lussurioso e scomunicato? Prediletta da Nostradamus, ospita la più grande raccolta di mummie e libri egizi dei morti, eccitava Nietzsche e ispirava a De Chirico la sua pittura metafisica... L'enigma di questa ""strana metropoli"" è indagato da due autori diversissimi che ci raccontano le atmosfere e i personaggi di Torino, sempre sorprendente, a volte inquietante, da due opposte prospettive - cattolica e laica - che a volte si scontrano, a volte si mescolano.",https://www.ibs.it/mistero-di-torino-due-ipotesi-libro-vittorio-messori-aldo-cazzullo/e/9788804791119,True,2026-07-09
Altri Editori,https://www.ibs.it/images/9791281641174_0_0_150_0_75.jpg,Strategic autonomy and the future of Europe. Lectio magistralis of Paolo Gentiloni at the Vigoni-Hamburg Forum,Paolo Gentiloni,Villa Vigoni Editore,2026,,https://www.ibs.it/strategic-autonomy-and-the-future-libro-paolo-gentiloni/e/9791281641174,False,2026-07-04
Altri Editori,https://www.ibs.it/images/9791281164864_0_0_150_0_75.jpg,Perché non votiamo più,Antonio Ferrante,GFE,2026,,https://www.ibs.it/perche-non-votiamo-piu-libro-antonio-ferrante/e/9791281164864,True,2026-07-09
Altri Editori,https://www.ibs.it/images/9791224078807_0_0_150_0_75.jpg,Nessuno me l'aveva raccontata così. Dalla gravidanza alla vita vera con mia figlia,Silvia Saffioti,Youcanprint,2026,,https://www.ibs.it/nessuno-me-aveva-raccontata-cosi-libro-silvia-saffioti/e/9791224078807,False,2026-07-08
Altri Editori,https://www.ibs.it/images/9791224074656_0_0_150_0_75.jpg,Ad maiorem dei gloriam. Usi e tradizioni liturgiche della comunità di Castelletto Sopra Ticino,Stefano Raffaele Della Sala,Youcanprint,2026,,https://www.ibs.it/ad-maiorem-dei-gloriam-usi-libro-stefano-raffaele-della-sala/e/9791224074656,False,2026-07-04
Altri Editori,https://www.ibs.it/images/9791222818528_0_0_150_0_75.jpg,La Madonna e la Grande Madre. La vergine Maria nel cerchio Uroborico e le icone Mariane,Riccardo Brunetti,ilmiolibro self publishing,2026,,https://www.ibs.it/madonna-grande-madre-vergine-maria-libro-riccardo-brunetti/e/9791222818528,False,2026-07-08
Altri Editori,https://www.ibs.it/images/9788880996675_0_0_150_0_75.jpg,"Cunde e culacchie de cunde. Storie, vicende e leggende tarantine e tarantinizzate","Vincenzo Risolvo,Rosa Risolvo",Scorpione,2026,,https://www.ibs.it/cunde-culacchie-de-cunde-storie-libro-vincenzo-risolvo-rosa-risolvo/e/9788880996675,True,2026-07-09
Altri Editori,https://www.ibs.it/images/9788855270731_0_0_150_0_75.jpg,"I forti possono, i deboli devono, gli ignavi guardano. Il grande business",Nuccio Maiorano,Associazione Culturale Agape,2026,,https://www.ibs.it/forti-possono-deboli-devono-ignavi-libro-nuccio-maiorano/e/9788855270731,False,2026-06-22
Altri Editori,https://www.ibs.it/images/9788833637044_0_0_150_0_75.jpg,Perù. Il sentiero Inca,N/D,goWare,2026,,https://www.ibs.it/peru-sentiero-inca-libro-vari/e/9788833637044,False,2026-07-08
Altri Editori,https://www.ibs.it/images/9791222501444_0_0_150_0_75.jpg,La guerra segreta,Antonio Talia,Fuoriscena,2026,,https://www.ibs.it/guerra-segreta-libro-antonio-talia/e/9791222501444,False,2026-07-08
Altri Editori,https://www.ibs.it/images/9791298609457_0_0_150_0_75.jpg,Realismo strategico. Perché all’Italia serve una neutralità armata,Maurizio d'Orlando,Edizioni MdO,2026,,https://www.ibs.it/realismo-strategico-perche-all-italia-libro-maurizio-d-orlando/e/9791298609457,False,2026-07-08
Altri Editori,https://www.ibs.it/images/9791281913257_0_0_150_0_75.jpg,"Independence Day. Hollywood, gli alieni e l'eccezionalismo americano",Luca Mencacci,Inquadrature Perfette,2026,,https://www.ibs.it/independence-day-hollywood-alieni-eccezionalismo-libro-luca-mencacci/e/9791281913257,False,2026-07-04
Altri Editori,https://www.ibs.it/images/9791280388230_0_0_150_0_75.jpg,Destinazione alfa. Viaggio a ritroso verso le origini,Simona Buonaura,Giammarino,2026,,https://www.ibs.it/destinazione-alfa-viaggio-a-ritroso-libro-simona-buonaura/e/9791280388230,False,2026-07-01
Altri Editori,https://www.ibs.it/images/9791221825602_0_0_150_0_75.jpg,Città di pellicola. Il cinema italiano e lo spazio urbano (1930-1975),N/D,Aracne (Genzano di Roma),2026,,https://www.ibs.it/citta-di-pellicola-cinema-italiano-libro-vari/e/9791221825602,False,2026-07-08
Altri Editori,https://www.ibs.it/images/9788833568454_0_0_150_0_75.jpg,Reset,Mariadele Mancini,Progetto Cultura,2026,,https://www.ibs.it/reset-libro-mariadele-mancini/e/9788833568454,True,2026-07-09
Altri Editori,https://www.ibs.it/images/9788822925305_0_0_150_0_75.jpg,Patrimoni affioranti. Abitare il paesaggio culturale dei Campi Flegrei,N/D,Quodlibet,2026,,https://www.ibs.it/patrimoni-affioranti-abitare-paesaggio-culturale-libro-vari/e/9788822925305,False,2026-07-08
Altri Editori,https://www.ibs.it/images/9788822046321_0_0_150_0_75.jpg,Pianeta acustico. Viaggio fra le meraviglie sonore del mondo. Nuova ediz.,Trevor Cox,edizioni Dedalo,2026,,https://www.ibs.it/pianeta-acustico-viaggio-fra-meraviglie-libro-trevor-cox/e/9788822046321?inventoryId=990308986,False,2026-07-04
Editori Selezionati,https://www.ibs.it/images/9788806274054_0_0_150_0_75.jpg,La fisica dei supereroi di Hollywood,James Kakalios,Einaudi,2026,"È possibile volare cosí velocemente da invertire il corso del tempo? Qual è la tecnologia alla base della corazza di Iron Man? Come fa un protagonista piccolo come una formica a mettere K.O. supercattivi piú grandi di un uomo? James Kakalios ci ha condotto per mano tra personaggi dei fumetti e oggetti quotidiani per rivelarci i loro segreti. Adesso ci spiega, con la stessa ironia e accuratezza, la fisica alla base dei superpoteri degli eroi cinematografici piú famosi. Spaziando dalla teoria dei campi alla relatività ristretta, dal concetto di energia alle strutture cristalline, incontreremo Guanti dell'infinito e universi paralleli, Iron man e Thor e, nel frattempo, impareremo la scienza senza bisogno di formule e calcoli complicati, divertendoci, proprio come davanti a un film.",https://www.ibs.it/fisica-dei-supereroi-di-hollywood-libro-james-kakalios/e/9788806274054,False,2026-07-07
Altri Editori,https://www.ibs.it/images/9791280772817_0_0_150_0_75.jpg,"Walden, ovvero Vita nei boschi",Henry David Thoreau,Burno,2026,,https://www.ibs.it/walden-ovvero-vita-nei-boschi-libro-henry-david-thoreau/e/9791280772817?inventoryId=896876347,False,2026-07-04
Altri Editori,https://www.ibs.it/images/9788855233804_0_0_150_0_75.jpg,L'anima del polpo. Una sorprendente esplorazione delle meraviglie della coscienza,Sy Montgomery,Aboca Edizioni,2026,,https://www.ibs.it/anima-del-polpo-sorprendente-esplorazione-libro-sy-montgomery/e/9788855233804?inventoryId=990908306,False,2026-07-05
Editori Selezionati,https://www.ibs.it/images/9788811022374_0_0_150_0_75.jpg,Una volpe per amica,Catherine Raven,Garzanti,2026,,https://www.ibs.it/volpe-per-amica-libro-catherine-raven/e/9788811022374?inventoryId=957934867,False,2026-07-04
Altri Editori,https://www.ibs.it/images/9788842227953_0_0_150_0_75.jpg,La Terra è blu come un’arancia. Il mistero della ricerca,N/D,Allemandi,2026,,https://www.ibs.it/terra-blu-come-arancia-mistero-libro-vari/e/9788842227953?inventoryId=940887005,False,2026-07-07
Altri Editori,https://www.ibs.it/images/9791281581180_0_0_150_0_75.jpg,"Il capitalismo metabòlico. Nuova specie, nuovo capitalismo: le soggettività biotiche e le nuove frontiere del capitale-potere",Matteo Spagnuolo,Acro-Pòlis,2026,,https://www.ibs.it/capitalismo-metabolico-nuova-specie-nuovo-libro-matteo-spagnuolo/e/9791281581180,False,2026-07-08
Altri Editori,https://www.ibs.it/images/9788893855259_0_0_150_0_75.jpg,Calculus I,"Fabio Punzo,Stefano Biagi",Esculapio,2026,,https://www.ibs.it/calculus-libro-fabio-punzo-stefano-biagi/e/9788893855259,True,2026-07-09
Altri Editori,https://www.ibs.it/images/9788893855235_0_0_150_0_75.jpg,"Esercizi di analisi matematica 1, geometria e algebra lineare","Marco Contedini,Gabriele Grillo,Fabio Punzo",Esculapio,2026,,https://www.ibs.it/esercizi-di-analisi-matematica-1-libro-vari/e/9788893855235,True,2026-07-09
Altri Editori,https://www.ibs.it/images/9788860199317_0_0_150_0_75.jpg,Francesco Mussi paladino di un'apicoltura etica,Marco Marando,Felici,2026,,https://www.ibs.it/francesco-mussi-paladino-di-apicoltura-libro-marco-marando/e/9788860199317,False,2026-07-08
Altri Editori,https://www.ibs.it/images/9788846775689_0_0_150_0_75.jpg,Giros. Orchidee spontanee d'Europa (2026). Vol. 1,N/D,Edizioni ETS,2026,,https://www.ibs.it/giros-orchidee-spontanee-d-europa-libro-vari/e/9788846775689,True,2026-07-09
Altri Editori,https://www.ibs.it/images/9791224083535_0_0_150_0_75.jpg,L'inizio di una fine,Frederick Bradley,Youcanprint,2026,,https://www.ibs.it/inizio-di-fine-libro-frederick-bradley/e/9791224083535,False,2026-07-08
Altri Editori,https://www.ibs.it/images/9788893873543_0_0_150_0_75.jpg,Venezia e il clima che cambia. Scenari di rischio e azioni di mitigazone,N/D,Il Poligrafo,2026,,https://www.ibs.it/venezia-clima-che-cambia-scenari-libro-vari/e/9788893873543?inventoryId=1048901705,False,2026-07-08
Editori Selezionati,https://www.ibs.it/images/9788828219033_0_0_150_0_75.jpg,Quel caos grandioso chiamato universo,Guido Tonelli,Solferino,2026,,https://www.ibs.it/quel-caos-grandioso-chiamato-universo-libro-guido-tonelli/e/9788828219033,False,2026-07-07
Altri Editori,https://www.ibs.it/images/9791257001582_0_0_150_0_75.jpg,"Fare pace con il frigo. Ansia, stress e fame nervosa: smetti di riempire vuoti che non sono nello stomaco",Sonia Vellere,Terra Nuova Edizioni,2026,,https://www.ibs.it/fare-pace-con-frigo-ansia-libro-sonia-vellere/e/9791257001582?inventoryId=932532729,False,2026-07-03
Altri Editori,https://www.ibs.it/images/9791259922403_0_0_150_0_75.jpg,La via dell'Everest. Come imparare a credere in sé stessi e raggiungere i propri obiettivi,Melissa Arnot Reid,Corbaccio,2026,,https://www.ibs.it/via-dell-everest-come-imparare-libro-melissa-arnot-reid/e/9791259922403?inventoryId=920840498,False,2026-07-04
Altri Editori,https://www.ibs.it/images/9788836165728_0_0_150_0_75.jpg,Ritrova te stesso con Platone. Filosofie per essere felici,Salvatore Grandone,DIARKOS,2026,,https://www.ibs.it/ritrova-te-stesso-con-platone-libro-salvatore-grandone/e/9788836165728,True,2026-07-09
Altri Editori,https://www.ibs.it/images/9788830153882_0_0_150_0_75.jpg,Ciò che cerchi ti sta cercando. Trasforma la tua vita con la legge dell'attrazione,Gaia Zendali,Bompiani,2026,,https://www.ibs.it/cio-che-cerchi-ti-sta-libro-gaia-zendali/e/9788830153882,True,2026-07-09
