Categoria_App,Copertina,Titolo,Autore,Editore,Anno,Descrizione,Link,Nuovo,Data_Aggiunta
Altri Editori,https://www.ibs.it/images/9788890380655_0_0_150_0_75.jpg,Castelbuono e Cantalupo. Due microstorie nel cuore dell'Umbria,N/D,Comune di Bevagna,2026,,https://www.ibs.it/castelbuono-cantalupo-due-microstorie-nel-libro-vari/e/9788890380655,False,2026-03-31
Altri Editori,https://www.ibs.it/images/9788893238304_0_0_150_0_75.jpg,"America, go away! Come difendersi dal potere che sta travolgendo il mondo",Sara Lucaroni,Compagnia Editoriale Aliberti,2026,,https://www.ibs.it/america-go-away-come-difendersi-libro-sara-lucaroni/e/9788893238304,False,2026-04-02
Editori Selezionati,https://www.ibs.it/images/9788807200212_0_0_150_0_75.jpg,La continuità del male. Perché la destra italiana è ancora fascista,Tomaso Montanari,Feltrinelli,2026,"Il fascismo non è un relitto del passato. Non è un’ombra confinata nei manuali di storia o nei rituali nostalgici di una minoranza. È una corrente sotterranea, carsica, che attraversa la Repubblica e riaffiora ogni volta che la democrazia si indebolisce. Tomaso Montanari parte da una domanda semplice e feroce: che cosa resta del fascismo nell’Italia di oggi? La risposta è radicale. Il male non è una parentesi chiusa nel 1945, ma una continuità che si rinnova. Dalla fine della guerra un ininterrotto passaggio di testimone tra uomini, idee, linguaggi e apparati ha consentito alla mitologia e all’ideologia politica del fascismo di sopravvivere alla sconfitta militare e alla nascita della Costituzione. Non come ripetizione caricaturale del Ventennio, ma come adattamento strategico: restano identici la visione razzista dell’umanità, l’idea di una nazione basata sul sangue, l’avversione per ogni principio di eguaglianza, il culto del capo, un modello autoritario dello Stato, l’odio per le diversità. La continuità del male demolisce il mito consolatorio di una destra conservatrice, moderata, istituzionale e disposta a stare nei confini della Costituzione. Il progetto è esattamente il contrario: abbattere la Costituzione antifascista e riportarci all’odio e alla paura. Con rigore filologico e passione civile, Montanari ricostruisce la genealogia delle idee che dominano il discorso pubblico contemporaneo: la paura del diverso come strumento di governo, l’ossessione identitaria, il dominio patriarcale, l’ammirazione per le società “spartane” che praticano l’apartheid e la violenza. Ogni parola viene riportata alla sua fonte, ogni formula ricondotta alla sua origine. Non un’invettiva, ma un atto di verità politica. Chiamare le cose con il loro nome diventa una necessità democratica. Per capire che cosa sta accadendo. Per riconoscere la matrice dell’intolleranza e del discorso d’odio. Per spezzare la continuità del male, e fermare l’ascesa dei nuovi fascisti: siamo ancora in tempo. Se li vediamo per quello che sono davvero. C’è un lungo e sotterraneo filo nero che lega le idee della destra che governa l’Italia al fascismo. Un atto di verità politica.",https://www.ibs.it/continuita-del-male-perche-destra-libro-tomaso-montanari/e/9788807200212,False,2026-04-08
Editori Selezionati,https://www.ibs.it/images/9788858160411_0_0_150_0_75.jpg,A tu per tu con «Il capitale»,Roberto Fineschi,Laterza,2026,"Il capitale è un testo fondamentale della modernità, una pietra miliare del pensiero filosofico, economico e politico. C’è poco da fare: per capire qualcosa del mondo che ci circonda, nel bene e nel male, non si può proprio ignorarlo. Anche i suoi detrattori più accaniti e quanti si erano affrettati a relegarlo in soffitta, sono dovuti correre a rispolverarlo per cercare spiegazioni a fatti attualissimi come la formazione di grandi monopoli, la crisi economica, la disoccupazione di massa, l’ipersfruttamento di umani e ambiente, e molto altro ancora. Tutti fenomeni per i quali le teorie economiche mainstream offrono poche risposte e ancor meno soluzioni. Sembra, insomma, che Marx abbia ancora molto da dirci e che le sue chiavi di lettura abbiano conservato intatto il proprio valore. Vale dunque la pena rimettere mano al Capitale, senza dubbio la sua opera più importante. E qui viene il difficile, perché è un testo lungo e laborioso, di una complessità spesso scoraggiante per chi è sprovvisto di una formazione specifica. Questo libro viene incontro a chi desidera afferrare le geniali intuizioni contenute nel Capitale ma, per un motivo o per l’altro, non possa imbarcarsi da solo in una simile impresa. A farci da timoniere è allora uno dei maggiori esperti di Marx, Roberto Fineschi, che ha dedicato una vita a studiare l’opera del pensatore tedesco. Ripercorrendo con grande chiarezza la struttura e i concetti principali, senza mai banalizzarli, ma con una scrittura capace di sciogliere anche i nodi più intricati, Fineschi ci accompagna alla scoperta del Capitale. Un classico che rimane, a più di un secolo e mezzo dalla pubblicazione, insuperato e insuperabile.",https://www.ibs.it/a-tu-per-tu-con-libro-roberto-fineschi/e/9788858160411,False,2026-04-03
Altri Editori,https://www.ibs.it/images/9788855233828_0_0_150_0_75.jpg,Per una civiltà della terra. La sfida di un nuovo umanesimo nel tempo della complessità,"Mauro Ceruti,Francesco Bellusci",Aboca Edizioni,2026,,https://www.ibs.it/per-civilta-della-terra-sfida-libro-mauro-ceruti-francesco-bellusci/e/9788855233828,False,2026-04-03
Altri Editori,https://www.ibs.it/images/9791255431107_0_0_150_0_75.jpg,La pubblica (d)istruzione. Come la destra ha sabotato la scuola con la complicità della sinistra,Alex Corlazzoli,PaperFIRST,2026,,https://www.ibs.it/pubblica-distruzione-come-destra-ha-libro-alex-corlazzoli/e/9791255431107,False,2026-04-03
Editori Selezionati,https://www.ibs.it/images/9791223207611_0_0_150_0_75.jpg,"Il no che vorrei dirti. Smartphone, chat e social. Guida pratica per genitori smarriti",Francesca Barra,Giunti Editore,2026,"Francesca Barra affronta senza remore il tema più coinvolgente per ogni adulto che voglia comprendere le nuove generazioni e accompagnare i ragazzi nell'arte di crescere, quello della difficile mediazione nell'uso dei social. E lo fa da una prospettiva originale e poliedrica: è una giornalista d'inchiesta, conduttrice, scrittrice di lunga esperienza, ma anche la madre di quattro figli di età diverse, che vive in prima persona le contraddizioni dell'essere genitore in un'epoca iperconnessa e fragile. Dodici capitoli, ciascuno con un focus su un aspetto dello sfaccettato universo della comunicazione social, intrecciano storie vere, indagini, riflessioni, in cui alle parole di psicologi, pedagogisti, linguisti e insegnanti si affiancano quelle di genitori che hanno conosciuto il dolore. Il risultato è un testo pensato per creare consapevolezza, offrire strumenti pratici e diventare un punto di riferimento per madri, padri, educatori e professionisti del mondo della scuola. Un manifesto ma anche uno spazio di confronto che vuole “accendere il fuoco” dell'educazione, come diceva Yeats, e rinnovare il patto d'amore e responsabilità con i nostri ragazzi. La riflessione appassionata, partecipe e informata che ancora mancava in Italia per riportare al centro del dibattito sui ragazzi e i social la nostra parte, la nostra responsabilità educativa: la voce adulta.",https://www.ibs.it/no-che-vorrei-dirti-smartphone-libro-francesca-barra/e/9791223207611,False,2026-04-02
Editori Selezionati,https://www.ibs.it/images/9788858156001_0_0_150_0_75.jpg,Consegno pacchi a Pechino,Hu AnYan,Laterza,2026,"Cercare una camera economica con un impianto di aria condizionata decente. Calcolare la quantità giusta di alcol per riuscire ad addormentarsi senza sentirsi stonati all’inizio del turno di lavoro del giorno dopo. Trovare, tra le infinite strade di Pechino, il percorso per consegnare il maggior numero di pacchi nel minor tempo possibile. Sforzarsi di conservare un po’ di umanità. Nel descrivere le sue impressioni, Hu Anyan disegna con ricchezza di dettagli l’immagine di una generazione, di una classe, che non vuole cadere nella trappola dell’autocommiserazione, che è alla continua ricerca di un senso, pur essendo segnata dalla precarietà del mercato del lavoro e dalla pressione sociale. Dalle aziende di logistica a Shanghai alla consegna di pacchi a Pechino, passando da un lavoro all’altro, Hu Anyan svela dall’interno gli ingranaggi del capitalismo ad alta intensità e bassa umanità. E svela a sé stesso il potere liberatorio della scrittura. Un libro ipnotico, rivoluzionario, ricco di umanità e umorismo, tradotto in 15 lingue.",https://www.ibs.it/consegno-pacchi-a-pechino-libro-hu-anyan/e/9788858156001,False,2026-04-03
Editori Selezionati,https://www.ibs.it/images/9791222324364_0_0_150_0_75.jpg,Il sex appeal dell'inorganico,Mario Perniola,Mimesis,2026,"Viene pubblicata per la prima volta l’edizione rivista da Mario Perniola del suo intramontabile ""Il sex appeal dell’inorganico"". In esso, Perniola esplora una trasformazione radicale della sensibilità contemporanea, in cui la sessualità si estende oltre il corpo, oltre l’atto, oltre la distinzione tra soggetto e oggetto. L’esperienza estetica e quella erotica convergono in una zona neutra, artificiale, abitata da superfici lucide, corpi senza desiderio, attrazioni impersonali e sempre disponibili. Attraversando filosofia, cultura pop, sport, tecnologie e arte, il libro disegna una mappa della condizione postumana, in cui pensare significa sentire come cosa, e sentire significa riconoscersi in ciò che non è più vivo, ma neppure morto. Perniola conduce il lettore in un paesaggio mentale inedito, dove l’eccitazione non si lega più alla carne, ma alla distanza, all’astrazione, alla possibilità di percepire senza appartenere.",https://www.ibs.it/sex-appeal-dell-inorganico-libro-mario-perniola/e/9791222324364,False,2026-04-03
Altri Editori,https://www.ibs.it/images/9791259793829_0_0_150_0_75.jpg,La danza del pavone. Il grande imbroglio di Viktor Orbán,Alessandra Briganti,People,2026,,https://www.ibs.it/danza-del-pavone-grande-imbroglio-libro-alessandra-briganti/e/9791259793829,False,2026-04-03
Altri Editori,https://www.ibs.it/images/9791281149007_0_0_150_0_75.jpg,"Il filosofo nella Valley. Alex Karp, Palantir e l'ascesa dello Stato di sorveglianza",Michael Steinberger,Foglio edizioni,2026,,https://www.ibs.it/filosofo-nella-valley-alex-karp-libro-michael-steinberger/e/9791281149007,True,2026-04-09
Editori Selezionati,https://www.ibs.it/images/9788858160398_0_0_150_0_75.jpg,Il tempo dei mostri. Trump e la crisi dell’egemonia americana,Alberto Toscano,Laterza,2026,"Il ritorno di Donald Trump alla presidenza ha visto un’accelerazione della deriva autoritaria che aveva già segnato il suo primo mandato: agenti mascherati a caccia di migranti invadono le città; l’antifascismo è messo all’indice come terrorismo domestico; gli attivisti pro-Pal minacciati di deportazione; conformità ideologica è estorta alle grandi università; e così via, a ritmo frenetico. Rispondere a questi choc quotidiani con lo scandalo o la satira non basta. Dietro lo spettacolo grottesco di un potere sempre più crudo e volgare, votato al culto della sopraffazione, si scorgono logiche profonde. A partire dalla cronaca politica, Alberto Toscano ci porta a riflettere sulle dinamiche sociali di cui Trump non è causa, bensì formidabile reagente: dal revanscismo bianco alle guerre culturali, dall’ascesa dell’ala reazionaria di Silicon Valley al cesarismo tipico della politica americana. Figlio esemplare dell’American century, Trump è anche il segnale che gli Stati Uniti hanno perso la capacità di creare egemonia e sono perciò votati a continui parossismi di dominio. Make America Great Again voleva esorcizzare l’idea di un’America destinata al declino, ma non ha fatto che acutizzarla. Trump si voleva l’imprenditore di una grande rinascita della azienda USA, ma si sta rivelando l’idolo del suo crepuscolo.",https://www.ibs.it/tempo-dei-mostri-trump-crisi-libro-alberto-toscano/e/9788858160398,False,2026-04-04
Altri Editori,https://www.ibs.it/images/9791255481485_0_0_150_0_75.jpg,Il coraggio di essere libere. Scrittrici contro il fascismo,Rossana Dedola,Nutrimenti,2026,,https://www.ibs.it/coraggio-di-essere-libere-scrittrici-libro-rossana-dedola/e/9791255481485,False,2026-04-03
Altri Editori,https://www.ibs.it/images/9788822924377_0_0_150_0_75.jpg,Del copywriting come genere letterario. Gli anni all'Olivetti 1948-1974,Franco Fortini,Quodlibet,2026,,https://www.ibs.it/del-copywriting-come-genere-letterario-libro-franco-fortini/e/9788822924377,False,2026-04-02
Altri Editori,https://www.ibs.it/images/9788871869445_0_0_150_0_75.jpg,Rivivere. Una pratica filosofica,Frédéric Worms,Moretti & Vitali,2026,,https://www.ibs.it/rivivere-pratica-filosofica-libro-frederic-worms/e/9788871869445,False,2026-04-04
Editori Selezionati,https://www.ibs.it/images/9788806273323_0_0_150_0_75.jpg,I miliardari non pagano l'imposta sul reddito. Ed è ora di finirla,Gabriel Zucman,Einaudi,2026,"Per anni Gabriel Zucman ha disegnato la mappa delle grandi fortune mondiali, descrivendo le tecniche per aggirare le imposte nei paradisi fiscali. Poi ha iniziato a occuparsi delle multinazionali, della loro contorta contabilità, dei sistemi grazie ai quali i profitti realizzati in Francia o in Germania atterrano in Irlanda o nelle Bermude per sfuggire alle imposte. L’evasione fiscale internazionale ha influito notevolmente sull’aumento delle disuguaglianze, sull’ammontare del debito pubblico delle nazioni e ancor piú sul trionfo del sentimento di impotenza che costituisce il terreno di coltura dei movimenti reazionari contemporanei. Ma non è tra remote terre esotiche che i nostri principî di giustizia fondamentali spariscono. Svaniscono qui, sotto i nostri occhi, in un’evasione semplicissima, spesso legale ma con effetti sbalorditivi: i miliardari non pagano pressoché alcuna imposta sul reddito. Includendo tutti i versamenti obbligatori, il loro contributo è la metà di quello del cittadino medio. Si tratta di una grave violazione del principio di uguaglianza; ed è giunto il momento di porre fine a questa anomalia. Questa è la logica alla base dell’imposta del 2 per cento sugli ultraricchi.",https://www.ibs.it/miliardari-non-pagano-imposta-sul-libro-gabriel-zucman/e/9788806273323,False,2026-03-31
Altri Editori,https://www.ibs.it/images/9791281577244_0_0_150_0_75.jpg,Consoli e cucine. La diplomazia gastronomica,N/D,Grimaldi & C.,2026,,https://www.ibs.it/consoli-cucine-diplomazia-gastronomica-libro-vari/e/9791281577244,False,2026-04-03
Altri Editori,https://www.ibs.it/images/9788822925008_0_0_150_0_75.jpg,Viaggiando per un quarto di secolo. La letteratura del Novecento attraverso le carte inedite del diplomatico e scrittore Bruno Arcurio,Giovanni Capecchi,Quodlibet,2026,,https://www.ibs.it/viaggiando-per-quarto-di-secolo-libro-giovanni-capecchi/e/9788822925008,False,2026-04-03
Editori Selezionati,https://www.ibs.it/images/9791256140282_0_0_150_0_75.jpg,Tutto ciò che rimane. Una vita nella morte,Sue Black,Castelvecchi,2026,"Il corpo umano è un archivio silenzioso. Quando la vita si spegne, ciò che rimane sono le ossa, custodi fedeli di ciò che siamo stati. In esse si depositano abitudini, traumi, ferite: ogni esperienza lascia una traccia, ogni scelta ne modifica la forma. Senza che ce ne accorgiamo, giorno dopo giorno, la nostra esistenza plasma lo scheletro, trasformandolo lentamente in un autoritratto involontario. Sue Black, tra le più autorevoli antropologhe forensi al mondo, ha fatto della lettura delle ossa la sua missione. Lavora nei laboratori e sulle scene del crimine, nei cimiteri e nei territori devastati da guerre e catastrofi, ricostruendo dai resti umani storie che il tempo aveva sepolto. Con il rigore di un manuale scientifico e l’energia di un grande romanzo d’indagine, il libro si confronta con casi reali in cui ogni dettaglio può fare la differenza: teschi frantumati da ricomporre, cicatrici da interpretare, identità da ricostruire. Lontano da ogni compiacimento del macabro, l’autobiografia di Black offre un’esplorazione limpida e profondamente umana del legame tra vita e morte. Perché leggendo nelle ossa ciò che la carne dimentica impariamo a riconoscere il peso delle nostre scelte e il valore concreto del tempo che viviamo.",https://www.ibs.it/tutto-cio-che-rimane-vita-libro-sue-black/e/9791256140282,False,2026-04-03
Altri Editori,https://www.ibs.it/images/9791254501382_0_0_150_0_75.jpg,"Proletari di tutta la Terra. Lavoro, ecologia e riproduzione nell'era della crisi planetaria",Stefania Barca,Codice,2026,,https://www.ibs.it/proletari-di-tutta-terra-lavoro-libro-stefania-barca/e/9791254501382,False,2026-04-01
Editori Selezionati,https://www.ibs.it/images/9788806258245_0_0_150_0_75.jpg,A cavallo con i poeti,Igort,Einaudi,2026,"Il Giappone per Igort è un luogo dell’anima, un luogo dove ripensare la bellezza e il suo prendere forma nel disegno. In questo libro magnificamente illustrato, a metà tra taccuino di viaggio e album dei ricordi, Igort ripercorre i passi di due amati maestri, il poeta Basho e il pittore Hokusai, da nord a sud, in cerca dello «spirito della tigre nell’aria», l’essenza delle cose, e di “karumi”, «la leggerezza del quotidiano». La natura è un tema privilegiato di moltissima poesia giapponese, a cominciare da quella espressa con la tecnica dell’haiku, tesa a cogliere l’attimo. Matsuo Basho, il più grande maestro di questa tecnica, trasse ispirazione da viaggi tanto faticosi quanto illuminanti, durante i quali percorse migliaia di chilometri su e giù per le piste poco battute del Giappone antico, in compagnia del fido Sora, poeta anche lui. Nel viaggio, sembra dirci Basho, c’è il segreto della bellezza, che deve essere imperfetta, discreta, asimmetrica, perché la simmetria è parodia, opera dell’uomo, appunto, e non della natura. Igort, a sua volta un grande viaggiatore e profondo conoscitore del Giappone moderno, ha ripercorso le tappe del cammino che Basho compì nel 1689, nel profondo Nord del Paese, e poi, sempre con taccuino e colori alla mano, si è diretto a sud, sulle tracce di un altro dei suoi amati maestri, il «vecchio pazzo per la pittura» Hokusai, per contemplare il mutevole Fuji, alla ricerca della stessa meraviglia. Questo libro raccoglie le parole e le immagini sgorgate durante questo duplice viaggio, compiuto in compagnia di un amico fotografo. È un “haibun”, un diario scandito musicalmente dagli haiku di Basho e dagli spazi bianchi sulla pagina, una mappa possibile per conoscere un Giappone forse inedito, poco noto al turista occidentale, un album dei ricordi e un esercizio zen. Mentre il click della macchina fotografica registra istantaneamente la realtà, racconti e disegni richiedono un tempo più lungo, una sedimentazione. Ciononostante, proprio perché Igort li ha eseguiti sul posto, hanno una grande immediatezza e allo stesso tempo la forza del rito che da sempre consente agli artisti di giungere a una conoscenza più profonda, alla contemplazione.",https://www.ibs.it/a-cavallo-con-poeti-libro-igort/e/9788806258245,False,2026-04-08
Altri Editori,https://www.ibs.it/images/9791281639546_0_0_150_0_75.jpg,Disarmare il discorso. Sulla militarizzazione del linguaggio,Federico Faloppa,effequ,2026,,https://www.ibs.it/disarmare-discorso-sulla-militarizzazione-del-libro-federico-faloppa/e/9791281639546,False,2026-04-03
Altri Editori,https://www.ibs.it/images/9791281577251_0_0_150_0_75.jpg,Gli storici processi di Castel Capuano,N/D,Grimaldi & C.,2026,,https://www.ibs.it/storici-processi-di-castel-capuano-libro-vari/e/9791281577251,False,2026-04-03
Altri Editori,https://www.ibs.it/images/9791257010034_0_0_150_0_75.jpg,Tropici del dolore. Uno studio sulla narrativa contemporanea e il lutto,Luca Chiurchiù,Viella,2026,,https://www.ibs.it/tropici-del-dolore-studio-sulla-libro-luca-chiurchiu/e/9791257010034,False,2026-04-03
Editori Selezionati,https://www.ibs.it/images/9791256148363_0_0_150_0_75.jpg,Si salvatti chi può. 201 cose insopportabili di noi italiani,Matteo Salvatti,Castelvecchi,2026,"Un viaggio dentro i piccoli, grandi tic del Belpaese. Dopo anni passati a osservare l’Italia per strada, nei bar, negli uffici e sui social, Matteo Salvatti mette sotto la lente tutto ciò che, nella vita quotidiana, ci fa sbuffare, imbestialire o sorridere con complicità. Dalle code al supermercato alle stranezze dei ristoranti, dalle manie al telefono alle piccole furbizie di ogni giorno, l’autore passa in rassegna 201 situazioni capaci di farci perdere la pazienza. Con uno stile ironico e tagliente, Si Salvatti chi può smonta le abitudini più irritanti della nostra vita quotidiana e restituisce il ritratto di un’Italia che si riconosce, si arrabbia e ride di sé: il Paese dei poeti, dei santi, dei navigatori… e delle cose insopportabili.",https://www.ibs.it/si-salvatti-chi-puo-201-libro-matteo-salvatti/e/9791256148363,False,2026-04-03
Altri Editori,https://www.ibs.it/images/9791254846513_0_0_150_0_75.jpg,Tsunami Trump. Il nazionalismo americano e l'Europa,Sergio Fabbrini,Il Sole 24 Ore,2026,,https://www.ibs.it/tsunami-trump-nazionalismo-americano-europa-libro-sergio-fabbrini/e/9791254846513,False,2026-04-03
Altri Editori,https://www.ibs.it/images/9791254802458_0_0_150_0_75.jpg,Dry season. Il mio anno di piacere senza sesso,Melissa Febos,Nottetempo,2026,,https://www.ibs.it/dry-season-mio-anno-di-libro-melissa-febos/e/9791254802458,False,2026-04-03
Altri Editori,https://www.ibs.it/images/9788871869513_0_0_150_0_75.jpg,Nuove speranze per un mondo che cambia,Bertrand Russell,Moretti & Vitali,2026,,https://www.ibs.it/nuove-speranze-per-mondo-che-libro-bertrand-russell/e/9788871869513,False,2026-04-04
Altri Editori,https://www.ibs.it/images/9788869506222_0_0_150_0_75.jpg,Enciclopedia delle curiosità,Gaspare Bassi,Rogiosi,2026,,https://www.ibs.it/enciclopedia-delle-curiosita-libro-gaspare-bassi/e/9788869506222,False,2026-04-03
Editori Selezionati,https://www.ibs.it/images/9788865486627_0_0_150_0_75.jpg,Storia di Roby il pazzo. La parabola di Sandalo nella lotta armata,Gabriele Fantini,DeriveApprodi,2026,"Quella che avete tra le mani è la prima ricostruzione organica dell’anomala biografia di Roberto Sandalo (1957-2014), uomo che nello spazio di trent’anni ha militato in Lotta continua, è tracimato nelle file di Prima linea, si è pentito contribuendo allo smantellamento dell’organizzazione, per poi accostarsi alle Camicie Verdi della Lega Nord e, infine, ha compiuto azioni criminali contro esponenti della comunità islamica italiana. Riordinare i tasselli di una vita così complessa ha significato spogliarla dei giudizi e delle interpretazioni che in alcune circostanze erano passati dalla memorialistica ai lavori più marcatamente storici; ciò è stato possibile grazie all’abbondanza e alla varietà di documenti esaminati e dei soggetti interpellati dall’autore. La storia di «Roby il Pazzo», come era soprannominato, è venata da una forma di radicalismo indipendente dal contenuto, trovando bandiere ed esiti diversi. In ogni passaggio, il percorso e le scelte dell’individuo sono attentamente messi in relazione ai processi collettivi e ai contesti storici. A partire da una biografia che sembra un romanzo, questo è un libro che farà riflettere e discutere su una figura che, nel suo scabroso percorso, ci permette di osservare uno scorcio decisivo della storia italiana.",https://www.ibs.it/storia-di-roby-pazzo-parabola-libro-gabriele-fantini/e/9788865486627,False,2026-04-04
Editori Selezionati,https://www.ibs.it/images/9788858160428_0_0_150_0_75.jpg,"America dentro. Storie, volti, conflitti di un Paese in bilico","Massimo Gaggi,Tamara Jadrejcic",Laterza,2026,"Dall’Alaska, ‘ultima frontiera’ nella quale svaniscono nel nulla migliaia di persone, all’Alabama e alla Georgia dei conflitti razziali, dalla rivolta dei Sioux del South Dakota contro le big oil all’Appalachia della povertà estrema dei bianchi, Massimo Gaggi e Tamara Jadrejcic, coniugi giornalisti, sono stati per vent’anni testimoni di straordinari cambiamenti. Arrivati nel 2004, hanno conosciuto un’America ottimista, orgogliosa, quasi euforica. Che, però, dopo il crollo finanziario e la Grande recessione del 2008-2009 ha smesso di credere nelle istituzioni e di fidarsi delle élite. Un Paese sempre più insicuro, cupo, arrabbiato, spaventato dalla minaccia esterna del terrorismo jihadista e scosso dalle lacerazioni del tessuto sociale interno. Un Paese armato fino ai denti che ha cercato rifugio nel populismo e in cui il razzismo riemerge coi suprematisti, sdoganati da Trump dopo i tentativi di riconciliazione di Obama. Racconti paralleli di vita quotidiana – istruzione, sport, abitudini alimentari folli, le incredibili inefficienze e i costi assurdi della sanità più avanzata del mondo – ma anche viaggio nell’involuzione di una società che non riesce più a riconoscersi in valori comuni e nella radicalizzazione politica che uccide il confronto, il dialogo: al Congresso come a tavola con parenti e amici. Mentre Trump lascia spazio ai miliardari del tecnoautoritarismo.",https://www.ibs.it/america-dentro-storie-volti-conflitti-libro-massimo-gaggi-tamara-jadrejcic/e/9788858160428,False,2026-04-03
