Categoria_App,Copertina,Titolo,Autore,Editore,Anno,Descrizione,Link,Nuovo,Data_Aggiunta
Altri Editori,https://www.ibs.it/images/9788832986617_0_0_150_0_75.jpg,Dalla cultura sciamanica al taoismo,Massimo Braglia,ERGA,2026,,https://www.ibs.it/dalla-cultura-sciamanica-al-taoismo-libro-massimo-braglia/e/9788832986617,False,2026-04-21
Altri Editori,https://www.ibs.it/images/9788822295279_0_0_150_0_75.jpg,"Giovan Francesco Pico e la Strix: a cinquecento anni dalla caccia alle streghe di Mirandola. Atti del Convegno internazionale di Studi (Modena, 27 ottobre 2023)",N/D,Olschki,2026,,https://www.ibs.it/giovan-francesco-pico-strix-a-libro-vari/e/9788822295279,False,2026-04-17
Altri Editori,https://www.ibs.it/images/9791282054157_0_0_150_0_75.jpg,Quando gli dèi abitavano l'anima,Rocco Berloco,Gagliano Edizioni,2026,,https://www.ibs.it/quando-dei-abitavano-anima-libro-rocco-berloco/e/9791282054157,True,2026-04-23
Altri Editori,https://www.ibs.it/images/9791281917279_0_0_150_0_75.jpg,Sulla strada del samaritano. Il «decalogo» dell'amore,Andrea Mariani,Sanpino,2026,,https://www.ibs.it/sulla-strada-del-samaritano-decalogo-libro-andrea-mariani/e/9791281917279,False,2026-04-22
Altri Editori,https://www.ibs.it/images/9791280192738_0_0_150_0_75.jpg,"Vocazioni (2026). Vol. 2: Questo è il Figlio mio, l’amato!",N/D,Fond.ne di Religione Santi Francesco d'Assisi e Caterina da Siena,2026,,https://www.ibs.it/vocazioni-2026-vol-2-questo-libro-vari/e/9791280192738,False,2026-04-15
Altri Editori,https://www.ibs.it/images/9791259756206_0_0_150_0_75.jpg,Un cuore che vede. Riflessioni ed esperienze di carità vissuta in parrocchia,"Luigi Guglielmoni,Fausto Negri",Tau,2026,,https://www.ibs.it/cuore-che-vede-riflessioni-ed-libro-luigi-guglielmoni-fausto-negri/e/9791259756206,False,2026-04-21
Altri Editori,https://www.ibs.it/images/9791259627803_0_0_150_0_75.jpg,Gesù si è fatto un selfie,Antonio Passaro,Cantagalli,2026,,https://www.ibs.it/gesu-si-fatto-selfie-libro-antonio-passaro/e/9791259627803,False,2026-04-17
Altri Editori,https://www.ibs.it/images/9791255083474_0_0_150_0_75.jpg,San Simone Stock. Veggente della Madonna del Carmine. Ediz. illustrata,Graziano Pesenti,Velar,2026,,https://www.ibs.it/san-simone-stock-veggente-della-libro-graziano-pesenti/e/9791255083474,False,2026-04-22
Altri Editori,https://www.ibs.it/images/9791255083412_0_0_150_0_75.jpg,Santa Fara. Faro della Provvidenza. Ediz. illustrata,"Angela Laghezza,Francesco Nocco,Giulia Perrino",Velar,2026,,https://www.ibs.it/santa-fara-faro-della-provvidenza-libro-vari/e/9791255083412,False,2026-04-22
Altri Editori,https://www.ibs.it/images/9791255083405_0_0_150_0_75.jpg,Mons. Celestino Annibale Cattaneo. Padre delle orfane e degli orfani,Andemariam Tesfamichael,Velar,2026,,https://www.ibs.it/mons-celestino-annibale-cattaneo-padre-libro-andemariam-tesfamichael/e/9791255083405,False,2026-04-22
Altri Editori,https://www.ibs.it/images/9791255083399_0_0_150_0_75.jpg,Serva di Dio suor Maria Angela Crocifisso. Vita e carismi. Ediz. illustrata,Maria Rosaria Minopoli,Velar,2026,,https://www.ibs.it/serva-di-dio-suor-maria-libro-maria-rosaria-minopoli/e/9791255083399,False,2026-04-22
Altri Editori,https://www.ibs.it/images/9791220505031_0_0_150_0_75.jpg,Edificare la gioia. Francesco d'Assisi,Pierfranco Bruni,Pellegrini,2026,,https://www.ibs.it/edificare-gioia-francesco-d-assisi-libro-pierfranco-bruni/e/9791220505031,False,2026-04-21
Altri Editori,https://www.ibs.it/images/9788895561363_0_0_150_0_75.jpg,Voci del cammino,Alberto Campalani,Arca Edizioni,2026,,https://www.ibs.it/voci-del-cammino-libro-alberto-campalani/e/9788895561363,False,2026-04-21
Altri Editori,https://www.ibs.it/images/9788893189545_0_0_150_0_75.jpg,"Gli angeli nelle religioni monoteiste Ebraismo, Cristianesimo e Islam",Marcello Stanzione,Edizioni Segno,2026,,https://www.ibs.it/angeli-nelle-religioni-monoteiste-ebraismo-libro-marcello-stanzione/e/9788893189545,False,2026-04-21
Altri Editori,https://www.ibs.it/images/9788893189538_0_0_150_0_75.jpg,"Il sacerdote Antonio Lo Duca mistico degli arcangeli. Vita, opere, miracoli e opposizioni",Carmine Alvino,Edizioni Segno,2026,,https://www.ibs.it/sacerdote-antonio-duca-mistico-degli-libro-carmine-alvino/e/9788893189538,False,2026-04-21
Altri Editori,https://www.ibs.it/images/9788893189408_0_0_150_0_75.jpg,Una volta e per sempre,Laura Barbiero,Edizioni Segno,2026,,https://www.ibs.it/volta-per-sempre-libro-laura-barbiero/e/9788893189408,False,2026-04-21
Altri Editori,https://www.ibs.it/images/9788892873407_0_0_150_0_75.jpg,Maria e l'eucaristia. A messa insieme alla vergine Maria,Alberto Zironi,Il Pozzo di Giacobbe,2026,,https://www.ibs.it/maria-eucaristia-a-messa-insieme-libro-alberto-zironi/e/9788892873407,True,2026-04-23
Altri Editori,https://www.ibs.it/images/9788892701908_0_0_150_0_75.jpg,"Testi preziosi del buddhismo mistico. 108 testi, brani e canti di realizzazione",N/D,Psiche 2,2026,,https://www.ibs.it/testi-preziosi-del-buddhismo-mistico-libro-vari/e/9788892701908,False,2026-04-22
Editori Selezionati,https://www.ibs.it/images/9788892250383_0_0_150_0_75.jpg,Perché cerchi Francesco?,Fulvio Mannoia,San Paolo Edizioni,2026,"Perché Assisi, solo a udirne il nome, suscita un fremito al cuore? E perché, ancora oggi, sentiamo il bisogno di metterci in cammino verso questa città? In queste pagine, Fulvio Mannoia conduce il lettore in un pellegrinaggio non solo geografico, ma soprattutto spirituale: tra le pietre rosa del Subasio e il profumo mistico che ogni vicolo trasuda, Assisi si rivela simile a una nave che naviga i secoli senza affondare mai, custode instancabile di un messaggio di pace universale. Il racconto dei luoghi — dalla casa di Pietro di Bernardone al silenzio delle Carceri, dal Vescovado, teatro della Spogliazione di Francesco, al “grembo- della Porziuncola — e di alcune delle pagine più intense dell’esperienza francescana diviene invito a mettersi in cammino seguendo le orme del Poverello: colui che, facendosi piccolo, ha saputo includere il mondo intero nell’abbraccio di Dio.",https://www.ibs.it/perche-cerchi-francesco-libro-fulvio-mannoia/e/9788892250383,False,2026-04-22
Editori Selezionati,https://www.ibs.it/images/9788892250345_0_0_150_0_75.jpg,Camminiamo insieme,Leone XIV (Robert Francis Prevost),San Paolo Edizioni,2026,"I testi più significativi di Papa Leone XIV si offrono a noi proponendo un magistero che invita la Chiesa e l'umanità intera a “camminare insieme"". Dalle omelie ai discorsi, dagli appelli per la pace alle riflessioni sulla famiglia, sulla missione e sulla speranza, emerge una voce al contempo paterna e profetica, capace di parlare ai nostri giorni difficili con chiarezza evangelica e profonda tenerezza e di invitare ciascuno all'impegno per una testimonianza sincera in un mondo che fatica ad accogliere Cristo e il mistero della Vita. Al centro risplende l'annuncio della salvezza per tutti, luce che non abbaglia ma orienta, che non impone ma attrae. Leone XIV richiama con forza l'urgenza di una fede vissuta nella comunione, di una Chiesa missionaria, lievito nella pasta del mondo, testimone di unità in un'epoca segnata da divisioni e fragilità. Le sue parole aprono orizzonti di speranza, invitano a disarmare i cuori, a custodire le famiglie, a servire la vita e a riscoprire la gioia dell'Eucaristia. Queste pagine non sono soltanto memoria di un anno, ma promessa di un cammino: perché nessuno si salva da solo e la gioia del Vangelo fiorisce quando diventiamo, insieme, popolo in cammino verso la casa del Signore.",https://www.ibs.it/camminiamo-insieme-libro-leone-xiv-robert-francis-prevost/e/9788892250345,True,2026-04-23
Editori Selezionati,https://www.ibs.it/images/9788892250185_0_0_150_0_75.jpg,Raimon Panikkar. Profeta del dopodomani,Raffaele Luise,San Paolo Edizioni,2026,"Se si chiede a un fi glio della tradizione occidentale che cosa sia la filosofia, la risposta più probabile sarà che è l’esercizio del pensiero critico. Ma, se si fa la stessa domanda a qualcuno che coltivi la filosofia essendo radicato in un’altra tradizione, costui risponderà che essa è iniziazione alla vita. È in questo secondo senso, più pregnante e integrale, che Panikkar si è aperto all’esperienza fi losofica, a cui inerisce inscindibilmente un valore teologico e spirituale. Questo per lui ha comportato un cammino di maturazione che consente di portare a convergenza i significati riconosciuti nella ricerca e il modo di esistere. Dalla Prefazione di Roberto Mancini",https://www.ibs.it/raimon-panikkar-profeta-del-dopodomani-libro-raffaele-luise/e/9788892250185,False,2026-04-22
Editori Selezionati,https://www.ibs.it/images/9788892248359_0_0_150_0_75.jpg,Amen. La parola che salva (2026). Vol. 8: Agosto,N/D,San Paolo Edizioni,2026,,https://www.ibs.it/amen-parola-che-salva-2026-libro-vari/e/9788892248359,True,2026-04-23
Editori Selezionati,https://www.ibs.it/images/9788892248342_0_0_150_0_75.jpg,Amen. La parola che salva (2026). Vol. 7: Luglio,N/D,San Paolo Edizioni,2026,,https://www.ibs.it/amen-parola-che-salva-2026-libro-vari/e/9788892248342,True,2026-04-23
Editori Selezionati,https://www.ibs.it/images/9788892247840_0_0_150_0_75.jpg,La Bibbia,N/D,San Paolo Edizioni,2026,"La Bibbia in un’edizione perfetta da portare sempre con sé. Robusta ed elegante con copertina soft touch gommata ed elastico. Presenta 72 pagine a colori con introduzione generale alla lettura, cartine, ricostruzioni. E poi introduzioni ai singoli libri, note al testo: tutto ciò che occorre a chi si avvicina per la prima volta alla Parola di Dio. La Bibbia ogni giorno: un percorso guidato per leggere tutta la Bibbia in 365 giorni. La Bibbia per la catechesi: la guida alla lettura fornisce ai catechisti preziose indicazioni per spiegare il testo biblico. La Bibbia per la lettura orante: semplice, completa, recepisce le esortazioni di papa Francesco per una lettura orante, personale e comunitaria, del testo biblico. La Bibbia per tutti: ideale per i gruppi parrocchiali, i giovani, la formazione pastorale.",https://www.ibs.it/bibbia-libro-vari/e/9788892247840,True,2026-04-23
Altri Editori,https://www.ibs.it/images/9788884598301_0_0_150_0_75.jpg,L'alleanza nella misericordia,Maria Antonietta Cucci,Wip Edizioni,2026,,https://www.ibs.it/alleanza-nella-misericordia-libro-maria-antonietta-cucci/e/9788884598301,False,2026-04-22
Altri Editori,https://www.ibs.it/images/9788868948580_0_0_150_0_75.jpg,Gli oblati ieri e oggi,N/D,Centro Ambrosiano,2026,,https://www.ibs.it/oblati-ieri-oggi-libro-vari/e/9788868948580,True,2026-04-23
Altri Editori,https://www.ibs.it/images/9788865002438_0_0_150_0_75.jpg,Libertà e obbedienza nella chiesa. Una lezione di grande attualità,Lorenzo Milani,Libreria Editrice Fiorentina,2026,,https://www.ibs.it/liberta-obbedienza-nella-chiesa-lezione-libro-lorenzo-milani/e/9788865002438,False,2026-04-22
Altri Editori,https://www.ibs.it/images/9788839409737_0_0_150_0_75.jpg,Grande lessico dell'Antico Testamento,"G. Johannes Botterweck,Helmer Ringgren",Paideia,2026,,https://www.ibs.it/grande-lessico-dell-antico-testamento-libro-g-johannes-botterweck-helmer-ringgren/e/9788839409737,False,2026-04-22
Altri Editori,https://www.ibs.it/images/9788833067339_0_0_150_0_75.jpg,Insieme per il mondo. Il libro degli Atti,Michael R. Wagenman,ADI Media,2026,,https://www.ibs.it/insieme-per-mondo-libro-degli-libro-michael-r-wagenman/e/9788833067339,False,2026-04-18
Altri Editori,https://www.ibs.it/images/9788833067315_0_0_150_0_75.jpg,Francesco Toppi,Salvatore Cusumano,ADI Media,2026,,https://www.ibs.it/francesco-toppi-libro-salvatore-cusumano/e/9788833067315,False,2026-04-18
Altri Editori,https://www.ibs.it/images/9788833067209_0_0_150_0_75.jpg,Lo scopo della vita: vivere come Gesù,Jonny Ivey,ADI Media,2026,,https://www.ibs.it/scopo-della-vita-vivere-come-libro-jonny-ivey/e/9788833067209,False,2026-04-18
Altri Editori,https://www.ibs.it/images/9788833067193_0_0_150_0_75.jpg,Vivere per Cristo: una vita di servizio,N/D,ADI Media,2026,,https://www.ibs.it/vivere-per-cristo-vita-di-libro-vari/e/9788833067193,False,2026-04-18
Altri Editori,https://www.ibs.it/images/9788830820180_0_0_150_0_75.jpg,Bibbia e teologia morale,Giuseppe De Virgilio,Cittadella,2026,,https://www.ibs.it/bibbia-teologia-morale-libro-giuseppe-de-virgilio/e/9788830820180,True,2026-04-23
Altri Editori,https://www.ibs.it/images/9788825062045_0_0_150_0_75.jpg,La vita nella morte. Il «transitus» di Francesco d’Assisi,Zdzisław Józef Kijas,EMP - Edizioni Messaggero Padova,2026,,https://www.ibs.it/vita-nella-morte-transitus-di-libro-zdzislaw-jozef-kijas/e/9788825062045,False,2026-04-22
Altri Editori,https://www.ibs.it/images/9791256895380_0_0_150_0_75.jpg,"Il sorriso del Fondamento. Per una spiritualità del reale, della coscienza e del compimento",Filippo Lo Nigro,Passione Scrittore selfpublishing,2026,,https://www.ibs.it/sorriso-del-fondamento-per-spiritualita-libro-filippo-lo-nigro/e/9791256895380,False,2026-04-22
Altri Editori,https://www.ibs.it/images/9791255233138_0_0_150_0_75.jpg,Il disegno invisibile. Riflessioni teonomiche e non sul concetto di creazione,Maurizio Roccato,Pathos Edizioni,2026,,https://www.ibs.it/disegno-invisibile-riflessioni-teonomiche-non-libro-maurizio-roccato/e/9791255233138,False,2026-04-17
Altri Editori,https://www.ibs.it/images/9791224070313_0_0_150_0_75.jpg,Emesso un alto grido spirò. Dalla fine all'inizio,Mario Probi,Youcanprint,2026,,https://www.ibs.it/emesso-alto-grido-spiro-dalla-libro-mario-probi/e/9791224070313,False,2026-04-21
Altri Editori,https://www.ibs.it/images/9791224028109_0_0_150_0_75.jpg,Seguendo le orme di Gesù Cristo,Elena Toma,Youcanprint,2026,,https://www.ibs.it/seguendo-orme-di-gesu-cristo-libro-elena-toma/e/9791224028109,True,2026-04-23
Altri Editori,https://www.ibs.it/images/9791222817316_0_0_150_0_75.jpg,Parole per vivere. Incontri di Camaldoli,Antonio Terracciano,ilmiolibro self publishing,2026,,https://www.ibs.it/parole-per-vivere-incontri-di-libro-antonio-terracciano/e/9791222817316,True,2026-04-23
Editori Selezionati,https://www.ibs.it/images/9788837241780_0_0_150_0_75.jpg,Religioni e meditazione: il respiro,N/D,Morcelliana,2026,,https://www.ibs.it/religioni-meditazione-respiro-libro-vari/e/9788837241780,True,2026-04-23
Editori Selezionati,https://www.ibs.it/images/9788837241773_0_0_150_0_75.jpg,Qohelet o della serenità del vivere,Virgilio Melchiorre,Morcelliana,2026,,https://www.ibs.it/qohelet-o-della-serenita-del-libro-virgilio-melchiorre/e/9788837241773,True,2026-04-23
Altri Editori,https://www.ibs.it/images/9791281717688_0_0_150_0_75.jpg,Una Chiesa dentro la storia. Percorsi di formazione all'impegno sociale e politico e sfide di oggi,Michele Busi,Gam Editrice,2026,,https://www.ibs.it/chiesa-dentro-storia-percorsi-di-libro-michele-busi/e/9791281717688,False,2026-04-22
Altri Editori,https://www.ibs.it/images/9791281618480_0_0_150_0_75.jpg,Nome potente. Canti di lode e adorazione. Con CD-Audio,N/D,Edizioni RnS,2026,,https://www.ibs.it/nome-potente-canti-di-lode-libro-vari/e/9791281618480,False,2026-04-22
Altri Editori,https://www.ibs.it/images/9791257440138_0_0_150_0_75.jpg,Don Rodolfo. Un prete tra la gente,Gianni Mazzei,Macabor,2026,,https://www.ibs.it/don-rodolfo-prete-tra-gente-libro-gianni-mazzei/e/9791257440138,False,2026-04-22
Altri Editori,https://www.ibs.it/images/9788898788569_0_0_150_0_75.jpg,Tu sei il mio amore. Io vivo in te. Sono un frammento del tuo splendore,Franco Improda,Gesù La Nuova Rivelazione,2026,,https://www.ibs.it/tu-sei-mio-amore-io-libro-franco-improda/e/9788898788569,False,2026-04-22
Altri Editori,https://www.ibs.it/images/9788894719543_0_0_150_0_75.jpg,Sul crinale. (Uomo (e) Dio),Agostino Clerici,Clerici Agostino,2026,,https://www.ibs.it/sul-crinale-uomo-dio-libro-agostino-clerici/e/9788894719543,False,2026-04-17
Altri Editori,https://www.ibs.it/images/9788893804042_0_0_150_0_75.jpg,Le mie battaglie,Luciana Frassati Gawronska,Aragno,2026,,https://www.ibs.it/mie-battaglie-libro-luciana-frassati-gawronska/e/9788893804042,True,2026-04-23
Altri Editori,https://www.ibs.it/images/9788893804028_0_0_150_0_75.jpg,Risposta a monsignore,Franco Cordero,Aragno,2026,,https://www.ibs.it/risposta-a-monsignore-libro-franco-cordero/e/9788893804028,True,2026-04-23
Altri Editori,https://www.ibs.it/images/9788893803922_0_0_150_0_75.jpg,Le nuove rivelazioni dell'essere,Antonin Artaud,Aragno,2026,,https://www.ibs.it/nuove-rivelazioni-dell-essere-libro-antonin-artaud/e/9788893803922,False,2026-04-21
Altri Editori,https://www.ibs.it/images/9788881270842_0_0_150_0_75.jpg,Francesco il Papa degli Stati Uniti del mondo,Michele Capasso,Stati Uniti del Mondo - ETS - Edizioni Magma,2026,,https://www.ibs.it/francesco-papa-degli-stati-uniti-libro-michele-capasso/e/9788881270842,False,2026-04-21
Altri Editori,https://www.ibs.it/images/9788832235944_0_0_150_0_75.jpg,Considerazioni di un esorcista,Carmine Antonio De Filippis,Edizioni Francescane Italiane,2026,,https://www.ibs.it/considerazioni-di-esorcista-libro-carmine-antonio-de-filippis/e/9788832235944,False,2026-04-15
Altri Editori,https://www.ibs.it/images/9788832235937_0_0_150_0_75.jpg,CHE “GENERE” DI CHIESA?,"Giovanni Del Missier,Roberto Massaro",Edizioni Francescane Italiane,2026,,https://www.ibs.it/che-genere-di-chiesa-libro-giovanni-del-missier-roberto-massaro/e/9788832235937,False,2026-04-15
Altri Editori,https://www.ibs.it/images/9788832235920_0_0_150_0_75.jpg,Un uomo per bene,Sergio Meda,Edizioni Francescane Italiane,2026,,https://www.ibs.it/uomo-per-bene-libro-sergio-meda/e/9788832235920,False,2026-04-15
Editori Selezionati,https://www.ibs.it/images/9788807950858_0_0_150_0_75.jpg,Il vuoto e il fuoco. Per una clinica psicoanalitica delle organizzazioni,Massimo Recalcati,Feltrinelli,2026,"Come fa un'istituzione a rimanere rilevante nel tempo senza perdere lo slancio iniziale? Come non sciupare il guizzo “misterioso e commovente” che denota ogni nuova impresa? La risposta è contenuta in questo libro, in cui Recalcati offre una sintesi del suo lavoro clinico nelle organizzazioni e ci permette di osservarne le strutture portanti ripensando l'idea del soggetto collettivo, dei suoi fantasmi inconsci, dei suoi sintomi e delle sue risorse. Recalcati individua due nuclei fondamentali – il vuoto centrale, che consente la circolazione plurale dei discorsi, e il fuoco del desiderio, che mantiene la rotta verso un obiettivo comune – e li mette in relazione in una circolarità virtuosa che permette a un'organizzazione di sprigionare il proprio potenziale e di mantenersi viva sul lungo termine.",https://www.ibs.it/vuoto-fuoco-per-clinica-psicoanalitica-libro-massimo-recalcati/e/9788807950858,False,2026-04-22
Altri Editori,https://www.ibs.it/images/9788842835882_0_0_150_0_75.jpg,Idee per una teoria delle emozioni,Jean-Paul Sartre,Il Saggiatore,2026,,https://www.ibs.it/idee-per-teoria-delle-emozioni-libro-jean-paul-sartre/e/9788842835882,False,2026-04-17
Editori Selezionati,https://www.ibs.it/images/9791256148028_0_0_150_0_75.jpg,Lucian Freud. Il corpo e il segno,Gaetano Romagnuolo,Castelvecchi,2026,"Tra arte e psicoanalisi, Gaetano Romagnuolo attraversa la figura complessa e controversa di Lucian Freud per indagare il punto in cui l’atto artistico incontra la fugacità dell’esistenza. La sua pittura si configura come una «scrittura della carne», dove il gesto pittorico incide, stratifica e trasforma il corpo in una superficie viva, attraversata da tempo, memoria e inconscio, e il ritratto, lungi dall’essere imitazione, si fa evento, in cui il soggetto si confronta con la propria alterità e vacilla ogni stabilità identitaria. Pur prendendo le distanze dall’eredità del nonno Sigmund, Lucian ne riattiva l’interrogazione più radicale. Un artista non dichiaratamente freudiano, ma tale nel senso più profondo: capace di far cadere ogni sembiante e condurre lo sguardo fino alla verità irriducibile del corpo. Prefazione di Ida Stella Riccio.",https://www.ibs.it/lucian-freud-corpo-segno-libro-gaetano-romagnuolo/e/9791256148028,False,2026-04-17
Editori Selezionati,https://www.ibs.it/images/9791222327150_0_0_150_0_75.jpg,"Passaggio all’atto e acting out. C'è bisogno che io me lo tagli, affinché voi mi prestiate orecchio?",Marcel Czermak,Mimesis,2026,"L’atto costituisce una delle questioni tra le più difficili, enigmatiche e delicate per la clinica. Le sue implicazioni terapeutiche e medico-legali rappresentano difficoltà spesso difficili da affrontare. Tra ciò che la dottrina ha nominato “acting out” e il “passaggio all’atto” esiste uno spettro di implicazioni, tanto per il loro approccio quanto per i loro aspetti. Sovente, le differenze stabilite come punti di repere tra questi termini hanno incidenze terapeutiche, giuridiche e sociali considerevoli. Questo seminario di Marcel Czermak contribuisce a delle chiarificazioni necessarie, proponendo un grande numero di apporti alle tesi di Jacques Lacan. Il suo obiettivo è aiutare il medico, il giurista e lo psicanalista ad avere un punto di vista più definito di fronte a ciò che si chiama un atto, che sia quotidiano e ordinario o che si trovi a essere collocato nelle più gravi congiunture della vita sociale o di un singolo soggetto.",https://www.ibs.it/passaggio-all-atto-acting-out-libro-marcel-czermak/e/9791222327150,False,2026-04-17
Altri Editori,https://www.ibs.it/images/9791280447838_0_0_150_0_75.jpg,Ed io che sono? Tra psicologia ed educazione,Giancarlo Cesana,Liberilibri,2026,,https://www.ibs.it/ed-io-che-sono-tra-libro-giancarlo-cesana/e/9791280447838,True,2026-04-23
Altri Editori,https://www.ibs.it/images/9788892923010_0_0_150_0_75.jpg,"Psicologia del vivere consapevole. Governo di sé, responsabilità e infinitudine",Emanuela Panza,Santelli Editore,2026,,https://www.ibs.it/psicologia-del-vivere-consapevole-governo-libro-emanuela-panza/e/9788892923010,False,2026-04-17
Altri Editori,https://www.ibs.it/images/9788855132381_0_0_150_0_75.jpg,Neuropsychogical Trends (2026). Vol. 39,N/D,LED Edizioni Universitarie,2026,,https://www.ibs.it/neuropsychogical-trends-2026-vol-39-libro-vari/e/9788855132381,False,2026-04-17
Altri Editori,https://www.ibs.it/images/9791256895359_0_0_150_0_75.jpg,Fabula sana,Angelica Loscalzo,Passione Scrittore selfpublishing,2026,,https://www.ibs.it/fabula-sana-libro-angelica-loscalzo/e/9791256895359,False,2026-04-22
Altri Editori,https://www.ibs.it/images/9791224072218_0_0_150_0_75.jpg,Psicologia adleriana. Informazioni di base,Marco Bertinetti,Youcanprint,2026,,https://www.ibs.it/psicologia-adleriana-informazioni-di-base-libro-marco-bertinetti/e/9791224072218,False,2026-04-21
Editori Selezionati,https://www.ibs.it/images/9788828219217_0_0_150_0_75.jpg,"Mezé, miracoli e disastri. Il mio Libano in cucina, oltre la guerra","Maradona Youssef,Sara Faillaci",Solferino,2026,"Maradona Youssef: già dal nome si intuisce una vita insolita. Battezzato in onore della passione calcistica del padre Jean, primo e adorato figlio maschio di una famiglia paterna di militari e una famiglia materna di medici, nasce nel 1986 e cresce nel Libano in guerra. Un’infanzia e un’adolescenza complicate, in cui ci sono le ordinarie giornate di scuola, ma anche la paura delle bombe e degli attentati; ci sono le gite a caccia con la selvaggina cucinata sul fuoco da campo, ma anche i posti di blocco a cui si rischia la vita; e c’è una geografia complessa di appartenenze religiose e politiche da navigare per poter sopravvivere. La pace, per Maradona, è in un unico posto: la cucina. Il luogo dove le donne della famiglia modellano un miracolo di sapori, profumi, consistenze, che lui impara a chiamare «casa». Dove i mille pani del Libano, i suoi vini, le sue spezie trovano una sintesi e un’armonia. Anni dopo, trasferitosi in Italia per studiare, quell’arte gastronomica appresa aiutando la nonna, la madre e la zia diventerà a sorpresa il suo lavoro, quello di uno chef impegnato a portare nel suo nuovo Paese la ricchezza di sapore e significato della sua terra. Un memoir come un romanzo vero, un’educazione sentimentale che ci offre uno spaccato intimo, originale e vivo della questione mediorientale. Le ricette irresistibili che arricchiscono i capitoli uniscono i due mondi dell’autore, Italia e Libano, rinnovando la speranza nella pace e nella convivenza tra i popoli.",https://www.ibs.it/meze-miracoli-disastri-mio-libano-libro-maradona-youssef-sara-faillaci/e/9788828219217,False,2026-04-17
Editori Selezionati,https://www.ibs.it/images/9788845940965_0_0_150_0_75.jpg,Autocronologia,Alberto Arbasino,Adelphi,2026,"Fieramente avverso al «proustismo di maniera» – cioè a ogni «rievocazione sentimentale e patetica di nonne e bisnonne, e tanti sacrifici tra mangiarini e cuoricini e dispiaceri in casolari e casamenti intimistici» –, Arbasino ha steso sulla sua vita un velo di pudore e di riserbo. Si può dunque immaginare con quanta riluttanza abbia accolto l'idea di raccontarla in occasione delle sue opere in raccolta, e per di più di costringerla nella gabbia di una cronologia. Com'era prevedibile, ha finito per assecondare la sua verve irriverente, trasformando un anodino apparato in un congegno abnorme e fuori scala: più precisamente, in un libro di Arbasino, dove spiccano il suo stile inconfondibile e tutte le novità di un sedizioso percorso di «flâneur di varie arti», saggista e romanziere: la pratica di una «Kulturkritik» perseguita con leggerezza alla faccia di «ogni mini-territorio esclusivo delimitato da tante pipì accademiche»; il nomadismo – sullo sfondo di un'Italia ancora immobile e provinciale –, fruttuoso di «incontri e conversazioni», «mostre e serate teatrali e musicali epocali e memorabili»; la concezione del libro come macchina , come organismo autonomo e sempre provvisorio.",https://www.ibs.it/autocronologia-libro-alberto-arbasino/e/9788845940965,False,2026-04-22
