Categoria,Data_Aggiunta,Editore,Copertina,Titolo,Autore,Descrizione,Link
Novità,2026-06-03,Allary,https://products-images.di-static.com/image/glucksmann-raphael-nous-avons-encore-envie/9782370736178-475x500-1.webp,Nous avons encore envie,Raphaël Glucksmann,"Pour un sursaut patriotique ""Partout en France, je ressens une envie puissante, une envie frustrée, une envie brulante. L'envie de retrouver un destin à la hauteur de notre histoire. Je la ressens chez les citoyens de gauche et progressistes comme chez les électeurs du Rassemblement national. Je la ressens dans nos tristesses et nos colères, nos angoisses et nos dépits. Nous refusons le déclassement et le déclin. Nous ne voulons pas devenir un terrain de jeu pour tycoons américains, oligarques russes, dignitaires du Parti communiste chinois ou émirs qataris. Nous sommes fiers, oui. Fiers d'être francais. Fiers d'être européens. Fiers d'être démocrates. Fiers d'être républicains. Alors que beaucoup se résignent à une victoire de l'extrême droite en 2027, je suis convaincu que nous allons déjouer les pronostics, défier l'air du temps trumpiste ou poutiniste et renouer avec une certaine idée de la France. Le temps est venu d'un grand sursaut patriotique"". R. G.",https://www.decitre.fr/livres/nous-avons-encore-envie-9782370736178.html
Novità,2026-06-03,Place des Victoires,https://products-images.di-static.com/image/femelat-armelle-rosa-bonheur/9782809903324-475x500-1.webp,Rosa Bonheur,Armelle Fémelat,"Une monographie complète à seulement 9, 95 ? sur l'artiste française Rosa Bonheur ! Langues incluses : FR, EN, DE, NL, PT, ES. Rosa Bonheur est une personnalité hors normes, une artiste novatrice ainsi qu'une icône de l'émancipation des femmes. Engagée pour la reconnaissance des animaux, Rosa Bonheur (1822-1899) était une star de son vivant, glorifiée des deux côtés de l'Atlantique, officiellement reconnue et dominant le marché de l'art. Elle est célébrée à nouveau à l'occasion du bicentenaire de sa naissance notamment par le musée d'Orsay. Rosa Bonheur, peintre des animaux Première femme artiste à recevoir la Légion d'honneur, elle a laissé une oeuvre abondante, qui témoigne d'une vision exceptionnelle du monde du vivant. Fascinée par les animaux, elle avait rassemblé autour d'elle, au château de By, dans la forêt de Fontainebleau, une véritable ménagerie : vivaient en semi-liberté, vaches, moutons, chèvres, chevaux, chiens, chats, poules, canards et divers animaux sauvages, biches, cerfs, sangliers, daims, isards, mouflons, un couple de singes et même des lions durant quelques années. Ce sont ces animaux que l'on retrouve dans ces peintures, au coeur de spectaculaires compositions, ou sujets plus intimes de véritables portraits, chefs-d'oeuvre d'expressivité et de réalisme, sans une once de sentimentalisme ou d'anthropomorphisme. Rosa Bonheur travaillait en pantalon et avait choisi le matrimoine plutôt que le mariage conventionnel, sans pour autant chercher le scandale ou la provocation. Aujourd'hui, son art et sa personnalité convoquent des thèmes, notamment la place des femmes et la cause animale, qui sont plus que jamais d'actualité.",https://www.decitre.fr/livres/rosa-bonheur-9782809903324.html
Novità,2026-06-03,Bartillat,https://products-images.di-static.com/image/meyer-stabley-bertrand-yves-saint-laurent/9782841008124-475x500-1.webp,Yves Saint Laurent. Le soleil et les ombres,Bertrand Meyer-Stabley,"Dix ans après sa mort, il est temps de revisiter la vie et l'oeuvre du couturier le plus singulier de son siècle. Entre ombre et soleil, cet essai biographique nous plonge dans la tension étrange qui a marqué son existence, entre l'esthétisme sublimé de ses journées, sa maison de couture pleine de rituels, son appartement viscontien et ses nuits, ses excès, ses démons, sa relation passionnelle avec Pierre Bergé. Qui était le véritable Yves Saint Laurent ? Un personnage aux multiples facettes : un déprimé chronique aux sautes d'humeur imprévisibles ; un amoureux du silence et de la solitude, un adepte du voyage autour de la chambre qui refusait de sortir de chez lui, hormis au Maroc. Mais aussi un homme de clan qui avait besoin sans cesse d'une cour de fidèles, condamné à la création perpétuelle d'où il cherchait à s'évader par les artifices. Il fut enfin un sensible exacerbé que la moindre manifestation d'affection bouleversait. Bertrand Meyer-Stabley et Lynda Maache nous replongent dans quarante ans de création. D'Oran à Paris, de Marrakech à la Normandie, ils signent le roman du dernier monstre sacré de la couture.",https://www.decitre.fr/livres/yves-saint-laurent-9782841008124.html
Novità,2026-06-03,La Martinière,https://products-images.di-static.com/image/legrand-catherine-ikat/9791040121060-475x500-1.webp,Ikat. L'art de nouer les nuages,Catherine Legrand,"La styliste Catherine Legrand vous invite à découvrir un procédé de teinture et de tissage aussi méconnu que fascinant : l'ikat. De l'Inde au Japon, du Guatemala à Majorque, du Mexique à l'Ouzbékistan, découvrez des ikats aux allures variées, rencontrez les artisans du monde entier et partagez un savoir-faire ancestral. Entre récit de voyage et histoire du textile, une enquête sur ""l'art de nouer les nuages"" ou comment les motifs des étoffes naissent de l'alliance de la rigueur et de l'imprévu, de la précision et du flou.",https://www.decitre.fr/livres/ikat-9791040121060.html
Novità,2026-06-03,FYP éditions,https://products-images.di-static.com/image/foufa-mastafa-la-paresse-de-penser/9782364052772-475x500-1.webp,La paresse de penser. Pourquoi nous laissons l'IA decider à notre place,Mastafa Foufa,"Quand avez-vous, pour la dernière fois, cherché une réponse par vous-même au lieu de la demander à votre téléphone ? Ce réflexe révèle une mutation silencieuse : nous avons renoncé à chercher par nous-mêmes, délégué notre jugement à l'algorithme, notre mémoire à la machine, notre faculté de douter à l'oracle numérique. Mastafa Foufa, chercheur en intelligence artificielle chez Microsoft à Redmond, révèle depuis l'intérieur de la salle des machines ce que nul autre ne livre : la mécanique intime de la séduction algorithmique, ses biais, le point exact où la machine cesse de comprendre et continue pourtant de répondre avec une assurance confondante. Ni réquisitoire contre le progrès ni guide de désintoxication numérique, cet essai est un avertissement lucide sur ce que nous sommes en train de céder - notre souveraineté intellectuelle - au profit d'un confort qui nous transforme en validateurs dociles de réponses lissées. Préface de Luc Julia, co-créateur de Siri.",https://www.decitre.fr/livres/la-paresse-de-penser-9782364052772.html
Novità,2026-06-03,Micro Application,https://products-images.di-static.com/image/rodarie-hubert-l-europe-face-a-trump/9782822411660-475x500-1.webp,L'Europe face à Trump. Comment relever le défi,Hubert Rodarie,"Ce livre se propose, dans une première partie, en utilisant une analogie historique, de construire un cadre original de réflexion et d'analyse du phénomène Trump, phénomène qui dépasse la seule personnalité de Donald Trump. Une seconde partie regroupe par grands thèmes plusieurs cous de projecteurs sur des points essentiels qui caractérisent l'état du système économicopolitique actuel et, donc, des questions débattues.",https://www.decitre.fr/livres/l-europe-face-a-trump-9782822411660.html
Novità,2026-06-03,Folio,https://products-images.di-static.com/image/dali-salvador-les-moustaches-radar/9782073163059-475x500-1.webp,Les moustaches radar. (1955-1960),Salvador Dali,"Oscillantes, enbroulées ou déroulées, remontées ou décadentes, les moustaches de Salvador Dali intriguaient et fascinaient tous ceux qui le rencontraient... Peintre de génie, écrivain baroque, amoureux de Gala, personnage haut en couleur du roman de sa propre vie, Salvador Dali se livre avec impudeur et humour pour nous laisser entrevoir les mystères de sa peinture. Quelques pages du Journal d'un génie pour pénétrer dans l'intimité de l'un des plus grands créateurs du XX ? siècle.",https://www.decitre.fr/livres/les-moustaches-radar-9782073163059.html
Novità,2026-06-03,El Viso,https://products-images.di-static.com/image/maisonnier-elisabeth-jardins-des-lumieres-1750-1800/9791399068771-475x500-1.webp,Jardins des Lumières (1750-1800),Elisabeth Maisonnier,"""Réunir en un seul jardin tous les temps et tous les lieux"". Carmontelle Créé pour Marie-Antoinette, le jardin anglais du Petit Trianon, mêlant raffinement et exotisme, offrait un contraste saisissant avec les jardins à la française de Versailles : une illustration parfaite de cette véritable fureur des jardins qui saisit l'Europe entière à partir de 1750. Parmi les plus merveilleux, comment ne pas évoquer, en Angleterre, Kew Gardens et Stowe ; en Allemagne, les jardins du château de Schwetzingen, résidence du prince électeur du Palatinat ; ceux de Laeken aux Pays-Bas, demeure des Saxe-Cobourg ; les projets et réalisations de Gustave III, le ""seigneur jardinier"" , pour ses résidences de Haga et Drottingholm en Suède ; les jardins anglais de Tsarskoïe Selo et de Pavlovsk pour la tsarine Catherine puis le tsar Paul Ier ; en France, en ? n, le parc Monceau, le Désert de Retz, Ermenonville où se réfugiait Jean-Jacques Rousseau, ou Méréville où oeuvra le peintre Hubert Robert ? A travers 250 illustrations mêlant tableaux, dessins, mobilier, architecture de jardin, costumes, livres rares et photographies, ce livre d'art et d'histoire met en lumière la variété de ces jardins aux tracés irréguliers et aux fabriques souvent excentriques, où la dimension philosophique ou maçonnique côtoie l'exotisme le plus fantaisiste, jardins microcosmes et encyclopédiques dont la dimension touche à l'universel, reflets du monde et des idées du siècle des Lumières. Mêlant nature et artifice, ils dévoilent l'émergence d'un nouveau style décoratif, révélant un art de vivre réinventé, entre nature, voyage, fêtes et plaisirs.",https://www.decitre.fr/livres/jardins-des-lumieres-1750-1800-9791399068771.html
Novità,2026-06-03,La Découverte,https://products-images.di-static.com/image/bige-emma-mouvementements/9782348093470-475x500-1.webp,Mouvementements. Ecopolitiques de la danse,Emma Bigé,"A passer du temps dans des studios de danse, voilà ce qu'on peut apprendre : nous, mammifères humaines, habitantes de Terra, sommes mouvementées par une multitude de forces. Loin d'être automobiles, loin d'être contenues ou contenables dans la petite usine de nos corps, nous débordons. Les écologies scientiques nous en convainquent, les écologies politiques nous appellent à en faire une force insurrectionnelle. Et si nous apprenions, avec les écologies somatiques, à sentir et à célébrer nos débordements plus qu'humains ? A l'heure où les soulèvements de la Terre se multiplient, ce livre examine la manière dont certaines formes de danse (improvisations collectives, pratiques somatiques, installations chorégraphiques) tentent d'élaborer, dans les plis du monde mondialisé, des antidotes à l'anesthésie. Des manières de nouer nos gestes au-delà des fausses frontières de l'individu et de l'humain. Des manières de danser-sentir-penser l'enchevêtrement de nos mouvements.",https://www.decitre.fr/livres/mouvementements-9782348093470.html
Novità,2026-06-03,Mon poche,https://products-images.di-static.com/image/doux-samuel-l-eternite-de-xavier-dupont-de-ligonnes/9782379132049-475x500-1.webp,L'éternité de Xavier Dupont de Ligonnès,Samuel Doux,"Avril 2011, Xavier Dupont de Ligonnès s'évanouit quelque part dans le sud de la France, laissant derrière lui sa famille assassinée, enterrée avec soin sous la terrasse de leur maison. Au-delà du fait divers, une question demeure : comment devient-on le meurtrier présumé de ses enfants, de sa femme, de ses deux chiens ? Pas à pas, de Versailles à Nantes, de l'enfance à l'Apocalypse, L'Eternité de Xavier Dupont de Ligonnès retrace le parcours d'un homme intelligent, séduisant, obsessionnel, et dresse le portrait stupéfiant d'un fantôme qui n'a pas fini de hanter les mémoires.",https://www.decitre.fr/livres/l-eternite-de-xavier-dupont-de-ligonnes-9782379132049.html
Novità,2026-06-03,Balland,https://products-images.di-static.com/image/fedorovski-vladimir-le-diable-boiteux-au-kremlin/9782940843039-475x500-1.webp,Le diable boiteux au Kremlin. Le vrai magicien de Moscou,Vladimir Fédorovski,"Ce livre, riche en révélations, nous dévoile des épisodes fatidiques de l'histoire secrète du Kremlin - de la chute du mur de Berlin à Poutine - éclairant sous un autre jour notre actualité brûlante. Au centre de son récit, l'auteur place un témoin d'exception qui a été déterminant dans la chute du communisme et l'arrêt dé la guerre froide. Surnommé "" le diable boiteux "", Alexandre Yakovlev fut un prophète en prédisant la guerre en Europe ! Comme souvent, la réalité dépasse les fictions les plus osées... Sa longue familiarité avec tes arcanes politiques a permis à l'auteur - acteur et observateur privilégié de l'intérieur du Kremlin - de recueillir des témoignages uniques et de se plonger dans des archives confidentielles explosives et inédites, tels que le testament spirituel d'Alexandre Yakovlev architecte et inspirateur de la pérestroïka. La chronique réelle et documentée de Moscou est emplie de grandeur et de sang, de complots, de folies et de mystères... Fidèle à son art exceptionnel de conteur et bousculant des idées reçues, Vladimir Fédorovski raconte ainsi notre époque, la plus dangereuse de l'Histoire contemporaine.",https://www.decitre.fr/livres/le-diable-boiteux-au-kremlin-9782940843039.html
Novità,2026-06-03,Larousse,https://products-images.di-static.com/image/bernard-bruno-iconique-marilyn-monroe/9782036094598-475x500-1.webp,Iconique Marilyn Monroe,Bruno Bernard,"Découvrez de superbes photographies inédites de Marilyn Monroe, prises par Bruno Bernard, l'un des plus grands photographes d'Hollywood. Selon le Museum of Modern Art, sa célèbre photographie de Marilyn Monroe, vêtue d'une robe blanche flottant au-dessus d'une grille de métro, symbolise à elle seule le siècle dernier. Derrière ce cliché mythique se cache l'histoire de la métamorphose d'une adorable ingénue en une femme fatale au sex-appeal ravageur. Iconique Marilyn Monroe revisite le parcours de la star à travers l'objectif de Bruno Bernard et apporte un éclairage nouveau sur sa vie devant et derrière les caméras. Ami proche et soutien de la première heure, celui qui a contribué à lancer la carrière de Marilyn a aussi pris les photographies les plus mémorables et conservé ses plus beaux souvenirs dans ses journaux intimes dont il livre ici des extraits inédits. Grâce aux témoignages personnels du petit-fils de Bernard, Joshua John Miller, et de Mark A. Fortin, partez sur les traces de l'une des icônes les plus glamours du cinéma et découvrez comment Norma Jeane Baker est devenue Marilyn Monroe.",https://www.decitre.fr/livres/iconique-marilyn-monroe-9782036094598.html
Novità,2026-06-03,Beaux Arts éditions,https://products-images.di-static.com/image/beaux-arts-editions-de-monet-a-pissarro/9791020410757-475x500-1.webp,De Monet à Pissarro. L’Eure impressionniste,Beaux Arts Editions,N/D,https://www.decitre.fr/livres/de-monet-a-pissarro-9791020410757.html
Novità,2026-06-03,Le Livre de Poche,https://products-images.di-static.com/image/baldwin-james-le-jour-ou-j-etais-perdu/9782253250753-475x500-1.webp,Le jour où j'étais perdu. La vie de Malcolm X : un scénario,James Baldwin,"De la mort de son père, assassiné par le Ku Klux Klan, Malcolm Little tire rage et violence. Surnommé "" Red "" , il est entraîné de magouilles en crimes dans le milieu de la drogue à Harlem. La prison devient pour lui un espace de renaissance : autodidacte, il se nourrit de livres et se convertit à l'islam. Malcolm X devient une voix centrale du nationalisme afro-américain et de l'organisation Nation of Islam, qu'il finit par quitter pour embrasser une perspective plus universelle. Figure majeure du mouvement américain des droits civiques, il poursuivra sa lutte jusqu'à son assassinat en 1965, à New York. Dans ce scénario unique, James Baldwin, l'un des plus grands écrivains américains du xxe siècle, nous dépeint un homme incarné, traversé par ses contradictions, ses espoirs et sa foi. Commandé par Hollywood, puis retoqué car jugé trop radical, il est finalement repris par Spike Lee qui le remanie largement pour le porter à l'écran en 1992. Traduit de l'anglais (Etats-Unis) par Magali Berger.",https://www.decitre.fr/livres/le-jour-ou-j-etais-perdu-9782253250753.html
Novità,2026-06-03,Bayard jeunesse,https://products-images.di-static.com/image/du-bouetiez-anne-sophie-sainte-therese-de-lisieux-et-sainte-mere-teresa-de-calcutta-en-bd/9791036388484-475x500-1.webp,Sainte Thérèse de Lisieux et sainte Mère Teresa de Calcutta en BD,Anne-Sophie Du Bouëtiez,Deux itinéraires de femmes consacrées à dieu qui ont mis leur foi en dieu et en l'humanité pour changer les coeurs et promouvoir la paix.,https://www.decitre.fr/livres/sainte-therese-de-lisieux-et-sainte-mere-teresa-de-calcutta-en-bd-9791036388484.html
Novità,2026-06-03,Flammarion,https://products-images.di-static.com/image/berrod-nicolas-urgence-vitale/9782080439369-475x500-1.webp,Urgence vitale. Pourquoi l'hôpital public craque,Nicolas Berrod,"Plus de 100 milliards d'euros de budget annuel, un million. d'employés, plus de 1300 établissements... Et pourtant, l'hôpital public va mal, très mal. Nicolas Berrod, reporter au Parisien-Aujourd'hui en France, a passé deux ans en immersion dans les hôpitaux français. Son enquête, d'utilité publique, forte de centaines de témoignages et de documents inédits, est saisissante : patients maltraités, personnel impuissant, administration aveugle, pouvoirs publics amorphes, professeurs ""mandarins,, intouchables, scandales cachés, suicides, argent gaspillé... Nous sommes tous concernés.",https://www.decitre.fr/livres/urgence-vitale-9782080439369.html
Novità,2026-06-03,Hachette Pluriel,https://products-images.di-static.com/image/zemmour-eric-le-suicide-francais/9782818507926-475x500-1.webp,Le suicide français. 2008-2026édition actualisée,Eric Zemmour,""" Il y a un peu plus de dix ans, je publiais Le Suicide français. L'émoi fut considérable. Les journalistes, commentateurs, politiques rivalisèrent d'invectives à mon égard. On me traita de ""passéiste"", ""réactionnaire"", ""misogyne"", ""homophobe"", ""raciste"", ""fasciste' : Qu'avais-je fait ? Qu'avais-je dit ? Qu'avais-je écrit ? J'avais tenté de comprendre cette impression de dépossession qui étreignait nombre de Français, qui ne se sentaient plus chez eux dans leur pays. Il y a longtemps, l'écrivain français du XIXe siècle Edgar Quinet avait eu cette formule : ""Le véritable exil n'est pas d'être arraché de son pays ; c'est d'y vivre et de n'y plus rien trouver de ce qui le faisait aimer."" Pourquoi ce sentiment, autrefois limité à quelques élites, était-il devenu dans la France du XXIe siècle un phénomène de masse ? """,https://www.decitre.fr/livres/le-suicide-francais-9782818507926.html
Novità,2026-06-03,Glénat,https://products-images.di-static.com/image/fontana-jean-loup-vauban-homme-de-l-art/9782344074930-475x500-1.webp,"Vauban, homme de l'art",Jean-Loup Fontana,"Pour la première fois, un ouvrage consacré au patrimoine Vauban entièrement illustré. C'est du Vauban ! On salue généralement ainsi toute fortification ne montrant ni tours crénelées du temps des seigneurs ni coupoles en béton de la ligne Maginot. Vauban et ses émules se voient attribuer les ouvrages fortifiés relevant d'époques où la guerre ne se faisait déjà plus avec des armures et des échelles mais pas encore avec des chars blindés et des bombardiers aériens. A la charnière des deux mondes, Vauban a connu et souvent imaginé avec talent et ingéniosité les étapes conduisant de l'un à l'autre, devenant un maître incontesté de l'architecture militaire. Sa charge de Commissaire Général des Fortifications, ses nombreux écrits et les échanges épistolaires qu'il a laissés fournissent un témoignage exceptionnel sur un moment clé des civilisations modernes : les siècles baroques. Sciences spéculatives, arts libéraux et arts plastiques s'y fondent pour définir une culture globale dont Vauban reste l'une des illustrations les plus notables. L'auteur Jean-Loup Fontana nous conte l'histoire de ce "" patrimoine actuel "", apportant un éclairage nouveau sur cet homme de l'art qu'était Vauban. Citadelles, villes fortifiées, ouvrages isolés... les plus remarquables réalisations de Vauban sont ici croquées par l'illustrateur Jean-Benoît Héron, faisant de ce livre un ouvrage unique.",https://www.decitre.fr/livres/vauban-homme-de-l-art-9782344074930.html
Novità,2026-06-03,Mame,https://products-images.di-static.com/image/williencourt-cecile-de-ton-corps-de-garcon/9782728936731-475x500-1.webp,Ton corps de garçon. L'aventure de la puberté,Cécile de Williencourt,"Un guide utile, pratique et concret, à mettre dans les mains de toutes les jeunes dès les premiers signes de la puberté ! Les explications et conseils avisés de Cécile et de Jean de Williencourt, un homme et une femme formés à l'accompagnement des garçons et qui ont déjà suivi des centaines de jeunes. Ce guide illustré veut t'aider à découvrir pleinement la puissance de ton corps ! Il te permettra de comprendre tous les grands changements de la puberté. Tu y trouveras les réponses à toutes tes questions, des plus pratiques (sur les transformations de ta silhouette) aux plus profondes (quelles sont les raisons de ces bouleversements ? pourquoi ton humeur change-t-elle ? que se passe-t-il chez les femmes ? etc.) Le parfait manuel pour t'aider à vivre sereinement les changements liés à la puberté !",https://www.decitre.fr/livres/ton-corps-de-garcon-9782728936731.html
Novità,2026-06-03,Mame,https://products-images.di-static.com/image/meylaender-nick-jeanne-d-arc/9782728938117-475x500-1.webp,Jeanne d'Arc,Nick Meylaender,"Un manga sur Jeanne d'Arc, la sainte qui a suivi Dieu pour libérer la France ! Découvrez comment la jeune Jeanne, poussée par les voix de saint Michel, sainte Catherine et sainte Marguerite, a quitté son village et sa famille pour se battre aux côtés des français face aux envahisseurs anglais pendant la guerre de Cent Ans. Suivez sa mission sur les champs de bataille et son témoignage de foi et de confiance en Dieu.",https://www.decitre.fr/livres/jeanne-d-arc-9782728938117.html
Novità,2026-06-03,Ancre de Marine Editions,https://products-images.di-static.com/image/berthier-marc-carnet-de-croquis-de-marc/9782841414611-475x500-1.webp,Carnet de croquis de Marc. P. G. Berthier,Marc Berthier,""" Mon souhait serait que vous ayez remarqué que ce carnet est truffé de crobards de n'importe quoi, une esquisse d'un futur bricolage, un tas de cailloux à Chausey, un phare passé avec le courant, une bouteille à partager avec des amis, le tuyau rongé de mes pipes..."" "" C'est mon plaisir de dessiner pour le plaisir. Et pourquoi pas. Puisque vous avez la courtoisie de feuilleter ce carnet, j'espère vous faire naviguer sur du papier. Que le vent vous soit favorable.""",https://www.decitre.fr/livres/carnet-de-croquis-de-marc-9782841414611.html
Novità,2026-06-03,Points,https://products-images.di-static.com/image/valdiguie-laurent-les-autres-affaires-de-dominique-pelicot/9791041427635-475x500-1.webp,Les autres affaires de Dominique Pélicot. Que cachait le pseudo Fetiche45,Laurent Valdiguié,"Une enquête bouleversante qui met en lumière les failles du système judiciaire dans la protection des victimes. Et si Dominique Pélicot avait pu être arrêté plus tôt ? Et si d'autres femmes avaient été prises au sérieux ? Et si les services policiers et judiciaires n'avaient pas commis tant d'impairs ? Laurent Valdiguié pose la question suivante : la justice est-elle passée à côté d'un criminel en série ? Est-elle en mesure de rattraper ses fautes du passé, en enquêtant sur ses propres loupés ? Cette enquête reprend les faits commis par Dominique Pélicot depuis des dizaines d'années, les erreurs policières comme celles de la justice, ainsi que le silence ""assourdissant"" des politiciens. Les conséquences en sont indélébiles pour les victimes qui doivent les supporter et les subir à perpétuité. ""Un livre qu'on ne lâche pas. [... ] Une enquête fouillée, passionnante, dans laquelle on découvre que si tout avait bien fonctionné, Gisèle Pelicot n'aurait pas vécu le calvaire qu'elle a traversé"". France 5, C dans l'air Laurent Valdiguié est grand reporter pour le magazine Marianne. Il a également cofondé Victor Noir, un collectif d'investigation qui publient leurs enquêtes sur des personnalités politiques, dont Nicolas Sarkozy (Le Parrain : Sarko après Sarko, Seuil, 2023).",https://www.decitre.fr/livres/les-autres-affaires-de-dominique-pelicot-9791041427635.html
