Categoria_App,Copertina,Titolo,Autore,Editore,Anno,Descrizione,Link,Nuovo,Data_Aggiunta
Editori Selezionati,https://www.ibs.it/images/9788892250093_0_0_150_0_75.jpg,Figlia di Eva. Incroci ecumenici e femministi su Maria,"Simona Segoloni Ruta,Letizia Tomassone",San Paolo Edizioni,2026,"L’accesso delle donne alla teologia ha reso evidente l’urgenza di un ripensamento generale dei modelli, rendendo obsolete le forme statiche e i cattivi infiniti che occultano nel neutro i propri presupposti. L’insegnamento teologico può oggi abbandonare questi paradigmi, smascherandone la pretesa di universalità e l’ingiustizia strutturale che la connotava. Condizione imprescindibile per questa svolta è quella di accogliere le differenze, vagliando criticamente le prospettive acquisite, introducendo l’esplorazione di campi di indagine inediti, formulando categorie e paradigmi nuovi. Per questo nasce una nuova Serie teologica. Ciascun volume rivisita in prospettiva di genere gli ambiti teologici e si propone di attestare possibili circolarità ermeneutiche: tra discipline e temi, tra appartenenze confessionali, tra interessi e posizionamenti. La firma doppia di ciascuna ricerca è un segno del carattere aperto e dialogico dell’impresa.",https://www.ibs.it/figlia-di-eva-incroci-ecumenici-libro-simona-segoloni-ruta-letizia-tomassone/e/9788892250093,False,2026-04-13
Altri Editori,https://www.ibs.it/images/9788871055626_0_0_150_0_75.jpg,Teologia. Rivista della facoltà teologica dell'Italia settentrionale (2025). Vol. 4,N/D,Glossa,2026,,https://www.ibs.it/teologia-rivista-della-facolta-teologica-libro-vari/e/9788871055626,False,2026-04-15
Altri Editori,https://www.ibs.it/images/9788868948665_0_0_150_0_75.jpg,Professione di fede. Decisione. Protagonismo. Appartenenza,N/D,Centro Ambrosiano,2026,,https://www.ibs.it/professione-di-fede-decisione-protagonismo-libro-vari/e/9788868948665,True,2026-04-17
Altri Editori,https://www.ibs.it/images/9788868948573_0_0_150_0_75.jpg,Humor di Dio,Paolo Pivetti,Centro Ambrosiano,2026,,https://www.ibs.it/humor-di-dio-libro-paolo-pivetti/e/9788868948573,False,2026-04-15
Altri Editori,https://www.ibs.it/images/9788868948474_0_0_150_0_75.jpg,Bella fra! Guardate a lui e sarete raggianti. Oratorio estivo 2026,N/D,Centro Ambrosiano,2026,,https://www.ibs.it/bella-fra-guardate-a-lui-libro-vari/e/9788868948474,False,2026-04-15
Altri Editori,https://www.ibs.it/images/9788864969220_0_0_150_0_75.jpg,Il dogma dell'antidogmatismo. La libertà nella consapevolezza,Daniele Gasparetti,Tipheret,2026,,https://www.ibs.it/dogma-dell-antidogmatismo-liberta-nella-libro-daniele-gasparetti/e/9788864969220,False,2026-04-11
Altri Editori,https://www.ibs.it/images/9788862575393_0_0_150_0_75.jpg,Trasfigurazione. Lettura evangelica dell'ultima opera di Raffaello. Ediz. illustrata,Piero Stefani,Pazzini,2026,,https://www.ibs.it/trasfigurazione-lettura-evangelica-dell-ultima-libro-piero-stefani/e/9788862575393,False,2026-04-15
Altri Editori,https://www.ibs.it/images/9788851431556_0_0_150_0_75.jpg,Le tracce di Gesù. Storia delle reliquie di Cristo sui Cammini d’Europa,Andrea Gadda,Ancora,2026,,https://www.ibs.it/tracce-di-gesu-storia-delle-libro-andrea-gadda/e/9788851431556,False,2026-04-16
Altri Editori,https://www.ibs.it/images/9788849888256_0_0_150_0_75.jpg,La premura del bene,Davide Rondoni,Rubbettino,2026,,https://www.ibs.it/premura-del-bene-libro-davide-rondoni/e/9788849888256,True,2026-04-17
Altri Editori,https://www.ibs.it/images/9788831559195_0_0_150_0_75.jpg,Alle donne. Lettera. Nuova ediz.,Giovanni Paolo II,Paoline Editoriale Libri,2026,,https://www.ibs.it/alle-donne-lettera-nuova-ediz-libro-giovanni-paolo-ii/e/9788831559195,False,2026-04-13
Altri Editori,https://www.ibs.it/images/9788831559171_0_0_150_0_75.jpg,Ho avuto paura. Attraversare le ombre affidandosi,Giuseppe Di Stefano,Paoline Editoriale Libri,2026,,https://www.ibs.it/ho-avuto-paura-attraversare-ombre-libro-giuseppe-di-stefano/e/9788831559171,False,2026-04-13
Altri Editori,https://www.ibs.it/images/9788831559034_0_0_150_0_75.jpg,Il Rosario meditato con Maria,Roberto Seregni,Paoline Editoriale Libri,2026,,https://www.ibs.it/rosario-meditato-con-maria-libro-roberto-seregni/e/9788831559034,False,2026-04-13
Altri Editori,https://www.ibs.it/images/9788831151900_0_0_150_0_75.jpg,Ideale cercasi. La vita di Dina Zenari,Ilaria Pedrini,Città Nuova,2026,,https://www.ibs.it/ideale-cercasi-vita-di-dina-libro-ilaria-pedrini/e/9788831151900,False,2026-04-11
Altri Editori,https://www.ibs.it/images/9788831129640_0_0_150_0_75.jpg,Un carisma ed io,Michele Genisio,Città Nuova,2026,,https://www.ibs.it/carisma-ed-io-libro-michele-genisio/e/9788831129640,True,2026-04-17
Editori Selezionati,https://www.ibs.it/images/9788826610436_0_0_150_0_75.jpg,Insegnamenti di Francesco (2018). Vol. 6/1,Francesco (Jorge Mario Bergoglio),Libreria Editrice Vaticana,2026,,https://www.ibs.it/insegnamenti-di-francesco-2018-vol-libro-francesco-jorge-mario-bergoglio/e/9788826610436,False,2026-04-14
Altri Editori,https://www.ibs.it/images/9788822295279_0_0_150_0_75.jpg,"Giovan Francesco Pico e la Strix: a cinquecento anni dalla caccia alle streghe di Mirandola. Atti del Convegno internazionale di Studi (Modena, 27 ottobre 2023)",N/D,Olschki,2026,,https://www.ibs.it/giovan-francesco-pico-strix-a-libro-vari/e/9788822295279,True,2026-04-17
Altri Editori,https://www.ibs.it/images/9788810919767_0_0_150_0_75.jpg,RTE Rivista di teologia dell'evangelizzazione (2025). Vol. 58,N/D,EDB,2026,,https://www.ibs.it/rte-rivista-di-teologia-dell-libro-vari/e/9788810919767,False,2026-04-15
Altri Editori,https://www.ibs.it/images/9788801069792_0_0_150_0_75.jpg,Custode della notte. Dalla parola di Dio al cuore dell’uomo,Walter Vinci,Editrice Elledici,2026,,https://www.ibs.it/custode-della-notte-dalla-parola-libro-walter-vinci/e/9788801069792,False,2026-04-15
Altri Editori,https://www.ibs.it/images/9791256751204_0_0_150_0_75.jpg,La meditazione silenziosa cristiana. Raccoglimento interiore e apertura del cuore. Primi passi,Marisa Montagna,Effatà Editrice,2026,,https://www.ibs.it/meditazione-silenziosa-cristiana-raccoglimento-interiore-libro-marisa-montagna/e/9791256751204,False,2026-04-11
Altri Editori,https://www.ibs.it/images/9791255233138_0_0_150_0_75.jpg,Il disegno invisibile. Riflessioni teonomiche e non sul concetto di creazione,Maurizio Roccato,Pathos Edizioni,2026,,https://www.ibs.it/disegno-invisibile-riflessioni-teonomiche-non-libro-maurizio-roccato/e/9791255233138,True,2026-04-17
Altri Editori,https://www.ibs.it/images/9791255232995_0_0_150_0_75.jpg,Maria di Nazareth. Partigiana di Dio,Francesco Di Maria,Pathos Edizioni,2026,,https://www.ibs.it/maria-di-nazareth-partigiana-di-libro-francesco-di-maria/e/9791255232995,False,2026-04-11
Altri Editori,https://www.ibs.it/images/9788865002438_0_0_150_0_75.jpg,Libertà e obbedienza nella chiesa. Una lezione di grande attualità,Lorenzo Milani,Libreria Editrice Fiorentina,2026,,https://www.ibs.it/liberta-obbedienza-nella-chiesa-lezione-libro-lorenzo-milani/e/9788865002438,True,2026-04-17
Altri Editori,https://www.ibs.it/images/9791256221387_0_0_150_0_75.jpg,Simbolismo cosmico dei monumenti religiosi,"Bloch,Daniélou,Mircea Eliade",Editoriale Jouvence,2026,,https://www.ibs.it/simbolismo-cosmico-dei-monumenti-religiosi-libro-vari/e/9791256221387,False,2026-04-16
Altri Editori,https://www.ibs.it/images/9788831102346_0_0_150_0_75.jpg,L'economia di san Francesco. Le sfide del presente,"Serena Ionta,Paolo Santori",Città Nuova,2026,,https://www.ibs.it/economia-di-san-francesco-sfide-libro-serena-ionta-paolo-santori/e/9788831102346,False,2026-04-15
Altri Editori,https://www.ibs.it/images/9788831136365_0_0_150_0_75.jpg,La lettera ai romani. Commento esegetico e teologico,Santi Grasso,Città Nuova,2026,,https://www.ibs.it/lettera-ai-romani-commento-esegetico-libro-santi-grasso/e/9788831136365,False,2026-04-15
Altri Editori,https://www.ibs.it/images/9788831135597_0_0_150_0_75.jpg,Spirito Santo ad intra in san Bonaventura,Massimo Meini,Città Nuova,2026,,https://www.ibs.it/spirito-santo-ad-intra-in-libro-massimo-meini/e/9788831135597,False,2026-04-15
Altri Editori,https://www.ibs.it/images/9791282054157_0_0_150_0_75.jpg,Quando gli dèi abitavano l'anima,Rocco Berloco,Gagliano Edizioni,2026,,https://www.ibs.it/quando-dei-abitavano-anima-libro-rocco-berloco/e/9791282054157,False,2026-04-15
Altri Editori,https://www.ibs.it/images/9791280192738_0_0_150_0_75.jpg,"Vocazioni (2026). Vol. 2: Questo è il Figlio mio, l’amato!",N/D,Fond.ne di Religione Santi Francesco d'Assisi e Caterina da Siena,2026,,https://www.ibs.it/vocazioni-2026-vol-2-questo-libro-vari/e/9791280192738,False,2026-04-15
Altri Editori,https://www.ibs.it/images/9791256931088_0_0_150_0_75.jpg,Obscurity and exegesis. Towards an unwritten chapter of the history of ancient sacred texts,N/D,Edizioni di Storia e Letteratura,2026,,https://www.ibs.it/obscurity-and-exegesis-towards-an-libro-vari/e/9791256931088,False,2026-04-15
Altri Editori,https://www.ibs.it/images/9788894719543_0_0_150_0_75.jpg,Sul crinale. (Uomo (e) Dio),Agostino Clerici,Clerici Agostino,2026,,https://www.ibs.it/sul-crinale-uomo-dio-libro-agostino-clerici/e/9788894719543,True,2026-04-17
Altri Editori,https://www.ibs.it/images/9788832235944_0_0_150_0_75.jpg,Considerazioni di un esorcista,Carmine Antonio De Filippis,Edizioni Francescane Italiane,2026,,https://www.ibs.it/considerazioni-di-esorcista-libro-carmine-antonio-de-filippis/e/9788832235944,False,2026-04-15
Altri Editori,https://www.ibs.it/images/9788832235937_0_0_150_0_75.jpg,CHE “GENERE” DI CHIESA?,"Giovanni Del Missier,Roberto Massaro",Edizioni Francescane Italiane,2026,,https://www.ibs.it/che-genere-di-chiesa-libro-giovanni-del-missier-roberto-massaro/e/9788832235937,False,2026-04-15
Altri Editori,https://www.ibs.it/images/9788832235920_0_0_150_0_75.jpg,Un uomo per bene,Sergio Meda,Edizioni Francescane Italiane,2026,,https://www.ibs.it/uomo-per-bene-libro-sergio-meda/e/9788832235920,False,2026-04-15
Altri Editori,https://www.ibs.it/images/9788831175999_0_0_150_0_75.jpg,I fioretti di San Francesco,N/D,Città Nuova,2026,,https://www.ibs.it/fioretti-di-san-francesco-libro-vari/e/9788831175999,False,2026-04-15
Altri Editori,https://www.ibs.it/images/9788842835882_0_0_150_0_75.jpg,Idee per una teoria delle emozioni,Jean-Paul Sartre,Il Saggiatore,2026,,https://www.ibs.it/idee-per-teoria-delle-emozioni-libro-jean-paul-sartre/e/9788842835882,True,2026-04-17
Altri Editori,https://www.ibs.it/images/9788835187448_0_0_150_0_75.jpg,Cura della mente e conoscenza di sé. Riflessioni psicoanalitiche,Angelo Di Carlo,Franco Angeli,2026,,https://www.ibs.it/cura-della-mente-conoscenza-di-libro-angelo-di-carlo/e/9788835187448,False,2026-04-14
Altri Editori,https://www.ibs.it/images/9788834019191_0_0_150_0_75.jpg,Corpi linguistici. La continuità tra vita e linguaggio,"Ezequiel A. Di Paolo,Elena Clare Cuffari,Hanne De Jaegher",Astrolabio Ubaldini,2026,,https://www.ibs.it/corpi-linguistici-continuita-tra-vita-libro-vari/e/9788834019191,False,2026-04-11
Editori Selezionati,https://www.ibs.it/images/9788804807810_0_0_150_0_75.jpg,Mordere il cielo. Dove sono finite le nostre emozioni,Paolo Crepet,Mondadori,2026,"Viviamo in un mondo nel quale guerre, migrazioni epocali e nuove emergenze contribuiscono a creare un senso di precarietà, spingendoci a credere che le uniche modalità plausibili per sopravvivere siano la negazione e la paura. Solo che la prima ci condanna all'indifferenza, la seconda ci paralizza. In entrambi i casi, finiamo per relegarci in una solitudine che accomuna giovani e adulti, vecchi e bambini. Siamo nell'età dell'atarassia, dell'insensibilità? Il rischio c'è, ed è sempre più concreto. La maggior parte di noi non è consapevole di questa diffusa anestesia dell'anima, ciascuno si limita a godere dei privilegi e del benessere materiale rinchiuso nel proprio bozzolo. Ignorando che in questo modo l'umanità intera rischia di imbarbarire. Ma, per chi lo volesse cercare, l'antidoto c'è. È l'empatia. Condividendo ricordi personali, incontri e riflessioni, Paolo Crepet ci esorta con passione a ribellarci all'indifferenza, a non aver paura delle nostre idee e neppure dei nostri inciampi. Ci invita a riappropriarci con audacia, quasi con sfrontatezza, delle nostre emozioni per tornare finalmente a «mordere il cielo».",https://www.ibs.it/mordere-cielo-dove-sono-finite-libro-paolo-crepet/e/9788804807810,False,2026-04-14
Altri Editori,https://www.ibs.it/images/9791256650811_0_0_150_0_75.jpg,Le psicologie del profondo in ascolto del corpo. Sviluppi del discorso freudiano e sviluppi del discorso junghiano. Un dialogo,N/D,Alpes Italia,2026,,https://www.ibs.it/psicologie-del-profondo-in-ascolto-libro-vari/e/9791256650811,False,2026-04-11
Editori Selezionati,https://www.ibs.it/images/9788892250260_0_0_150_0_75.jpg,Non è mai troppo tardi per iniziare a vivere davvero. Come scoprire il kairós,Alfredo Altomonte,San Paolo Edizioni,2026,"Nell’antichità i greci usavano due termini diversi per definire il tempo: chronos per indicare lo scorrere dei minuti (e quindi la sua natura quantitativa) e kairos per indicare la natura qualitativa dello stesso, ovvero l’abilità di fare la cosa giusta al momento opportuno. Una delle sensazioni più comuni oggi è quella di sentirsi sempre fuori tempo, in ritardo rispetto alla vita. Ma ciò che proviamo è il bisogno di essere schiavi del tempo che scorre o vogliosi di un tempo vissuto? Spesso ci perdiamo nella classica frase «Scusa, non ho tempo…», lo facciamo in maniera convinta, quasi come se la categoria temporale non dipendesse da noi, bensì il contrario. I rischi del chronos sono dietro l’angolo: la tendenza a sentirsi fuori tempo ci induce spesso a sentire il vuoto della frenesia per poi fuggire in un altrove che ci ripropone gli stessi nuclei problematici. Alfredo Altomonte con questo testo ci dice che non è mai troppo tardi per cambiare strada, per sentirsi amati e amare. Non è mai troppo tardi per diventare sé stessi. Per farlo, però, dobbiamo ricominciare a respirare. Respirare è inteso come stare, stare nel vuoto, sentirlo e non fuggire, mentre tutti invitano a correre, riempire il vuoto con le cose del mondo. Nessuno, o quasi, dice invece che ogni tanto è giusto fermarsi, che va bene anche quando ci si sente persi e che non si è rotti solo perché non si sa dove si sta andando.",https://www.ibs.it/non-mai-troppo-tardi-per-libro-alfredo-altomonte/e/9788892250260,False,2026-04-13
Altri Editori,https://www.ibs.it/images/9791259562135_0_0_150_0_75.jpg,"Il corpo che significa. Psiche, simbolo ed energia tra Oriente e Occidente",Fabio Gambetti,Persiani,2026,,https://www.ibs.it/corpo-che-significa-psiche-simbolo-libro-fabio-gambetti/e/9791259562135,False,2026-04-15
Altri Editori,https://www.ibs.it/images/9791256651061_0_0_150_0_75.jpg,"Marilyn, eterna fanciulla. Psichiatria e psicoanalisi di una diva autodistruttiva","Liliana Dell'Osso,Riccardo Dalle Luche",Alpes Italia,2026,,https://www.ibs.it/marilyn-eterna-fanciulla-psichiatria-psicoanalisi-libro-liliana-dell-osso-riccardo-dalle-luche/e/9791256651061,False,2026-04-11
Editori Selezionati,https://www.ibs.it/images/9791256148028_0_0_150_0_75.jpg,Lucian Freud. Il corpo e il segno,Gaetano Romagnuolo,Castelvecchi,2026,"Tra arte e psicoanalisi, Gaetano Romagnuolo attraversa la figura complessa e controversa di Lucian Freud per indagare il punto in cui l’atto artistico incontra la fugacità dell’esistenza. La sua pittura si configura come una «scrittura della carne», dove il gesto pittorico incide, stratifica e trasforma il corpo in una superficie viva, attraversata da tempo, memoria e inconscio, e il ritratto, lungi dall’essere imitazione, si fa evento, in cui il soggetto si confronta con la propria alterità e vacilla ogni stabilità identitaria. Pur prendendo le distanze dall’eredità del nonno Sigmund, Lucian ne riattiva l’interrogazione più radicale. Un artista non dichiaratamente freudiano, ma tale nel senso più profondo: capace di far cadere ogni sembiante e condurre lo sguardo fino alla verità irriducibile del corpo. Prefazione di Ida Stella Riccio.",https://www.ibs.it/lucian-freud-corpo-segno-libro-gaetano-romagnuolo/e/9791256148028,True,2026-04-17
Editori Selezionati,https://www.ibs.it/images/9791222327150_0_0_150_0_75.jpg,"Passaggio all’atto e acting out. C'è bisogno che io me lo tagli, affinché voi mi prestiate orecchio?",Marcel Czermak,Mimesis,2026,"L’atto costituisce una delle questioni tra le più difficili, enigmatiche e delicate per la clinica. Le sue implicazioni terapeutiche e medico-legali rappresentano difficoltà spesso difficili da affrontare. Tra ciò che la dottrina ha nominato “acting out” e il “passaggio all’atto” esiste uno spettro di implicazioni, tanto per il loro approccio quanto per i loro aspetti. Sovente, le differenze stabilite come punti di repere tra questi termini hanno incidenze terapeutiche, giuridiche e sociali considerevoli. Questo seminario di Marcel Czermak contribuisce a delle chiarificazioni necessarie, proponendo un grande numero di apporti alle tesi di Jacques Lacan. Il suo obiettivo è aiutare il medico, il giurista e lo psicanalista ad avere un punto di vista più definito di fronte a ciò che si chiama un atto, che sia quotidiano e ordinario o che si trovi a essere collocato nelle più gravi congiunture della vita sociale o di un singolo soggetto.",https://www.ibs.it/passaggio-all-atto-acting-out-libro-marcel-czermak/e/9791222327150,True,2026-04-17
Altri Editori,https://www.ibs.it/images/9788892923010_0_0_150_0_75.jpg,"Psicologia del vivere consapevole. Governo di sé, responsabilità e infinitudine",Emanuela Panza,Santelli Editore,2026,,https://www.ibs.it/psicologia-del-vivere-consapevole-governo-libro-emanuela-panza/e/9788892923010,True,2026-04-17
Altri Editori,https://www.ibs.it/images/9791282549967_0_0_150_0_75.jpg,Der affe im prächtigen gewand. Von der ursprünglichen gebrechlichkeit zum universellen bewusstsein.,Bruno Del Medico,PensareDiverso,2026,,https://www.ibs.it/der-affe-im-prachtigen-gewand-libro-bruno-del-medico/e/9791282549967,False,2026-04-15
Altri Editori,https://www.ibs.it/images/9791282549950_0_0_150_0_75.jpg,Le singe au magnifique manteau. De la fragilité originelle à la conscience universelle,Bruno Del Medico,PensareDiverso,2026,,https://www.ibs.it/singe-au-magnifique-manteau-de-libro-bruno-del-medico/e/9791282549950,False,2026-04-15
Altri Editori,https://www.ibs.it/images/9791282549943_0_0_150_0_75.jpg,O macaco com o esplêndido manto. Da fragilidade original à consciência universal,Bruno Del Medico,PensareDiverso,2026,,https://www.ibs.it/o-macaco-com-o-esplendido-libro-bruno-del-medico/e/9791282549943,False,2026-04-15
Altri Editori,https://www.ibs.it/images/9791282549936_0_0_150_0_75.jpg,El mono del espléndido traje. De la fragilidad original a la conciencia universal,Bruno Del Medico,PensareDiverso,2026,,https://www.ibs.it/el-mono-del-esplendido-traje-libro-bruno-del-medico/e/9791282549936,False,2026-04-15
Altri Editori,https://www.ibs.it/images/9791282549929_0_0_150_0_75.jpg,The monkey in splendid attire. From original fragility to universal consciousness,Bruno Del Medico,PensareDiverso,2026,,https://www.ibs.it/the-monkey-in-splendid-attire-libro-bruno-del-medico/e/9791282549929,False,2026-04-15
Altri Editori,https://www.ibs.it/images/9791282549868_0_0_150_0_75.jpg,De vonk en het Oneindige. De oorsprong en de reden van alle bewustzijn. Waar het bewustzijn ontstaat. Waarom we bewust zijn. Reis door het universele bewustzijn.,Bruno Del Medico,PensareDiverso,2026,,https://www.ibs.it/de-vonk-en-het-oneindige-libro-bruno-del-medico/e/9791282549868,False,2026-04-15
Altri Editori,https://www.ibs.it/images/9791282549851_0_0_150_0_75.jpg,A centelha e o Infinito. A origem e a razão de todas as consciências. Onde nasce a consciência. Porque somos conscientes. Viagem pela consciência universal,Bruno Del Medico,PensareDiverso,2026,,https://www.ibs.it/a-centelha-o-infinito-a-libro-bruno-del-medico/e/9791282549851,False,2026-04-15
Altri Editori,https://www.ibs.it/images/9791282549738_0_0_150_0_75.jpg,"Quantenanalogien in Carl Jungs Denken. Kollektives unbewusstes, numinose energien, synchronizität und das psychoide in verbindung mit der neuen physik",Bruno Del Medico,PensareDiverso,2026,,https://www.ibs.it/quantenanalogien-in-carl-jungs-denken-libro-bruno-del-medico/e/9791282549738,False,2026-04-15
Altri Editori,https://www.ibs.it/images/9791282549455_0_0_150_0_75.jpg,"A física quântica e a consciência do universo. Segunda edição ampliada. A dupla fenda, a sobreposição, o entrelaçamento. A necessidade de observadores conscientes para a existência do mundo",Bruno Del Medico,PensareDiverso,2026,,https://www.ibs.it/a-fisica-quantica-a-consciencia-libro-bruno-del-medico/e/9791282549455,False,2026-04-15
Altri Editori,https://www.ibs.it/images/9791282549424_0_0_150_0_75.jpg,"La física cuántica y la conciencia del universo. La doble rendija, la superposición, el entrelazamiento. La necesidad de observadores conscientes para la existencia del mundo",Bruno Del Medico,PensareDiverso,2026,,https://www.ibs.it/fisica-cuantica-y-conciencia-del-libro-bruno-del-medico/e/9791282549424,False,2026-04-15
Altri Editori,https://www.ibs.it/images/9791282269056_0_0_150_0_75.jpg,Il modello gestaltico integrato nella psicologia del lavoro e delle organizzazioni. Processi di contatto e psicopatologia nei sistemo organizzativi,Vincenzo Motta,Luigi Guerriero Editore,2026,,https://www.ibs.it/modello-gestaltico-integrato-nella-psicologia-libro-vincenzo-motta/e/9791282269056,True,2026-04-17
Altri Editori,https://www.ibs.it/images/9791221825923_0_0_150_0_75.jpg,Riparare la coppia. Strategie per trasformare il conflitto in risorsa. Nuova ediz.,Raffaele Focaroli,Aracne (Genzano di Roma),2026,,https://www.ibs.it/riparare-coppia-strategie-per-trasformare-libro-raffaele-focaroli/e/9791221825923,False,2026-04-15
Altri Editori,https://www.ibs.it/images/9788855132381_0_0_150_0_75.jpg,Neuropsychogical Trends (2026). Vol. 39,N/D,LED Edizioni Universitarie,2026,,https://www.ibs.it/neuropsychogical-trends-2026-vol-39-libro-vari/e/9788855132381,True,2026-04-17
Editori Selezionati,https://www.ibs.it/images/9788806272715_0_0_150_0_75.jpg,Una cosa spirituale. Non fare niente e altre forme d’arte,Vasco Brondi,Einaudi,2026,"Vasco Brondi ci racconta la sua esperienza con la creatività, i momenti in cui ha sentito che il flusso creativo non scorreva più e i momenti in cui l’ha ritrovato. Esplora e mette in relazione le esperienze e le pratiche creative e spirituali di grandi artisti e di grandi mistici e tradizioni contemplative: Nick Cave e i sufi, le cartomanti e Federico Fellini, i padri del deserto e i CCCP, Marina Abramovic e i monaci tibetani, i “sadhu” e David Lynch, Simone Weil e il regno dei cieli. Per scoprire e lasciarsi ispirare dai processi creativi di registi, musicisti, scrittori, artisti visivi e dal loro rapporto con l’invisibile. Vasco Brondi, che con le sue canzoni è arrivato a tanti, ci suggerisce che l’arte, in quest’epoca materialista, non è solo intrattenimento ma può metterci in contatto con le magie e i misteri del nostro transito terrestre. In questo senso la creatività è una cosa spirituale.",https://www.ibs.it/cosa-spirituale-non-fare-niente-libro-vasco-brondi/e/9788806272715,False,2026-04-15
Altri Editori,https://www.ibs.it/images/9788832974676_0_0_150_0_75.jpg,Fabrizio Miccoli. Gloria e peccato di un campione,"Lorenzo Avola,Carolina Orlandi",66thand2nd,2026,,https://www.ibs.it/fabrizio-miccoli-gloria-peccato-di-libro-lorenzo-avola-carolina-orlandi/e/9788832974676,False,2026-04-11
Editori Selezionati,https://www.ibs.it/images/9788828219217_0_0_150_0_75.jpg,"Mezé, miracoli e disastri. Il mio Libano in cucina, oltre la guerra","Maradona Youssef,Sara Faillaci",Solferino,2026,"Maradona Youssef: già dal nome si intuisce una vita insolita. Battezzato in onore della passione calcistica del padre Jean, primo e adorato figlio maschio di una famiglia paterna di militari e una famiglia materna di medici, nasce nel 1986 e cresce nel Libano in guerra. Un’infanzia e un’adolescenza complicate, in cui ci sono le ordinarie giornate di scuola, ma anche la paura delle bombe e degli attentati; ci sono le gite a caccia con la selvaggina cucinata sul fuoco da campo, ma anche i posti di blocco a cui si rischia la vita; e c’è una geografia complessa di appartenenze religiose e politiche da navigare per poter sopravvivere. La pace, per Maradona, è in un unico posto: la cucina. Il luogo dove le donne della famiglia modellano un miracolo di sapori, profumi, consistenze, che lui impara a chiamare «casa». Dove i mille pani del Libano, i suoi vini, le sue spezie trovano una sintesi e un’armonia. Anni dopo, trasferitosi in Italia per studiare, quell’arte gastronomica appresa aiutando la nonna, la madre e la zia diventerà a sorpresa il suo lavoro, quello di uno chef impegnato a portare nel suo nuovo Paese la ricchezza di sapore e significato della sua terra. Un memoir come un romanzo vero, un’educazione sentimentale che ci offre uno spaccato intimo, originale e vivo della questione mediorientale. Le ricette irresistibili che arricchiscono i capitoli uniscono i due mondi dell’autore, Italia e Libano, rinnovando la speranza nella pace e nella convivenza tra i popoli.",https://www.ibs.it/meze-miracoli-disastri-mio-libano-libro-maradona-youssef-sara-faillaci/e/9788828219217,True,2026-04-17
Altri Editori,https://www.ibs.it/images/9788865499634_0_0_150_0_75.jpg,"A.C. confidential. La mia vita tra arte, bicicletta e design","Antonio Colombo,Giacomo Pellizzari",Ediciclo,2026,,https://www.ibs.it/ac-confidential-mia-vita-tra-libro-antonio-colombo-giacomo-pellizzari/e/9788865499634,False,2026-04-11
