Categoria_App,Copertina,Titolo,Autore,Editore,Anno,Descrizione,Link,Nuovo,Data_Aggiunta
Editori Selezionati,https://www.ibs.it/images/9788858160381_0_0_150_0_75.jpg,Tracce fasciste. L'eredità materiale del Ventennio,Emanuele Ertola,Laterza,2026,"Caserme dismesse, Case del Fascio riconvertite, statue rimosse o restaurate, affreschi coperti e poi riscoperti: l’Italia contemporanea convive ogni giorno, spesso senza accorgersene, con l’eredità materiale lasciata dal fascismo. Questo libro ricostruisce i modi in cui il nostro Paese ha affrontato – tra rimozione, oblio e valorizzazione – i segni ingombranti del Ventennio. Dal 1943 in avanti la rottura con il passato ha convissuto con la continuità, il vastissimo e ubiquo lascito fascista è stato ora percepito come una vergogna da nascondere, ora come testimonianza storica o persino come patrimonio culturale da esibire. Così, si sono alternate ondate di iconoclastia, tentativi di cancellazione simbolica, ma anche scelte di conservazione o recupero. All’inizio le reazioni furono guidate dall’urgenza di marcare la distanza dal regime, ma negli anni del boom economico questa esigenza ha convissuto con l’eredità fascista, non ponendo particolare attenzione al suo significato simbolico. Negli ultimi decenni il dibattito si è riacceso: dalla riscoperta, a partire dagli anni Ottanta, di un patrimonio artistico e architettonico che è stato restaurato e messo in mostra, fino ai dibattiti sulla ‘eredità difficile’ dei totalitarismi e alle polemiche sulla presunta cancel culture. Così, monumenti, edifici, opere d’arte, e persino nomi delle strade, sono diventati terreno di battaglia per la memoria collettiva, rivelando le difficoltà dell’Italia repubblicana a fare i conti con la propria storia.",https://www.ibs.it/tracce-fasciste-eredita-materiale-del-libro-emanuele-ertola/e/9788858160381,False,2026-04-04
Editori Selezionati,https://www.ibs.it/images/9788815396181_0_0_150_0_75.jpg,Alla festa della rivoluzione. Artisti e libertari con D'Annunzio a Fiume. Nuova ediz.,Claudia Salaris,Il Mulino,2026,"«Una sarabanda furiosa, ricca di guasconate e beffe spettacolari. Così l'avventura di Fiume raccontata dalla parte degli ""scalmanati"", di artisti e libertari che vi accorsero per dare vita a una festa mobile, ""la festa della rivoluzione""» Simonetta Fiori «Sta entusiasmando tutti quelli a cui l'ho consigliato» Giordano Bruno Guerri L'impresa fiumana (1919-1920) fu un crocevia di esperienze diverse, di spinte ribelli e di ambizioni rivoluzionarie. Un lungo, febbrile carnevale all'insegna della festa, della trasgressione e della provocazione, in sintonia con le avanguardie artistiche del tempo e, per certi aspetti, con lo spirito insurrezionale del Sessantotto. L'autrice guarda a quell'avventura restituendola come una vita-festa: un intreccio di bravate futuriste e di utopie che oggi potremmo definire no global, di libertà sessuale e di pirateria, di gioco e di guerra, capace di far convergere anarchici, artisti e irrequieti di ogni risma. Così, la Fiume dannunziana si rivela non solo come un episodio storico, ma come un momento essenziale di quella cultura della rivolta che ha attraversato l'intero Novecento.",https://www.ibs.it/alla-festa-della-rivoluzione-artisti-libro-claudia-salaris/e/9788815396181,False,2026-04-04
Altri Editori,https://www.ibs.it/images/9788836164479_0_0_150_0_75.jpg,I mostri nella storia. Creature impossibili tra mito e scienza,Massimo Centini,DIARKOS,2026,,https://www.ibs.it/mostri-nella-storia-creature-impossibili-libro-massimo-centini/e/9788836164479,False,2026-04-01
Editori Selezionati,https://www.ibs.it/images/9788858160831_0_0_150_0_75.jpg,Storia internazionale della Resistenza italiana,N/D,Laterza,2026,"Nella Resistenza italiana, parte integrante di un conflitto globale che ha travolto i confini nazionali e spazzato vite e destini ai quattro angoli del pianeta, hanno combattuto migliaia di persone che italiane non erano. Spinte alla lotta da una pluralità di motivazioni e da una molteplicità di percorsi individuali, che vanno dall’internazionalismo consapevole alla semplice ricerca di una via di salvezza individuale, si trovarono coinvolte nello stesso spicchio di guerra mondiale, nello stesso periodo e sullo stesso lato della barricata. Una storia della Resistenza a lungo trascurata e che oggi possiamo finalmente riscoprire.",https://www.ibs.it/storia-internazionale-della-resistenza-italiana-libro-vari/e/9788858160831,False,2026-04-04
Editori Selezionati,https://www.ibs.it/images/9788817198486_0_0_150_0_75.jpg,"La promessa. Dal suffragio femminile alla prima donna a palazzo Chigi, storia di una rivoluzione incompleta",Marianna Aprile,Rizzoli,2026,"Il 1946 è un anno decisivo per le donne. Dopo un lungo percorso puntellato di conflitti, rivendicazioni ed esperienze cruciali come la Resistenza, prima con le elezioni amministrative di marzo, e poi con il referendum del 2 giugno e l'elezione dell'Assemblea costituente, le donne votano e sono votate per la prima volta. Nascono elettrici ed elette. A Montecitorio sbarcano le ventuno costituenti e il loro contributo alla Carta fissa quei principi che le battaglie di generazioni successive di donne, attiviste, femministe e parlamentari - di sinistra e di destra - riusciranno a far tradurre in leggi concrete e nuovi diritti: divorzio, aborto, maternità protetta, parità salariale, riforma del diritto di famiglia. Ma qual è oggi lo stato di salute di quei diritti? E avere per la prima volta una donna a Palazzo Chigi ci racconta davvero di un Paese in cui la lotta per la piena cittadinanza delle donne può dirsi vinta? Ricostruendo vicende dimenticate e muovendosi tra le biografie straordinarie di donne troppo a lungo ignorate, Marianna Aprile ripercorre una storia lunga ottant'anni che tutti dovremmo conoscere, e si chiede infine che cosa resta della promessa del suffragio femminile: le donne pensano ancora al voto come a ""una cosa stupenda"", come la definì Lula Tonini nel 1946?",https://www.ibs.it/promessa-dal-suffragio-femminile-alla-libro-marianna-aprile/e/9788817198486,False,2026-04-08
Editori Selezionati,https://www.ibs.it/images/9788815394972_0_0_150_0_75.jpg,"Roma tradita. Settembre 1943, la mancata difesa e l'occupazione tedesca",Elena Aga Rossi,Il Mulino,2026,"Nonostante la vasta produzione storiografica sull’8 settembre, restano irrisolti nodi fondamentali: perché Roma non fu difesa? Perché, dopo l’annuncio dell’armistizio, Badoglio si rifiutò di dare l’ordine di attaccare i tedeschi? Con la desecretazione degli atti della Commissione parlamentare d’inchiesta, gli studiosi hanno avuto accesso a migliaia di pagine di testimonianze e relazioni. L’analisi di questi documenti ha rivelato omissioni, falsificazioni e contraddizioni da parte dei protagonisti, impegnati a giustificarsi e a scaricare responsabilità. I vertici militari parlarono di resa inevitabile e adottarono, per giustificarsi, una sovrastima delle forze tedesche. Elena Aga Rossi ricostruisce quei giorni per restituire verità a uno dei passaggi più drammatici della storia italiana.",https://www.ibs.it/roma-tradita-settembre-1943-mancata-libro-elena-aga-rossi/e/9788815394972,False,2026-04-03
Editori Selezionati,https://www.ibs.it/images/9788804803072_0_0_150_0_75.jpg,Lo specchio americano. Lo sguardo della Cina sugli Stati Uniti,Simone Pieranni,Mondadori,2026,"C'è stato un tempo in cui per un giovane cinese mangiare pollo fritto da KFC a Pechino era un atto di trasgressione, e guardare Titanic al cinema significava sognare un futuro come quello di Los Angeles. Per decenni, la Cina ha osservato gli Stati Uniti con una fascinazione magnetica, un misto di desiderio e complesso d'inferiorità. L'America non era solo un partner o un nemico: era lo specchio in cui la Cina cercava la propria immagine riflessa per capire cosa sarebbe diventata «da grande». Oggi quel mondo è finito e quelle immagini sono cambiate. In un presente in cui tutti si affannano a decifrare le ambizioni di Pechino, per capire dove stia andando la Cina dobbiamo capire cosa pensano i cinesi dell'Occidente. In queste pagine, Simone Pieranni ci accompagna nel complesso rapporto fra i due Paesi, ripercorrendo oltre un secolo di relazioni culturali: dall'epoca di Mao alla Guerra Fredda, dalle riforme di Deng Xiaoping al «sogno cinese» di Xi Jinping, fino alle sfide dell'intelligenza artificiale. Ne emerge un sentimento ambivalente di amore e odio, e una lunga fascinazione della Cina nei confronti degli Stati Uniti, talvolta con effetti paradossali, come nel caso dei giovani cinesi che guardano con simpatia a Trump e al fenomeno MAGA. Una fascinazione che, tuttavia, negli ultimi anni è cambiata: la Cina è passata dall'essere uno dei Paesi più poveri al mondo a divenire una superpotenza, e in questo percorso l'America è sempre stata lo specchio in cui cercarsi, il gigante da sfidare e, forse, da superare.",https://www.ibs.it/specchio-americano-sguardo-della-cina-libro-simone-pieranni/e/9788804803072,False,2026-04-08
Editori Selezionati,https://www.ibs.it/images/9788858160824_0_0_150_0_75.jpg,L'alba della storia. Una rivoluzione iniziata diecimila anni fa,Guido Barbujani,Laterza,2026,"Quando l’umanità ha cominciato a coltivare i campi e ad addomesticare gli animali è cominciata una storia diversa, che è ancora la nostra. Diecimila anni fa si sono messe in moto trasformazioni che ancora ci riguardano, che ancora influenzano il nostro modo di lavorare, di vestirci, di mangiare, di confrontarci con gli altri membri della nostra comunità. È la rivoluzione neolitica: il momento in cui, più che in qualunque altro, biologia e cultura si sono intrecciate, influenzandosi a vicenda e producendo la nostra storia. Passando dallo studio del DNA a quello delle lingue, dagli scavi archeologici alle manipolazioni genetiche, e anche attraverso il racconto di alcune storie esemplari, Guido Barbujani ci porta indietro nel tempo fino a 10.000 anni fa, alla rivoluzione neolitica.",https://www.ibs.it/alba-della-storia-rivoluzione-iniziata-libro-guido-barbujani/e/9788858160824,False,2026-04-03
Altri Editori,https://www.ibs.it/images/9788838949753_0_0_150_0_75.jpg,Le crociate di Terrasanta,Marco Meschini,Sellerio Editore Palermo,2026,,https://www.ibs.it/crociate-di-terrasanta-libro-marco-meschini/e/9788838949753,False,2026-04-01
Altri Editori,https://www.ibs.it/images/9788833673639_0_0_150_0_75.jpg,"Tre élites coloniali. Roma, la Spagna e le Americhe",Ronald Syme,Officina Libraria,2026,,https://www.ibs.it/tre-elites-coloniali-roma-spagna-libro-ronald-syme/e/9788833673639,False,2026-04-03
Editori Selezionati,https://www.ibs.it/images/9788811022428_0_0_150_0_75.jpg,Obiettivo Groenlandia. Le lezioni della storia dai vichinghi a Trump,Elizabeth Buchanan,Garzanti,2026,"Da sempre la Groenlandia è una terra di frontiera, teatro di esplorazioni e di rivalità strategiche. Il suo territorio, abitato da poco più di cinquantamila persone e situato per l'80 per cento oltre il Circolo Polare Artico, ha inciso sugli equilibri globali e, allo stesso tempo, ne è stato profondamente segnato. In questo libro Elizabeth Buchanan ricostruisce i momenti cruciali della storia dell'isola, dalle prime colonie vichinghe di Erik il Rosso, il cui cospicuo insediamento scomparve misteriosamente nel nulla, fino alle mire sempre più minacciose e inquietanti dell'amministrazione Trump. Lo fa addentrandosi nel complesso rapporto tra gli indigeni e il governo danese, ricordando le offerte d'acquisto da parte americana nel 1867 e poi nel 1910 e nel 1946, contestualizzando il trattato che durante la Seconda guerra mondiale sancì la presenza militare statunitense sul territorio, di fatto mai più revocata. Ancora, Buchanan dà conto della trasformazione della Groenlandia in avamposto strategico durante la Guerra fredda, prima con la costruzione di una base a propulsione nucleare sotto la calotta glaciale e poi con Iceworm, il progetto voluto (e mai attuato) dal presidente Kennedy, che prevedeva il dispiegamento di seicento missili balistici nascosti nel ghiaccio.",https://www.ibs.it/obiettivo-groenlandia-lezioni-della-storia-libro-elizabeth-buchanan/e/9788811022428,False,2026-04-08
Altri Editori,https://www.ibs.it/images/9788893665797_0_0_150_0_75.jpg,Public history. Teorie pratiche e prospettive del modello «CESRAM»,"Antonio Caso,Deborah De Blasi,Giuliana Iurlano",Le Lettere,2026,,https://www.ibs.it/public-history-teorie-pratiche-prospettive-libro-vari/e/9788893665797,False,2026-04-03
Editori Selezionati,https://www.ibs.it/images/9788817195430_0_0_150_0_75.jpg,Tutto è tubercolosi. Storia della malattia infettiva più letale al mondo,John Green,Rizzoli,2026,"La tubercolosi accompagna l'umanità da millenni. Un tempo romanticizzata come il male dei poeti, oggi è una malattia legata alla povertà, che segue le tracce di ingiustizia e disuguaglianza che noi stessi abbiamo tracciato. Nel 2019, John Green incontra Henry Reider, un giovane paziente affetto da tubercolosi all'ospedale di Lakka, in Sierra Leone. Tra i due nasce subito un'amicizia profonda: Henry ha gambe sottili e un sorriso contagioso, pieno di vita. Da quel primo incontro, Green è diventato una delle voci più appassionate nella battaglia per un accesso più equo alle cure e per rompere il silenzio su un'infezione che, pur essendo curabile e prevenibile, continua a uccidere oltre un milione di persone ogni anno.",https://www.ibs.it/tutto-tubercolosi-storia-della-malattia-libro-john-green/e/9788817195430,False,2026-04-01
Editori Selezionati,https://www.ibs.it/images/9788833945873_0_0_150_0_75.jpg,La casa in montagna. Storia di quattro partigiane,Caroline Moorehead,Bollati Boringhieri,2026,"Siamo ormai a tre generazioni di distanza dalla guerra partigiana del 1943-45, e certi eventi di quegli anni hanno perso in parte la loro carica emozionale. In questi decenni è stato compiuto (e ancora si compie) un imprescindibile lavoro di ricerca storica, che ha documentato con cura le battaglie e le vite dei protagonisti di allora, e ha analizzato nel dettaglio gli elenchi degli assassinati e dei torturati, e l'orribile computo dei drammi umani, spesso descritto con linguaggio asettico nei documenti della burocrazia. Oggi è importante che, per non dimenticare, si levi su quelle vicende anche una voce autoriale, in grado di legare i fatti storici in un filo narrativo coinvolgente e cristallino. È ciò che fa Caroline Moorehead in questo libro, un'opera completa, capace di ricreare l'atmosfera di paura e di dolore, ma anche in grado di rendere la spinta ideale provata da molte donne coraggiose, determinate ad agire e rischiare per il bene della loro comunità. Pagina dopo pagina, leggiamo senza fiato la storia delle quattro protagoniste – Ada Gobetti, Bianca Guidetti Serra, Frida Malan e Silvia Pons –, partigiane emblematiche di un intero movimento di donne altruiste, forti e motivate, che animarono azioni di ribellione collettiva, sfidando la guerra, la paura e i pregiudizi. In questo racconto, attento e delicato, troviamo testimonianze che riescono a commuovere e a ispirare, e restano impresse a lungo, grazie alla penna felice dell'autrice. Attraverso lo sguardo e l'esempio di queste protagoniste in lotta contro il nazifascismo, ""La casa in montagna"" ci restituisce una memoria unica, che oggi troppi vorrebbero dimenticare.",https://www.ibs.it/casa-in-montagna-storia-di-libro-caroline-moorehead/e/9788833945873,False,2026-04-04
Editori Selezionati,https://www.ibs.it/images/9788815394996_0_0_150_0_75.jpg,"Un'altra storia dell'aborto. Contraccezione, diritti e salute nell'Italia repubblicana",Azzurra Tafuro,Il Mulino,2026,"Nell’Italia e nell’Europa della guerra fredda, l’aborto e la contraccezione sono poste in gioco cruciali, che incrociano due grandi temi: da un lato, l’ossessione per la bomba demografica e il controllo biopolitico della popolazione; dall’altro, i diritti e la salute riproduttiva e sessuale delle donne e di tutti. Questo libro traccia un’altra storia della campagna per la depenalizzazione della contraccezione e dell’aborto in Italia, guardando al di là dei confini nazionali e delle aule parlamentari. In questo modo, è possibile situare il paese al cuore di una fittissima rete di relazioni transnazionali e restituire voce ai femminismi, alle associazioni per il birth control, alla stampa e ai milioni di italiani e italiane che rivendicarono il diritto di amarsi e di decidere quando e se avere figli.",https://www.ibs.it/altra-storia-dell-aborto-contraccezione-libro-azzurra-tafuro/e/9788815394996,False,2026-04-04
Editori Selezionati,https://www.ibs.it/images/9788806270179_0_0_150_0_75.jpg,Atlante del Medioevo. Dalla caduta di Roma all’anno Mille in 90 mappe,John Haywood,Einaudi,2026,"Cinque secoli e più di trasformazioni cruciali – dalla caduta di Roma alla formazione dell’Impero carolingio, dalla nascita dell’Islam al ruolo della Chiesa – raccontati con rigore narrativo e straordinaria potenza visiva: grazie a 90 mappe e più di 250 immagini, il Medioevo non era mai stato visto così.",https://www.ibs.it/atlante-del-medioevo-dalla-caduta-libro-john-haywood/e/9788806270179,False,2026-04-08
Altri Editori,https://www.ibs.it/images/9788816419360_0_0_150_0_75.jpg,La natura politica del museo,Giovanni Pinna,Jaca Book,2026,,https://www.ibs.it/natura-politica-del-museo-libro-giovanni-pinna/e/9788816419360,False,2026-04-04
Editori Selezionati,https://www.ibs.it/images/9791256148431_0_0_150_0_75.jpg,Edvard Beneš e Jan Masaryk. Due protagonisti dell’Europa democratica di fronte alle dittature (1938-1948),N/D,Castelvecchi,2026,"Eletto nel 1935 alla successione del suo maestro, Tomáš G. Masaryk, nel ruolo di presidente della Repubblica, Edvard Beneš fu costretto a capitolare davanti al Diktat di Monaco, in cui Mussolini si atteggiò a protagonista della scena diplomatica europea. Il secondo dopoguerra segnò poi il destino della democrazia cecoslovacca, stretta tra l’espansionismo sovietico e il progressivo disimpegno delle potenze occidentali. Jan Masaryk, ministro degli Esteri, visse in prima persona le drammatiche contraddizioni della politica internazionale degli anni Quaranta. Cosmopolita e brillante diplomatico, difese con passione e fiducia il futuro del suo Paese, diventando una figura amatissima grazie ai messaggi che, durante la guerra, trasmetteva settimanalmente ai suoi concittadini dai microfoni della BBC. La sua morte, avvenuta nel marzo 1948 sul selciato del cortile di palazzo Černín a Praga, sotto la finestra della sua stanza, segnò la definitiva spaccatura del Continente e l’inizio della Guerra Fredda. Fu suicidio o omicidio?",https://www.ibs.it/edvard-benes-jan-masaryk-due-libro-vari/e/9791256148431,False,2026-04-03
Altri Editori,https://www.ibs.it/images/9791282062282_0_0_150_0_75.jpg,"Malvinas. Una guerra del secolo scorso, un giornalista e un diario ritrovato","Paolo Argentini,Giancarlo Feliziani",il Millimetro,2026,,https://www.ibs.it/malvinas-guerra-del-secolo-scorso-libro-paolo-argentini-giancarlo-feliziani/e/9791282062282,False,2026-04-03
Altri Editori,https://www.ibs.it/images/9791281577220_0_0_150_0_75.jpg,Storia di una capitale. Napoli dalle origini al 1860,Gino Doria,Grimaldi & C.,2026,,https://www.ibs.it/storia-di-capitale-napoli-dalle-libro-gino-doria/e/9791281577220,False,2026-04-03
Altri Editori,https://www.ibs.it/images/9791256940660_0_0_150_0_75.jpg,Donne invisibili. La Resistenza femminile nella Bassa modenese,Fabio Montella,Bibliotheka Edizioni,2026,,https://www.ibs.it/donne-invisibili-resistenza-femminile-nella-libro-fabio-montella/e/9791256940660,False,2026-04-03
Altri Editori,https://www.ibs.it/images/9791255633235_0_0_150_0_75.jpg,"Certe canzoni. Settant'anni di musica: rock, pop, cantautori",Antonio Tricomi,Guida,2026,,https://www.ibs.it/certe-canzoni-settant-anni-di-libro-antonio-tricomi/e/9791255633235,False,2026-04-03
Altri Editori,https://www.ibs.it/images/9791255411222_0_0_150_0_75.jpg,"Kharkiv. Complessa, indomita, ferita, indistruttibile",Yaryna Grusha,Paesi Edizioni,2026,,https://www.ibs.it/kharkiv-complessa-indomita-ferita-indistruttibile-libro-yaryna-grusha/e/9791255411222,False,2026-04-03
Altri Editori,https://www.ibs.it/images/9791255212782_0_0_150_0_75.jpg,Dieci giorni che sconvolsero il mondo,John Reed,LEG Edizioni,2026,,https://www.ibs.it/dieci-giorni-che-sconvolsero-mondo-libro-john-reed/e/9791255212782,False,2026-04-03
Altri Editori,https://www.ibs.it/images/9788868576943_0_0_150_0_75.jpg,Bella ciao. Storia e fortuna di una canzone,Cesare Bermani,Interlinea,2026,,https://www.ibs.it/bella-ciao-storia-fortuna-di-libro-cesare-bermani/e/9788868576943,False,2026-04-04
Altri Editori,https://www.ibs.it/images/9788867671731_0_0_150_0_75.jpg,Venezia lost and found. Fotografie degli anni '60 perdute e ritrovate. Ediz. bilingue,"Alberto Toso Fei,Manfredo Manfroi",Kellermann Editore,2026,,https://www.ibs.it/venezia-lost-and-found-fotografie-libro-alberto-toso-fei-manfredo-manfroi/e/9788867671731,False,2026-04-03
Altri Editori,https://www.ibs.it/images/9788862623919_0_0_150_0_75.jpg,Storia. Domande e risposte,N/D,Idea Libri,2026,,https://www.ibs.it/storia-domande-risposte-libro-vari/e/9788862623919,False,2026-04-04
Altri Editori,https://www.ibs.it/images/9788862505291_0_0_150_0_75.jpg,"La croce e la spada. La Santa Sede, il Portogallo e la politica missionaria (1926-1974)",Eugenio Enea,Guerini e Associati,2026,,https://www.ibs.it/croce-spada-santa-sede-portogallo-libro-eugenio-enea/e/9788862505291,False,2026-04-04
Editori Selezionati,https://www.ibs.it/images/9788855228121_0_0_150_0_75.jpg,Dietro quel portone. L'infanzia negata nei collegi dell'Italia del dopoguerra,Claudia Fantini,Donzelli,2026,"«Il portone del collegio che si chiude non significa solo una separazione fisica, ma simbolica. È il gesto che sancisce l'ingresso in un altro mondo, in un'altra logica, in un'altra vita. Ecco la realtà nascosta dietro il mito dell'educazione rigorosa: una pedagogia del dolore, una didattica dell'obbedienza, un'istituzione totale che non formava, ma piegava». «Allora non ne ero ancora consapevole, ma tutto quello che ero e che ero stato fino a quel momento sarebbe scomparso per sempre, chiuso fuori da quel portone. Niente sarebbe stato più come prima. Niente è stato più come prima». Così Emilio Ciavarelli ricorda il momento in cui, da bambino, entra nella colonia permanente «Federico Di Donato» di Narni. Dal 1965 al 1970, gli anni della scuola elementare, Emilio vive lontano dalla famiglia, nell'istituto gestito da suore come un «lager». L'unico conforto: le visite di una donna che lo riempie di affettuose attenzioni, ma che a un certo punto svanisce nel nulla, e che Emilio cercherà per tutta la vita: Maria Vittoria Scrocchia. Il rumore del portone che si chiude alle spalle è fissato in modo indelebile nei ricordi di centinaia di ex bambine e bambini che, tra gli anni cinquanta e settanta, vissero dentro istituti che promettevano assistenza ed educazione ma che spesso si traducevano in rigida disciplina, abusi e privazioni affettive. Luoghi in cui la coercizione era continua e minuta, lo spazio rigidamente diviso, il tempo frammentato, persino i movimenti codificati. La voce di Emilio, raccolta con grazia da Claudia Fantini e sapientemente intrecciata ad altre testimonianze in un racconto corale, descrive cosa significasse, nell'Italia del boom, crescere in un collegio dell'Opera nazionale maternità e infanzia, uno di quegli istituti fondati durante il fascismo per educare all'obbedienza e chiusi solo negli anni settanta, dopo che alcune inchieste giornalistiche – riportate in appendice al volume – avevano rivelato un sistema di malversazioni e clientelismi nell'assistenza all'infanzia che coinvolgeva gerarchie religiose e interessi politici. Alle testimonianze dalla viva voce degli ex bambini e bambine del collegio «Federico Di Donato» si affiancano le riflessioni dell'autrice che, inquadrando le vicende di Narni nel più ampio contesto storico e sociale, illuminano una pagina poco raccontata della storia sociale italiana e invitano a interrogarsi sul rapporto tra istituzioni, educazione e diritti dell'infanzia. Come scrive Giorgio Parisi nella sua Prefazione, «i piccoli reclusi di un tempo hanno trovato in Claudia Fantini una mediatrice partecipe, e in questo libro un luogo per parlare con tutti noi». Una storia individuale che si rivela, alla fine, storia di molti.",https://www.ibs.it/dietro-quel-portone-infanzia-negata-libro-claudia-fantini/e/9788855228121,False,2026-04-04
Altri Editori,https://www.ibs.it/images/9788842835615_0_0_150_0_75.jpg,"La miniera del mondo. Artieri, inventori, impostori",Piero Camporesi,Il Saggiatore,2026,,https://www.ibs.it/miniera-del-mondo-artieri-inventori-libro-piero-camporesi/e/9788842835615,False,2026-04-01
Altri Editori,https://www.ibs.it/images/9788833248936_0_0_150_0_75.jpg,I nemici del Drake. Enzo Ferrari e le scuderie inglesi,"Carlo Cavicchi,Mario Donnini,Maurizio Cilli",Minerva Edizioni (Bologna),2026,,https://www.ibs.it/nemici-del-drake-enzo-ferrari-libro-vari/e/9788833248936,True,2026-04-09
