Categoria_App,Copertina,Titolo,Autore,Editore,Anno,Descrizione,Link,Nuovo,Data_Aggiunta
Editori Selezionati,https://www.ibs.it/images/9788828219354_0_0_150_0_75.jpg,Il fantasma delle montagne. Alla scoperta dei segreti del leopardo delle nevi,Kulbhushansingh Suryawanshi,Solferino,2026,"Esistono animali che sembrano appartenere al regno del mito: il leopardo delle nevi è uno di questi. Predatore silenzioso, schivo e incapace di ruggire, vive solitario in alta quota sulle montagne dell’Himalaya, circondato solo da ghiacciai, neve e cime rocciose, come un asceta nella sua dimora celeste. Il manto bianco e marrone-argento, segnato da rosette scure, funziona come un mantello magico: un camuffamento così efficace che può scomparire alla vista, e che gli è valso il soprannome di «fantasma delle montagne». Specie simbolo della conservazione della regione, svolge un ruolo fondamentale per la salvaguardia di un ecosistema austero e delicato. Kulbhushansingh Suryawanshi, uno dei massimi esperti mondiali dei leopardi delle nevi, racconta in questo libro il suo lavoro di ricerca ultradecennale, le sue avventure sulle vette, le iniziative con le popolazioni locali per proteggere questi felini inafferrabili e ciò che resta del loro habitat, sempre più minacciato. Un racconto emozionante, illuminante e coinvolgente, perché ancora oggi la sola possibilità di un incontro con il fantasma delle montagne è un’esperienza trascendentale. Come ha scritto Peter Matthiessen: «Che il leopardo delle nevi esista, che sia qui, che i suoi occhi gelidi ci osservino dalla montagna, questo è sufficiente».",https://www.ibs.it/fantasma-delle-montagne-alla-scoperta-libro-kulbhushansingh-suryawanshi/e/9788828219354?inventoryId=1038791937,False,2026-07-20
Altri Editori,https://www.ibs.it/images/9788883234460_0_0_150_0_75.jpg,"Con gli occhi del cervello. Immagini, luci, colori",Semir Zeki,Di Renzo Editore,2026,,https://www.ibs.it/con-occhi-del-cervello-immagini-libro-semir-zeki/e/9788883234460,False,2026-07-21
Altri Editori,https://www.ibs.it/images/9791281228559_0_0_150_0_75.jpg,Quando gli animali parlano. Verso una democrazia interspecie,Eva Meijer,Ortica Editrice,2026,,https://www.ibs.it/quando-animali-parlano-verso-democrazia-libro-eva-meijer/e/9791281228559?inventoryId=920840503,False,2026-07-17
Altri Editori,https://www.ibs.it/images/9791256351275_0_0_150_0_75.jpg,Erbacce urbane. Guida all'incontro con la piccola flora di strada,Stefano Sturloni,Edizioni Junior,2026,,https://www.ibs.it/erbacce-urbane-guida-all-incontro-libro-stefano-sturloni/e/9791256351275,True,2026-07-23
Altri Editori,https://www.ibs.it/images/9788850656875_0_0_150_0_75.jpg,La metà nascosta delle piante. Gli invisibili nel terreno agrario,N/D,Edagricole,2026,,https://www.ibs.it/meta-nascosta-delle-piante-invisibili-libro-vari/e/9788850656875?inventoryId=934650593,False,2026-07-17
Altri Editori,https://www.ibs.it/images/9791280629906_0_0_150_0_75.jpg,L'eco delle cime. Carnet della Val d'Ala. Ediz. illustrata,"Marta Ferrero,Gianni Castagneri,Cristina Girard",Graphot,2026,,https://www.ibs.it/eco-delle-cime-carnet-della-libro-vari/e/9791280629906,False,2026-07-21
Altri Editori,https://www.ibs.it/images/9788893189729_0_0_150_0_75.jpg,Santa Ildegarda di Bingen. La visione ecologica di una mistica del Medioevo,"Francesco Guarino,Marcello Stanzione",Edizioni Segno,2026,,https://www.ibs.it/santa-ildegarda-di-bingen-visione-libro-francesco-guarino-marcello-stanzione/e/9788893189729,False,2026-07-21
Altri Editori,https://www.ibs.it/images/9788850656899_0_0_150_0_75.jpg,"Allevare nell'età dell'AI. Animali, dati e senso",Andrea Rosati,Edagricole,2026,,https://www.ibs.it/allevare-nell-eta-dell-ai-libro-andrea-rosati/e/9788850656899?inventoryId=1009503123,False,2026-07-17
Altri Editori,https://www.ibs.it/images/9788808299192_0_0_150_0_75.jpg,"Fisica per medicina. Per il semestre aperto di Medicina, Odontoiatria e Veterinaria. Con e-book","Gian Marco Contessa,Giuseppe Augusto Marzo,Marco D'Arienzo",CEA,2026,,https://www.ibs.it/fisica-per-medicina-per-semestre-libro-vari/e/9788808299192,False,2026-07-21
Editori Selezionati,https://www.ibs.it/images/9791255972242_0_0_150_0_75.jpg,Pensiero critico. Strategie cognitive per navigare con razionalità tra certezze e dubbi,Alessandro Zocchi,UTET Università,2026,"Perché persone intelligenti credono a cose sbagliate? Perché, anche quando abbiamo tutti i dati a disposizione, continuiamo a prendere decisioni che poi rimpiangiamo? E perché cambiare idea, di fronte a prove evidenti, ci costa così tanto? La risposta non sta nella mancanza di intelligenza o di informazioni, ma nel modo in cui funziona la nostra mente. Questo libro è una guida chiara e concreta per sviluppare il pensiero critico come competenza quotidiana. Attraverso esempi reali, riferimenti alle neuroscienze e alla psicologia cognitiva, Alessandro Zocchi accompagna chi legge alla scoperta di come funziona davvero la mente quando ragiona, e del perché così spesso sbaglia. Dai bias cognitivi alle fallacie logiche, dal ruolo delle emozioni alla metacognizione, fino agli strumenti del ragionamento scientifico e della probabilità, il percorso proposto aiuta a riconoscere le trappole mentali e a costruire un modo di pensare più consapevole, flessibile ed efficace. Non si tratta di diventare esperti, ma di imparare a porsi le domande giuste, valutare le prove con maggiore lucidità e prendere decisioni migliori, ogni giorno. Perché pensare meglio non è un lusso intellettuale: è una necessità.",https://www.ibs.it/pensiero-critico-strategie-cognitive-per-libro-alessandro-zocchi/e/9791255972242,False,2026-07-16
Altri Editori,https://www.ibs.it/images/9791224087885_0_0_150_0_75.jpg,The asymptotes of reality. How the cosmos found its laws,Mauro Corsini,Youcanprint,2026,,https://www.ibs.it/the-asymptotes-of-reality-how-libro-mauro-corsini/e/9791224087885,False,2026-07-22
Altri Editori,https://www.ibs.it/images/9791256894918_0_0_150_0_75.jpg,Teoria unitaria dell'universo. Vol. 1: Unificazione della matematica e IA,Giuseppe Mascioli,Passione Scrittore selfpublishing,2026,,https://www.ibs.it/teoria-unitaria-dell-universo-vol-libro-giuseppe-mascioli/e/9791256894918,False,2026-07-22
Altri Editori,https://www.ibs.it/images/9791256894833_0_0_150_0_75.jpg,L'AI capita? Cosa succede davvero dietro una risposta intelligente,Beatrice Zicola,Passione Scrittore selfpublishing,2026,,https://www.ibs.it/ai-capita-cosa-succede-davvero-libro-beatrice-zicola/e/9791256894833,False,2026-07-22
Altri Editori,https://www.ibs.it/images/9791255763246_0_0_150_0_75.jpg,Storie di bestie e di persone. Lo sviluppo della zootecnia in Emilia: punto di riferimento per l'economia agricola italiana,"Paolo Corsinotti,Giovanni Tosatti,Mauro Martinelli",Edizioni Artestampa,2026,,https://www.ibs.it/storie-di-bestie-di-persone-libro-vari/e/9791255763246,False,2026-07-22
Editori Selezionati,https://www.ibs.it/images/9788832858990_0_0_150_0_75.jpg,Processo al colesterolo. La verità della scienza oltre equivoci e falsi miti,"Fulvio Ursini,Paola Arosio",Raffaello Cortina Editore,2026,"Un’aula di tribunale. Un imputato insolito: il colesterolo. È davvero un nemico pericoloso o la sua colpevolezza merita di essere riesaminata? Il colesterolo è davvero il principale responsabile di infarto e ictus? Quando è necessario intervenire con le statine e quando no? Qual è il ruolo dell’alimentazione e quanto è utile l’attività fisica? Questo saggio affronta un tema oggi molto discusso e, per farlo, integra in modo originale rigore scientifico e struttura narrativa. Attraverso la metafora di un processo, accusa e difesa mettono a confronto, con il supporto dei periti, le evidenze chiave. Da un lato, gli studi che hanno contribuito a indicare il colesterolo come il principale fattore di rischio cardiovascolare e ad avviare le prime ricerche farmacologiche per abbassarne i livelli nel sangue. Dall’altro, i limiti interpretativi, la distinzione tra correlazione e causalità, gli interessi economici delle case farmaceutiche e le domande ancora aperte. Un confronto serrato tra dati, interpretazioni e punti di vista che invita a ripensare criticamente una delle convinzioni più radicate della medicina moderna.",https://www.ibs.it/processo-al-colesterolo-verita-della-libro-fulvio-ursini-paola-arosio/e/9788832858990?inventoryId=987933583,True,2026-07-23
Editori Selezionati,https://www.ibs.it/images/9788832858969_0_0_150_0_75.jpg,Colloqui con i genitori,Donald W. Winnicott,Raffaello Cortina Editore,2026,"Colloqui con i genitori raccoglie alcune delle conversazioni radiofoniche che Winnicott tenne per la bbc nell’arco di oltre vent’anni. Rivolti originariamente a un pubblico di genitori, soprattutto di madri, questi testi conservano intatta la forza di una voce capace di parlare della crescita dei bambini senza trasformare l’esperienza viva della cura in prescrizione o dottrina. A partire da situazioni quotidiane – l’allattamento, il gioco, il dire di “no”, la gelosia, il senso di colpa, le difficoltà dell’adozione –, Winnicott illumina ciò che prende forma nella relazione tra il bambino e chi si occupa di lui. Il suo intento non è insegnare ai genitori che cosa devono fare, ma aiutarli a riconoscere il valore di ciò che già sentono e fanno, rafforzando in loro la capacità di offrire un ambiente sufficientemente buono. Ne emerge un libro ancora oggi sorprendentemente attuale: non un manuale di educazione, ma un invito a osservare con attenzione ciò che accade nelle relazioni più ordinarie e decisive da cui prende forma la vita psichica di ciascun individuo.",https://www.ibs.it/colloqui-con-genitori-libro-donald-w-winnicott/e/9788832858969?inventoryId=987933672,False,2026-07-17
Altri Editori,https://www.ibs.it/images/9791259923721_0_0_150_0_75.jpg,7 giorni per ridurre lo stress. Un programma concreto per mitigare gli effetti dell'ansia e prevenirne l'insorgenza,Elissa Epel,Corbaccio,2026,,https://www.ibs.it/7-giorni-per-ridurre-stress-libro-elissa-epel/e/9791259923721?inventoryId=998146946,False,2026-07-17
Altri Editori,https://www.ibs.it/images/9791257001797_0_0_150_0_75.jpg,Massaggi per cani felici,"Élodie Martins,Françoise Claustres",Terra Nuova Edizioni,2026,,https://www.ibs.it/massaggi-per-cani-felici-libro-elodie-martins-francoise-claustres/e/9791257001797,False,2026-07-22
Altri Editori,https://www.ibs.it/images/9788844072803_0_0_150_0_75.jpg,"Calendario della famiglia 2027 da parete (26,5 x 38,5 cm)",N/D,Demetra,2026,,https://www.ibs.it/calendario-della-famiglia-2027-da-libro-vari/e/9788844072803,True,2026-07-23
Editori Selezionati,https://www.ibs.it/images/9788892251007_0_0_150_0_75.jpg,Fare la scelta giusta. Il coraggio di prendere decisioni,Anselm Grün,San Paolo Edizioni,2026,"Qual è la decisione giusta da prendere? Come faccio a sapere di non avere sbagliato? Queste sono solo alcune delle domande più ricorrenti che vengono poste a Anselm Grün nei suoi incontri. In ogni momento della nostra quotidianità dobbiamo infatti prendere delle decisioni, la più importante delle quali è scegliere se essere vittime degli eventi o se gestire al meglio la nostra vita. In questo volume, a cavallo tra spiritualità e psicologia, Padre Grün aiuta il lettore a comprendere qual è il modo migliore per giungere a una scelta. Nell'ultimo capitolo del libro sono raccolte delle ""preghiere per la giusta decisione"".",https://www.ibs.it/fare-scelta-giusta-coraggio-di-libro-anselm-grun/e/9788892251007,False,2026-07-21
Editori Selezionati,https://www.ibs.it/images/9791256148806_0_0_150_0_75.jpg,Dizionario poetico dell'umano. 140 racconti,Sergio Astori,Castelvecchi,2026,"Centoquaranta “parole buone”, brevi racconti organizzati come un vocabolario esistenziale. Da “Abbraccio” a “Vela”, i testi – nati nell’arco di sei anni – attingono all’esperienza quotidiana delle relazioni, della cura, della fragilità e della meraviglia. Ogni lemma è una soglia narrativa che invita a sostare, a riconoscere il senso nascosto nei gesti ordinari e a ritrovare nel linguaggio uno spazio di umanizzazione. Le sette sezioni tematiche – incontro, profondità, rinascita, prendersi a cuore, divenire, vivere insieme, stupore – compongono un itinerario poetico e civile, in cui le parole aiutano a rileggere la fragilità e la possibilità di trasformazione. Accompagnato da immagini pensate come pause di bellezza e di respiro, il libro si offre come un alfabeto da consultare nei momenti di dubbio e di ripartenza: una riserva di senso a cui tornare. Prefazione di Matteo Ferrari; Postfazione di Sergio Massironi.",https://www.ibs.it/dizionario-poetico-dell-umano-140-libro-sergio-astori/e/9791256148806?inventoryId=963636023,False,2026-07-17
Altri Editori,https://www.ibs.it/images/9788844072872_0_0_150_0_75.jpg,"Kintsukuroi. Calendario Giappone 2027 da parete (12,5 X 48 cm)",N/D,Demetra,2026,,https://www.ibs.it/kintsukuroi-calendario-giappone-2027-da-libro-vari/e/9788844072872,True,2026-07-23
Altri Editori,https://www.ibs.it/images/9791298597952_0_0_150_0_75.jpg,Anche le risorse umane possono usare l' I.A. strumenti pratici per adottarla nei processi HR,Luca Tamburrino,Edizioni FiordiRisorse,2026,,https://www.ibs.it/anche-risorse-umane-possono-usare-libro-luca-tamburrino/e/9791298597952,True,2026-07-23
Altri Editori,https://www.ibs.it/images/9791281917507_0_0_150_0_75.jpg,Inconsolabile,Adèle Van Reeth,Sanpino,2026,,https://www.ibs.it/inconsolabile-libro-adele-van-reeth/e/9791281917507,False,2026-07-22
Altri Editori,https://www.ibs.it/images/9791281794917_0_0_150_0_75.jpg,La luce. Le leggi della natura e il ruolo della luce nell'alchimia della vita,Marcello Pamio,GDL,2026,,https://www.ibs.it/luce-leggi-della-natura-ruolo-libro-marcello-pamio/e/9791281794917,False,2026-07-16
Altri Editori,https://www.ibs.it/images/9791257610807_0_0_150_0_75.jpg,Fuori dal loop. Riconoscere l’ansia e trattarla come amica,Grazia Munciguerra,Giacovelli Editore,2026,,https://www.ibs.it/fuori-dal-loop-riconoscere-ansia-libro-grazia-munciguerra/e/9791257610807,False,2026-07-21
Altri Editori,https://www.ibs.it/images/9791257610340_0_0_150_0_75.jpg,"Colpo di reni, colpo di sonno. Una storia vera",Francesco Galena,Giacovelli Editore,2026,,https://www.ibs.it/colpo-di-reni-colpo-di-libro-francesco-galena/e/9791257610340,False,2026-07-18
Altri Editori,https://www.ibs.it/images/9791256973033_0_0_150_0_75.jpg,Eternal bonds. Navigating the journey of marriage with strength and intimacy,Damian Iriogbe,Europe Books,2026,,https://www.ibs.it/eternal-bonds-navigating-the-journey-libro-damian-iriogbe/e/9791256973033?inventoryId=991338206,False,2026-07-17
Altri Editori,https://www.ibs.it/images/9791256953233_0_0_150_0_75.jpg,Soft skills e quesiti situazionali per i concorsi pubblici. Manuale per tutti i concorsi 2026. Con software di simulazione,Balestrucci I.,Nld Concorsi,2026,,https://www.ibs.it/soft-skills-quesiti-situazionali-per-libro-balestrucci-i/e/9791256953233,False,2026-07-16
Altri Editori,https://www.ibs.it/images/9788899174545_0_0_150_0_75.jpg,Non sono qui per piacere. Manuale di leadership femminile per chi ha smesso di obbedire. Il potere nasce dalla ferita che non hai più paura di mostrare,Rossella Pruneti,RP Publishing,2026,,https://www.ibs.it/non-sono-qui-per-piacere-libro-rossella-pruneti/e/9788899174545,False,2026-07-21
Altri Editori,https://www.ibs.it/images/9788869438844_0_0_150_0_75.jpg,Omeopatia per bambini. Una guida pratica per genitori consapevoli,Carlo Tonarelli,Frilli,2026,,https://www.ibs.it/omeopatia-per-bambini-guida-pratica-libro-carlo-tonarelli/e/9788869438844,False,2026-07-21
Altri Editori,https://www.ibs.it/images/9788844072902_0_0_150_0_75.jpg,Agenda per la famiglia 2027,N/D,Demetra,2026,,https://www.ibs.it/agenda-per-famiglia-2027-libro-vari/e/9788844072902,True,2026-07-23
Altri Editori,https://www.ibs.it/images/9788844072865_0_0_150_0_75.jpg,"Pensa positivo. Calendario 2027 da tavolo (13,8 x 12,7 cm)",N/D,Demetra,2026,,https://www.ibs.it/pensa-positivo-calendario-2027-da-libro-vari/e/9788844072865,True,2026-07-23
Altri Editori,https://www.ibs.it/images/9791282628013_0_0_150_0_75.jpg,"Risplendi nella tua unicità. Spazi di colore e scrittura per riconoscerti, ascoltarti e tornare a scegliere",Sheyla Bobba,SBS Edizioni,2026,,https://www.ibs.it/risplendi-nella-tua-unicita-spazi-libro-sheyla-bobba/e/9791282628013,False,2026-07-20
Altri Editori,https://www.ibs.it/images/9791224086208_0_0_150_0_75.jpg,Stay fresh,Loris Marcello D'Alimonte,Youcanprint,2026,,https://www.ibs.it/stay-fresh-libro-loris-marcello-d-alimonte/e/9791224086208,False,2026-07-22
Altri Editori,https://www.ibs.it/images/9791224085263_0_0_150_0_75.jpg,Posso morire? Lettera a mio figlio,Giovanni Berti,Youcanprint,2026,,https://www.ibs.it/posso-morire-lettera-a-mio-libro-giovanni-berti/e/9791224085263,False,2026-07-22
Altri Editori,https://www.ibs.it/images/9791224084037_0_0_150_0_75.jpg,"Reset mentale. 30 giorni per uscire da stress, confusione e sovraccarico mentale",Alessandro Salucci,Youcanprint,2026,,https://www.ibs.it/reset-mentale-30-giorni-per-libro-alessandro-salucci/e/9791224084037,False,2026-07-22
Altri Editori,https://www.ibs.it/images/9791281251298_0_0_150_0_75.jpg,La cabina di regia. Marketing strategico. Gli allenamenti d’impresa per trasformare la crescita in un processo governabile,Carmela Villani,D&P Editori,2026,,https://www.ibs.it/cabina-di-regia-marketing-strategico-libro-carmela-villani/e/9791281251298,True,2026-07-23
Altri Editori,https://www.ibs.it/images/9788865806050_0_0_150_0_75.jpg,La medicina senza guerra. Breve introduzione all'omeopatia del terreno,Paolo Greco,Il Leone Verde,2026,,https://www.ibs.it/medicina-senza-guerra-breve-introduzione-libro-paolo-greco/e/9788865806050,False,2026-07-22
Altri Editori,https://www.ibs.it/images/9791298596726_0_0_150_0_75.jpg,"Il successo è un participio. Fai succedere i tuoi sogni, una fatica alla volta",Stefano Grassi,SimplyBook,2026,,https://www.ibs.it/successo-participio-fai-succedere-tuoi-libro-stefano-grassi/e/9791298596726,False,2026-07-17
Altri Editori,https://www.ibs.it/images/9791298603844_0_0_150_0_75.jpg,"Le 15 leggi del patrimonio. Come un imprenditore ha perso tutto, ha smesso di delegare ciecamente e ha ricostruito il suo patrimonio",Luca Lixi,Plannix SCF,2026,,https://www.ibs.it/15-leggi-del-patrimonio-come-libro-luca-lixi/e/9791298603844,False,2026-07-21
Editori Selezionati,https://www.ibs.it/images/9788826610801_0_0_150_0_75.jpg,Disarmata e disarmante. La pace è un dono,Leone XIV (Robert Francis Prevost),Libreria Editrice Vaticana,2026,"Fin dal suo primo discorso in pubblico Papa Leone XIV ha posto la pace come tema decisivo per la Chiesa oggi. Questo libro presenta in maniera articolata, secondo un ordine strutturato, un itinerario nei discorsi e interventi di Papa Leone nel corso del primo anno di pontificato intorno al tema della ricerca della pace, del rifiuto della guerra, del rigetto del disarmo e delle soluzioni pacifiche nelle controversie internazionali. Un testo da leggere, rileggere e meditare per trovare nuove ragioni nell'impegno per la pace e contro ogni guerra.",https://www.ibs.it/disarmata-disarmante-pace-dono-libro-leone-xiv-robert-francis-prevost/e/9788826610801,False,2026-07-21
Editori Selezionati,https://www.ibs.it/images/9791222324746_0_0_150_0_75.jpg,Scivias. Conosci le vie del Signore,Ildegarda di Bingen (santa),Mimesis,2026,"Scivias è l’opera principale di Ildegarda di Bingen, mistica, badessa benedettina, teologa e visionaria. Composto tra il 1141 e il 1151, il testo raccoglie ventisei visioni profetiche che l’autrice ricevette e trascrisse con l’approvazione ecclesiastica, in un’epoca in cui raramente alle donne era consentito l’accesso all’autorialità teologica. Le visioni, dense di simbolismo e accompagnate da spettacolari miniature, sono organizzate in tre parti che tracciano il percorso dell’anima, dalla creazione alla salvezza, passando attraverso la caduta, il peccato, la redenzione e la vita della Chiesa.",https://www.ibs.it/scivias-conosci-vie-del-signore-libro-ildegarda-di-bingen-santa/e/9791222324746?inventoryId=889486516,False,2026-07-17
Editori Selezionati,https://www.ibs.it/images/9788837241674_0_0_150_0_75.jpg,Sulla Risurrezione. Un mistero teologico e scientifico,Giacomo Canobbio,Morcelliana,2026,"Abituati a non riflettere sulla morte, come se riguardasse soltanto gli altri, troviamo irrealistiche «la risurrezione dei morti e la vita del mondo che verrà», sebbene di esse ci si proclami in attesa in ogni celebrazione eucaristica. La risurrezione di Gesù e degli esseri umani è uno dei contenuti fondamentali della fede cristiana, di cui l'autore intende mostrare la plausibilità alla luce della teologia, dialogando con il sapere scientifico. La resistenza di molti si basa sul fatto che la risurrezione non è verificabile. Tuttavia nel corso del tempo essa è stata strenuamente sostenuta dalle teologie cristiane e il dibattito si è interrogato se debba essere collocata alla fine del mondo o al termine della vita di ciascuno. Anche sulla condizione dei risorti è possibile interrogarsi cercando di pensare scientificamente la trasformazione della materia. Un libro che supera l'incapacità odierna di parlare del destino finale delle persone e del creato.",https://www.ibs.it/sulla-risurrezione-mistero-teologico-scientifico-libro-giacomo-canobbio/e/9788837241674?inventoryId=986260660,False,2026-07-17
Altri Editori,https://www.ibs.it/images/9788816307810_0_0_150_0_75.jpg,L'ebraismo. Storia e identità,Maurice-Ruben Hayoun,Jaca Book,2026,,https://www.ibs.it/ebraismo-storia-identita-libro-maurice-ruben-hayoun/e/9788816307810?inventoryId=995015691,False,2026-07-17
Altri Editori,https://www.ibs.it/images/9791256271399_0_0_150_0_75.jpg,La persona umana come essere relazionale. Prospettive transdisciplinari,N/D,Marcianum Press,2026,,https://www.ibs.it/persona-umana-come-essere-relazionale-libro-vari/e/9791256271399?inventoryId=870550963,False,2026-07-17
Editori Selezionati,https://www.ibs.it/images/9788837240967_0_0_150_0_75.jpg,Delle cinque piaghe della santa Chiesa,Antonio Rosmini,Morcelliana,2026,"Quante sono le piaghe nelle mani, nei piedi e nel costato di Cristo crocifisso, tanti sono i mali che affliggono la Chiesa: la divisione del popolo dal clero nel culto, l'insufficiente educazione dei sacerdoti, la disunione dei vescovi, la loro nomina lasciata all'autorità temporale, l'asservimento dei beni della Chiesa al potere politico. Quest'opera, inserita nell'Indice dei libri proibiti nel 1849, un anno dopo la sua prima pubblicazione, continuò tacitamente ad alimentare la tensione verso una riforma della Chiesa cattolica. Ottenne l'autorizzazione alla ristampa solo nel 1966, durante il pontificato di Paolo vi e poco dopo la chiusura del Concilio Vaticano ii. La nuova edizione apparve allora come segno dei tempi e l'autore come profeta e precursore del Concilio. Un classico a lungo scomodo, ma sempre attuale per il suo invito a un rinnovamento prima di tutto spirituale e interiore.",https://www.ibs.it/delle-cinque-piaghe-della-santa-libro-antonio-rosmini/e/9788837240967?inventoryId=858392052,False,2026-07-17
Editori Selezionati,https://www.ibs.it/images/9788833946542_0_0_150_0_75.jpg,Il tempo che resta. Un commento alla «Lettera ai Romani»,Giorgio Agamben,Bollati Boringhieri,2026,"Se è vero che ogni opera del passato giunge alla piena leggibilità solo in determinati momenti della sua storia, per le Lettere di Paolo l'ora sembra venuta. A uno dei testi più commentati della tradizione occidentale Agamben restituisce quel rango messianico che solo può riorientare la prospettiva di una interpretazione ormai bimillenaria. Paolo non fonda una religio dell'universale, non annuncia una nuova identità e una nuova vocazione, ma revoca ogni identità e ogni vocazione; non abolisce la Legge, ma la dispone a un uso che si colloca al di là di ogni diritto. Cuore del messianismo – dall'evangelo paolino fino alle tesi ""Sul concetto della storia"" di Benjamin, che talora ne nascondono gli splendidi calchi – è una esperienza del tempo affidata all'inversione del rapporto tra passato e futuro, tra memoria e speranza. Come tempo di ora, segmento di tempo profano teso fra la resurrezione di Gesù e l'eschaton apocalittico, il tempo messianico si costituisce in figura stessa del tempo presente, di ogni presente. Sul canone di «ricapitolazione vertiginosa» che appartiene al messianico è modellato anche l'andamento del libro di Agamben: una sapienza esegetica da biblista si trasfonde nelle illuminazioni del filosofo che interroga Paolo a partire da Schmitt, Kafka e Scholem, e che sa cogliere nella parola paolina, attraverso Lutero, le ascendenze concettuali della dialettica hegeliana.",https://www.ibs.it/tempo-che-resta-commento-alla-libro-giorgio-agamben/e/9788833946542?inventoryId=1017027948,False,2026-07-17
Altri Editori,https://www.ibs.it/images/9788831135603_0_0_150_0_75.jpg,La luce di Cristo. Un'introduzione al cattolicesimo,Thomas Joseph White,Città Nuova,2026,,https://www.ibs.it/luce-di-cristo-introduzione-al-libro-thomas-joseph-white/e/9788831135603?inventoryId=980648190,False,2026-07-17
Altri Editori,https://www.ibs.it/images/9788816307995_0_0_150_0_75.jpg,Il Giappone e il sacro,N/D,Jaca Book,2026,,https://www.ibs.it/giappone-sacro-libro-vari/e/9788816307995?inventoryId=995015607,False,2026-07-17
Altri Editori,https://www.ibs.it/images/9791281620735_0_0_150_0_75.jpg,Veglia di pace,John Dear,Il Pellegrino,2026,,https://www.ibs.it/veglia-di-pace-libro-john-dear/e/9791281620735?inventoryId=841441296,False,2026-07-21
Altri Editori,https://www.ibs.it/images/9791259756244_0_0_150_0_75.jpg,Mi riprendo il Vangelo. Appunti per una fede in ricerca,Aldo Curiotto,Tau,2026,,https://www.ibs.it/mi-riprendo-vangelo-appunti-per-libro-aldo-curiotto/e/9791259756244,False,2026-07-20
