Categoria_App,Copertina,Titolo,Autore,Editore,Anno,Descrizione,Link,Nuovo,Data_Aggiunta
Editori Selezionati,https://www.ibs.it/images/9788845426919_0_0_150_0_75.jpg,Vite leggendarie. I grandi protagonisti della storia greca. La Grecia classica,Giorgio Ieranò,Sonzogno,2026,"C’è Solone, il grande saggio: legislatore e poeta, ma anche padre di tutti i viaggiatori, che in Egitto ascolta dai sacerdoti la leggenda di Atlantide. C’è Pericle, simbolo della gloria di Atene, ma anche un leader contraddittorio, che incarnava al tempo stesso i luminosi ideali della democrazia e la brutale violenza dell’imperialismo. Ci sono i comandanti della grande guerra contro i persiani: lo spartano Leonida, caduto eroicamente nella battaglia delle Termopili con i suoi Trecento, e l’ateniese Temistocle, che dalla gloria del trionfo passerà all’umiliazione dell’esilio. Ma ci sono anche le donne, come la coltissima Aspasia o l’aristocratica Elpinice, che sono riuscite a far sentire la loro voce in un mondo dominato dai maschi. C’è Alcibiade, l’uomo più audace, spregiudicato e seducente che Atene abbia mai conosciuto. E poi Socrate, che di Alcibiade era stato l’amante, costretto a bere la cicuta perché accusato di corrompere i giovani. E Demostene, il ragazzo balbuziente che divenne il più grande oratore di tutti i tempi e morì combattendo per la libertà di Atene. Intanto il sipario calava sul mondo della Grecia classica e si annunciava un’epoca nuova, con l’avvento di Alessandro Magno: l’uomo che osò proclamarsi figlio di dio e trasformò la sua breve vita in una leggenda immortale. Rievocare queste vicende significa sfogliare le pagine più appassionanti della storia greca. Ma anche riscoprire il fascino di racconti che hanno plasmato il nostro immaginario e rispecchiano da sempre in modo formidabile splendori e miserie dell’esistenza umana.",https://www.ibs.it/vite-leggendarie-grandi-protagonisti-della-libro-giorgio-ierano/e/9788845426919,False,2026-04-15
Editori Selezionati,https://www.ibs.it/images/9788815395788_0_0_150_0_75.jpg,La Repubblica di Genova. (1528-1797),Paolo Calcagno,Il Mulino,2026,"Dal 1528 alla caduta nel 1797 in seguito all'ascesa napoleonica, questo libro ricostruisce la storia della Repubblica di Genova seguendo la trasformazione di una città marinara in una solida potenza aristocratica. Liberatasi dalle dominazioni straniere, Genova consolidò un sistema politico fondato sull'oligarchia e sul legame con il Banco di San Giorgio, cuore finanziario della Repubblica. Alleata della Spagna asburgica, seppe ritagliarsi un ruolo centrale nello scacchiere italiano ed europeo, tra crisi interne, guerre con Savoia e Francia, e rinnovate ambizioni marittime. Lungi dall'essere un secolo di decadenza, il Settecento genovese vide una sorprendente vitalità economica e portuale, preludio alla fine di uno Stato antico nelle forme ma ancora vitale nello spirito.",https://www.ibs.it/repubblica-di-genova-1528-1797-libro-paolo-calcagno/e/9788815395788,False,2026-04-11
Editori Selezionati,https://www.ibs.it/images/9788829033652_0_0_150_0_75.jpg,Villa Adriana,Adalberto Ottati,Carocci,2026,"Villa Adriana è uno dei complessi architettonici più significativi dell'età imperiale: un autentico laboratorio di architettura e arti visive in cui sperimentazione tecnica e invenzione formale si fondono in modo esemplare. Modello duraturo per la storia dell'architettura e fonte d'ispirazione per la cultura occidentale, la villa combina un impianto innovativo con un apparato scultoreo di eccezionale ricchezza, parte integrante del progetto culturale e ideologico del princeps. Con un linguaggio chiaro e rigoroso, e attraverso numerose planimetrie e immagini, il volume ne offre una sintesi critica, ricostruendone storia, forme ed eredità, dalla riscoperta rinascimentale al riconoscimento come sito patrimonio dell'umanità, guidando così il lettore fra teatri, terme e giardini monumentali di un luogo unico al mondo.",https://www.ibs.it/villa-adriana-libro-adalberto-ottati/e/9788829033652,False,2026-04-11
Editori Selezionati,https://www.ibs.it/images/9788858057285_0_0_150_0_75.jpg,Le ragioni della guerra. Perché ogni scusa è buona,Simone Guida,Gribaudo,2026,"Un orecchio mozzato. Dei pasticcini. Una partita di calcio. Banane. Un errore di traduzione. Sembrano dettagli minimi: materiali da cronaca laterale, inneschi per aneddoti saporiti, baruffe e resoconti buffi. Sembrano poca cosa, eppure, nei secoli, sono bastati a far divampare una guerra. Pretesti semplici, memorabili: il tipo di scintilla che rende una decisione presentabile, una scelta condivisibile, una violenza giustificabile. La storia lo insegna: non serve un casus belli perfetto, basta averne uno. A volte è l’ultimo episodio di un’escalation; altre è una narrazione pronta all’uso, ridicola solo in apparenza, cucita sopra interessi economici, paure collettive e ambizioni di potere. In questo libro, Simone Guida attraversa epoche e continenti per mostrare come, tra le facoltà del genio umano, ci sia anche quella di trasformare il futile in inevitabile, l’incidente in destino, la propaganda in religione. E mentre smonta i pretesti di conflitti grandi e meno grandi di cui è disseminata la storia, mette a nudo la domanda che resta, al fondo delle ricostruzioni: perché cediamo con tanta facilità alla violenza? Non è un interrogativo astratto, né una curiosità da manuale. È il punto esatto in cui la storia smette di essere lontana: perché ogni pretesto di conflitto funziona solo se trova terreno fertile in ciascuno di noi. Nella voglia di semplificare, nel bisogno di sentirci dalla parte giusta, nella disponibilità a scambiare la paura per certezza e l’egoismo per verità.",https://www.ibs.it/ragioni-della-guerra-perche-ogni-libro-simone-guida/e/9788858057285,False,2026-04-15
Editori Selezionati,https://www.ibs.it/images/9788829794249_0_0_150_0_75.jpg,Controrivoluzione. Una storia politica del nostro tempo,Giovanni Orsina,Marsilio,2026,"Un’insurrezione politica sconvolge le democrazie. La chiamiamo «populismo» e ne parliamo ogni giorno, ma non potremo mai capirla se non comprendiamo l’ordine impolitico e rivoluzionario contro cui si ribella. Quell’ordine inseguiva un sogno: conciliare in un equilibrio perfetto libertà individuale e solidarietà sociale, reti globali e differenze locali, sviluppo economico e tutela ambientale. Che cos’è andato storto? Ripercorrendo le metamorfosi della democrazia negli ultimi sessant’anni, l’autore mette a nudo le contraddizioni del nostro tempo: come una rivoluzione nata liberale sia divenuta sempre più moralista, come un ordine che voleva emancipare gli individui ne abbia dimenticato i bisogni quotidiani. E come abbia preso forma, infine, un’aspra reazione di rigetto nel nome della concretezza e della vicinanza. Il desiderio urgente di rifugiarsi in una comunità che si fondi su ciò che resta della tradizione, per chi reagisce da destra, o in una comunità nuova che realizzi la democrazia autentica, per chi lo fa da sinistra. «Le definizioni del populismo paiono descrivere qualcosa di totalmente altro dal liberalismo. Solo scavando più a fondo ci si rende conto di quanto “l’altro” tenda a diventare “lo stesso”, di quanto la rivolta s’immedesimi nell’ordine contro cui si scaglia, e viceversa. In questo gioco di specchi rinasce la politica, ma disfunzionale. Perché ciascuno dei contendenti ha in seno pulsioni antipolitiche e rifiuta di riconoscere legittimità all’antagonista. Ma anche perché sono venute meno le condizioni che consentono di agire nello spazio pubblico in una forma strutturata, significativa e duratura. Resiste ancora la nazione, pur molto indebolita, e spinge l’insurrezione verso destra.»",https://www.ibs.it/controrivoluzione-storia-politica-del-nostro-libro-giovanni-orsina/e/9788829794249,False,2026-04-11
Editori Selezionati,https://www.ibs.it/images/9788833944777_0_0_150_0_75.jpg,La fine della fine della storia. Abitare la scomodità del mondo,Gabriele Segre,Bollati Boringhieri,2026,"Per trent'anni in Occidente ci siamo raccontati una storia rassicurante: la storia era finita. Dopo la caduta del Muro di Berlino, il futuro sembrava una strada in discesa verso democrazia, benessere e diritti per tutti. Bastava aspettare, aggiustare qualche dettaglio, correggere qualche ingiustizia, e il mondo intero ci avrebbe seguito. Poi la realtà si è fatta sentire: attentati, crisi economiche, pandemia, nuove guerre feroci, catastrofi ambientali, ondate d'odio. La parte maggioritaria del mondo ci ha detto, molto chiaramente, che quel sogno era solo nostro, la storia non era affatto finita, avevamo solo smesso di guardarla. Davanti a questa disillusione abbiamo scelto la rimozione. Invece di elaborare il lutto per un futuro che non potrà mai avvenire, oggi ci aggrappiamo alla normalità. Alla domanda «come stiamo?» ripetiamo automaticamente «va tutto bene», ma non è così. La politica si è ridotta ad amministrazione di emergenze, gestione del presente, manutenzione di algoritmi. Al posto delle visioni insegue i sondaggi, ossessionata dai dati in tempo reale. Il linguaggio politico – incapace di elaborare il trauma della fine delle certezze – si è ridotto a puro fatto tecnico. In queste pagine originali e acute, Gabriele Segre analizza il fallimento della politica senza cedere al catastrofismo. Non si tratta di piangere il mondo che avevamo immaginato e che non si realizzerà, ma di accettare che abitiamo un luogo scomodo, nel quale volenti o nolenti dovremo restare. Se la storia è ricominciata, non possiamo più chiederci «quando torneremo alla normalità», ma «come faremo ad abitare un tempo che non promette certezze». È questo il compito della politica: recuperare la capacità di sentire, desiderare insieme, dare speranza, che è poi l'unico modo onesto di rispondere alla domanda più semplice e più spaventosa: «Come stai?».",https://www.ibs.it/fine-della-fine-della-storia-libro-gabriele-segre/e/9788833944777,False,2026-04-11
Editori Selezionati,https://www.ibs.it/images/9788817196734_0_0_150_0_75.jpg,Rasputin e la fine dei Romanov,Antony Beevor,Rizzoli,2026,"Chi fu davvero Grigorij Rasputin? L'«uomo di Dio» inviato per salvare l'erede - lo zarevic Aleksej - o un abile manipolatore capace di soggiogare il cuore stesso dell'impero russo? Antony Beevor, punto di riferimento della storiografia narrativa, fa luce sull'ascesa vertiginosa del folle mistico, il contadino giunto dalla Siberia, a malapena in grado di leggere e scrivere, che riuscì a stregare lo zar Nicola II e la zarina Alessandra. Rasputin non rivestiva incarichi ufficiali, non aveva forze al suo comando ed era un convinto monarchico, non certo un rivoluzionario. Tuttavia, al di là delle sue intenzioni, contribuì più di ogni altro individuo al collasso della più grande autocrazia del mondo. Il «diavolo in vesti d'angelo», capace di fermare il sangue del figlio dello zar emofiliaco, scatenò infatti un'emorragia di consensi senza precedenti. Basandosi su fonti autorevoli e testimonianze, Antony Beevor si interroga sul significato storico della figura di Rasputin mettendo in luce un fenomeno troppo spesso trascurato: come l'impatto delle fake news dell'epoca - dalle storie ingigantite che circolavano sulla corruzione politica e finanziaria del regime zarista alle voci del tutto infondate riguardo alle dissolutezze di Rasputin con l'imperatrice e persino con le sue figlie - abbia minato alle fondamenta la legittimità dello zar, ben prima della rivoluzione di febbraio. Il poeta Aleksandr Blok scrisse che «la pallottola che mise fine alla sua vita andò dritta al cuore della dinastia regnante». Grigorij Rasputin fu dunque un profeta, un imbroglione o una vittima della storia? C'era un fondo di verità in quei racconti, oppure il vero lascito di Rasputin è un'inquietante lezione sulla potenza del mito?",https://www.ibs.it/rasputin-fine-dei-romanov-libro-antony-beevor/e/9788817196734,False,2026-04-15
Altri Editori,https://www.ibs.it/images/9788869738623_0_0_150_0_75.jpg,Storie di comando. I generali italiani del Risorgimento,Andrea Santangelo,Salerno Editrice,2026,,https://www.ibs.it/storie-di-comando-generali-italiani-libro-andrea-santangelo/e/9788869738623,False,2026-04-11
Editori Selezionati,https://www.ibs.it/images/9788829035328_0_0_150_0_75.jpg,Il ghetto di Roma. Storia di una comunità ebraica,Serena Di Nepi,Carocci,2026,"Dal 1555 al 1870, salvo brevi interruzioni, gli ebrei di Roma furono confinati nel Ghetto, un quartiere murato con portoni chiusi dal tramonto all'alba. Il volume ricostruisce la storia della comunità ebraica romana in questi tre secoli (guerre d'Italia, Riforma, Illuminismo, Risorgimento), evidenziando la loro capacità di resistere a discriminazioni, battesimi forzati e difficoltà economiche, mantenendo la propria identità religiosa in un ambiente ostile ma in parte accogliente. Le vicende del gruppo, deciso a preservare la propria differenza, sono narrate attraverso viaggi, conflitti, incontri e figure storiche. Con l'Unità d'Italia, il Ghetto fu smantellato come simbolo di un'intolleranza ritenuta superata, ma che resta profondamente impressa nella memoria degli ebrei di Roma, i quali considerano ancora oggi quel quartiere uno spazio significativo della loro storia.",https://www.ibs.it/ghetto-di-roma-storia-di-libro-serena-di-nepi/e/9788829035328,False,2026-04-11
Editori Selezionati,https://www.ibs.it/images/9788858160497_0_0_150_0_75.jpg,"Archeologia. Storia e metodi, paesaggi e persone",Giuliano Volpe,Laterza,2026,"Nell’ultimo mezzo secolo l’archeologia ha molto modificato e arricchito il proprio bagaglio metodologico e ampliato i propri campi d’azione a livello temporale, spaziale e tematico. Questo libro offre un punto di vista aggiornato sull’evoluzione della disciplina, valorizzandone le molteplici opportunità.",https://www.ibs.it/archeologia-storia-metodi-paesaggi-persone-libro-giuliano-volpe/e/9788858160497,True,2026-04-17
Altri Editori,https://www.ibs.it/images/9788867835652_0_0_150_0_75.jpg,"Su due lati del confine. Rohingya, cronache di un popolo perseguitato","Giuliano Battiston,Emanuele Giordana",ADD Editore,2026,,https://www.ibs.it/su-due-lati-del-confine-libro-giuliano-battiston-emanuele-giordana/e/9788867835652,False,2026-04-11
Editori Selezionati,https://www.ibs.it/images/9788815395757_0_0_150_0_75.jpg,Il governo del pallone. Storia della Federazione Italiana Giuoco Calcio,"Massimo Cervelli,Alberto Molinari",Il Mulino,2026,"La Federazione Italiana Giuoco Calcio ha modellato e accompagnato l'evoluzione dello sport più popolare tra gli italiani. Fulcro del sistema-calcio sul piano sportivo, tecnico e organizzativo, la FIGC è stata al centro di tensioni politiche, economiche e sociali: dagli incerti passi iniziali al primo dopoguerra, quando il calcio si diffonde nel tessuto sociale del Paese; dal fascismo, che assume la FIGC come modello organizzativo per irreggimentare lo sport, alla rinascita democratica; dal «miracolo economico», quando il calcio è coinvolto nei processi di modernizzazione, fino alle sfide della globalizzazione. Ripercorrerne la storia significa riflettere sulle trasformazioni dell'Italia contemporanea: tra sport e politica, consenso e scandali, identità collettiva e spettacolo globale.",https://www.ibs.it/governo-del-pallone-storia-della-libro-massimo-cervelli-alberto-molinari/e/9788815395757,False,2026-04-11
Altri Editori,https://www.ibs.it/images/9791281142831_0_0_150_0_75.jpg,Carlo di Borbone. Un nuovo Re per Napoli,Ludovico Silvestri,Colonnese,2026,,https://www.ibs.it/carlo-di-borbone-nuovo-re-libro-ludovico-silvestri/e/9791281142831,False,2026-04-11
Altri Editori,https://www.ibs.it/images/9788868013790_0_0_150_0_75.jpg,I Celti. Storia di un popolo,T. G. E. Powell,Ghibli,2026,,https://www.ibs.it/celti-storia-di-popolo-libro-t-g-e-powell/e/9788868013790,False,2026-04-16
Altri Editori,https://www.ibs.it/images/9791255212799_0_0_150_0_75.jpg,L'arte del comando,Sergio Valzania,LEG Edizioni,2026,,https://www.ibs.it/arte-del-comando-libro-sergio-valzania/e/9791255212799,False,2026-04-11
Editori Selezionati,https://www.ibs.it/images/9788829034239_0_0_150_0_75.jpg,"La Resistenza armata nell'Italia centrale. Territori, protagonisti, rappresentazioni",N/D,Carocci,2026,"I saggi raccolti nel volume approfondiscono l'esperienza della lotta armata della Resistenza condotta fra Italia centrale e Linea Gotica, con particolare attenzione alla Toscana, provando a rispondere alla domanda: la guerra partigiana in questa zona fu davvero di breve durata? Inoltre, quali caratteristiche differenti ebbe rispetto a quella nel Nord, a cui generalmente si fa riferimento?",https://www.ibs.it/resistenza-armata-nell-italia-centrale-libro-vari/e/9788829034239,False,2026-04-11
Editori Selezionati,https://www.ibs.it/images/9791255690696_0_0_150_0_75.jpg,Il prezzo della salvezza. Fascismo e «questione ebraica» in Dalmazia (1941-1943),Federico Goddi,Giuntina,2026,"Nel volume viene ricostruito il sistema della “protezione” offerta dalle autorità italiane agli ebrei residenti e profughi nel Governatorato della Dalmazia, spostando quindi l’attenzione dalla ricerca sulle motivazioni – umanità, prestigio e pacificazione – alla ricostruzione del processo politico che condizionò i provvedimenti degli apparati fascisti. La protezione offerta dalle autorità italiane agli ebrei residenti nei territori occupati è al centro dell’interesse storiografico, come testimoniano due recenti lavori di sintesi. L’argomento è stato indagato anche per quel che concerne l’utilizzo politico del tema nell’immediato dopoguerra. Le mancate consegne degli ebrei ai tedeschi sono state infatti sfruttate per accreditare un’immagine positiva dell’Italia sulla scena internazionale. Si pensi all’importante documentazione redatta dal ministero degli Affari Esteri a partire dal 1946, che attribuisce all’intero corpo diplomatico italiano un intento salvifico. La produzione di liste con «Elenchi [dei] diplomatici e miliari che hanno aiutato gli ebrei durante la Seconda guerra mondiale» ha lasciato tracce anche all’Ufficio storico dello Stato maggiore dell’esercito. Quell’immagine generica e generosa – che è in realtà più complessa e sfumata – è riconducibile al perdurante mito del bravo italiano, che ancor oggi compare tra le righe di opere di studiosi attivi nel settore degli Holocaust studies, complice l’utilizzo, tra le fonti secondarie, di una memorialistica che ha lungamente dipinto gli italiani come estranei alle logiche di partecipazione – anche “solo” indiretta – allo sterminio ebraico. Insistente nonché preoccupante è la citazione di alcune attitudini non meglio definite che formerebbero una sorta di “carattere nazionale”, così tipizzato: «sympathetic Italian attitude».",https://www.ibs.it/prezzo-della-salvezza-fascismo-questione-libro-federico-goddi/e/9791255690696,False,2026-04-15
Altri Editori,https://www.ibs.it/images/9791281142855_0_0_150_0_75.jpg,Ferdinando di Borbone. Un Re tra vicoli e Palazzo,Ludovico Silvestri,Colonnese,2026,,https://www.ibs.it/ferdinando-di-borbone-re-tra-libro-ludovico-silvestri/e/9791281142855,False,2026-04-11
Editori Selezionati,https://www.ibs.it/images/9788828218913_0_0_150_0_75.jpg,Il ricordo è l'unica difesa. Il manoscritto ritrovato di una donna antifascista,Ester Parri,Solferino,2026,"«Accovacciata sotto cinque coperte fredde, cercavo un conforto nel ricordo di quel mondo che c’era oltre le mura. Non tentavo di dormire, mi sarebbe sembrata una vigliaccheria.» Non ha mai smesso di lottare Ester Parri. Nemmeno quando il regime fascista ha recluso e poi confinato il marito Ferruccio, leader della Resistenza e primo presidente del Consiglio dopo la Liberazione. Nemmeno quando a essere catturata e incarcerata dalla Gestapo a San Vittore è stata anche lei. E nemmeno quando si è trovata a fare i conti con le angosce di madre temendo per il figlio Giorgio, giovane partigiano. In queste memorie inedite, scritte sul retro di fascicoli del Consiglio d’Europa e ritrovate dalla nipote, l’autrice racconta i due mesi più drammatici della sua vita, tra gennaio e marzo 1945, e fa rivivere, attraverso potenti flashback, quasi vent’anni della storia d’Italia, dall’organizzazione dell’espatrio clandestino del leader socialista Turati nel dicembre 1926 fino all’aprile 1945, quando Ester ritrova il marito a Locarno. Uno spaccato della dittatura e della Resistenza ma anche della vita quotidiana e dei suoi personaggi grandi e piccoli, con una particolare attenzione per le donne che incontra: le signore «dalle unghie laccate e dalle bocche dipinte», fiancheggiatrici del regime, le prigioniere politiche, ma anche parrucchiere, portinaie, impiegate, che con le loro vicende contribuiscono all’affresco più ampio di un’epoca. La passione civile è inalterata in ogni pagina, così come la sua fedeltà agli ideali di libertà e giustizia. La sua voce parla direttamente al cuore, emoziona e rende vivo quel nostro passato che rischia di diventare remoto per sempre.",https://www.ibs.it/ricordo-unica-difesa-manoscritto-ritrovato-libro-ester-parri/e/9788828218913,True,2026-04-17
Altri Editori,https://www.ibs.it/images/9791255212478_0_0_150_0_75.jpg,L'Europa verso la catastrofe. La politica estera dell'Italia fascista. 1936-1942,Galeazzo Ciano,LEG Edizioni,2026,,https://www.ibs.it/europa-verso-catastrofe-politica-estera-libro-galeazzo-ciano/e/9791255212478,True,2026-04-17
Editori Selezionati,https://www.ibs.it/images/9791259972798_0_0_150_0_75.jpg,Il contributo ebraico all'editoria italiana dall'Unità alle leggi razziali,N/D,Ronzani Editore,2026,"La storia dell’editoria italiana è anche, in larga parte, storia di editori, stampatori, librai e intellettuali ebrei che hanno dato un contributo decisivo alla formazione della cultura moderna. Questo volume ripercorre per la prima volta in modo organico e corale la vicenda degli editori di cultura ebraica in Italia, dall’Unità nazionale fino alla caduta del Fascismo, intrecciando biografie familiari, imprese culturali, sfide politiche e persecuzioni. Dai pionieri della stampa ebraica agli editori laici protagonisti della modernizzazione, i saggi qui raccolti illuminano figure e dinastie come Olschki, Treves, Voghera, Orvieto, Enriques, Lattes, Bemporad e Belforte, restituendo loro il ruolo che hanno avuto nella diffusione del sapere, nella costruzione di reti commerciali e culturali e nella difesa dell’identità ebraica. Storici, bibliografi e studiosi compongono un affresco inedito e ricco di sfumature: un viaggio attraverso secoli di idee, libri e persone che hanno intrecciato, spesso in modo decisivo, la propria vicenda con quella dell’Italia.",https://www.ibs.it/contributo-ebraico-all-editoria-italiana-libro-vari/e/9791259972798,False,2026-04-16
Editori Selezionati,https://www.ibs.it/images/9788817200059_0_0_150_0_75.jpg,Apologia della storia o Mestiere di storico,Marc Bloch,Rizzoli,2026,"""Papà, mi spieghi a cosa serve la storia?"" Inizia così, con una domanda ingenua e perciò disarmante, ""Apologia della storia"" o ""Mestiere di storico"". Un libro che non è un semplice trattato metodologico, ma un manifesto sulla funzione civile dello storico, un'appassionata difesa della ""scienza degli uomini nel tempo"". Scritto negli anni Quaranta e rimasto incompiuto a causa della fucilazione di Marc Bloch da parte della Gestapo, questo volume rappresenta il testamento spirituale di uno degli storici più importanti del secolo scorso. Di fronte alla catastrofe nazista, Bloch si getta in un corpo a corpo che interroga il senso di una scienza che sembra non riuscire mai a evitare l'avvenire del peggio. Ma non solo: in queste pagine si trovano aneddoti e descrizioni illuminanti che raccontano il complesso lavoro dello storico. Un mestiere d'artigianato che non può limitarsi a raccogliere le fonti ma deve ogni volta analizzarle e compararle con delicatezza e precisione.",https://www.ibs.it/apologia-della-storia-o-mestiere-libro-marc-bloch/e/9788817200059,False,2026-04-14
Altri Editori,https://www.ibs.it/images/9791280559685_0_0_150_0_75.jpg,Amori queer contro il fascismo. Manifesto per una democrazia deviante,Costanza Spina,le plurali,2026,,https://www.ibs.it/amori-queer-contro-fascismo-manifesto-libro-costanza-spina/e/9791280559685,False,2026-04-16
Altri Editori,https://www.ibs.it/images/9791257010324_0_0_150_0_75.jpg,Francesco d'Assisi e la sfida della storia,Raimondo Michetti,Viella,2026,,https://www.ibs.it/francesco-d-assisi-sfida-della-libro-raimondo-michetti/e/9791257010324,True,2026-04-17
Altri Editori,https://www.ibs.it/images/9791256361571_0_0_150_0_75.jpg,Maiorca,Giovanni Dozzini,Fandango Libri,2026,,https://www.ibs.it/maiorca-libro-giovanni-dozzini/e/9791256361571,False,2026-04-11
Altri Editori,https://www.ibs.it/images/9791256154722_0_0_150_0_75.jpg,"Spazi postcoloniali. Dislocazioni, diaspore, cartografie",Isabella D'angelo,Meltemi,2026,,https://www.ibs.it/spazi-postcoloniali-dislocazioni-diaspore-cartografie-libro-isabella-d-angelo/e/9791256154722,False,2026-04-11
Altri Editori,https://www.ibs.it/images/9791256154661_0_0_150_0_75.jpg,Il terzo braccio di Regina Coeli,Italo Zingarelli,Meltemi,2026,,https://www.ibs.it/terzo-braccio-di-regina-coeli-libro-italo-zingarelli/e/9791256154661,False,2026-04-11
