Categoria_App,Copertina,Titolo,Autore,Editore,Anno,Descrizione,Link,Nuovo,Data_Aggiunta
Altri Editori,https://www.ibs.it/images/9791281942516_0_0_150_0_75.jpg,"Videomarketing. Strategie per conquistare persone, social network e mercato",Federico Irace,Fox&Sparrows Edizioni,2026,,https://www.ibs.it/videomarketing-strategie-per-conquistare-persone-libro-federico-irace/e/9791281942516,False,2026-04-03
Altri Editori,https://www.ibs.it/images/9791281242630_0_0_150_0_75.jpg,L'abisso digitale. Cronache dell'umano medio ai tempi del Wi-Fi,Emanuele Tagliaferri,Aletheia Editore,2026,,https://www.ibs.it/abisso-digitale-cronache-dell-umano-libro-emanuele-tagliaferri/e/9791281242630,False,2026-04-07
Altri Editori,https://www.ibs.it/images/9791280905529_0_0_150_0_75.jpg,Giuseppe Catenacci un uomo controcorrente. Un sorvegliante della cosa pubblica,Giuseppe Mastromarino,Photo Travel Editions,2026,,https://www.ibs.it/giuseppe-catenacci-uomo-controcorrente-sorvegliante-libro-giuseppe-mastromarino/e/9791280905529,False,2026-04-02
Altri Editori,https://www.ibs.it/images/9791259934185_0_0_150_0_75.jpg,Quaderni di comunicazione scientifica (2024). Vol. 6-7,N/D,Rosenberg & Sellier,2026,,https://www.ibs.it/quaderni-di-comunicazione-scientifica-2024-libro-vari/e/9791259934185,True,2026-04-09
Altri Editori,https://www.ibs.it/images/9791257410094_0_0_150_0_75.jpg,Brevis (2026). Vol. 41,"Tino La Vecchia,Patrizia D'amico,Giorgio Di Bella",GAEditori,2026,,https://www.ibs.it/brevis-2026-vol-41-libro-vari/e/9791257410094,False,2026-04-03
Altri Editori,https://www.ibs.it/images/9791257181499_0_0_150_0_75.jpg,Un enigma. Il corpo della donna: un breve vademecum lungo 30.000 anni,Roberto Scannavini,Edizioni Pendragon,2026,,https://www.ibs.it/enigma-corpo-della-donna-breve-libro-roberto-scannavini/e/9791257181499,False,2026-04-04
Altri Editori,https://www.ibs.it/images/9791257181468_0_0_150_0_75.jpg,La vita davanti a me. Sempre in cammino,Antonia Grasselli,Edizioni Pendragon,2026,,https://www.ibs.it/vita-davanti-a-me-sempre-libro-antonia-grasselli/e/9791257181468,False,2026-04-04
Altri Editori,https://www.ibs.it/images/9791256952977_0_0_150_0_75.jpg,"Concorso 3382 volontari in ferma prefissata triennale (VFT). Manuale con teoria, quiz, tabelle, podacst e mappe concettuali. Con espansione online",N/D,Nld Concorsi,2026,,https://www.ibs.it/concorso-3382-volontari-in-ferma-libro-vari/e/9791256952977,False,2026-04-03
Altri Editori,https://www.ibs.it/images/9791256860395_0_0_150_0_75.jpg,I social prima dei social,Mauro Corno,Il Foglio Letterario Edizioni,2026,,https://www.ibs.it/social-prima-dei-social-libro-mauro-corno/e/9791256860395,False,2026-04-01
Altri Editori,https://www.ibs.it/images/9791256830602_0_0_150_0_75.jpg,Stregoneria popolare italiana. Vol. 2: La magia degli elementi,Andrea Romanazzi,Anguana Edizioni,2026,,https://www.ibs.it/stregoneria-popolare-italiana-vol-2-libro-andrea-romanazzi/e/9791256830602,False,2026-04-02
Altri Editori,https://www.ibs.it/images/9791256751228_0_0_150_0_75.jpg,Abbecedario mediale. Ripensare Internet dall'inizio,Marco Brusati,Effatà Editrice,2026,,https://www.ibs.it/abbecedario-mediale-ripensare-internet-dall-libro-marco-brusati/e/9791256751228,False,2026-04-04
Altri Editori,https://www.ibs.it/images/9791256180394_0_0_150_0_75.jpg,Il manifesto del Partito comunista,"Karl Marx,Friedrich Engels",Coppola Editore,2026,,https://www.ibs.it/manifesto-del-partito-comunista-libro-karl-marx-friedrich-engels/e/9791256180394,False,2026-04-02
Altri Editori,https://www.ibs.it/images/9791256026524_0_0_150_0_75.jpg,Concorso Allievi Marescialli Arma dei Carabinieri. Manuale per gli accertamenti attitudinali e la prova orale. Con software di esercitazione,N/D,Edises professioni & concorsi,2026,,https://www.ibs.it/concorso-allievi-marescialli-arma-dei-libro-vari/e/9791256026524,False,2026-04-02
Altri Editori,https://www.ibs.it/images/9791224327387_0_0_150_0_75.jpg,Sotto la stessa croce. Storie di servizio e umanità nel corpo militare volontario della Croce Rossa Italiana e dell'universo volontariato,Antonio Biancardi,Autopubblicato,2026,,https://www.ibs.it/sotto-stessa-croce-storie-di-libro-antonio-biancardi/e/9791224327387,False,2026-04-02
Altri Editori,https://www.ibs.it/images/9791224324928_0_0_150_0_75.jpg,Gestire l'immigrazione è possibile. Quando l'emergenza diventa sistema,Rakbir Hasan,Autopubblicato,2026,,https://www.ibs.it/gestire-immigrazione-possibile-quando-emergenza-libro-rakbir-hasan/e/9791224324928,True,2026-04-09
Editori Selezionati,https://www.ibs.it/images/9791222330549_0_0_150_0_75.jpg,Paradoxa (2026). Vol. 1: Palla al centro. Identikit del partito che (ancora) non c'è,N/D,Mimesis,2026,"Si farà o no un nuovo partito di centro? E che fisionomia avrà o potrebbe avere? Le analisi qui presentate convergono almeno su un aspetto: il centro non è un luogo o una collocazione, ma un’operazione, una «sintesi», un «metodo», una «chiave di lettura», una «postura», una «cultura», una «prassi». Lo sforzo, da parte di tutti gli autori è quello di profilare l’identità centrista con contenuti il più possibile nitidi, tra i quali emergono senz’altro: personalismo, europeismo, principio di sussidiarietà, ispirazione cristiana, salvaguardia delle istituzioni e dell’interazione con i corpi intermedi (contro la disintermediazione), opzione in favore della complessità di contro a soluzioni semplificatorie e polarizzanti.",https://www.ibs.it/paradoxa-2026-vol-1-palla-libro-vari/e/9791222330549,False,2026-04-03
Altri Editori,https://www.ibs.it/images/9791220505000_0_0_150_0_75.jpg,"Mario Casalinuovo il giurista, il politico. Atti del Convegno (Catanzaro, 19 aprile 2024)",Mario Casalinuovo,Pellegrini,2026,,https://www.ibs.it/mario-casalinuovo-giurista-politico-atti-libro-mario-casalinuovo/e/9791220505000,False,2026-04-07
Altri Editori,https://www.ibs.it/images/9788893628280_0_0_150_0_75.jpg,Editest TOLC-SU Area umanistica e sociale 3000 quiz. Ampia raccolta di quesiti tratti da prove reali e 10 simulazioni d'esame per la preparazione ai test di ammissione. Con software di simulazione,N/D,Editest,2026,,https://www.ibs.it/editest-tolc-su-area-umanistica-libro-vari/e/9788893628280,False,2026-04-02
Altri Editori,https://www.ibs.it/images/9788892764354_0_0_150_0_75.jpg,Piccolo trattato di giardinaggio punk. Imparare a disimparare,Éric Lenoir,Elliot,2026,,https://www.ibs.it/piccolo-trattato-di-giardinaggio-punk-libro-eric-lenoir/e/9788892764354,False,2026-04-07
Altri Editori,https://www.ibs.it/images/9788873268475_0_0_150_0_75.jpg,La promessa. Un secolo di lotte contadine,Maria Santiloni Cavatassi,Affinità Elettive Edizioni,2026,,https://www.ibs.it/promessa-secolo-di-lotte-contadine-libro-maria-santiloni-cavatassi/e/9788873268475,False,2026-04-04
Editori Selezionati,https://www.ibs.it/images/9788869775499_0_0_150_0_75.jpg,"Embodied discourse, embodied practice. The body as text, medium, and testimony in Japan",N/D,Mimesis International,2026,,https://www.ibs.it/embodied-discourse-embodied-practice-the-libro-vari/e/9788869775499,False,2026-04-03
Altri Editori,https://www.ibs.it/images/9788869723858_0_0_150_0_75.jpg,Il diritto privato della comunicazione d'impresa,Carlo Berti,Bonomo,2026,,https://www.ibs.it/diritto-privato-della-comunicazione-d-libro-carlo-berti/e/9788869723858,False,2026-04-07
Altri Editori,https://www.ibs.it/images/9788868027117_0_0_150_0_75.jpg,"In nome di dio. Il fondamento religioso, politico e rivoluzionario della repubblica islamica",Alì Khamenei,Pgreco,2026,,https://www.ibs.it/in-nome-di-dio-fondamento-libro-ali-khamenei/e/9788868027117,False,2026-04-04
Altri Editori,https://www.ibs.it/images/9788863366969_0_0_150_0_75.jpg,Il regime del calcolo,Nicolò Tomaini,Il Prato,2026,,https://www.ibs.it/regime-del-calcolo-libro-nicolo-tomaini/e/9788863366969,False,2026-04-04
Altri Editori,https://www.ibs.it/images/9788859046455_0_0_150_0_75.jpg,"Trento al bivio. Da città di progetti a città di piano. Quartieri, montagna e clima verso il 2030-2040",Roberto Sani,Erickson,2026,,https://www.ibs.it/trento-al-bivio-da-citta-libro-roberto-sani/e/9788859046455,False,2026-04-07
Altri Editori,https://www.ibs.it/images/9788850503780_0_0_150_0_75.jpg,Concorso 3382 VFT volontari in ferma prefissata triennale. 1555 volontari esercito. 1095 volontari marina. 732 volontari aeronautica. Manuale. Teorie e quiz. Con Con SOFTWARE per la simulazione della prova. Con Estensioni online. Con Videolezioni,N/D,Nissolino,2026,,https://www.ibs.it/concorso-3382-vft-volontari-in-libro-vari/e/9788850503780,False,2026-04-07
Altri Editori,https://www.ibs.it/images/9788849889307_0_0_150_0_75.jpg,Formiche (2026). Vol. 222: Il ponte necessario. L'interdipendenza strategica tra Usa e Ue,N/D,Rubbettino,2026,,https://www.ibs.it/formiche-2026-vol-222-ponte-libro-vari/e/9788849889307,False,2026-04-07
Altri Editori,https://www.ibs.it/images/9788849889154_0_0_150_0_75.jpg,"Roccelleasy. La trasformazione affascinante. Vision, innovation e Change management: dalla spinta del PNRR alla creazione di valore pubblico",Beniamino Cordova,Rubbettino,2026,,https://www.ibs.it/roccelleasy-trasformazione-affascinante-vision-innovation-libro-beniamino-cordova/e/9788849889154,True,2026-04-09
Altri Editori,https://www.ibs.it/images/9788849888799_0_0_150_0_75.jpg,"Il patrimonio audiovisivo. Tecnologie e metodologie di preservazione, restauro e digitalizzazione cinematografica",N/D,Rubbettino,2026,,https://www.ibs.it/patrimonio-audiovisivo-tecnologie-metodologie-di-libro-vari/e/9788849888799,False,2026-04-07
Altri Editori,https://www.ibs.it/images/9788833405940_0_0_150_0_75.jpg,Il palazzo del Circolo dell'Unione di Firenze,N/D,Sillabe,2026,,https://www.ibs.it/palazzo-del-circolo-dell-unione-libro-vari/e/9788833405940,True,2026-04-09
Altri Editori,https://www.ibs.it/images/9788833202259_0_0_150_0_75.jpg,Costituzione della Repubblica italiana. Aggiornata a marzo 2026,N/D,Foschi (Santarcangelo),2026,,https://www.ibs.it/costituzione-della-repubblica-italiana-aggiornata-libro-vari/e/9788833202259,False,2026-04-08
Altri Editori,https://www.ibs.it/images/9791280667090_0_0_150_0_75.jpg,Non è per me. Ediz. italiana e russa,Varvara Pražka,Modern Times,2026,,https://www.ibs.it/non-per-me-ediz-italiana-libro-varvara-prazka/e/9791280667090,False,2026-04-07
Altri Editori,https://www.ibs.it/images/9791255521099_0_0_150_0_75.jpg,Un intreccio nero. La nuova inchiesta sul caso Spampinato,Carmelo Schininà,Liberedizioni,2026,,https://www.ibs.it/intreccio-nero-nuova-inchiesta-sul-libro-carmelo-schinina/e/9791255521099,False,2026-04-02
Altri Editori,https://www.ibs.it/images/9791224063254_0_0_150_0_75.jpg,Il serialista Unabomber. Geographic profiling a nord est,Domingo Magliocca,Youcanprint,2026,,https://www.ibs.it/serialista-unabomber-geographic-profiling-a-libro-domingo-magliocca/e/9791224063254,False,2026-04-03
Altri Editori,https://www.ibs.it/images/9791281995147_0_0_150_0_75.jpg,Pietre senza popolo. Pratiche di resistenza attiva alla turistificazione neoliberale,Angela Fais,L.A.D. Edizioni,2026,,https://www.ibs.it/pietre-senza-popolo-pratiche-di-libro-angela-fais/e/9791281995147,False,2026-04-03
Altri Editori,https://www.ibs.it/images/9791224067986_0_0_150_0_75.jpg,"Femminicidio in gravidanza: due vite sotto minaccia. Profili psicologici, comportamentali e giuridici","Catia Pugi,Francesco Galvano",Youcanprint,2026,,https://www.ibs.it/femminicidio-in-gravidanza-due-vite-libro-catia-pugi-francesco-galvano/e/9791224067986,False,2026-04-03
Altri Editori,https://www.ibs.it/images/9791224067924_0_0_150_0_75.jpg,Viagra. The ultimate guidebook,Laura D. White,Youcanprint,2026,,https://www.ibs.it/viagra-the-ultimate-guidebook-libro-laura-d-white/e/9791224067924,False,2026-04-03
Altri Editori,https://www.ibs.it/images/9791224066507_0_0_150_0_75.jpg,Voci ribelli. Storie e ragioni di chi ha scelto di dire no al sistema,Chiara Talin,Youcanprint,2026,,https://www.ibs.it/voci-ribelli-storie-ragioni-di-libro-chiara-talin/e/9791224066507,False,2026-04-07
Altri Editori,https://www.ibs.it/images/9791224055310_0_0_150_0_75.jpg,Mysteries and monuments of Sardinia,Luca Torcasio,Youcanprint,2026,,https://www.ibs.it/mysteries-and-monuments-of-sardinia-libro-luca-torcasio/e/9791224055310,False,2026-04-04
Altri Editori,https://www.ibs.it/images/9791224050971_0_0_150_0_75.jpg,"Guerre e miserie. L'oscena Seconda Guerra Mondiale e altri conflitti. Storie di guerra, anche sull'ultima di oggi",Alessio Tanfoglio,Youcanprint,2026,,https://www.ibs.it/guerre-miserie-oscena-seconda-guerra-libro-alessio-tanfoglio/e/9791224050971,False,2026-04-04
Altri Editori,https://www.ibs.it/images/9791224045489_0_0_150_0_75.jpg,Alla ricerca dell'uomo perduto. Anno Due,Paolo Agazzi,Youcanprint,2026,,https://www.ibs.it/alla-ricerca-dell-uomo-perduto-libro-paolo-agazzi/e/9791224045489,False,2026-04-04
Editori Selezionati,https://www.ibs.it/images/9791222328317_0_0_150_0_75.jpg,E/C. Rivista dell'associazione italiana di studi semiotici (2025). Vol. 44: Maleducati e mal educare,N/D,Mimesis,2026,,https://www.ibs.it/ec-rivista-dell-associazione-italiana-libro-vari/e/9791222328317,False,2026-04-07
Editori Selezionati,https://www.ibs.it/images/9791222321752_0_0_150_0_75.jpg,E/C. Rivista dell'associazione italiana di studi semiotici (2025). Vol. 43: Strani cibi,N/D,Mimesis,2026,,https://www.ibs.it/ec-rivista-dell-associazione-italiana-libro-vari/e/9791222321752,False,2026-04-07
Altri Editori,https://www.ibs.it/images/9791221509243_0_0_150_0_75.jpg,Antonio Gramsci. Vita morale e fede socialista,Joseph Francese,Firenze University Press,2026,,https://www.ibs.it/antonio-gramsci-vita-morale-fede-libro-joseph-francese/e/9791221509243,False,2026-04-07
Altri Editori,https://www.ibs.it/images/9791221508901_0_0_150_0_75.jpg,Homo horizontalis. Ascesi fisiche e ascese alpinistiche,N/D,Firenze University Press,2026,,https://www.ibs.it/homo-horizontalis-ascesi-fisiche-ascese-libro-vari/e/9791221508901,False,2026-04-07
Altri Editori,https://www.ibs.it/images/9788893926836_0_0_150_0_75.jpg,Indiscipline. Rivista di scienze sociali (2026). Vol. 1,N/D,Morlacchi,2026,,https://www.ibs.it/indiscipline-rivista-di-scienze-sociali-libro-vari/e/9788893926836,False,2026-04-07
Altri Editori,https://www.ibs.it/images/9788893543347_0_0_150_0_75.jpg,"Il Nüshu. Una scrittura per resistere, cantare, ricordare","Giulia Falcini,Zhao Liming,Hu Yanyu",CSA Editrice,2026,,https://www.ibs.it/nushu-scrittura-per-resistere-cantare-libro-vari/e/9788893543347,False,2026-04-03
Altri Editori,https://www.ibs.it/images/9791280945594_0_0_150_0_75.jpg,Jean Marc Itard. La pedagogia speciale e la pedagogia clinica,"Piero Crispiani,Riccardo Sebastiani",Itard,2026,,https://www.ibs.it/jean-marc-itard-pedagogia-speciale-libro-piero-crispiani-riccardo-sebastiani/e/9791280945594,True,2026-04-09
Altri Editori,https://www.ibs.it/images/9791280838636_0_0_150_0_75.jpg,Fake news. Con opuscolo,Marica Lucarelli,Ducale,2026,,https://www.ibs.it/fake-news-con-opuscolo-libro-marica-lucarelli/e/9791280838636,False,2026-04-03
Altri Editori,https://www.ibs.it/images/9791259918543_0_0_150_0_75.jpg,"Ipotesi di complotto. Perché affascinano, come si diffondono, perché resistono",Marco Marsili,Intra,2026,,https://www.ibs.it/ipotesi-di-complotto-perche-affascinano-libro-marco-marsili/e/9791259918543,False,2026-04-04
Altri Editori,https://www.ibs.it/images/9791257890193_0_0_150_0_75.jpg,Scuola di economia politica della sinistra italiana e mondiale del Nuovo Millennio. Con programma economico per l'Italia,Primo Giovannelli,EBS Print,2026,,https://www.ibs.it/scuola-di-economia-politica-della-libro-primo-giovannelli/e/9791257890193,True,2026-04-09
Altri Editori,https://www.ibs.it/images/9791257490065_0_0_150_0_75.jpg,La scuola fascista di giornalismo. Origini del controllo mediatico nel ventennio e riflessi contemporanei,Eugenio Gallavotti,Luni Editrice,2026,,https://www.ibs.it/scuola-fascista-di-giornalismo-origini-libro-eugenio-gallavotti/e/9791257490065,False,2026-04-07
Altri Editori,https://www.ibs.it/images/9791224046509_0_0_150_0_75.jpg,Sulle note del cambiamento negli anni '70 e '80. Vol. 1: Vita e musica di un'epoca,Dario Bartoleni,Youcanprint,2026,,https://www.ibs.it/sulle-note-del-cambiamento-negli-libro-dario-bartoleni/e/9791224046509,True,2026-04-09
Altri Editori,https://www.ibs.it/images/9791221826302_0_0_150_0_75.jpg,"La bussola costituzionale. Costituzione, cittadinanza e partecipazione: un percorso di educazione civica",Bruno Di Giacomo Russo,Aracne (Genzano di Roma),2026,,https://www.ibs.it/bussola-costituzionale-costituzione-cittadinanza-partecipazione-libro-bruno-di-giacomo-russo/e/9791221826302,True,2026-04-09
Altri Editori,https://www.ibs.it/images/9788899048181_0_0_150_0_75.jpg,"Rivista Savej. Raccontare il Piemonte un articolo alla volta (2026). Vol. 18: Storie di strade. Percorsi, incontri e memorie",N/D,Savej,2026,,https://www.ibs.it/rivista-savej-raccontare-piemonte-articolo-libro-vari/e/9788899048181,True,2026-04-09
Altri Editori,https://www.ibs.it/images/9788868694708_0_0_150_0_75.jpg,Tu non sai quanto furba è l'onestà,Paolo Dalla Vecchia,Supernova,2026,,https://www.ibs.it/tu-non-sai-quanto-furba-libro-paolo-dalla-vecchia/e/9788868694708,True,2026-04-09
Altri Editori,https://www.ibs.it/images/9788868694531_0_0_150_0_75.jpg,Two voices in Venice,Caterina Falomo,Supernova,2026,,https://www.ibs.it/two-voices-in-venice-libro-caterina-falomo/e/9788868694531,True,2026-04-09
Altri Editori,https://www.ibs.it/images/9788849561425_0_0_150_0_75.jpg,Il detenuto ora è il mio vicino,"Daniela Ronco,Valeria Verdolini",Edizioni Scientifiche Italiane,2026,,https://www.ibs.it/detenuto-ora-mio-vicino-libro-daniela-ronco-valeria-verdolini/e/9788849561425,True,2026-04-09
Altri Editori,https://www.ibs.it/images/9788893665780_0_0_150_0_75.jpg,La libertà dei liberali. Aspetti e problemi della vita italiana,Pietro Di Muccio de Quattro,Le Lettere,2026,,https://www.ibs.it/liberta-dei-liberali-aspetti-problemi-libro-pietro-di-muccio-de-quattro/e/9788893665780,False,2026-04-04
Altri Editori,https://www.ibs.it/images/9788867099320_0_0_150_0_75.jpg,Il controllo sfinterico,Giovanni Maria Guazzo,Anicia (Roma),2026,,https://www.ibs.it/controllo-sfinterico-libro-giovanni-maria-guazzo/e/9788867099320,False,2026-04-08
Altri Editori,https://www.ibs.it/images/9791256581153_0_0_150_0_75.jpg,Japan illustrated. Vol. 2,N/D,Sprea Editori,2026,,https://www.ibs.it/japan-illustrated-vol-2-libro-vari/e/9791256581153,True,2026-04-09
Altri Editori,https://www.ibs.it/images/9788891678171_0_0_150_0_75.jpg,Manuale operativo delle associazioni,"Susanna Beretta,Guglielmo Mauri",Maggioli Editore,2026,,https://www.ibs.it/manuale-operativo-delle-associazioni-libro-susanna-beretta-guglielmo-mauri/e/9788891678171,False,2026-04-01
Altri Editori,https://www.ibs.it/images/9788842836544_0_0_150_0_75.jpg,Sorellanza. Femminismo e antispecismo,Martina Miccichè,Il Saggiatore,2026,,https://www.ibs.it/sorellanza-femminismo-antispecismo-libro-martina-micciche/e/9788842836544,False,2026-04-08
Altri Editori,https://www.ibs.it/images/9791282031288_0_0_150_0_75.jpg,Dissonanze. Nella cornice della natura,Giorgetta Dorfles,Battello Stampatore,2026,,https://www.ibs.it/dissonanze-nella-cornice-della-natura-libro-giorgetta-dorfles/e/9791282031288,False,2026-04-02
Altri Editori,https://www.ibs.it/images/9791281453302_0_0_150_0_75.jpg,Le innovazioni sostenibili delle comunità emblematiche,Fondazione Edamus,Trenta Editore,2026,,https://www.ibs.it/innovazioni-sostenibili-delle-comunita-emblematiche-libro-fondazione-edamus/e/9791281453302,False,2026-04-01
Altri Editori,https://www.ibs.it/images/9791256026661_0_0_150_0_75.jpg,Concorso VFT Volontari in Ferma prefissata Triennale,N/D,Edises professioni & concorsi,2026,,https://www.ibs.it/concorso-vft-volontari-in-ferma-libro-vari/e/9791256026661,False,2026-04-04
Altri Editori,https://www.ibs.it/images/9791224322498_0_0_150_0_75.jpg,Arxipelag. Vol. 3: Can we have fun?,N/D,Carosellolab srl,2026,,https://www.ibs.it/arxipelag-vol-3-can-we-libro-vari/e/9791224322498,False,2026-04-01
Altri Editori,https://www.ibs.it/images/9788891679574_0_0_150_0_75.jpg,Rapporto di lavoro pubblico,Angelo Capalbo,Maggioli Editore,2026,,https://www.ibs.it/rapporto-di-lavoro-pubblico-libro-angelo-capalbo/e/9788891679574,False,2026-04-01
Altri Editori,https://www.ibs.it/images/9788891679024_0_0_150_0_75.jpg,Manuale per corporate planner ai- ready,"Michele Iaselli,Valeria Lazzarolli",Maggioli Editore,2026,,https://www.ibs.it/manuale-per-corporate-planner-ai-libro-michele-iaselli-valeria-lazzarolli/e/9788891679024,False,2026-04-01
Altri Editori,https://www.ibs.it/images/9788891675521_0_0_150_0_75.jpg,Tutela e sicurezza nei luoghi di lavoro,Rocchina Staiano,Maggioli Editore,2026,,https://www.ibs.it/tutela-sicurezza-nei-luoghi-di-libro-rocchina-staiano/e/9788891675521,False,2026-04-01
Altri Editori,https://www.ibs.it/images/9788885619395_0_0_150_0_75.jpg,La pena oltre la pena. La doppia condanna delle donne in carcere,"Susanna Ripamonti,Roberta Ghidelli",Libraccio Editore,2026,,https://www.ibs.it/pena-oltre-pena-doppia-condanna-libro-susanna-ripamonti-roberta-ghidelli/e/9788885619395,False,2026-04-07
Altri Editori,https://www.ibs.it/images/9788885604667_0_0_150_0_75.jpg,Almanacco cucina italiana. Si mangia e si beve futurista. Lo devono sapere tutti,Raffaella Aschieri,Giuseppe De Nicola,2026,,https://www.ibs.it/almanacco-cucina-italiana-si-mangia-libro-raffaella-aschieri/e/9788885604667,False,2026-04-02
Editori Selezionati,https://www.ibs.it/images/9788815395801_0_0_150_0_75.jpg,Agroecologia. Riconciliare natura e agricoltura,Francesco Lami,Il Mulino,2026,"Pesticidi, monocolture, allevamento intensivo. L'agricoltura è alla base della nostra civiltà, ma è anche una delle attività a maggiore impatto sull'ambiente. Davanti a questo paradosso, l'agroecologia propone un cambio di prospettiva: guardare ai campi coltivati come ecosistemi complessi, dove la biodiversità non è un ostacolo ma una risorsa. Pagina dopo pagina vedremo che dalle piante ai microrganismi del suolo, dagli insetti impollinatori ai nemici naturali dei parassiti, ogni elemento può contribuire a rendere l'agricoltura più resiliente e sostenibile, e che favorire i processi naturali invece di combatterli può rappresentare una soluzione praticabile per nutrire il mondo senza distruggerlo. Tra ecologia e agronomia, un viaggio nella complessità della vita, là dove cresce il nostro cibo.",https://www.ibs.it/agroecologia-riconciliare-natura-agricoltura-libro-francesco-lami/e/9788815395801,False,2026-04-03
Altri Editori,https://www.ibs.it/images/9791256026562_0_0_150_0_75.jpg,L'esame di Stato per biologi. Kit completo. Manuale teorico e Tracce svolte per l'Esame di abilitazione professionale. Con espansione online,N/D,Edises professioni & concorsi,2026,,https://www.ibs.it/esame-di-stato-per-biologi-libro-vari/e/9791256026562,False,2026-04-03
Editori Selezionati,https://www.ibs.it/images/9788817197748_0_0_150_0_75.jpg,"L'ottavo senso. Impariamo ad ascoltare il nostro corpo con l'interocezione, per vivere meglio e in salute",Caroline Williams,Rizzoli,2026,"L'interocezione è uno dei nostri sensi fondamentali e, allo stesso tempo, uno dei meno conosciuti. È la voce silenziosa del corpo che parla al cervello, il canale attraverso cui percepiamo la fame e la sete, il caldo e il freddo, la tensione, la calma o l'allarme che accompagna stress e panico. È il senso interiore che ci permette di sapere come stiamo, ancora prima di riuscire a dirlo a parole. In questo libro illuminante e rivoluzionario, Caroline Williams accompagna il lettore alla scoperta dell'""ottavo senso"", destinato a trasformare profondamente il modo in cui comprendiamo la salute mentale e il benessere fisico in tutti gli ambiti della nostra vita, dal sonno alla sessualità. L'autrice racconta il dialogo tra corpo e cervello attraverso un viaggio che intreccia neuroscienze, medicina, mindfulness e terapie corporee, e basandosi sulle ricerche di neuroscienziati e professionisti della salute che sperimentano nuovi approcci terapeutici per disturbi d'ansia, alimentari e somatici.",https://www.ibs.it/ottavo-senso-impariamo-ad-ascoltare-libro-caroline-williams/e/9788817197748,False,2026-04-08
