Data,Titolo,Descrizione_Completa,Ospiti,Immagine,Link
12/06/2026,BOOM! Mediaset testa Rischiatutto,"Davide Maggio svela la realizzazione di tre puntate zero di Jeopardy!, il Rischiatutto di Mike Bongiorno. Ecco i conduttori scelti",N/d,https://www.davidemaggio.it/app/uploads/2026/06/Jeopardy.jpg,https://www.davidemaggio.it/anteprime/boom-mediaset-testa-rischiatutto
11/06/2026,Otto e Mezzo,,,https://kdam.iltrovatore.it/p/103/sp/10300/thumbnail/entry_id/0_ftdukq6d///width/1280/quality/100/name/0_ftdukq6d.jpgname/0_ftdukq6d.jpg_vrs7978name/0_ftdukq6d.jpg,https://www.la7.it/otto-e-mezzo/rivedila7/otto-e-mezzo-11-06-2026-648760
11/06/2026,"Temptation Island 2026, Cristian e Soraya sono la quarta coppia","A scrivere al programma è stata la ragazza: è stanca di andare alle sagre di paese con il fidanzato che ""non ha i soldi per una cena ma per comprarsi la maschera di Spider-Man sì""",N/d,https://www.davidemaggio.it/app/uploads/2026/06/Cristian-e-Soraya-Temptation-Island-2026.jpg,https://www.davidemaggio.it/temptation-island/temptation-island-2026-cristian-e-soraya-sono-la-quarta-coppia
11/06/2026,"Sarabanda Celebrity, ecco i team di stasera","LDA, Aka 7even e Helena Prestes tra i protagonisti della nuova puntata dello show musicale di Italia 1","Lda, aka 7even, helena prestes",https://www.davidemaggio.it/app/uploads/2026/02/SLF_4305-1024x683.jpg,https://www.davidemaggio.it/sarabanda/sarabanda-celebrity-ecco-i-team-di-stasera-6
11/06/2026,Quarto Grado raddoppia anche questa settimana,Al centro delle due puntate i casi Paganelli e Garlasco. Ecco le anticipazioni e gli ospiti,N/d,https://www.davidemaggio.it/app/uploads/2026/06/Louis-Dassilva.jpg,https://www.davidemaggio.it/quarto-grado/quarto-grado-raddoppia-anche-questa-settimana
11/06/2026,Concita De Gregorio ed Elsa Fornero stasera a Piazzapulita,Un'inchiesta sull'uomo più ricco d'Italia al centro della puntata. Ecco le anticipazioni e gli ospiti dell'11 giugno 2026,"Concita de gregorio, elsa fornero",https://www.davidemaggio.it/app/uploads/2026/01/Corrado-Formigli-1024x576.jpg,https://www.davidemaggio.it/piazzapulita/concita-de-gregorio-ed-elsa-fornero-stasera-a-piazzapulita
10/06/2026,Otto e Mezzo,,,https://kdam.iltrovatore.it/p/103/sp/10300/thumbnail/entry_id/0_nyxtxo9q///width/1280/quality/100/name/0_nyxtxo9q.jpgname/0_nyxtxo9q.jpg_vrs6737name/0_nyxtxo9q.jpg,https://www.la7.it/otto-e-mezzo/rivedila7/otto-e-mezzo-10-06-2026-648599
11/06/2026,BOOM! Giulia Salemi a The Traitors,Davide Maggio annuncia la presenza dell'ex vippona nel cast della seconda stagione dello show di Prime Video,N/d,https://www.davidemaggio.it/app/uploads/2025/09/Giulia-Salemi--1024x615.jpg,https://www.davidemaggio.it/the-traitors/boom-giulia-salemi-a-the-traitors
11/06/2026,BOOM! Gianluca Torre a The Traitors,Davide Maggio annuncia tra i concorrenti dello show di Prime Video l’agente immobiliare di Casa a Prima Vista,Gianluca torre,https://www.davidemaggio.it/app/uploads/2023/11/Gianluca-Torre-Casa-a-Prima-Vista-1024x616.webp,https://www.davidemaggio.it/anteprime/boom-gianluca-torre-a-the-traitors
11/06/2026,BOOM! Lorella Cuccarini a The Traitors,Davide Maggio annuncia la prima concorrente ufficiale della seconda edizione dello show di Prime Video. Per la più amata dagli italiani si tratta dell’assoluto debutto in questo ruolo,N/d,https://www.davidemaggio.it/app/uploads/2026/06/LORELLA-CUCCARINI_262-2000x1136.jpg,https://www.davidemaggio.it/anteprime/boom-lorella-cuccarini-a-the-traitors
11/06/2026,Storie al Bivio: Monica Setta e il fascino dell’inconsistenza,"Storie al Bivio esiste in virtù della sua conduttrice: è un fattore totalizzante che rappresenta, allo stesso tempo, la sua fortuna e la sua condanna.",N/d,https://www.davidemaggio.it/app/uploads/2026/06/Monica-Setta-Storie-al-Bivio.webp,https://www.davidemaggio.it/recensioni/storie-al-bivio-monica-setta-e-il-fascino-dellinconsistenza
10/06/2026,Antonino Monteleone ci riprova (ancora!) con Filorosso,"Dopo gli insuccessi su Rai 2, l'ex iena conquista la prima serata di Rai 3 da lunedì 15 giugno. Al suo fianco Adele Grossi",N/d,https://www.davidemaggio.it/app/uploads/2026/06/Antonino-Monteleone.jpg,https://www.davidemaggio.it/filorosso/antonino-monteleone-ci-riprova-ancora-con-filorosso
10/06/2026,I casi Liliana Resinovich e Pamela Genini stasera a Chi l’ha Visto,Spazio anche alla scomparsa di Paula Andrea Bran Yépez. Ecco le anticipazioni del 10 giugno 2026,N/d,https://www.davidemaggio.it/app/uploads/2025/09/Federica-Sciarelli-Chi-lha-visto-1024x769.jpeg,https://www.davidemaggio.it/chi-l-ha-visto/i-casi-liliana-resinovich-e-pamela-genini-stasera-a-chi-lha-visto
10/06/2026,"Realpolitik saluta con Walter Veltroni, Gianrico Carofiglio e Veronica Gentili","Tommaso Labate chiude la stagione con la stretta attualità politica, le nozze a Palermo di Dua Lipa e il caso Garlasco. Ecco le anticipazioni e gli ospiti del 10 giugno 2026","Walter veltroni, gianrico carofiglio, veronica gentili",https://www.davidemaggio.it/app/uploads/2025/10/Tommaso-Labate-Rete-4-Realpolitik-1024x538.jpg,https://www.davidemaggio.it/realpolitik/realpolitik-saluta-con-walter-veltroni-gianrico-carofiglio-e-veronica-gentili
10/06/2026,Battiti Live torna con Ilary Blasi e Fabio Rovazzi,"Il cantante subentra ad Alvin, impegnato nelle Filippine con la conduzione dell'Isola dei Famosi. Lo show musicale in onda a luglio su Canale 5",N/d,https://www.davidemaggio.it/app/uploads/2024/12/FABIO-ROVAZZI_01-e1734972138254-1024x634.jpg,https://www.davidemaggio.it/battiti-live/battiti-live-torna-con-ilary-blasi-e-fabio-rovazzi
09/06/2026,Otto e Mezzo,,,https://kdam.iltrovatore.it/p/103/sp/10300/thumbnail/entry_id/0_hb240f3c///width/1280/quality/100/name/0_hb240f3c.jpgname/0_hb240f3c.jpg_vrs9556name/0_hb240f3c.jpg,https://www.la7.it/otto-e-mezzo/rivedila7/otto-e-mezzo-09-06-2026-648426
10/06/2026,"Temptation Island 2026, Giovanni e Sabrina sono la terza coppia","A scrivere al programma è stato il fidanzato, convinto di un tradimento in parte ammesso dalla ragazza: ""Nell'ultimo anno mi è capitato di avere una distrazione""",N/d,https://www.davidemaggio.it/app/uploads/2026/06/Giovanni-e-Sabrina-Temptation-Island-2026.jpg,https://www.davidemaggio.it/temptation-island/temptation-island-2026-giovanni-e-sabrina-sono-la-terza-coppia
09/06/2026,"È Sempre Cartabianca, Berlinguer tra Medio Oriente e Garlasco con De Rensis","Tra gli ospiti anche Andrea Scanzi, Nicola Fratoianni e Mario Sechi. Ecco le anticipazioni del 9 giugno 2026","Andrea scanzi, nicola fratoianni, mario sechi",https://www.davidemaggio.it/app/uploads/2025/12/Bianca-Berlinguer-2-1024x576.jpg,https://www.davidemaggio.it/e-sempre-cartabianca/e-sempre-cartabianca-berlinguer-tra-medio-oriente-e-garlasco-con-de-rensis
09/06/2026,"diMartedì, Travaglio e Veltroni all’ultima di Floris",Focus sulla stretta attualità e sull'economia italiana. Ecco le anticipazioni del 9 giugno 2026,"Marco travaglio, walter veltroni",https://www.davidemaggio.it/app/uploads/2025/09/Floris-diMartedi-1024x576.jpeg,https://www.davidemaggio.it/dimartedi/dimartedi-travaglio-e-veltroni-allultima-di-floris
09/06/2026,Affari Tuoi come La Ruota della Fortuna: arriva in palio una macchina,"Si tratta di un'auto Opel, nuovo premio nel gioco dei pacchi a partire dalla puntata del 10 giugno 2026",N/d,https://www.davidemaggio.it/app/uploads/2026/04/Stefano-De-Martino-e1781001567227.jpg,https://www.davidemaggio.it/affari-tuoi/affari-tuoi-come-la-ruota-della-fortuna-arriva-in-palio-una-macchina
08/06/2026,Otto e Mezzo,,"Nicola Gratteri, Tomaso Montanari, Lucio Caracciolo",https://kdam.iltrovatore.it/p/103/sp/10300/thumbnail/entry_id/0_1jurv4gg///width/1280/quality/100/name/0_1jurv4gg.jpgname/0_1jurv4gg.jpg_vrs2484name/0_1jurv4gg.jpg,https://www.la7.it/otto-e-mezzo/rivedila7/otto-e-mezzo-08-06-2026-648312
08/06/2026,"Quarta Repubblica, Nicola Porro intervista il leader di Reform UK Nigel Farage",Focus sui casi di giustizia e il delitto di Garlasco. Ecco le anticipazioni e gli ospiti dell'8 giugno 2026,Nigel farage,https://www.davidemaggio.it/app/uploads/2026/01/Nicola-Porro-e1767449860675-1024x671.jpeg,https://www.davidemaggio.it/quarta-repubblica/quarta-repubblica-nicola-porro-intervista-il-leader-di-reform-uk-nigel-farage
08/06/2026,Massimo Giletti torna su Rai 3 con Mussolini – Le Verità Nascoste,Una docu-inchiesta per sciogliere i dubbi sulla vita e sulla morte del Duce. Intervengono anche Bruno Vespa e Michele Santoro,"Bruno vespa, michele santoro",https://www.davidemaggio.it/app/uploads/2026/06/Massimo-Giletti.png,https://www.davidemaggio.it/programmi-tv/massimo-giletti-torna-su-rai-3-con-mussolini-le-verita-nascoste
08/06/2026,Propaganda Live chiude la stagione con un doppio appuntamento,Il programma di Diego Bianchi su La7 in onda eccezionalmente stasera e venerdì,N/d,https://www.davidemaggio.it/app/uploads/2025/08/Diego-Bianchi-Propaganda-Live--e1756467775612-1024x625.jpeg,https://www.davidemaggio.it/propaganda-live/propaganda-live-chiude-la-stagione-con-un-doppio-appuntamento
08/06/2026,"Super Karaoke debutta su Canale 5 con Noemi, Al Bano, Raf e Ivana Spagna","Lucilla Agosti, Daniele Battaglia, Fabio De Vivo e Rosaria Rollo guidano le quattro squadre in gara","Noemi, al bano, raf, ivana spagna",https://www.davidemaggio.it/app/uploads/2026/06/Michelle-Hunziker-2000x1422.jpeg,https://www.davidemaggio.it/super-karaoke/super-karaoke-debutta-su-canale-5-con-noemi-al-bano-raf-e-ivana-spagna
08/06/2026,"Temptation Island 2026, Francesca e Danilo sono la seconda coppia","A scrivere al programma è stata la ragazza, certa che il fidanzato le dica ""tante balle"". Lui, invece, si sente ""in gabbia, in galera""",N/d,https://www.davidemaggio.it/app/uploads/2026/06/Francesca-e-Danilo-Tempation-Island-2026.jpg,https://www.davidemaggio.it/temptation-island/temptation-island-2026-francesca-e-danilo-sono-la-seconda-coppia
07/06/2026,"Citofonare Rai2, Perego e Barale ‘sfrattate’ dallo studio all’ultima puntata","""Mai successo nella storia della Rai. Hanno registrato in cortile con i telefonini"", lamenta Presta. Ecco cosa è successo",N/d,https://www.davidemaggio.it/app/uploads/2026/06/Citofonare-Rai2.jpg,https://www.davidemaggio.it/citofonare-rai2/citofonare-rai2-perego-e-barale-sfrattate-dallo-studio-allultima-puntata
07/06/2026,Malgioglio e i Jalisse ‘a Ruota Libera’ dalla Fialdini,Attesi in studio anche Casalegno e Mazzocchi. Ecco le anticipazioni del 7 giugno 2026,"Cristiano malgioglio, jalisse, elenoire casalegno, marco mazzocchi",https://www.davidemaggio.it/app/uploads/2025/09/Jalisse-e1758291799321-1024x674.jpg,https://www.davidemaggio.it/da-noi-a-ruota-libera/malgioglio-e-i-jalisse-a-ruota-libera-dalla-fialdini
06/06/2026,"In Altre Parole saluta con Paola Turci, Giovanni Floris e Gad Lerner","Attesi all'ultima di Massimo Gramellini anche Massimo Giannini, Donato Carrisi e Mary L. Trump. Ecco le anticipazioni del 6 giugno 2026","Paola turci, giovanni floris, gad lerner, massimo giannini, donato carrisi, mary l. trump",https://www.davidemaggio.it/app/uploads/2026/06/Paola-Turci.jpg,https://www.davidemaggio.it/in-altre-parole/in-altre-parole-saluta-con-paola-turci-giovanni-floris-e-gad-lerner
06/06/2026,Rai 1 omaggia Pippo Baudo con uno speciale del TG1,Oggi pomeriggio in onda Mister TV - Pippo Baudo Story a 90 anni dalla nascita dell'indimenticabile presentatore,N/d,https://www.davidemaggio.it/app/uploads/2026/06/Pippo-Baudo.png,https://www.davidemaggio.it/notizie-tv/rai-1-omaggia-pippo-baudo-con-uno-speciale-del-tg1
06/06/2026,"TV Talk chiude la stagione con Samira Lui, Massimo Bernardini, Alessia Marcuzzi e Michela Giraud",Mia Ceran saluta il pubblico di rai 3 con la consegna degli Awards. Ecco le anticipazioni del 6 giugno 2026,"Samira lui, alessia marcuzzi, michela giraud",https://www.davidemaggio.it/app/uploads/2026/01/Samira-Lui-1024x576.jpg,https://www.davidemaggio.it/tv-talk/tv-talk-chiude-la-stagione-con-samira-lui-massimo-bernardini-alessia-marcuzzi-e-michela-giraud
05/06/2026,Otto e Mezzo,,"Franco Bernabè, Lucio Caracciolo, Monica Guerzoni, Riccardo Staglianò",https://kdam.iltrovatore.it/p/103/sp/10300/thumbnail/entry_id/0_c1vfze7e///width/1280/quality/100/name/0_c1vfze7e.jpgname/0_c1vfze7e.jpg_vrs1905name/0_c1vfze7e.jpg,https://www.la7.it/otto-e-mezzo/rivedila7/otto-e-mezzo-05-06-2026-648035
06/06/2026,"Sanremo 2027, ecco le date",Il Festival guidato da Stefano De Martino in programma dal 16 al 20 febbraio 2027,N/d,https://www.davidemaggio.it/app/uploads/2026/03/Stefano-De-Martino.jpg,https://www.davidemaggio.it/festival-di-sanremo/sanremo-2027-ecco-le-date
05/06/2026,"Temptation Island 2026, Gabriele e Sara sono la prima coppia","A scrivere al programma è stato lui, convinto che la sua fidanzata lo abbia tradito. Convivono da due anni",N/d,https://www.davidemaggio.it/app/uploads/2026/06/Gabriele-e-Sara-Temptation-Island-2026.jpg,https://www.davidemaggio.it/temptation-island/temptation-island-2026-gabriele-e-sara-sono-la-prima-coppia
05/06/2026,"Italia loves Unesco, Milly Carlucci lancia la candidatura della canzone napoletana a patrimonio dell’umanità","Serata-evento in diretta su Rai 1 dall'Arena di Verona. Gigi D'Alessio, Massimo Ranieri, Serena Rossi e Sal Da Vinci ambasciatori della campagna","Gigi d'alessio, massimo ranieri, serena rossi, sal da vinci",https://www.davidemaggio.it/app/uploads/2026/02/SLF_8447-2000x1333.jpg,https://www.davidemaggio.it/programmi-tv/italia-loves-unesco-milly-carlucci-lancia-la-candidatura-della-canzone-napoletana-a-patrimonio-dellumanita
05/06/2026,Elio e le Storie Tese stasera a Propaganda Live,Diego Bianchi celebra gli ottant’anni dalla nascita della Repubblica con un'intervista a Rosa Oliva. Ecco le anticipazioni del 5 giugno 2026,Rosa oliva,https://www.davidemaggio.it/app/uploads/2026/03/Diego-Bianchi-2.jpeg,https://www.davidemaggio.it/propaganda-live/elio-e-le-storie-tese-stasera-a-propaganda-live
05/06/2026,"Isola dei Famosi, Selvaggia Lucarelli e Alvin conducono la prossima edizione",Ambiguo il riferimento alla messa in onda: nelle prossime stagioni. Cioè quando?,N/d,https://www.davidemaggio.it/app/uploads/2026/06/IMG_1343.jpeg,https://www.davidemaggio.it/isola-dei-famosi/selvaggia-lucarelli-e-alvin-conducono-isola-dei-famosi
04/06/2026,Otto e Mezzo,,"Italo Bocchino, Paolo Mieli, Marco Travaglio",https://kdam.iltrovatore.it/p/103/sp/10300/thumbnail/entry_id/0_9kzoz2zi///width/1280/quality/100/name/0_9kzoz2zi.jpgname/0_9kzoz2zi.jpg_vrs3046name/0_9kzoz2zi.jpg,https://www.la7.it/otto-e-mezzo/rivedila7/otto-e-mezzo-04-06-2026-647878
04/06/2026,"RIP 2, nel cast anche Fedez e Simona Ventura",Su Prime Video arriva la seconda edizione del comedy show con cinque nuovi vip pronti ai loro funerali. Max Angioni e Martina Catuzzi new entry tra i comici,N/d,https://www.davidemaggio.it/app/uploads/2026/06/RIP-2-il-cast-2000x1333.jpg,https://www.davidemaggio.it/rip-roast-in-peace/rip-2-nel-cast-anche-fedez-e-simona-ventura
04/06/2026,"Sarabanda Celebrity, ecco i team di stasera","Prendono parte alla nuova sfida anche Sabrina Salerno, Asia Argento e Gigi e Ross","Sabrina salerno, asia argento, gigi, ross",https://www.davidemaggio.it/app/uploads/2026/05/Enrico-Papi-2000x1492.jpg,https://www.davidemaggio.it/sarabanda/sarabanda-celebrity-ecco-i-team-di-stasera-5
04/06/2026,Matteo Renzi e Serena Bortone stasera a Piazzapulita,Spazio a una nuova inchiesta di Emanuela Pala sul movimento europeo per la remigrazione. Ecco le anticipazioni e gli ospiti del 4 giugno 2026,"Matteo renzi, serena bortone",https://www.davidemaggio.it/app/uploads/2026/04/Matteo-Renzi.jpeg,https://www.davidemaggio.it/piazzapulita/matteo-renzi-e-serena-bortone-stasera-a-piazzapulita
04/06/2026,Bisio e Incontrada fuori da Zelig,"L’annuncio arriva dagli storici autori Gino e Michele. Alla base della scelta, gli impegni lavorativi dei due conduttori.",N/d,https://www.davidemaggio.it/app/uploads/2025/01/Bisio-Incontrada-ZELIG-Canale5-1024x681.jpg,https://www.davidemaggio.it/zelig-intrattenimento/bisio-e-incontrada-fuori-da-zelig
03/06/2026,Otto e Mezzo,,"Il programma di approfondimento quotidiano condotto da Lilli Gruber, con ospiti in studio e il punto di Paolo Pagliaro. 25a Edizione",https://kdam.iltrovatore.it/p/103/sp/10300/thumbnail/entry_id/0_ssqpmuvp///width/1280/quality/100/name/0_ssqpmuvp.jpgname/0_ssqpmuvp.jpg_vrs1732name/0_ssqpmuvp.jpg,https://www.la7.it/otto-e-mezzo/rivedila7/otto-e-mezzo-03-06-2026-647788
03/06/2026,"Una Giornata Particolare, Cazzullo in Africa per la seconda parte di Faccetta Nera",Puntata dedicata alla conquista e alla caduta dell’Impero. Ecco le anticipazioni e gli ospiti del 3 giugno 2026,N/d,https://www.davidemaggio.it/app/uploads/2025/10/Aldo-Cazzullo-1024x576.jpg,https://www.davidemaggio.it/una-giornata-particolare/una-giornata-particolare-cazzullo-in-africa-per-la-seconda-parte-di-faccetta-nera
03/06/2026,Quarto Grado raddoppia nell’ultima settimana di sfida con Ore 14 Sera e intervista Marco Poggi,"Il programma di Rete 4 in onda anche di giovedì al posto di Dritto e Rovescio. Tra gli ospiti in studio Mirko Crepaldi, storico amico di Andrea Sempio","Marco poggi, mirko crepaldi",https://www.davidemaggio.it/app/uploads/2025/09/Gianluigi-Nuzzi-e-Alessandra-Viero-Quarto-Grado-1024x640.jpg,https://www.davidemaggio.it/quarto-grado/quarto-grado-raddoppia-nellultima-settimana-di-sfida-con-ore-14-sera-e-intervista-marco-poggi
03/06/2026,"Giuseppe Conte, Elsa Fornero e Veronica Gentili stasera a Realpolitik",Lo scenario politico italiano e il caso Garlasco al centro della puntata. Ecco le anticipazioni del 3 giugno 2026,"Giuseppe conte, elsa fornero",https://www.davidemaggio.it/app/uploads/2026/02/Giuseppe-Conte-1024x576.jpg,https://www.davidemaggio.it/realpolitik/giuseppe-conte-elsa-fornero-e-veronica-gentili-stasera-a-realpolitik
03/06/2026,"Chi l’ha Visto?, stasera nuove testimonianze sul caso di Paula Andrea Bran Yépez",Focus anche sui casi di Pamela Genini e Claudia De Chirico. Ecco le anticipazioni del 3 giugno 2026,N/d,https://www.davidemaggio.it/app/uploads/2025/10/Chi-lha-visto-Sciarelli-1024x733.jpg,https://www.davidemaggio.it/chi-l-ha-visto/chi-lha-visto-stasera-nuove-testimonianze-sul-caso-di-paula-andrea-bran-yepez
02/06/2026,Otto e Mezzo,,,https://kdam.iltrovatore.it/p/103/sp/10300/thumbnail/entry_id/0_eioluow3///width/1280/quality/100/name/0_eioluow3.jpgname/0_eioluow3.jpg_vrs7233name/0_eioluow3.jpg,https://www.la7.it/otto-e-mezzo/rivedila7/otto-e-mezzo-02-06-2026-647611
03/06/2026,Gerry Scotti lancia la sfida all’Eredità: “Non so se abbia la forza di eguagliare o superare ciò che fa Affari Tuoi contro di me”,"La Ruota della Fortuna non si ferma e va avanti initerrottamente per tutta l'estate, sfidando il nuovo access di Rai 1",N/d,https://www.davidemaggio.it/app/uploads/2025/07/Gerry-Scotti-e-Samira-Lui-e1752562899559-1024x594.jpeg,https://www.davidemaggio.it/la-ruota-della-fortuna/gerry-scotti-lancia-la-sfida-alleredita-non-so-se-abbia-la-forza-di-eguagliare-o-superare-cio-che-fa-affari-tuoi-contro-di-me
02/06/2026,Pier Luigi Bersani e Massimo Gramellini stasera a diMartedì,Focus sulle strategie di Giorgia Meloni e sulla politica estera nella puntata del 2 giugno 2026,"Pier luigi bersani, massimo gramellini",https://www.davidemaggio.it/app/uploads/2024/06/Giovanni-Floris-DiMartedi-1024x574.jpg,https://www.davidemaggio.it/dimartedi/pier-luigi-bersani-e-massimo-gramellini-stasera-a-dimartedi
02/06/2026,"Antonio De Rensis, Enzo Iacchetti e Mario Giordano stasera a È Sempre Cartabianca",Il caso Garlasco e le difficoltà economiche al centro della puntata del 2 giugno 2026,"Antonio de rensis, enzo iacchetti, mario giordano",https://www.davidemaggio.it/app/uploads/2026/03/Bianca-Berlinguer-7.jpg,https://www.davidemaggio.it/e-sempre-cartabianca/antonio-de-rensis-enzo-iacchetti-e-mario-giordano-stasera-a-e-sempre-cartabianca
01/06/2026,Otto e Mezzo,,"Ospiti di Lilli Gruber, Lina Palmerini, Michela Ponzani, Massimo Cacciari e Paola Caridi",https://kdam.iltrovatore.it/p/103/sp/10300/thumbnail/entry_id/0_5llg9tjr//width/1280/quality/100/name/0_5llg9tjr.jpgname/0_5llg9tjr.jpg,https://www.la7.it/otto-e-mezzo/rivedila7/otto-e-mezzo-01-06-2026-647538
01/06/2026,"Quarta Repubblica tra Russia-Europa, Covid e Garlasco",Focus sui rapporti tra la sinistra e le frange più radicali dell’Islam. Ecco le anticipazioni e gli ospiti del 1° giugno 2026,N/d,https://www.davidemaggio.it/app/uploads/2026/02/Nicola-Porro-5-1024x576.jpg,https://www.davidemaggio.it/quarta-repubblica/quarta-repubblica-tra-russia-europa-covid-e-garlasco
31/05/2026,Fuori dal Coro chiude con un’intervista a un testimone dell’accoltellamento di Milano Certosa,"In studio anche Mario Roggero, il gioielliere condannato in appello per l’uccisione di due rapinatori. Ecco le anticipazioni del 31 maggio 2026",Mario roggero,https://www.davidemaggio.it/app/uploads/2025/11/Fuori-dal-Coro-Mario-Giordano-1024x536.jpg,https://www.davidemaggio.it/fuori-dal-coro/fuori-dal-coro-chiude-con-unintervista-a-un-testimone-dellaccoltellamento-di-milano-certosa
31/05/2026,"Pamela Prati, Da Noi… a Ruota Libera!","Nuove interviste anche per Maria Giovanna Elmi e Lorella Boccia che presenta con Fabio Gallo ""UnoMattina Weekly"". Ecco le anticipazioni del 31 maggio 2026","Pamela prati, maria giovanna elmi, lorella boccia, fabio gallo",https://www.davidemaggio.it/app/uploads/2025/11/Francesca-Fialdini-Rai-1-1024x576.webp,https://www.davidemaggio.it/da-noi-a-ruota-libera/pamela-prati-da-noi-a-ruota-libera
31/05/2026,"Domenica In chiude la stagione con Catherine Louise Birmingham, la mamma della ‘famiglia nel bosco’","Presenti all'ultima puntata anche Samurai Jay, Mietta ed Enrico Brignano. Ecco le anticipazioni del 31 maggio 2026","Catherine louise birmingham, samurai jay, mietta, enrico brignano",https://www.davidemaggio.it/app/uploads/2026/05/Catherine-e1779901644900.jpeg,https://www.davidemaggio.it/domenica-in/domenica-in-chiude-la-stagione-con-catherine-louise-birmingham-la-mamma-della-famiglia-nel-bosco
30/05/2026,Monica Setta conquista il prime time di Rai 2 con Storie al Bivio di Sera,"Il programma, nato in daytime, sbarca in prima serata per tutta l'estate, dal 9 giugno al 4 agosto",N/d,https://www.davidemaggio.it/app/uploads/2026/05/Monica-Setta-e1780158809696-2000x1279.jpeg,https://www.davidemaggio.it/storie-di-donne-al-bivio/monica-setta-conquista-il-prime-time-di-rai-2-con-storie-al-bivio-di-sera
30/05/2026,Lorella Boccia e Marco Conidi portano la ‘Musica Mia’ su Rai 1,"Il programma sbarca nel sabato pomeriggio della rete ammiraglia Rai. La prima puntata di oggi è 'Na voce e na chitarra', in omaggio a Napoli",N/d,https://www.davidemaggio.it/app/uploads/2026/05/Lorella-Boccia-e-Marco-Conidi.png,https://www.davidemaggio.it/programmi-tv/lorella-boccia-e-marco-conidi-portano-la-musica-mia-su-rai-1
30/05/2026,Linea Med con Angela Tuccia e Giulia Teri debutta nel sabato pomeriggio di Rai 1,"Nuovo programma dedicato alle influenze del Mar Mediterraneo, dai racconti di mare alle ricette più iconiche",N/d,https://www.davidemaggio.it/app/uploads/2026/05/Angela-Tuccia-e-Giulia-Teri.png,https://www.davidemaggio.it/programmi-tv/linea-med-con-angela-tuccia-e-giulia-teri-debutta-nel-sabato-pomeriggio-di-rai-1
30/05/2026,"In Altre Parole: ospite Davide Simone Cavallo, il 22enne vittima del brutale pestaggio a Milano","Attesi, tra gli altri, anche Rosy Bindi, Gabriele Corsi e Marco Damilano. Ecco le anticipazioni del 30 maggio 2026","Davide simone cavallo, rosy bindi, gabriele corsi, marco damilano",https://www.davidemaggio.it/app/uploads/2026/05/Davide-Simone-Cavallo.jpg,https://www.davidemaggio.it/in-altre-parole/in-altre-parole-ospite-davide-simone-cavallo-il-22enne-vittima-del-brutale-pestaggio-a-milano
30/05/2026,"Serena Bortone, Francesca Fialdini, Piero Chiambretti e Zerocalcare oggi a TV Talk",Presenti anche Ema Stokholma e Luca Barbarossa. Ecco le anticipazioni del 30 maggio 2026,"Serena bortone, francesca fialdini, piero chiambretti, zerocalcare, ema stokholma, luca barbarossa",https://www.davidemaggio.it/app/uploads/2026/05/Zerocalcare-2000x1334.jpg,https://www.davidemaggio.it/tv-talk/serena-bortone-francesca-fialdini-piero-chiambretti-e-zerocalcare-oggi-a-tv-talk
29/05/2026,Otto e Mezzo,,"Il programma di approfondimento quotidiano condotto da Lilli Gruber, con ospiti in studio e il punto di Paolo Pagliaro. 25a Edizione",https://kdam.iltrovatore.it/p/103/sp/10300/thumbnail/entry_id/0_u3xncpuv///width/1280/quality/100/name/0_u3xncpuv.jpgname/0_u3xncpuv.jpg_vrs1909name/0_u3xncpuv.jpg,https://www.la7.it/otto-e-mezzo/rivedila7/otto-e-mezzo-29-05-2026-647246
29/05/2026,Francesca Albanese stasera a Propaganda Live,"Valerio Aprea, Salvo Di Paola e Carmine Del Grosso ai monologhi, musica con Fatoumata Diawara. Ecco le anticipazioni del 29 maggio 2026","Francesca albanese, valerio aprea, salvo di paola, carmine del grosso, fatoumata diawara",https://www.davidemaggio.it/app/uploads/2026/05/Francesca-Albanese.jpg,https://www.davidemaggio.it/propaganda-live/francesca-albanese-stasera-a-propaganda-live
29/05/2026,“Io credo nell’innocenza di Sempio” e cade un fulmine sullo studio di Infante che resta al buio,Durante l'intervento dell'avvocato Angela Taccia ad Ore 14 Sera salta l'impianto luci,Angela taccia,https://www.davidemaggio.it/app/uploads/2026/05/Angela-Taccia.jpg,https://www.davidemaggio.it/ore-14-rai/io-credo-nellinnocenza-di-sempio-e-cade-un-fulmine-sullo-studio-di-infante-che-resta-al-buio
29/05/2026,Quarto Grado tra Garlasco e carceri,Francesca Carollo ha intervistato Fabio Savi sul caso della Banda della Uno Bianca. Ecco le anticipazioni del 29 maggio 2026,N/d,https://www.davidemaggio.it/app/uploads/2025/09/Gianluigi-Nuzzi-e-Alessandra-Viero-Quarto-Grado-1024x640.jpg,https://www.davidemaggio.it/quarto-grado/quarto-grado-tra-garlasco-e-carceri
