Data,Titolo,Descrizione_Completa,Ospiti,Immagine,Link
26/04/2026,"Cucine da Incubo 12, La Furba di Poggio a Caiano (Prato) è il secondo ristorante da salvare","Antonino Cannavacciuolo alle prese con i modi di fare della titolare Silvia, che accompagna i commensali durante il pasto tra parolacce e battute di dubbio gusto",N/D,https://www.davidemaggio.it/app/uploads/2026/04/CDI7141.jpg,https://www.davidemaggio.it/cucine-da-incubo/cucine-da-incubo-12-la-furba-di-poggio-a-caiano-prato-e-il-secondo-ristorante-da-salvare
26/04/2026,"Domenica In con i Pooh, Sal Da Vinci e Patty Pravo",Presenti anche Giovanna Botteri e Candida Morvillo per lo spazio attualità. Ecco le anticipazioni del 26 aprile 2026,N/D,https://www.davidemaggio.it/app/uploads/2026/04/i-Pooh-2000x1125.webp,https://www.davidemaggio.it/domenica-in/domenica-in-con-i-pooh-sal-da-vinci-e-patty-pravo
26/04/2026,"Amici 2026, fuori Alex. La squadra Cuccarini-Peparini resta senza ballerini","I giudici decidono di salvare i cantanti Elena e Lorenzo, condannando all'uscita Alex",N/D,https://www.davidemaggio.it/app/uploads/2026/04/ALEX_06A0195-2000x1333.jpg,https://www.davidemaggio.it/amici-di-maria-de-filippi/amici-2026-fuori-alex-la-squadra-cuccarini-peparini-resta-senza-ballerini
25/04/2026,Canzonissima torna nel 2027,Lo show del sabato sera di Rai 1 condotto da Milly Carlucci confermato per il prossimo anno,N/D,https://www.davidemaggio.it/app/uploads/2026/04/Canzonissima-1-2000x1124.jpg,https://www.davidemaggio.it/canzonissima/canzonissima-torna-nel-2027
25/04/2026,Fabrizio Moro con “Il mio canto libero” vince Canzonissima 2026,Il cantante trionfa nello show del sabato sera di Rai 1 con la cover del celebre brano di Lucio Battisti. Ecco tutti i video e la cronaca minuto per minuto della finale,N/D,https://www.davidemaggio.it/app/uploads/2026/04/Fabrizio-Moro-Canzonissima-2026.jpg,https://www.davidemaggio.it/canzonissima/canzonissima-2026-la-finale-in-diretta-vince-fabrizio-moro-il-mio-canto-libero
25/04/2026,"In Altre Parole: Willie Peyote, Nicola Gratteri e Mary L. Trump tra gli ospiti","Attesi anche Tomaso Montanari, Michela Ponzani e Lella Costa. Ecco le anticipazioni del 25 aprile 2026",N/D,https://www.davidemaggio.it/app/uploads/2025/02/Willie-Peyote-1024x620.jpg,https://www.davidemaggio.it/in-altre-parole/in-altre-parole-willie-peyote-nicola-gratteri-e-mary-l-trump-tra-gli-ospiti
25/04/2026,"Ciao Maschio e il coraggio con Jimmy Ghione, Francesco Arienzo e Roberto Parodi",Attesi due giovani musicisti: Michelle Perez e Francesco Stifano. Ecco le anticipazioni del 25 aprile 2026,N/D,https://www.davidemaggio.it/app/uploads/2025/10/Nunzia-De-Girolamo-_-Ciao-Maschio-1024x576.webp,https://www.davidemaggio.it/ciao-maschio/ciao-maschio-e-il-coraggio-con-jimmy-ghione-francesco-arienzo-e-roberto-parodi
25/04/2026,"Verissimo: Michelle Hunziker, Lino Banfi e Tina Cipollari tra gli ospiti","In studio anche Serena Rossi, Mimmo dei Cesaroni e Marco Bocci. Ecco tutti gli ospiti del weekend",N/D,https://www.davidemaggio.it/app/uploads/2025/11/TINA-CIPOLLARI_92762-1024x683.jpg,https://www.davidemaggio.it/verissimo/verissimo-michelle-hunziker-lino-banfi-e-tina-cipollari-tra-gli-ospiti
25/04/2026,"TV Talk: Corrado Formigli, Flavio Insinna e Paola Perego tra gli ospiti",Presenti anche Giovanni Esposito e Scintilla per parlare della nuova edizione di LOL. Ecco le anticipazioni del 25 aprile 2026,N/D,https://www.davidemaggio.it/app/uploads/2024/10/Insinna-e-il-cane-1024x586.jpeg,https://www.davidemaggio.it/tv-talk/tv-talk-corrado-formigli-flavio-insinna-e-paola-perego-tra-gli-ospiti
24/04/2026,"Grande Fratello Vip 2026, diretta dodicesima puntata: in 4 al televoto per la prossima eliminazione",Ecco tutti i video e la cronaca live minuto per minuto della serata,N/D,https://www.davidemaggio.it/app/uploads/2026/04/Ilary-Blasi-nella-casa-GF-Vip-2026-2000x1335.jpg,https://www.davidemaggio.it/grande-fratello/grande-fratello-vip-2026-diretta-dodicesima-puntata-nominati-cosa-e-successo
24/04/2026,"Propaganda Live: Frankie hi-nrg mc, Lina Simons e Michele Riondino tra gli ospiti","Per il reportage della settimana, Diego Bianchi racconta il segno lasciato da Papa Francesco. Ecco le anticipazioni del 24 aprile 2026",N/D,https://www.davidemaggio.it/app/uploads/2026/03/Diego-Bianchi-2.jpeg,https://www.davidemaggio.it/propaganda-live/propaganda-live-frankie-hi-nrg-mc-lina-simons-e-michele-riondino-tra-gli-ospiti
24/04/2026,Ore 14 Sera raddoppia stasera contro Quarto Grado,Milo Infante in prima serata eccezionalmente di venerdì con uno speciale su Garlasco,N/D,https://www.davidemaggio.it/app/uploads/2025/09/Milo-Infante-Ore-14-Sera-1024x576.png,https://www.davidemaggio.it/ore-14-rai/ore-14-sera-raddoppia-stasera-contro-quarto-grado
24/04/2026,Quarto Grado tra Garlasco e le avvelenate di Campobasso,Spazio anche al caso della tomba profanata di Pamela Genini. Ecco le anticipazioni del 24 aprile 2026,N/D,https://www.davidemaggio.it/app/uploads/2025/09/Gianluigi-Nuzzi-e-Alessandra-Viero-Quarto-Grado-1024x640.jpg,https://www.davidemaggio.it/quarto-grado/quarto-grado-tra-garlasco-e-le-avvelenate-di-campobasso
24/04/2026,Money Road 2 su Sky Uno da giovedì 21 maggio 2026,Il reality rivelazione della scorsa stagione è pronto a tornare con 12 nuovi viaggiatori,N/D,https://www.davidemaggio.it/app/uploads/2026/04/BSC06602-2000x1333.jpg,https://www.davidemaggio.it/money-road/money-road-2-su-sky-uno-da-giovedi-21-maggio-2026
23/04/2026,"Amici 2026, anticipazioni sesta puntata del Serale: arrivano Brancale, Meta e Siani","Tornano Argentero e Laurenti. Un nuovo eliminato nella sfida a squadre. Ecco cosa è successo nella registrazione, in onda su Canale 5 sabato 25 aprile",N/D,https://www.davidemaggio.it/app/uploads/2026/04/SERENA-BRANCALE-E-DELIA_1101-2000x1333.jpg,https://www.davidemaggio.it/amici-di-maria-de-filippi/amici-2026-anticipazioni-sesta-puntata-del-serale-arrivano-brancale-meta-e-siani
23/04/2026,Elly Schlein ospite a Piazzapulita,Corrado Formigli torna a occuparsi della crisi d'identità della destra di Governo. Ecco le anticipazioni del 23 aprile 2026,N/D,https://www.davidemaggio.it/app/uploads/2025/10/Elly-Schlein-Piazzapulita-1024x577.jpeg,https://www.davidemaggio.it/piazzapulita/elly-schlein-ospite-a-piazzapulita
23/04/2026,"Le Iene stasera con Lucia Ocone e Frankie hi-nrg mc. Tra i servizi, la parabola di Fabrizio Miccoli",Prosegue l'inchiesta di Filippo Roma sul caso della Scommessa Collettiva di Mario Adinolfi. Ecco le anticipazioni del 23 aprile 2026,N/D,https://www.davidemaggio.it/app/uploads/2025/09/Le-Iene-Veronica-Gentili-e-Max-Angioni-1024x682.jpg,https://www.davidemaggio.it/le-iene/le-iene-stasera-con-lucia-ocone-e-frankie-hi-nrg-mc-tra-i-servizi-la-parabola-di-fabrizio-miccoli
23/04/2026,"Splendida Cornice: Ute Lemper, Diego Abatantuono e Giorgio Locatelli tra gli ospiti","Geppi Cucciari canta ""Vattene amore"" con Mietta. Ecco le anticipazioni del 23 aprile 2026",N/D,https://www.davidemaggio.it/app/uploads/2025/10/Geppi-Cucciari-Splendida-Cornice-1024x576.jpg,https://www.davidemaggio.it/splendida-cornice/splendida-cornice-ute-lemper-diego-abatantuono-e-giorgio-locatelli-tra-gli-ospiti
23/04/2026,Matteo Salvini ospite a Dritto e Rovescio,Paolo Del Debbio propone un’inchiesta sullo scandalo della prostituzione di lusso a Milano che ha coinvolto il mondo sportivo. Ecco le anticipazioni del 23 aprile 2026,N/D,https://www.davidemaggio.it/app/uploads/2026/03/Matteo-Salvini-Rete-4.jpg,https://www.davidemaggio.it/dritto-e-rovescio/matteo-salvini-ospite-a-dritto-e-rovescio-2
22/04/2026,"Grande Fratello Vip 2026, diretta undicesima puntata: Paola ‘finta eliminata’ e isolata nel monolocale","Adriana conquista l'immunità, Marco e Alessandra al televoto (senza eliminazione). Ecco tutti i video e la cronaca live minuto per minuto della serata",N/D,https://www.davidemaggio.it/app/uploads/2026/04/Todaro-e-Mussolini-2000x1335.jpg,https://www.davidemaggio.it/grande-fratello/grande-fratello-vip-2026-diretta-undicesima-puntata-cosa-e-successo
22/04/2026,"Chi l’ha Visto?, colpo di scena sul caso Chef Milza",Focus sul caso di Alessandro Venturelli e sulla morte di madre e figlia a Campobasso. Ecco le anticipazioni del 22 aprile 2026,N/D,https://www.davidemaggio.it/app/uploads/2025/09/Federica-Sciarelli-Chi-lha-Visto-1024x576.png,https://www.davidemaggio.it/chi-l-ha-visto/chi-lha-visto-colpo-di-scena-sul-caso-chef-milza
22/04/2026,"Realpolitik: Bindi, Bonelli, Sangiuliano e Sallusti tra gli ospiti",Focus sull’attualità politica tra rincari e la disputa sul sovranismo in Europa. Ecco le anticipazioni del 22 aprile 2026,N/D,https://www.davidemaggio.it/app/uploads/2025/10/Tommaso-Labate-Rete-4-Realpolitik-1024x538.jpg,https://www.davidemaggio.it/realpolitik/realpolitik-bindi-bonelli-sangiuliano-e-sallusti-tra-gli-ospiti
22/04/2026,"Elettra Lamborghini sull’orlo dell’esaurimento rinnega l’intervista a Belve: “Non mi è piaciuta, non avrei dovuto accettare”","""Non mi è piaciuta l'intervista... non avrei dovuto accettare sapendo in questo momento di essere in totale burnout"", dice la cantante",N/D,https://www.davidemaggio.it/app/uploads/2026/04/Elettra-Lamborghini-2-e1776861262734.jpeg,https://www.davidemaggio.it/belve/elettra-lamborghini-sullorlo-dellesaurimento-rinnega-lintervista-a-belve-non-mi-e-piaciuta-non-avrei-dovuto-accettare
22/04/2026,BOOM! Si litiga per la conduzione dell’Isola dei Famosi,Reality in alto mare. Conduzione e cast non ancora definiti. Nemmeno un contratto firmato. Unico nome 'noto' (ma bollito) è...,N/D,https://www.davidemaggio.it/app/uploads/2025/10/Belen-e1761309523984-1024x708.jpg,https://www.davidemaggio.it/isola-dei-famosi/boom-si-litiga-per-la-conduzione-dellisola-dei-famosi
22/04/2026,"Dopo il Circoletto, la Congregazione! Castellitto contro i David di Donatello","L'attore si scaglia contro la manifestazione in quello che sembra un richiamo al famoso ""circoletto""",N/D,https://www.davidemaggio.it/app/uploads/2026/04/Sergio-Castellitto-Non-ti-pago-2000x1012.jpg,https://www.davidemaggio.it/david-di-donatello/dopo-il-circoletto-la-congregazione-castellitto-contro-i-david-di-donatello
21/04/2026,"FarWest, Sottile torna sul dossier ‘mafia-appalti’ e sulle stragi di Falcone e Borsellino","Tra i temi di puntata anche la morte di Antonella Di Ielsi e Sara Di Vita, l'omicidio di Giacomo Bongiorni e il delitto di Garlasco. Ecco le anticipazioni del 21 aprile 2026",N/D,https://www.davidemaggio.it/app/uploads/2025/10/Salvo-Sottile-FarWest-e1762531515681-1024x628.webp,https://www.davidemaggio.it/farwest/farwest-sottile-torna-sul-dossier-mafia-appalti-e-sulle-stragi-di-falcone-e-borsellino
